Ticker,Title,Datetime,Source
acn,Analysts’ Opinions Are Mixed on These Technology Stocks: Accenture (ACN) and Broadcom (AVGO),2024-03-22 08:20:07,TipRanks
acn,Investor Optimism Improves Slightly; Dow Jumps Over 250 Points,2024-03-22 07:53:47,Benzinga
acn,"Analysts Conflicted on These Technology Names: Accenture (ACN), Tyler Technologies (TYL) and Five9 (FIVN)",2024-03-22 07:31:36,TipRanks
acn,Hold Rating on Accenture Amidst Cautious IT Spending and Slower Growth Projections,2024-03-21 21:35:19,TipRanks
acn,Why FactSet Research Shares Are Trading Lower By Around 5%? Here Are Other Stocks Moving In Thursday's Mid-Day Session,2024-03-21 19:39:11,Benzinga
acn,"Bulls Stampede On Fed's Dovish Signal, Nasdaq 100 Hits New Record High, DOJ Sues Apple: What's Driving Markets Thursday?",2024-03-21 18:00:39,Benzinga
acn,"ACN Stock Earnings: Accenture Beats EPS, Misses Revenue for Q2 2024",2024-03-21 14:52:53,InvestorPlace
acn,"Biggest stock movers today: GES, ACN, MU, AVGO, LI, and more",2024-03-21 14:08:51,Seeking Alpha
acn,"BILI, EXAI and ENVB among pre-market losers",2024-03-21 12:43:23,Seeking Alpha
acn,Accenture declares $1.29 dividend,2024-03-21 12:19:01,Seeking Alpha
acn,Accenture cuts annual revenue growth forecast,2024-03-21 11:27:22,Seeking Alpha
acn,"Accenture Non-GAAP EPS of $2.77 beats by $0.10, revenue of $15.8B misses by $40M",2024-03-21 10:41:40,Seeking Alpha
acn,"Micron, Accenture And 3 Stocks To Watch Heading Into Thursday",2024-03-21 08:31:57,Benzinga
acn,Accenture Likely To Report Lower Q2 Earnings; Here Are The Recent Forecast Changes From Wall Street's Most Accurate Analysts,2024-03-21 07:41:25,Benzinga
acn,"Analysts Are Bullish on Top Technology Stocks: Nvidia (NVDA), Accenture (ACN)",2024-03-21 06:51:19,TipRanks
acn,Maintaining Hold on Accenture: Modest Revenue Boost from Acquisitions Amidst Valuation and Growth Concerns,2024-03-21 06:35:52,TipRanks
acn,Accenture Q2 2024 Earnings Preview,2024-03-20 16:24:25,Seeking Alpha
acn,7 Blockchain Stocks That Could Make Bitcoin’s Gains Look Like Chump Change,2024-03-19 16:02:23,InvestorPlace
acn,Accenture Buys Dutch Supply Chain Consultancy Flo Group,2024-03-19 13:52:19,RTTNews
acn,Nvidia To Rally Around 10%? Here Are 10 Top Analyst Forecasts For Tuesday,2024-03-19 13:34:33,Benzinga
acn,NVIDIA To Rally Around 20%? Here Are 10 Top Analyst Forecasts For Monday,2024-03-18 12:52:31,Benzinga
acn,Accenture To Acquire Aris Group,2024-03-18 12:43:31,RTTNews
acn,"Earnings week ahead: FedEx, Nike, XPeng, Tencent, General Mills and more",2024-03-17 12:20:00,Seeking Alpha
acn,"Catalyst Watch: Fed rates meeting, Nvidia CEO speaks at GTC 2024, Reddit IPO",2024-03-15 19:16:36,Seeking Alpha
acn,"Analysts Are Bullish on Top Technology Stocks: Micron (MU), SentinelOne (S)",2024-03-12 12:20:07,TipRanks
acn,Analysts’ Opinions Are Mixed on These Technology Stocks: Accenture (ACN) and Marvell (MRVL),2024-03-11 06:30:12,TipRanks
acn,Maintaining Hold on Accenture: Balancing Positive Share Performance with High Valuation and Growth Concerns,2024-03-08 06:15:50,TipRanks
acn,Expert Ratings For Accenture,2024-03-07 14:00:55,Benzinga
acn,"Analysts’ Top Technology Picks: Accenture (ACN), ODDITY Tech Ltd. Class A (ODD)",2024-03-07 10:10:49,TipRanks
acn,Wall Street Analysts Are Bullish on Top Technology Picks,2024-03-07 05:03:21,TipRanks
acn,Hold Rating on Accenture Amid Modest Acquisitions and Challenging Market Dynamics,2024-03-07 04:55:17,TipRanks
acn,Accenture To Acquire Udacity; Terms Undisclosed,2024-03-06 03:00:27,RTTNews
acn,Accenture to acquire edtech firm Udacity,2024-03-05 16:26:20,Seeking Alpha
acn,Accenture buys Melbourne-based marketing technology consultancy The Lumery,2024-03-04 06:57:19,Seeking Alpha
acn,Accenture Acquires The Lumery For Undisclosed Terms,2024-03-04 02:42:46,RTTNews
acn,3 Stocks on the Verge of Skyrocketing 30%,2024-02-28 18:42:43,InvestorPlace
acn,"Analysts Offer Insights on Technology Companies: First Solar (FSLR), Accenture (ACN) and Avnet (AVT)",2024-02-28 11:40:33,TipRanks
acn,Accenture To Acquire Mindcurv,2024-02-28 11:18:19,RTTNews
acn,"Catalyst Watch: Nvidia phenomenon, Amazon to the Dow and Anheuser-Busch drama",2024-02-23 20:00:00,Seeking Alpha
acn,"Analysts Offer Insights on Technology Companies: Verisign (VRSN), Accenture (ACN) and Zoom Video Communications (ZM)",2024-02-22 05:50:44,TipRanks
acn,"Analysts Offer Insights on Technology Companies: Amplitude (AMPL), Workiva (WK) and Accenture (ACN)",2024-02-21 13:04:22,TipRanks
acn,"Analysts’ Top Technology Picks: Accenture (ACN), Nvidia (NVDA)",2024-02-21 08:20:22,TipRanks
acn,3 Machine Learning Stocks to Turn $1000 Into $1 Million: February 2024,2024-02-20 16:32:24,InvestorPlace
acn,Accenture To Buy Bulgarian Customer Analytics Firm GemSeek,2024-02-20 10:15:27,RTTNews
acn,Accenture to buy Bulgaria's GemSeek to further expand customer analytics services,2024-02-20 08:53:35,Seeking Alpha
acn,What Are the Best AI Stocks in February 2024? Our Top 3 Picks,2024-02-19 16:19:00,InvestorPlace
acn,Accenture Stock: A Deep Dive Into Analyst Perspectives (7 Ratings),2024-02-14 21:00:41,Benzinga
acn,Palantir Stock Charged Past $20. History Suggests More Upside Is Ahead.,2024-02-14 13:00:00,InvestorPlace
acn,7 AI Stocks With Serious Potential to Make You a Millionaire,2024-02-08 19:04:10,InvestorPlace
acn,3 AI Stocks to Buy for the Next Bull Run: February 2024,2024-02-07 19:31:48,InvestorPlace
acn,The 3 Best Artificial Intelligence Stocks to Invest In for Big Gains in 2024,2024-02-02 13:45:07,InvestorPlace
acn,Cash Flow Kings: 3 Dream Dividend Stocks for Steady Income,2024-01-31 17:57:41,InvestorPlace
acn,3 Stocks to Buy for a Diversified Portfolio in 2024,2024-01-26 18:39:30,InvestorPlace
acn,Breaking Down Accenture: 6 Analysts Share Their Views,2024-01-24 21:00:46,Benzinga
acn,Accenture Acquires Impendi For Undisclosed Sum,2024-01-17 16:00:23,RTTNews
acn,Analysts Conflicted on These Technology Names: Accenture (ACN) and Shopify (SHOP),2024-01-11 06:50:40,TipRanks
acn,Accenture Agrees To Acquire Navisite,2024-01-10 18:13:25,RTTNews
acn,Accenture To Acquire Work & Co.,2024-01-09 19:56:43,RTTNews
acn,The Age of AI: Picking the Next Winners,2024-01-08 12:57:35,TipRanks
acn,Seismic Surge: These 3 Tech Titans Shaping the IT Frontier,2024-01-04 09:04:42,InvestorPlace
acn,Analysts Have Conflicting Sentiments on These Technology Companies: Accenture (ACN) and Micron (MU),2023-12-25 05:20:36,TipRanks
acn,Accenture To Acquire Customer Management IT And SirfinPA,2023-12-22 11:20:05,RTTNews
acn,Analysts Offer Insights on Technology Companies: GDS Holdings (GDS) and Accenture (ACN),2023-12-22 01:50:20,TipRanks
acn,Accenture To Acquire Jixie; Terms Undisclosed - Quick Facts,2023-12-21 07:29:29,RTTNews
acn,"Analysts Offer Insights on Technology Companies: Accenture (ACN), Adobe (ADBE) and SunPower (SPWR)",2023-12-21 06:41:15,TipRanks
acn,3 Long-Term Stocks Every Smart Investor Should Own in 2024,2023-12-20 21:44:01,InvestorPlace
acn,"Morgan Stanley's Bold Bet On Accenture, Builds Buy Case",2023-12-20 21:11:08,Benzinga
acn,Buy Rating on Accenture Stock Amid Robust M&A Strategy and Operational Discipline,2023-12-20 10:55:49,TipRanks
acn,"Analysts’ Top Technology Picks: Accenture (ACN), Zscaler (ZS)",2023-12-20 01:30:48,TipRanks
acn,TD Cowen Reaffirms Their Hold Rating on Accenture (ACN),2023-12-19 22:25:31,TipRanks
acn,"ACN Stock Earnings: Accenture Beats EPS, Beats Revenue for Q1 2024",2023-12-19 16:51:24,InvestorPlace
acn,US Stocks Higher; Accenture Issues Weak Sales Outlook,2023-12-19 15:42:31,Benzinga
acn,McDonald's And Accenture To Expand Partnership,2023-12-19 15:38:39,RTTNews
acn,Accenture Confirms Business Outlook For FY24,2023-12-19 13:21:13,RTTNews
acn,Fear & Greed Index Remains In 'Extreme Greed' Zone; S&P 500 Settles Higher,2023-12-19 09:34:52,Benzinga
acn,Accenture Likely To Report Higher Q1 Earnings; These Most Accurate Analysts Revise Forecasts Ahead Of Earnings Call,2023-12-18 17:18:13,Benzinga
acn,Here's what to expect from Accenture's earnings report,2023-12-18 15:01:13,Markets Insider Automation
acn,Analysts Have Conflicting Sentiments on These Technology Companies: Accenture (ACN) and Navitas Semiconductor (NVTS),2023-12-15 08:07:26,TipRanks
acn,Where Accenture Stands With Analysts,2023-12-14 16:00:33,Benzinga
acn,Accenture and Google Cloud Launch Joint Generative AI Center of Excellence to Help Enterprises Harness the Value of Generative AI,2023-12-13 17:22:00,PR Newswire
acn,Buy Rating Affirmed for Accenture Amid Aggressive M&A Strategy and Growth Potential,2023-12-13 10:55:52,TipRanks
acn,Accenture (ACN) Gets a Hold from TD Cowen,2023-12-13 06:22:48,TipRanks
acn,Analysts Offer Insights on Technology Companies: Accenture (ACN) and Kingdee International Software Group Co (OtherKGDEF),2023-12-11 07:30:16,TipRanks
acn,"Analysts Have Conflicting Sentiments on These Technology Companies: SentinelOne (S), Adobe (ADBE) and Accenture (ACN)",2023-12-07 10:20:54,TipRanks
acn,Accenture To Acquire Rabbit's Tale; Terms Undisclosed - Quick Facts,2023-11-29 08:55:10,RTTNews
acn,Accenture Acquires Incapsulate,2023-11-28 15:58:35,RTTNews
acn,Accenture Agrees To Acquire Ammagamma For Undisclosed Sum,2023-11-28 11:36:54,RTTNews
acn,The 3 Best Data Analytics Stocks to Buy for 2024,2023-11-23 13:00:00,InvestorPlace
acn,"Analysts Offer Insights on Technology Companies: Accenture (ACN), Okta (OKTA) and Keysight Technologies (KEYS)",2023-11-21 05:50:15,TipRanks
acn,"Analysts’ Opinions Are Mixed on These Technology Stocks: Microsoft (MSFT), NICE (NICE) and Accenture (ACN)",2023-11-20 06:50:48,TipRanks
acn,Goldman Sachs' 2024 Equity Outlook: Winning Stocks And Sectors To Watch,2023-11-16 21:51:17,Benzinga
acn,What 16 Analyst Ratings Have To Say About Accenture,2023-11-16 15:00:20,Benzinga
acn,Accenture To Acquire Solnet; Terms Undisclosed,2023-11-16 03:16:34,RTTNews
acn,Accenture Invests In Vu Technologies,2023-11-15 14:37:44,RTTNews
acn,3 Machine Learning Stocks You’ll Regret Not Buying Soon: November 2023,2023-11-14 03:03:44,InvestorPlace
acn,Google Layoffs 2023: What to Know About the Latest GOOG Job Cuts,2023-11-09 15:15:56,InvestorPlace
acn,Don’t Get Stuck with These 3 Declining Stocks,2023-11-06 20:17:16,InvestorPlace
acn,Accenture Acquires Innotec Security For Undisclosed Sum,2023-11-02 11:38:07,RTTNews
acn,"Analysts Conflicted on These Technology Names: DXC Technology (DXC), Instructure Holdings (INST) and Accenture (ACN)",2023-11-02 05:41:55,TipRanks
acn,Stagwell (STGW) Completes Divestment of ConcentricLife to Accenture for $245 Million,2023-11-01 13:26:00,PR Newswire
acn,Accenture To Acquire OnProcess Technology,2023-10-31 14:31:37,RTTNews
acn,"STAGWELL (STGW) TO SELL CONCENTRICLIFE, INTEGRATED HEALTHCARE MARKETING AGENCY, TO ACCENTURE",2023-10-25 18:45:00,PR Newswire
acn,3 Stocks to Buy Before They Become the Next Trillion-Dollar Companies in 2024,2023-10-25 18:00:00,InvestorPlace
acn,"Hershey, Fastly And 2 Other Stocks Insiders Are Selling",2023-10-25 14:04:09,Benzinga
acn,"Analysts Have Conflicting Sentiments on These Technology Companies: Autodesk (ADSK), Accenture (ACN) and Techtronic Industries (OtherTTNDF)",2023-10-25 06:10:44,TipRanks
acn,Accenture Buys ON Service GROUP For Undisclosed Sum,2023-10-18 10:41:21,RTTNews
acn,Accenture Federal Services and Google Public Sector Launch Cybersecurity Center of Excellence,2023-10-17 15:00:00,PR Newswire
acn,"Analysts Are Bullish on Top Technology Stocks: Booz Allen (BAH), Accenture (ACN)",2023-10-13 09:10:48,TipRanks
acn,7 Tech Stocks To Make You The Millionaire Next Door: October Edition,2023-10-12 17:48:36,InvestorPlace
acn,Accenture Invests Undisclosed Sum In Aliro Quantum,2023-10-10 14:31:22,RTTNews
acn,7 Tech Stocks That Also Pay You to Own Them,2023-10-10 00:57:30,InvestorPlace
acn,3 Machine Learning Stocks Ready to Make a Move Higher,2023-10-06 15:47:55,InvestorPlace
acn,"Analysts Offer Insights on Technology Companies: Snowflake (SNOW), Accenture (ACN) and Rivian Automotive (RIVN)",2023-10-05 07:40:30,TipRanks
acn,"Accenture's Conservative Approach To FY24 Justified, Says Analyst: What Investors Should Know",2023-09-29 20:33:14,Benzinga
acn,Accenture Analysts Cut Their Forecasts After Q4 Results,2023-09-29 20:28:29,Benzinga
acn,Piper Sandler Maintains Neutral Rating for Accenture: Here's What You Need To Know,2023-09-29 19:00:36,Benzinga
acn,BMO Capital Maintains Market Perform Rating for Accenture: Here's What You Need To Know,2023-09-29 19:00:11,Benzinga
acn,Nike To Rally Around 53%? Here Are 10 Other Analyst Forecasts For Friday,2023-09-29 14:03:56,Benzinga
acn,"Analysts Have Conflicting Sentiments on These Technology Companies: Nyxoah (NYXH), Tesla (TSLA) and Accenture (ACN)",2023-09-29 11:11:18,TipRanks
acn,Analysts Conflicted on These Technology Names: Accenture (ACN) and Zeta Global Holdings Corp (ZETA),2023-09-29 11:00:48,TipRanks
acn,"Analysts Conflicted on These Technology Names: Ebay (EBAY), Accenture (ACN) and Workday (WDAY)",2023-09-29 06:40:20,TipRanks
acn,Nasdaq Rises Over 100 Points; Accenture Shares Fall After Q4 Results,2023-09-28 20:30:50,Benzinga
acn,Why CarMax Shares Are Trading Lower By Around 10%? Here Are Other Stocks Moving In Thursday's Mid-Day Session,2023-09-28 19:04:17,Benzinga
acn,Accenture Issues FY24 Guidance,2023-09-28 13:28:15,RTTNews
acn,"Accenture Rides On Longer-Term AI Opportunity, Analyst Forecasts Steady Margin Expansion",2023-09-27 20:35:52,Benzinga
acn,What Wall Street expects from Accenture's earnings,2023-09-27 15:01:13,Markets Insider Automation
acn,"Analysts Offer Insights on Technology Companies: ESS Tech (GWH), Accenture (ACN) and Nutanix (NTNX)",2023-09-27 11:30:28,TipRanks
acn,Expert Ratings for Accenture,2023-09-26 16:01:09,Benzinga
acn,USMC: Bigger is Better with This Mega-Cap ETF,2023-09-25 23:01:46,TipRanks
acn,Analysts Have Conflicting Sentiments on These Technology Companies: Accenture (ACN) and Apple (AAPL),2023-09-23 05:50:15,TipRanks
acn,"ACN, PDD, INTU: 3 Attractive Tech Stocks Analysts are Bullish On",2023-09-22 20:55:17,TipRanks
acn,Pearson Taps Microsoft Veteran Omar Abbosh As Next CEO,2023-09-20 13:25:05,Benzinga
acn,Accenture (ACN): New Buy Recommendation for This Technology Giant,2023-09-18 10:15:27,TipRanks
acn,"Analysts Offer Insights on Technology Companies: Accenture (ACN), PROCEPT BioRobotics (PRCT) and Amazon (AMZN)",2023-09-13 09:02:55,TipRanks
acn,17 Analysts Have This to Say About Accenture,2023-09-08 21:00:52,Benzinga
acn,Analysts’ Opinions Are Mixed on These Technology Stocks: Accenture (ACN) and Broadcom (AVGO),2023-09-07 06:20:56,TipRanks
acn,September Rally? 3 Technology Stocks to Buy Before Liftoff.,2023-09-06 20:00:17,InvestorPlace
acn,Analysts Offer Insights on Technology Companies: Applied Materials (AMAT) and Accenture (ACN),2023-09-02 05:50:25,TipRanks
acn,"Analysts’ Opinions Are Mixed on These Technology Stocks: nCino (NCNO), MongoDB (MDB) and Accenture (ACN)",2023-09-01 06:43:56,TipRanks
acn,"Catalyst Watch: Spotlight on Lululemon, drug pricing and the August jobs report",2023-08-25 19:00:25,Seeking Alpha
acn,Goldman Sachs Reveals Long-Term AI Portfolio: Here Are The 50 Stocks To Monitor,2023-08-22 18:03:33,Benzinga
acn,Hasbro To Rally Over 42%? Here Are 10 Other Analyst Forecasts For Tuesday,2023-08-22 14:12:36,Benzinga
acn,The 3 Most Undervalued Tech Stocks to Buy Now: August 2023,2023-08-21 14:32:07,InvestorPlace
acn,"WIX, AMZN, NOW – 3 Strong-Buy-Rated Tech Stocks with AI Upside",2023-08-18 19:16:49,TipRanks
acn,3 Machine Learning Stocks You Better Be Buying on Each and Every Dip,2023-08-11 18:30:08,InvestorPlace
acn,The 3 Best Machine Learning Stocks to Buy in August,2023-08-09 20:33:51,InvestorPlace
acn,Accenture To Form JV With Coca-Cola Bottlers Japan,2023-08-09 10:19:56,RTTNews
acn,DXC Technology slumps 25% after Q1 results bring rating cuts at Wall Street,2023-08-03 12:38:33,Seeking Alpha
acn,Wall Street Analysts Are Neutral on Top Technology Picks,2023-08-03 11:50:13,TipRanks
acn,"If You Can Only Buy One Machine Learning Stock, It Better Be One of These 3 Names",2023-08-01 12:17:54,InvestorPlace
acn,5 AI Stocks Poised for Growth Without Sky-High Risk,2023-07-31 11:00:23,InvestorPlace
acn,"ServiceNow CFO talks new generative AI offerings, Nvidia partnership",2023-07-29 12:00:00,Seeking Alpha
acn,"ServiceNow sinks even as Baird defends after strong Q2, guidance",2023-07-27 17:44:43,Seeking Alpha
acn,Accenture acquires Strongbow Consulting; terms not disclosed,2023-07-27 14:26:40,Seeking Alpha
acn,"ServiceNow slips even as Q2 results top estimates, unveils Nvidia partnership",2023-07-26 20:20:43,Seeking Alpha
acn,5 Moonshot AI Stocks to Buy Immediately,2023-07-24 15:29:21,InvestorPlace
acn,"With Q2 results on tap, IBM focus is on software growth, second-half outlook",2023-07-19 11:00:00,Seeking Alpha
acn,"Infosys Secures $2B Contract, Sets Positive Tone Amidst Accenture and TCS Reports: Analyst",2023-07-18 18:54:34,Benzinga
acn,Expert Ratings for Accenture,2023-07-07 21:00:47,Benzinga
acn,"Dividend Roundup: Unilever, PNC Financial, Oracle, AbbVie, and more",2023-07-07 11:04:22,Seeking Alpha
acn,Big Tech on the Prowl: 3 Potential AI Stock Acquisition Targets,2023-06-27 12:45:22,InvestorPlace
acn,"Benzinga's Top Ratings Upgrades, Downgrades For June 23, 2023",2023-06-23 17:01:45,Benzinga
acn,"Analysts Offer Insights on Technology Companies: DoubleVerify Holdings (DV), MongoDB (MDB) and Accenture (ACN)",2023-06-23 16:30:49,TipRanks
acn,Chipotle To Rally Over 12%? Here Are 10 Other Analyst Forecasts For Friday,2023-06-23 14:22:52,Benzinga
acn,Accenture Analysts Cut Their Forecasts After Q3 Results,2023-06-23 13:34:42,Benzinga
acn,"Analysts Are Bullish on These Technology Stocks: MongoDB (MDB), Accenture (ACN)",2023-06-23 11:40:33,TipRanks
acn,Bank of America Securities Remains a Buy on Accenture (ACN),2023-06-23 08:55:23,TipRanks
acn,"4 stocks to watch on Thursday: Accenture, Tesla and more",2023-06-22 13:29:15,Seeking Alpha
acn,Accenture Raises FY23 Adj. EPS Outlook; Boosts Dividend 15% - Update,2023-06-22 13:19:27,RTTNews
acn,"AMC, TRUP and INM among pre-market losers",2023-06-22 12:29:19,Seeking Alpha
acn,Accenture stock dips despite Q3 beat with outlook in focus,2023-06-22 11:44:21,Seeking Alpha
acn,Accenture declares $1.12 dividend,2023-06-22 10:55:48,Seeking Alpha
acn,"Accenture Non-GAAP EPS of $3.19 beats by $0.19, revenue of $16.56B beats by $80M",2023-06-22 10:47:23,Seeking Alpha
acn,"Accenture, Steelcase And 3 Stocks To Watch Heading Into Thursday",2023-06-22 10:04:11,Benzinga
acn,"Sterling Investment Partners Announces Sale of Anser Advisory to Accenture and Spinoff of Markon, Anser's Federal Consulting Business",2023-06-21 18:27:00,PR Newswire
acn,Accenture FQ3 2023 Earnings Preview,2023-06-21 16:00:45,Seeking Alpha
acn,The Latest Analyst Ratings for Accenture,2023-06-21 15:01:28,Benzinga
acn,Accenture earnings: here's what Wall Street expects,2023-06-21 15:01:13,Markets Insider Automation
acn,Analysts Optimistic Ahead of Accenture’s (NYSE:ACN) Q3 Earnings: What to Expect,2023-06-21 14:47:53,TipRanks
acn,Notable earnings before Thursday's open,2023-06-21 14:05:06,Seeking Alpha
acn,Accenture makes investment in Brazilian firm Parfin,2023-06-20 13:32:50,Seeking Alpha
acn,"New Buy Rating for Accenture (ACN), the Technology Giant",2023-06-20 10:45:15,TipRanks
acn,"Catalyst watch: Powell testifies to Congress, Microsoft-Activision Blizzard hearing and Dollar Tree event",2023-06-16 19:00:31,Seeking Alpha
acn,"Earnings Week Ahead: FedEx, KB Home, Accenture, CarMax and more",2023-06-16 18:00:09,Seeking Alpha
acn,"Benzinga's Top Ratings Upgrades, Downgrades For June 15, 2023",2023-06-15 17:01:04,Benzinga
acn,Verastem To Rally Around 287%? Here Are 10 Other Analyst Forecasts For Thursday,2023-06-15 14:10:55,Benzinga
acn,Accenture To Invest $3 Bln In Data &AI,2023-06-13 13:15:11,RTTNews
acn,"New Buy Rating for Accenture (ACN), the Technology Giant",2023-06-13 10:35:12,TipRanks
acn,The 3 Most Promising Tech Stocks to Buy Now,2023-06-13 10:20:27,InvestorPlace
acn,Immersive Labs Collaborates With Accenture To Solve Cyber Talent Shortage,2023-06-07 12:19:52,RTTNews
acn,Analysts Have Conflicting Sentiments on These Technology Companies: Microsoft (MSFT) and Accenture (ACN),2023-06-07 10:01:45,TipRanks
acn,Accenture Unit Gets $329 Mln Contract From USAID - Quick Facts,2023-06-06 15:12:07,RTTNews
acn,3 Quantum Computing Stocks That Could Skyrocket in the Next 12 Months,2023-06-06 11:00:24,InvestorPlace
acn,Analyst Ratings for Accenture,2023-06-02 21:00:51,Benzinga
acn,"Analysts Have Conflicting Sentiments on These Technology Companies: Samsara (IOT), Accenture (ACN) and Guidewire (GWRE)",2023-06-02 10:40:05,TipRanks
acn,Tech Stocks Advance On Epic AI-Rally: S&P and Dow Dip as Debt Deal Vote and Fed Rate Fears Trigger Unsettling Turbulence,2023-05-30 12:56:34,Benzinga
acn,Accenture To Acquire Green Domus; Terms Undisclosed,2023-05-29 14:29:59,RTTNews
acn,Accenture to acquire Brazilian sustainability consultancy Green Domus,2023-05-29 12:43:06,Seeking Alpha
acn,"Analysts Offer Insights on Technology Companies: Veeva Systems (VEEV), Fortive (FTV) and Accenture (ACN)",2023-05-26 11:40:05,TipRanks
acn,ACN Stock Alert: Accenture Lands Massive Contract With IRS,2023-05-24 18:46:46,InvestorPlace
acn,Accenture Federal Services to modernize IRS systems through EDOS contract,2023-05-24 13:49:29,Seeking Alpha
acn,Goldman Sachs picks top stocks in case of a hard landing,2023-05-23 11:39:57,Seeking Alpha
acn,Robert W. Baird Keeps Their Hold Rating on Accenture (ACN),2023-05-11 15:55:41,TipRanks
acn,"3 AI Stocks That Could Turn $1,000 into $10,000 in a Year",2023-05-10 18:08:56,InvestorPlace
acn,Accenture Buys Objectivity; Terms Not Disclosed,2023-05-09 12:04:35,RTTNews
acn,"Analysts Offer Insights on Technology Companies: Accenture (ACN), Globant SA (GLOB) and Zscaler (ZS)",2023-05-08 16:30:19,TipRanks
acn,The 3 Most Promising Edge Computing Stocks to Buy in May 2023,2023-05-03 10:25:42,InvestorPlace
acn,Robert W. Baird Remains a Hold on Accenture (ACN),2023-05-01 14:55:21,TipRanks
acn,"Accenture to buy Einr AS, expanding logistics to Nordics",2023-04-28 07:53:00,Seeking Alpha
acn,Tech is Back. 3 ETFs to Invest in the Sector,2023-04-27 17:53:19,TipRanks
acn,"Disney, Accenture And These 2 Stocks Insiders Are Selling",2023-04-26 13:49:57,Benzinga
acn,3 Blockchain Stocks That Could Disrupt Multiple Industries,2023-04-21 10:35:50,InvestorPlace
acn,7 Dividend Stocks to Buy That Are Backed by Strong Cash Flows,2023-04-16 18:52:57,InvestorPlace
acn,Accenture (ACN): New Buy Recommendation for This Technology Giant,2023-04-13 09:35:18,TipRanks
acn,Analysts Offer Insights on Technology Companies: Accenture (ACN) and Sprout Social (SPT),2023-04-12 06:21:57,TipRanks
acn,"Morgan Stanley cuts Comcast, adds Becton Dickinson to its model portfolio",2023-04-06 15:09:09,Seeking Alpha
acn,"Benzinga's Top Ratings Upgrades, Downgrades For April 5, 2023",2023-04-05 17:00:36,Benzinga
acn,Virtual Technologies Group Names IT Veteran Dean Marsh as CEO,2023-04-04 15:01:00,PR Newswire
acn,Pinterest Layoffs 2023: What to Know About the Latest PINS Job Cuts,2023-03-28 13:27:36,InvestorPlace
acn,"Analysts Conflicted on These Technology Names: Accenture (ACN), Activision Blizzard (ATVI) and Ciena (CIEN)",2023-03-28 10:30:43,TipRanks
acn,"Analysts Conflicted on These Technology Names: Accenture (ACN), Workday (WDAY) and Phreesia (PHR)",2023-03-27 12:40:22,TipRanks
acn,"Demand For Digital Services, Position To Deliver At Scale Earn Accenture Price Target Boost Post Q2 Beat",2023-03-24 18:59:15,Benzinga
acn,Accenture Gets Price Target Bumps By Analysts Following Upbeat Q2 Results,2023-03-24 13:29:45,Benzinga
acn,Meta Platforms To Rally Over 32%? Here Are 10 Other Analyst Forecasts For Friday,2023-03-24 13:20:57,Benzinga
acn,"Analysts Offer Insights on Technology Companies: Accenture (ACN), Lizhi Inc (LIZI) and AvePoint (AVPT)",2023-03-24 10:30:26,TipRanks
acn,"Analysts Offer Insights on Technology Companies: Accenture (ACN), Phunware (PHUN) and Health Catalyst (HCAT)",2023-03-24 10:20:48,TipRanks
acn,"Analysts Offer Insights on Technology Companies: Accenture (ACN), Netflix (NFLX) and SecureWorks (SCWX)",2023-03-24 10:10:45,TipRanks
acn,"Best Stocks to Beat the Market, 3/24/23",2023-03-24 07:14:35,TipRanks
acn,"S&P, Dow, Nasdaq choppy one day after Fed selloff",2023-03-23 19:31:37,Seeking Alpha
acn,Why Block Shares Are Trading Lower By Over 13%? Here Are Other Stocks Moving In Thursday's Mid-Day Session,2023-03-23 18:11:21,Benzinga
acn,"Nasdaq Surges Over 2%; Accenture To Reduce 19,000 Jobs",2023-03-23 17:13:25,Benzinga
acn,"KB Home, Accenture, Netflix  And Other Big Stocks Moving Higher On Thursday",2023-03-23 15:39:32,Benzinga
acn,REGN Stock Alert: Regeneron Pharmaceuticals Gains on Dupixent Drug Data,2023-03-23 14:43:13,InvestorPlace
acn,ZURA Stock Alert: Zura Bio SPAC Merger Rally Ends,2023-03-23 14:15:21,InvestorPlace
acn,Accenture Layoffs 2023: What to Know About the Latest ACN Job Cuts,2023-03-23 13:49:21,InvestorPlace
acn,"Accenture to lay off 19,000 people in cost cutting effort",2023-03-23 12:40:14,Seeking Alpha
acn,"Accenture Sees Higher Q3 Revenues; Cuts FY23 Earnings, Sales Growth View - Update",2023-03-23 12:11:05,RTTNews
acn,"S&P 500 Rebounds; Tech, Gold, Bitcoin Rally As Investors Bet On Fed Pause In May",2023-03-23 11:49:41,Benzinga
acn,Accenture declares $1.12 dividend,2023-03-23 10:51:21,Seeking Alpha
acn,"Accenture Non-GAAP EPS of $2.69 beats by $0.19, revenue of $15.81B beats by $220M",2023-03-23 10:49:08,Seeking Alpha
acn,"Accenture, Steelcase And 3 Stocks To Watch Heading Into Thursday",2023-03-23 09:04:44,Benzinga
acn,Accenture Q2 2023 Earnings Preview,2023-03-22 21:35:07,Seeking Alpha
acn,Notable earnings before Thursday's open,2023-03-22 15:12:48,Seeking Alpha
acn,Here's what Wall Street expects from Accenture's earnings report,2023-03-22 15:01:13,Markets Insider Automation
