Ticker,Title,Datetime,Source
ma,Wall Street is booming. Here's where the hot jobs are now.,2025-01-15 19:04:01,Business Insider
ma,MasterCard agrees to pay $26M to settle pay bias lawsuit,2025-01-15 11:10:46,TipRanks
ma,MasterCard price target raised to $595 from $576 at Barclays,2025-01-14 23:25:42,TipRanks
ma,"Lilly cuts FY24 outlook, United Rentals to acquire H&E: Morning Buzz",2025-01-14 17:00:54,TipRanks
ma,"Visa, Fiserv upgraded, Mastercard, Flywire cut at Seaport",2025-01-14 16:12:39,Seeking Alpha
ma,SA Charts: These companies are the biggest S&P 500 spenders on buybacks in Q3,2025-01-14 15:40:56,Seeking Alpha
ma,MasterCard price target raised to $584 from $572 at Citi,2025-01-14 15:00:41,TipRanks
ma,"Visa upgraded, MasterCard downgraded: Wall Street’s top analyst calls",2025-01-14 14:41:10,TipRanks
ma,Seaport downgrades MasterCard on preference for Visa in 2025,2025-01-14 12:46:53,TipRanks
ma,Visa upgraded to Buy at Seaport Research on U.S. exposure,2025-01-14 12:40:44,TipRanks
ma,MasterCard downgraded to Neutral from Buy at Seaport Research,2025-01-14 10:41:07,TipRanks
ma,Mastercard Reinforces Commitment To Ghana With The Opening Of New Office In Accra,2025-01-13 21:02:21,RTTNews
ma,Most and least shorted S&P 500 financial stocks in December,2025-01-13 18:52:04,Seeking Alpha
ma,"MasterCard expands operations in Africa, opens first office in Ghana",2025-01-13 14:36:07,TipRanks
ma,Capital One upgraded to Buy from Neutral at UBS,2025-01-13 12:25:54,TipRanks
ma,CFPB says green light for FDX to issue open banking standards,2025-01-08 22:49:12,Seeking Alpha
ma,Datavant is on the M&A hunt as the $7B health data company bulks up before a potential IPO,2025-01-07 11:02:01,Business Insider
ma,Analysts Offer Insights on Financial Companies: Mastercard (MA) and Interactive Brokers (IBKR),2025-01-05 09:21:00,TipRanks
ma,"Dividend Roundup: Johnson & Johnson, JPMorgan, Oracle, Mastercard, and more",2025-01-03 13:29:47,Seeking Alpha
ma,"Here's what Big Pharma could buy in 2025, from obesity drugs to precision cancer treatments, according to a top M&A banker",2025-01-03 11:02:00,Business Insider
ma,"U.S. credit card defaults at highest level since 2010, FT says",2024-12-30 14:40:42,TipRanks
ma,Wedbush hikes Apple target to high on Street: Morning Buzz,2024-12-26 17:00:44,TipRanks
ma,"Internal document: AWS has planned lower spending on ZT Systems, a data center gear maker being acquired by AMD",2024-12-26 15:46:01,Business Insider
ma,MasterCard SpendingPulse reports U.S. retail sales up 3.8%,2024-12-26 12:35:08,TipRanks
ma,"U.S. holiday spending climbs 4.8% Y/Y, Visa says",2024-12-23 16:47:39,Seeking Alpha
ma,Citi's 10 things to watch for in fintech in 2025,2024-12-22 21:25:16,Seeking Alpha
ma,"Costco stock no bargain, might be time to sell, Barron’s says",2024-12-22 12:30:10,TipRanks
ma,"VCs say digital agents, 'crypto mania,' and a torrent of liquidity are the tech trends to watch in 2025",2024-12-21 11:02:01,Business Insider
ma,"Analysts Offer Insights on Financial Companies: Mastercard (MA), PayPal Holdings (PYPL) and Truist Financial (TFC)",2024-12-20 18:08:39,TipRanks
ma,MasterCard completes acquisition of Recorded Future,2024-12-20 17:15:22,TipRanks
ma,"Dividend Roundup: Mastercard, Broadcom, Southwest Airlines, Waste Management, and more",2024-12-20 13:28:52,Seeking Alpha
ma,UBS’s global equity focus list: stocks within financial technology,2024-12-19 17:34:38,Seeking Alpha
ma,Deel has closed its 5th acquisition this year. Here's how its CEO decides which company to buy.,2024-12-19 10:02:01,Business Insider
ma,"MasterCard boosts dividend, Jabil reports Q1 beat: Morning Buzz",2024-12-18 17:00:52,TipRanks
ma,Least shorted S&P 500 stocks in November,2024-12-18 15:37:04,Seeking Alpha
ma,MasterCard price target raised to $654 from $564 at Morgan Stanley,2024-12-18 12:25:16,TipRanks
ma,Morgan Stanley Sticks to Its Buy Rating for Mastercard (MA),2024-12-18 11:35:33,TipRanks
ma,"CFPB again taking aim at credit card industry, rewards programs, WaPo reports",2024-12-18 11:15:39,TipRanks
ma,Mastercard board approves $12B stock buyback,2024-12-17 21:31:42,Seeking Alpha
ma,Mastercard increases dividend by ~15% to $0.76,2024-12-17 21:22:52,Seeking Alpha
ma,MasterCard raises quarterly dividend by 15% to 76c per share,2024-12-17 21:20:57,TipRanks
ma,MasterCard board approves new $12B buyback program,2024-12-17 21:20:43,TipRanks
ma,Most and least shorted S&P 500 financial stocks in November,2024-12-12 17:32:54,Seeking Alpha
ma,The biggest supermarket merger in US history is dead,2024-12-11 16:44:01,Business Insider
ma,BlackRock CFO Martin Small outlines the asset management giant's top 3 criteria for every acquisition,2024-12-11 10:02:02,Business Insider
ma,MasterCard price target raised to $610 from $590 at Jefferies,2024-12-09 15:30:32,TipRanks
ma,MasterCard price target raised to $618 from $580 at Keefe Bruyette,2024-12-09 13:20:05,TipRanks
ma,Payment processing firms track robust spending on Black Friday-Cyber Monday,2024-12-08 21:20:12,Seeking Alpha
ma,"Analysts Offer Insights on Financial Companies: Insurance Australia Group Limited (OtherIAUGF), Toronto Dominion Bank (TD) and Mastercard (MA)",2024-12-05 17:21:07,TipRanks
ma,Holiday season off to ‘healthy start’ with strong Black Friday-Cyber Monday,2024-12-04 17:05:33,TipRanks
ma,Mastercard reaches agreement in U.K. suit over card fees,2024-12-03 20:42:30,Seeking Alpha
ma,"BlackRock is buying HPS, rounding out a year of blockbuster deals",2024-12-03 11:02:01,Business Insider
ma,Mastercard (MA) Gets a Buy from Wells Fargo,2024-12-03 10:58:30,TipRanks
ma,Goldman Sachs: Go back to this investing strategy that beat the market during Trump's first term,2024-12-02 19:18:00,Business Insider
ma,"Early holiday spending data bode well for Visa, Mastercard, others, Citi says",2024-12-02 16:47:27,Seeking Alpha
ma,MasterCard price target lowered to $557 from $563 at Goldman Sachs,2024-12-02 12:17:51,TipRanks
ma,"Data shows Black Friday spending rose 3.4% year-over-year, Reuters reports",2024-12-01 12:05:10,TipRanks
ma,5 sectors that could see an uptick in dealmaking under Trump's second presidency,2024-11-28 19:42:02,Business Insider
ma,Kodak Retirement Income Plan Trust to sell some assets to Mastercard Foundation,2024-11-25 14:10:34,TipRanks
ma,BNY Mellon to manage U.S. Department of the Treasury’s Direct Express,2024-11-21 16:15:16,TipRanks
ma,Mastercard joins hands with JP Morgan to get foreign exchange on blockchain,2024-11-21 14:43:38,Seeking Alpha
ma,Mastercard’s Strategic Growth and Expansion: Analyst Buy Rating,2024-11-21 06:36:40,TipRanks
ma,Comcast doesn't want its cable TV networks anymore,2024-11-20 14:26:01,Business Insider
ma,Meet the Jersey Mike's founder now worth $7.5 billion after selling his sandwich chain to Blackstone,2024-11-20 13:32:01,Business Insider
ma,Crypto-trading platform Bakkt surges on Trump Media takeover talk,2024-11-19 12:44:01,Business Insider
ma,"Overweight-rated Financial stocks, as group’s outlook looks attractive - MS",2024-11-18 17:07:05,Seeking Alpha
ma,Quality cyclicals are expected to continue going up; here are the top-rated by Morgan Stanley,2024-11-18 16:45:31,Seeking Alpha
ma,MasterCard management to meet with Mizuho,2024-11-18 15:25:25,TipRanks
ma,Barclays Sticks to Their Buy Rating for Mastercard (MA),2024-11-18 09:07:15,TipRanks
ma,"Lone Pine takes new positions in Salesforce and Starbucks, exits Mastercard",2024-11-15 15:45:32,TipRanks
ma,Least shorted S&P 500 stocks in October,2024-11-15 15:32:00,Seeking Alpha
ma,MasterCard price target raised to $567 from $533 at TD Cowen,2024-11-15 12:30:55,TipRanks
ma,Citi Sticks to Its Buy Rating for Mastercard (MA),2024-11-15 11:48:18,TipRanks
ma,Mastercard’s Strategic Growth and Expansion: A Buy Rating by Bryan Bergin,2024-11-15 06:15:33,TipRanks
ma,"Soroban Capital buys CenterPoint Energy, exits Exelon, others in Q3",2024-11-14 22:09:33,Seeking Alpha
ma,"Lone Pine buys UnitedHealth, exits Workday in Q3",2024-11-14 22:02:11,TipRanks
ma,Disney dodges the Trump question,2024-11-14 17:36:01,Business Insider
ma,Most and least shorted S&P 500 financial stocks in October,2024-11-14 15:06:00,Seeking Alpha
ma,Seaport Global Keeps Their Buy Rating on Mastercard (MA),2024-11-14 13:56:14,TipRanks
ma,Jefferies Remains a Buy on Mastercard (MA),2024-11-14 13:15:52,TipRanks
ma,MasterCard price target raised to $565 from $550 at BMO Capital,2024-11-14 12:40:19,TipRanks
ma,Mastercard’s Strategic Growth Potential and Market Expansion: A Compelling Investment Opportunity,2024-11-14 12:05:30,TipRanks
ma,MasterCard price target raised to $564 from $544 at Morgan Stanley,2024-11-14 12:00:32,TipRanks
ma,RBC Capital Sticks to Their Buy Rating for Mastercard (MA),2024-11-14 11:47:45,TipRanks
ma,"Analysts’ Top Financial Picks: Swiss Re AG (SSREF), Mastercard (MA)",2024-11-14 11:20:11,TipRanks
ma,MasterCard price target raised to $585 from $530 at Wells Fargo,2024-11-14 11:15:20,TipRanks
ma,Mastercard: Strong Growth Potential and Market Position Justify Buy Rating,2024-11-14 11:07:34,TipRanks
ma,Mastercard’s Strong Growth Projections and Reduced Risks Justify Buy Rating,2024-11-14 09:47:36,TipRanks
ma,Mastercard’s Strategic Growth Drivers and Opportunities Reinforce Buy Rating,2024-11-13 20:15:13,TipRanks
ma,"MasterCard targets ‘largely aligned with Street expectations,’ says Barclays",2024-11-13 20:05:45,TipRanks
ma,"Charter to acquire Liberty Broadband, Spotify reports Q3 beat: Morning Buzz",2024-11-13 17:16:07,TipRanks
ma,Jensen Huang says SoftBank's Masayoshi Son once offered to help him buy out Nvidia — but he passed,2024-11-13 17:02:01,Business Insider
ma,Mastercard sees EPS CAGR in mid-teens through 2025 to 2027,2024-11-13 13:54:06,Seeking Alpha
ma,Mastercard Targets Robust Growth Through 2027 Goals,2024-11-13 13:50:39,TipRanks
ma,MasterCard sees 2025-2027 EPS CAGR in mid-teens,2024-11-13 13:37:43,TipRanks
ma,Oppenheimer Sticks to Their Buy Rating for Mastercard (MA),2024-11-13 13:07:36,TipRanks
ma,Mastercard’s Strong Performance and Growth Prospects Drive Buy Rating,2024-11-13 07:06:01,TipRanks
ma,"Analysts Are Bullish on Top Financial Stocks: Assured Guaranty (AGO), Mastercard (MA)",2024-11-12 11:10:04,TipRanks
ma,MasterCard to hold a meeting,2024-11-11 20:36:23,TipRanks
ma,Marqeta gains on report private equity firms may be circling on takeover,2024-11-11 14:52:11,Seeking Alpha
ma,Mastercard’s Investor Day: A Catalyst for Long-Term Growth and Investment Opportunities,2024-11-08 06:25:26,TipRanks
ma,Warner Bros. Discovery CEO David Zaslav thinks Trump will let him consolidate,2024-11-07 17:04:01,Business Insider
ma,Private equity giant KKR is in talks to acquire the adtech company Integral Ad Science,2024-11-06 21:26:01,Business Insider
ma,"Visa, Mastercard fees at the center of EU antitrust probe - report",2024-11-06 17:45:39,Seeking Alpha
ma,"EU investigating MasterCard, Visa retailer fees, Reuters reports",2024-11-06 17:30:14,TipRanks
ma,Deutsche Bank  Keeps Their Buy Rating on Mastercard (MA),2024-11-05 13:35:13,TipRanks
ma,MasterCard price target raised to $544 from $540 at Morgan Stanley,2024-11-04 14:25:15,TipRanks
ma,MasterCard price target raised to $572 from $566 at Citi,2024-11-04 11:40:41,TipRanks
ma,Mastercard’s Positive Outlook: Steady Growth and Favorable Trends Support Buy Rating,2024-11-04 11:38:52,TipRanks
ma,"Visa and Mastercard's growth runway in the U.S. may be shortening, Mizuho says",2024-11-03 21:15:56,Seeking Alpha
ma,How to talk like a banker,2024-11-03 12:02:01,Business Insider
ma,RBC Capital Reaffirms Their Buy Rating on Mastercard (MA),2024-11-02 01:49:48,TipRanks
ma,"Analysts Offer Insights on Financial Companies: SpareBank 1 SMN (OtherSRMGF), Erste Group Bank (OtherEBKOF) and Mastercard (MA)",2024-11-02 01:40:36,TipRanks
ma,Mastercard’s Strong Performance and Promising Outlook Justifies Buy Rating,2024-11-01 18:45:24,TipRanks
ma,MasterCard price target raised to $565 from $505 at Macquarie,2024-11-01 18:40:28,TipRanks
ma,MasterCard price target raised to $580 from $510 at Deutsche Bank,2024-11-01 12:50:21,TipRanks
ma,"Analysts Offer Insights on Financial Companies: Cipher Mining (CIFR), Mastercard (MA) and Blue Owl Capital (OWL)",2024-11-01 12:40:09,TipRanks
ma,"Analysts Offer Insights on Financial Companies: Mastercard (MA), Intercontinental Exchange (ICE) and Willis Towers Watson (WTW)",2024-11-01 12:23:07,TipRanks
ma,MasterCard price target lowered to $580 from $593 at JPMorgan,2024-11-01 11:25:40,TipRanks
ma,MasterCard price target raised to $605 from $540 at Susquehanna,2024-11-01 11:25:32,TipRanks
ma,MasterCard price target raised to $580 from $515 at KeyBanc,2024-11-01 10:20:38,TipRanks
ma,"Analysts’ Top Financial Picks: Mastercard (MA), Applied Digital Corporation (APLD)",2024-11-01 10:04:35,TipRanks
ma,Mastercard’s Strong Q3 Performance and Growth Potential Justify Buy Rating,2024-11-01 10:02:27,TipRanks
ma,Mastercard (MA) Receives a Rating Update from a Top Analyst,2024-11-01 09:26:46,TipRanks
ma,"Analysts Have Conflicting Sentiments on These Financial Companies: Lazard (LAZ), Mastercard (MA) and Lincoln National (LNC)",2024-11-01 09:11:25,TipRanks
ma,Mastercard’s Neutral Outlook Amid Growth Challenges and Regulatory Risks,2024-11-01 09:08:56,TipRanks
ma,Barclays Remains a Buy on Mastercard (MA),2024-11-01 07:26:53,TipRanks
ma,Mastercard (MA) Gets a Buy from KeyBanc,2024-11-01 07:20:24,TipRanks
ma,Mastercard Reports Strong Q3 2024 Financial Results,2024-11-01 04:18:40,TipRanks
ma,Mastercard: Strong Q3 Performance and Medium-Term Growth Prospects Amidst Regulatory and Tax Challenges,2024-10-31 21:45:13,TipRanks
ma,"Microsoft reports Q1 beat, Comcast weighs cable networks spinoff: Morning Buzz",2024-10-31 16:01:23,TipRanks
ma,MasterCard received formal request from EU over anti-competitive behavior,2024-10-31 15:05:30,TipRanks
ma,MasterCard says consumer spending ‘remains healthy’,2024-10-31 13:25:34,TipRanks
ma,MasterCard sees $85M expense in Q4,2024-10-31 13:25:26,TipRanks
ma,MasterCard says macroeconomic environment ‘remains positive’,2024-10-31 13:21:10,TipRanks
ma,Mastercard Incorporated Announces Rise In Q3 Income,2024-10-31 13:13:13,RTTNews
ma,MasterCard sees Q4 adjusted revenue growth low-teens,2024-10-31 13:12:49,TipRanks
ma,Mastercard in charts: Worldwide GDV +9% and Purchase Transactions +11% in Q3,2024-10-31 12:34:43,Seeking Alpha
ma,"Earnings Snapshot: Mastercard tops consensus in Q3, Cross-border volume up 17%",2024-10-31 12:21:28,Seeking Alpha
ma,Mastercard Q3 earnings beat amid healthy consumer spending,2024-10-31 12:18:14,Seeking Alpha
ma,"MasterCard reports Q3 adjusted EPS $3.89, consensus $3.74",2024-10-31 12:11:10,TipRanks
ma,"Mastercard Non-GAAP EPS of $3.89 beats by $0.14, revenue of $7.37B beats by $100M",2024-10-31 12:05:49,Seeking Alpha
ma,Notable companies reporting before tomorrow’s open,2024-10-30 18:00:59,TipRanks
ma,Mastercard’s Positive Outlook: Benefiting from Visa’s Strong Performance and Strategic Pricing,2024-10-30 10:18:53,TipRanks
ma,"Visa, Mastercard to post earnings this week – here's what to expect",2024-10-28 16:22:57,Seeking Alpha
ma,"Visa, Mastercard to post earnings this week – here's what to expect",2024-10-28 16:22:57,Seeking Alpha
ma,Investors eye earnings data volatility movements as it reflects highest levels in 15 years,2024-10-28 12:24:42,Seeking Alpha
ma,"Earnings week ahead: MSFT, AMZN, AAPL, META, GOOG, AMD, PFE, F, MCD, SBUX, XOM, CVX and more",2024-10-28 04:23:31,Seeking Alpha
ma,13 of 18 financial stocks post earnings beats - Earnings Scorecard,2024-10-26 18:27:00,Seeking Alpha
ma,About 75% of companies that reported earnings this week delivered EPS wins-Earnings Scorecard,2024-10-26 17:46:00,Seeking Alpha
ma,"Catalyst Watch: Eyes on tech with Apple, Amazon, Alphabet, and Meta reporting",2024-10-25 19:00:00,Seeking Alpha
ma,Mastercard’s Growth Potential and Strong Market Position Justify Buy Rating,2024-10-24 16:36:16,TipRanks
ma,Visa vs. Mastercard: Which Credit Card Giant Is the Better Buy Ahead of Earnings?,2024-10-24 10:57:25,TipRanks
ma,Bernstein Keeps Their Buy Rating on Mastercard (MA),2024-10-22 09:59:30,TipRanks
ma,MasterCard price target raised to $560 from $500 at Bernstein,2024-10-22 09:45:42,TipRanks
ma,Coherent appoints Rob Beard as chief legal and global affairs officer,2024-10-21 18:19:18,TipRanks
ma,Mastercard Launches Move Commercial Payments For Real-Time Cross-Border Transactions,2024-10-21 03:21:43,RTTNews
ma,Humana gains amid reports of renewed Cigna talks (update),2024-10-18 20:41:55,Seeking Alpha
ma,Fifth Third stock dips after Q3 revenue misses the mark as credit loss provision jumps,2024-10-18 14:17:41,Seeking Alpha
ma,Expedia stock jumps on report that Uber explored a takeover of the travel platform,2024-10-17 13:50:01,Business Insider
ma,Least shorted S&P 500 stocks in September,2024-10-16 16:21:34,Seeking Alpha
ma,Most and least shorted S&P 500 financial stocks in September,2024-10-14 16:30:39,Seeking Alpha
ma,Mastercard join hands with Citigroup for cross-border payments with debit cards,2024-10-10 12:11:45,Seeking Alpha
ma,Mastercard (MA) Receives a Buy from Barclays,2024-10-10 07:25:41,TipRanks
ma,"Mastercard introduces accelerated payments in South Africa, partners with ACIW",2024-10-08 17:24:44,Seeking Alpha
ma,"Key deals this week: AT&T, Qualcomm, Crown Castle and more",2024-10-05 18:36:00,Seeking Alpha
ma,Lower credit card-processing fees for Canadian small businesses to take effect this month,2024-10-04 14:56:29,Seeking Alpha
ma,Mastercard agrees to buy subscription management software startup Minna,2024-10-01 16:52:19,Seeking Alpha
ma,"For Wall Street deal makers, the billion-dollar bangers are back",2024-09-27 18:20:02,Business Insider
ma,"EU banks create Wero payments to reduce reliance on Visa, Mastercard - report",2024-09-27 15:21:55,Seeking Alpha
ma,Nvidia continues acquisition streak with OctoAI,2024-09-26 18:52:01,Business Insider
ma,"Visa stock sell-off, induced by DOJ suit, creates buying opportunity: Morgan Stanley",2024-09-25 13:43:22,Seeking Alpha
ma,"DOJ set to sue Visa - one analyst shifts favored stock, another says buy",2024-09-24 14:18:07,Seeking Alpha
ma,"Qualcomm buying Intel doesn't make sense, Wall Street's top chip analyst says",2024-09-23 21:22:03,Business Insider
ma,Why Intel is still so important: Real countries have fabs,2024-09-21 03:30:04,Business Insider
ma,Intel jumps after WSJ reports Qualcomm approached the struggling chipmaker about a deal,2024-09-20 23:36:01,Business Insider
ma,Will pay-by-bank option threaten Visa and Mastercard? Two analysts weigh in,2024-09-20 12:50:33,Seeking Alpha
ma,"V, MA, or AXP: Which Credit Card Stock Will Outperform?",2024-09-18 22:31:54,TipRanks
ma,Mastercard snaps seven straight days of gains,2024-09-18 20:23:25,Seeking Alpha
ma,"As consumers rack up expensive debt, credit card giants reach new highs",2024-09-17 20:19:19,Seeking Alpha
ma,Influencer app Node's $13 million sale shows how central tech and AI have become to talent management,2024-09-17 15:02:00,Business Insider
ma,Mastercard declares $0.66 dividend,2024-09-16 20:20:57,Seeking Alpha
ma,Mastercard CFO Sachin Mehra To Undergo Treatment For Non-Hodgkin Lymphoma,2024-09-16 19:17:04,RTTNews
ma,Least shorted S&P 500 stocks in August,2024-09-15 13:36:00,Seeking Alpha
ma,"Deals this week: Qualcomm, Squarespace, Adnoc, General Mills and more",2024-09-14 19:44:00,Seeking Alpha
ma,Most and least shorted S&P 500 financial stocks in August,2024-09-13 18:32:57,Seeking Alpha
ma,"Analysts Are Bullish on These Financial Stocks: US Bancorp (USB), Mastercard (MA)",2024-09-13 00:42:03,TipRanks
ma,Mastercard To Acquire Recorded Future From Insight Partners For $2.65 Bln - Quick Facts,2024-09-12 13:50:22,RTTNews
ma,Mastercard to buy Recorded Future for $2.65B,2024-09-12 11:30:40,Seeking Alpha
ma,"Visa rated Buy, Mastercard, Jack Henry rated Neutral in new Compass coverage",2024-09-04 15:36:18,Seeking Alpha
ma,"Visa raised to Outperform, Mastercard cut to Neutral at BNP",2024-09-03 15:17:22,Seeking Alpha
ma,Mastercard ramps up efforts to ditch card numbers for safer online shopping - report,2024-08-30 14:34:17,Seeking Alpha
ma,Autry Stephens sold his company for $26 billion but died before the deal was done. Here's how a Texas farm boy became an oil tycoon.,2024-08-29 14:14:01,Business Insider
ma,Mastercard To Debut Payment Passkey Service In India,2024-08-29 09:57:38,RTTNews
ma,Companies in Fin-Tech that would be impacted by a 100 basis point fall in floating rates,2024-08-27 17:48:41,Seeking Alpha
ma,Retailers charge cash-back fees to consumers on smaller supply of free cash access points: CFPB,2024-08-27 14:55:34,Seeking Alpha
ma,"Catalyst Watch: Nvidia's blockbuster earnings, CrowdStrike on the hot seat, and PCE inflation watch",2024-08-23 19:00:15,Seeking Alpha
ma,An oil tycoon sold his company for $26 billion this year — but died before the deal closed,2024-08-22 12:22:01,Business Insider
ma,"Analysts Have Conflicting Sentiments on These Financial Companies: Tokio Marine Holdings (OtherTKOMF), Mastercard (MA) and Zurich Insurance Group (OtherZFSVF)",2024-08-20 10:42:08,TipRanks
ma,The Canadian company behind Circle K wants to buy 7-Eleven's Japanese owner in a blockbuster deal,2024-08-19 16:16:01,Business Insider
ma,Mastercard is planning to lay off 3% of staff globally - report,2024-08-16 19:10:01,Seeking Alpha
ma,Mars is buying the maker of Pringles and Cheez-It for almost $36 billion,2024-08-14 13:56:01,Business Insider
ma,Analysts Offer Insights on Financial Companies: Mastercard (MA) and UBS Group AG (UBS),2024-08-14 11:20:09,TipRanks
ma,Most shorted S&P 500 financial stocks at July end,2024-08-13 18:06:05,Seeking Alpha
ma,Mastercard (MA) Receives a Buy from Jefferies,2024-08-13 12:17:01,TipRanks
ma,More public healthcare companies will be taken private. Here's what PE firms are betting on.,2024-08-12 11:02:01,Business Insider
ma,3 Undervalued Stocks Set to Skyrocket: August Edition,2024-08-11 11:25:00,InvestorPlace
ma,3 Stocks Warren Buffett Should Sell (Other Than Apple),2024-08-10 11:34:00,InvestorPlace
ma,3 Dividend Stocks to Buy Now for a Winning Portfolio,2024-08-08 15:56:02,InvestorPlace
ma,U.S. credit card debt continues rising above $1T: Is there a reason to worry?,2024-08-07 11:18:51,Seeking Alpha
ma,3 Blue-Chip Stocks on the Rise After Strong Q2 Earnings,2024-08-06 10:50:00,InvestorPlace
ma,Nvidia is on an acquisition spree even as regulatory scrutiny heats up and AI M&A cools,2024-08-05 11:02:01,Business Insider
ma,"Analysts’ Opinions Are Mixed on These Financial Stocks: Mastercard (MA), Rocket Companies (RKT) and Bank of America (BAC)",2024-08-05 08:24:10,TipRanks
ma,Barclays Remains a Buy on Mastercard (MA),2024-08-05 07:47:00,TipRanks
ma,Mastercard’s Buy Rating Affirmed: Strong U.S. Market Share Growth and Solid Revenue Prospects,2024-08-05 07:37:55,TipRanks
ma,"U.S. economy jitters are spurring more caution among consumers, survey shows",2024-08-03 20:10:00,Seeking Alpha
ma,"RIOT, CLSK, MARA top week's biggest financial losers amid bitcoin selloff",2024-08-03 14:04:00,Seeking Alpha
ma,3 Up-and-Coming Stocks That Could Make Your Summer Unforgettable,2024-08-02 11:35:00,InvestorPlace
ma,The Top 7 Growth Stocks to Buy Now: Summer 2024,2024-08-02 10:00:00,InvestorPlace
ma,Argus Research Reaffirms Their Buy Rating on Mastercard (MA),2024-08-01 14:26:52,TipRanks
ma,Buy Rating Affirmed for Mastercard Amidst Strong Q2 Performance and Positive Growth Outlook,2024-08-01 13:38:55,TipRanks
ma,Maintain Buy on Mastercard: Strong Q2 Results and Positive Growth Trajectory,2024-08-01 12:55:31,TipRanks
ma,"Analysts Offer Insights on Financial Companies: Mastercard (MA), Metlife (MET) and WisdomTree (WT)",2024-08-01 12:54:38,TipRanks
ma,Morgan Stanley Keeps Their Buy Rating on Mastercard (MA),2024-08-01 12:50:18,TipRanks
ma,Seaport Global Sticks to Their Buy Rating for Mastercard (MA),2024-08-01 12:46:59,TipRanks
ma,Mastercard (MA) Receives a Buy from Citi,2024-08-01 11:06:45,TipRanks
ma,RBC Capital Remains a Buy on Mastercard (MA),2024-08-01 10:47:03,TipRanks
ma,Mastercard Stock Analysis: Hold Rating Justified Amid Growth and Risks,2024-08-01 10:02:28,TipRanks
ma,Buy Rating for Mastercard: Strong VAS Growth and Bullish Financial Outlook,2024-08-01 09:39:50,TipRanks
ma,Analysts Offer Insights on Financial Companies: Mastercard (MA) and KKR & Co (KKR),2024-08-01 08:23:38,TipRanks
ma,Barclays Remains a Buy on Mastercard (MA),2024-08-01 08:22:40,TipRanks
ma,Mastercard (MA) Receives a Buy from KeyBanc,2024-08-01 08:17:43,TipRanks
ma,Buy Rating Affirmed for Mastercard Amid Strong Financial Performance and Positive Outlook,2024-08-01 07:45:30,TipRanks
ma,Mastercard (MA) Gets a Buy from KBW,2024-08-01 05:36:37,TipRanks
ma,Mastercard’s Sustained Growth and Strategic Positioning Merit a Buy Rating with a Raised Target of $533,2024-07-31 22:15:36,TipRanks
ma,"MA Stock Earnings: Mastercard Beats EPS, Beats Revenue for Q2 2024",2024-07-31 16:53:22,InvestorPlace
ma,"Mastercard Incorporated Q2 Profit Increases, Beats Estimates",2024-07-31 14:09:17,RTTNews
ma,"Biggest stock movers today: MA, MO, AMD, ASML, and more",2024-07-31 13:50:32,Seeking Alpha
ma,Mastercard Q2 earnings and revenue top consensus on healthy consumer spending,2024-07-31 13:09:57,Seeking Alpha
ma,Mastercard in charts: Worldwide GDV and Purchase Transactions rise Q/Q and Y/Y in Q2,2024-07-31 12:29:26,Seeking Alpha
ma,"Earnings Summary: Mastercard surpasses consensus in Q2, Cross-border volume up 17%",2024-07-31 12:16:32,Seeking Alpha
ma,"Mastercard Non-GAAP EPS of $3.59 beats by $0.08, revenue of $7B beats by $150M",2024-07-31 12:07:40,Seeking Alpha
ma,3 Growth Stocks That Could Make Your Summer Unforgettable,2024-07-31 11:02:00,InvestorPlace
ma,The Top 3 Software Stocks to Buy Now: Summer 2024,2024-07-30 20:21:09,InvestorPlace
