Ticker,Title,Datetime,Source
ma,Mastercard Vs. Visa: Analyst Nods For Mastercard After Impressive Quarterly Performance,2024-02-01 23:15:23,Benzinga
ma,The 3 Best Dividend Stocks to Invest In for Big Gains in 2024,2024-02-01 23:13:51,InvestorPlace
ma,Expert Ratings For Mastercard,2024-02-01 20:00:57,Benzinga
ma,"T Rowe Price, Zion most shorted S&P 500 financial stocks in mid-January",2024-02-01 17:53:11,Seeking Alpha
ma,"Analysts Are Bullish on Top Financial Stocks: Hanover Insurance (THG), Mastercard (MA)",2024-02-01 13:01:11,TipRanks
ma,Mastercard (MA): A Strong Buy on Robust International Growth and Diversified Revenue Streams,2024-02-01 12:35:36,TipRanks
ma,Analysts’ Opinions Are Mixed on These Financial Stocks: Mastercard (MA) and Bank OZK (OZK),2024-02-01 12:21:02,TipRanks
ma,"Analysts Offer Insights on Financial Companies: Chubb (CB), Mastercard (MA) and First Commonwealth (FCF)",2024-02-01 12:10:15,TipRanks
ma,Mastercard’s Strong Financial Outlook and Consumer Resilience Prompt ‘Buy’ Rating,2024-02-01 11:46:02,TipRanks
ma,"Warren Buffett's Berkshire Hathaway is an epic turnaround story — and its latest deal looks a winner, expert says",2024-02-01 10:44:01,Business Insider
ma,Mastercard’s Growth and Valuation Potential: A Buy Rating Justification,2024-02-01 10:25:53,TipRanks
ma,"Analysts’ Opinions Are Mixed on These Financial Stocks: Marketaxess Holdings (MKTX), Navient (NAVI) and Mastercard (MA)",2024-02-01 10:04:25,TipRanks
ma,Mastercard (MA) Receives a Buy from KeyBanc,2024-02-01 07:35:31,TipRanks
ma,"Analysts Offer Insights on Financial Companies: Marketaxess Holdings (MKTX), Evercore Partners (EVR) and Mastercard (MA)",2024-02-01 06:40:08,TipRanks
ma,Monness Sticks to Its Hold Rating for Mastercard (MA),2024-01-31 19:56:14,TipRanks
ma,"Nasdaq, S&P 500 Slip Ahead Of Fed Meeting, Regional Banks Sink After NYCB Disappoints: What's Driving Markets Wednesday?",2024-01-31 18:45:28,Benzinga
ma,Cash Flow Kings: 3 Dream Dividend Stocks for Steady Income,2024-01-31 17:57:41,InvestorPlace
ma,MasterCard Inc. hosts conference call for investors,2024-01-31 14:45:00,Markets Insider Automation
ma,"5 stocks to watch on Wednesday: Boeing, Qualcomm, Teva Pharmaceutical and more",2024-01-31 14:17:00,Seeking Alpha
ma,"Mastercard Incorporated Q4 Profit Increases, beats estimates",2024-01-31 14:05:13,RTTNews
ma,"Mastercard Q4 earnings, revenue beat consensus, gross dollar volume misses",2024-01-31 13:42:54,Seeking Alpha
ma,"Mastercard in charts: Worldwide GDV surges 10%, Purchase Transactions soar ~13% in Q4",2024-01-31 13:20:37,Seeking Alpha
ma,"Mastercard Non-GAAP EPS of $3.18 beats by $0.10, revenue of $6.5B beats by $20M",2024-01-31 13:03:23,Seeking Alpha
ma,Notable earnings before Wednesday's open,2024-01-30 15:50:57,Seeking Alpha
ma,MasterCard earnings: here's what to expect,2024-01-30 15:01:13,Markets Insider Automation
ma,"Dillard’s, Citi and Mastercard enter into new credit card agreements",2024-01-29 21:23:18,Seeking Alpha
ma,3 Under-$10 Stocks With Millionaire-Maker Potential,2024-01-29 18:47:22,InvestorPlace
ma,"Marathon Petroleum, Exxon among BofA picks for options opportunity on earnings surprise",2024-01-29 17:14:01,Seeking Alpha
ma,"Catalyst watch: Apple earnings, Boeing on the hot seat, FOMC meeting and Amer Sports IPO",2024-01-26 20:00:55,Seeking Alpha
ma,5 Mega-Cap Stocks Ready to Make the Magnificent 7 a Dynamic Dozen,2024-01-25 18:01:15,InvestorPlace
ma,"Eyes on consumer spending ahead of Visa, Mastercard earnings reports",2024-01-24 19:08:00,Seeking Alpha
ma,"Mastercard, Clearing House To Expand Real-Time Payments Partnership",2024-01-24 15:51:09,RTTNews
ma,"Warren Buffett's company bought out a truck-stop business with bigger revenues than Nike, Coke, or Netflix",2024-01-24 15:46:01,Business Insider
ma,"Mastercard, The Clearing House extend partnership for real-time payments",2024-01-24 15:33:48,Seeking Alpha
ma,Beyond the Magnificent 7 Stocks: 3 Underdogs to Watch in 2024,2024-01-23 22:57:28,InvestorPlace
ma,Mastercard Stock (NYSE:MA): Soft Landing to Support Strong Growth,2024-01-23 22:11:15,TipRanks
ma,12 Stocks Near Record Highs Thanks to Bullish Consumer Sentiment,2024-01-23 20:09:31,InvestorPlace
ma,Mizuho USA's top fintech payment picks for 2024,2024-01-21 21:35:00,Seeking Alpha
ma,"DocuSign, Zoom, and Twilio thrived in the pandemic-era stock market. In 2024, they're some of cloud software's most likely M&A targets.",2024-01-19 20:54:01,Premium
ma,Affirm and Robinhood Make It To Top FinTech Stocks for 2024 - Analyst Says It Promises Growth for Average Americans,2024-01-18 20:44:20,Benzinga
ma,3 ‘Forever’ Dividend Stocks to Lock Up Now and Throw Away the Key,2024-01-18 19:11:30,InvestorPlace
ma,"ADP Analyst Upgrades Stock Before Q2 Earnings, But Still Favors Visa And Mastercard",2024-01-17 17:56:46,Benzinga
ma,Warren Buffett's company now fully owns a truck-stop chain that was the 5th-largest private company in America,2024-01-17 13:54:00,Business Insider
ma,Goldman Sachs Finds Mastercard Shining In 2024 Despite Weak Industry Outlook,2024-01-11 21:44:45,Benzinga
ma,Goldman Sachs Maintains Buy Rating for Mastercard: Here's What You Need To Know,2024-01-11 18:00:19,Benzinga
ma,V Stock Prediction: Can Visa Be a $1 Trillion Company in 5 Years?,2024-01-11 11:20:00,InvestorPlace
ma,Why Mastercard Stock Is Your Best Dividend Pick for 2024,2024-01-10 18:57:36,InvestorPlace
ma,"'A tale of two cities': Only the very best late-stage startups will raise funds in 2024, investors say",2024-01-10 11:02:02,Premium
ma,3 Stocks Set to Soar 68% to 200% Higher,2024-01-09 03:58:10,InvestorPlace
ma,A Closer Look at 15 Analyst Recommendations For Mastercard,2024-01-08 14:00:31,Benzinga
ma,"Analysts Conflicted on These Financial Names: Mastercard (MA), Popular (BPOP) and Western Alliance (WAL)",2024-01-05 11:00:43,TipRanks
ma,3 High-Octane Growth Stocks Ready to Hit New 52-Week Highs,2024-01-05 10:24:00,InvestorPlace
ma,Investment bankers are watching these 6 signals as they pray for an M&A rebound in 2024,2024-01-01 13:16:01,Premium
ma,Why Are They Pounding the Table for PayPal Stock Heading Into 2024?,2023-12-30 17:19:59,InvestorPlace
ma,The Top 7 Stocks to Buy Before They Take Off Next Year,2023-12-30 12:00:00,InvestorPlace
ma,"The 500 Top Stocks to Buy for 2024, Ranked by AI",2023-12-29 19:35:36,InvestorPlace
ma,Wall Street is gearing up for an AI shopping spree. Meet 11 bankers poised to come out on top.,2023-12-26 11:02:02,Premium
ma,World Stage Winners: 3 Stocks Benefitting from Global Geopolitical Shifts,2023-12-25 18:36:15,InvestorPlace
ma,Morgan Stanley's CEO blames 2023's bank failures on 'stupidity of their own management',2023-12-22 12:20:01,Business Insider
ma,7 Low-Volatility Stocks for Stable Growth in 2024,2023-12-21 19:11:41,InvestorPlace
ma,Best Blue-Chip Stocks 2024: 7 to Add to Your Must-Buy List,2023-12-21 13:53:07,InvestorPlace
ma,7 Blue-Chip Dividend Stocks to Buy Before Dec. 31,2023-12-20 00:08:39,InvestorPlace
ma,Mergers and acquisitions tumble more than 30% to fall short of $3 trillion for the first time in 10 years,2023-12-19 16:48:01,Business Insider
ma,"SOFI, COIN, HOOD, UPST, or AFRM: Who’s Winning the Fintech Stocks Race?",2023-12-18 21:24:43,InvestorPlace
ma,Income Boosters: 3 Stocks With Newly Announced Dividend Hikes,2023-12-18 18:10:28,InvestorPlace
ma,"GS, MA, V: Top Hedge Fund Expert Favors These 3 Financial Stocks",2023-12-18 10:41:11,TipRanks
ma,Analysts Offer Insights on Financial Companies: Mastercard (MA) and Charles Schwab (SCHW),2023-12-18 01:30:19,TipRanks
ma,3 Dividend Stock Cash Machines That Will Pay You Forever,2023-12-15 18:18:01,InvestorPlace
ma,"Warren Buffett snaps up nearly $600 million of Occidental stock in 3 days, signaling he likes the energy group's latest deal",2023-12-14 12:22:01,Business Insider
ma,Mastercard Stock (NYSE:MA) is Hedge Fund Expert’s Top Pick,2023-12-14 11:02:28,TipRanks
ma,Wells Fargo Sticks to Their Buy Rating for Mastercard (MA),2023-12-14 10:46:56,TipRanks
ma,3 Compelling Dividend Stocks With Strong Buy Ratings,2023-12-14 10:35:00,InvestorPlace
ma,"UK Payments Regulator Proposes To Cap Cross-border Fees On Mastercard, Visa Cards",2023-12-13 12:29:14,RTTNews
ma,Adtech company Perion is acquiring digital billboard ad platform Hivestack for $100 million,2023-12-12 12:32:01,Premium
ma,Life-Changing Investments: 3 Stocks That Will Set You Up for the Long Haul,2023-12-11 20:42:45,InvestorPlace
ma,"Legendary investor Charlie Munger shared his regrets, mistakes, and life lessons in his final TV interview. Here are the 18 best quotes.",2023-12-10 15:36:01,Business Insider
ma,Dividend Gold: 3 Stocks With Sustainable Payouts,2023-12-08 11:15:00,InvestorPlace
ma,Blue-Chip Resilience: 3 Stocks Defying Market Trends,2023-12-07 23:27:38,InvestorPlace
ma,Mastercard’s Strategic Buyback Program and Dividend Increase Bolster Buy Rating,2023-12-07 08:10:57,TipRanks
ma,It sure looks like corporate America isn't afraid of Joe Biden anymore,2023-12-06 12:02:01,Business Insider
ma,Analyst Expectations for Mastercard's Future,2023-12-05 19:00:33,Benzinga
ma,Buy Rating Affirmed for Mastercard Amidst Innovation and Strategic Growth Opportunities,2023-12-05 10:16:51,TipRanks
ma,Warren Buffett may help Occidental Petroleum pay for a potential $10 billion takeover. Here's what's fueling the speculation.,2023-12-05 10:10:01,Business Insider
ma,7 Dividend Stocks That Will Warm Your Heart This Winter,2023-12-04 12:00:00,InvestorPlace
ma,7 Stocks That Your Grandchildren Will Be Glad You Bought for Them,2023-12-03 21:33:28,InvestorPlace
ma,Broadcom CEO Hock Tan plans to consolidate teams at VMware: 'I don't need two sales organizations',2023-11-30 22:44:01,Premium
ma,7 Top-Rated Fintech Stocks That Analysts Are Loving Now,2023-11-29 18:40:09,InvestorPlace
ma,J.Crew Group Partners with Synchrony and Mastercard® for New Credit Card Program,2023-11-29 14:00:00,PR Newswire
ma,"Biz2X, Mastercard Tie-up To Provide Analytics To Small Business Lenders",2023-11-28 12:44:14,RTTNews
ma,Broadcom lays off many VMware employees after closing its $69 billion acquisition of the company,2023-11-27 19:28:01,Business Insider
ma,3 Elite Dividend-Paying Stocks to Hold for Eons,2023-11-21 16:21:49,InvestorPlace
ma,The 7 Best Stocks to Buy for Slowing Inflation,2023-11-21 12:15:00,InvestorPlace
ma,The 4 Best Blockchain Stocks (Beyond Cryptocurrency),2023-11-21 00:43:06,InvestorPlace
ma,Mastercard's JV Gets Approval To Start Domestic Payments In China,2023-11-20 15:55:00,RTTNews
ma,"Warren Buffett's company has built a record $157 billion cash pile so he can capitalize when the economy tanks, veteran professor Steve Hanke says",2023-11-20 13:18:01,Business Insider
ma,Positive Growth Trajectory and Defensive Stability: A Case for Buying Mastercard Stock,2023-11-16 11:56:41,TipRanks
ma,"Warren Buffett is 'sitting on a monstrous pile of cash' so he can pounce when bargains pop up, Liberty Media's John Malone says",2023-11-14 12:32:02,Business Insider
ma,3 Monster Growth Stocks to Buy for 2024 and Beyond,2023-11-14 11:00:00,InvestorPlace
ma,3 Fintech Stocks You’ll Regret Not Buying Soon: November 2023,2023-11-13 23:33:53,InvestorPlace
ma,Over $13M Bet On This Energy Stock? Check Out These 4 Stocks Insiders Are Buying,2023-11-10 14:52:06,Benzinga
ma,Bank of America: 4 signs that a company might be acquired and see shares pop — and 12 stocks primed for a deal right now,2023-11-10 11:02:01,Premium
ma,3 Stocks that ChatGPT Says Will Be Winners This Holiday Season,2023-11-06 20:00:30,InvestorPlace
ma,Warren Buffett's Berkshire Hathaway reveals record $157 billion cash pile as the investor hunts in vain for bargains,2023-11-04 14:48:02,Business Insider
ma,Find Stability in the Market With These 7 Blue-Chip Stocks to Buy,2023-11-03 10:10:00,InvestorPlace
ma,"Internal documents reveal new details of X stock awards to staff, including what happens if the company IPOs or is acquired",2023-10-31 20:56:01,Premium
ma,"Analysts Conflicted on These Financial Names: Mastercard (MA), Travelers Companies (TRV) and Lazard (LAZ)",2023-10-31 11:10:07,TipRanks
ma,Analysts Offer Insights on Financial Companies: Mastercard (MA) and WEX (WEX),2023-10-31 07:20:15,TipRanks
ma,"Analysts Offer Insights on Financial Companies: BrightSpire Capital (BRSP), Mastercard (MA) and UOB (OtherUOVEF)",2023-10-31 07:11:01,TipRanks
ma,"Analysts Are Bullish on These Financial Stocks: Primerica (PRI), Mastercard (MA)",2023-10-30 02:30:10,TipRanks
ma,"Analysts Are Bullish on These Financial Stocks: LPL Financial (LPLA), Mastercard (MA)",2023-10-30 01:20:07,TipRanks
ma,Raymond James Sticks to Its Buy Rating for Mastercard (MA),2023-10-28 04:15:50,TipRanks
ma,These Analysts Lower Their Forecasts On Mastercard After Q3 Earnings,2023-10-27 19:39:50,Benzinga
ma,Analysts’ Opinions Are Mixed on These Financial Stocks: Swiss Re AG (OtherSSREF) and Mastercard (MA),2023-10-27 14:20:09,TipRanks
ma,Amazon To Rally Around 55%? Here Are 10 Top Analyst Forecasts For Friday,2023-10-27 14:06:58,Benzinga
ma,"Analysts Offer Insights on Financial Companies: Mastercard (MA), Capital City Bank (CCBG) and Cvb Financial (CVBF)",2023-10-27 12:40:17,TipRanks
ma,Oppenheimer Remains a Hold on Mastercard (MA),2023-10-27 12:08:30,TipRanks
ma,"Analysts Offer Insights on Financial Companies: Mastercard (MA), Popular (BPOP) and Bread Financial Holdings (BFH)",2023-10-27 11:12:27,TipRanks
ma,"Analysts’ Opinions Are Mixed on These Financial Stocks: UMB Financial (UMBF), SLM (SLM) and Mastercard (MA)",2023-10-27 11:00:32,TipRanks
ma,"Analysts’ Opinions Are Mixed on These Financial Stocks: Bread Financial Holdings (BFH), Willis Towers Watson (WTW) and Mastercard (MA)",2023-10-27 10:50:21,TipRanks
ma,"Analysts Conflicted on These Financial Names: Mastercard (MA), Arthur J Gallagher & Co (AJG) and Cullen/Frost Bankers (CFR)",2023-10-27 09:51:02,TipRanks
ma,Mastercard (MA) Gets a Buy from KeyBanc,2023-10-27 07:04:29,TipRanks
ma,"Worldline's Concerns Impact FinTech Sector, Analyst Says Affirm and Block's Reactions Unwarranted with Limited EU Exposure",2023-10-26 21:11:25,Benzinga
ma,Crude Oil Down 2.5%; Mastercard Posts Upbeat Earnings,2023-10-26 20:42:07,Benzinga
ma,"US Stocks Sink, VIX Soars As Overheated Economy, Mixed Earnings Complicate Fed's Path: What's Driving Markets Thursday?",2023-10-26 19:23:50,Benzinga
ma,"Mastercard Incorporated Q3 Profit Increases, beats estimates",2023-10-26 14:06:16,RTTNews
ma,PayPal Stock (NASDAQ:PYPL): Is the 83% Plunge Worth Buying?,2023-10-26 01:50:15,TipRanks
ma,MasterCard earnings: here's what Wall Street expects,2023-10-25 15:01:13,Markets Insider Automation
ma,Could SoFi Be a Millionaire-Maker Stock?,2023-10-25 13:47:50,InvestorPlace
ma,"Analysts Offer Insights on Financial Companies: Fiserv (FI), Mastercard (MA) and Old National Bancorp Capital (ONB)",2023-10-25 10:41:08,TipRanks
ma,"Buy, Hold or Sell SOFI Stock? What Happens on Oct. 30 Could Dictate Your Next Move.",2023-10-24 17:51:38,InvestorPlace
ma,3 Russell 2000 Stocks That Are Poised for Explosive Growth,2023-10-24 11:00:08,InvestorPlace
ma,"Ex-Shopify and Deliverr workers say layoffs, compensation issues at Flexport capped a 15-month rollercoaster: 'Honestly a bit relieved that it's over'",2023-10-23 15:54:01,Premium
ma,"Analysts Conflicted on These Financial Names: Zions Bancorporation National Association (ZION), Comerica (CMA) and Mastercard (MA)",2023-10-23 11:10:25,TipRanks
ma,SoFi’s Identity Crisis: A Bank in Fintech’s Clothing,2023-10-21 14:19:58,InvestorPlace
ma,"Investor Risk Sentiment Wavers Amid War, Interest Rate Concerns; Tesla Earnings Disappoint: The Week In The Markets",2023-10-20 22:08:03,Benzinga
ma,"J.P. Morgan, Mastercard Launches Pay-by-bank Solution",2023-10-20 13:29:51,RTTNews
ma,"Analysts Offer Insights on Financial Companies: Hancock Whitney (HWC), Mastercard (MA) and Encore Capital (ECPG)",2023-10-20 02:30:12,TipRanks
ma,7 Stocks to Buy Before They Become the Next Trillion-Dollar Companies: October Edition,2023-10-19 16:25:11,InvestorPlace
ma,SoFi’s Slow Burn: Why Patience With SOFI Stock Could Pay Off,2023-10-18 21:19:48,InvestorPlace
ma,Visa To Rally More Than 15%? Here Are 10 Top Analyst Forecasts For Wednesday,2023-10-18 14:04:01,Benzinga
ma,"M&A in Hollywood is revving up — insiders predict the top deals by Disney, Warner Bros. Discovery, and more after months of strikes and disruption",2023-10-17 11:12:02,Premium
ma,How to Build a Bear-Market Proof Portfolio: 7 Top Picks,2023-10-17 09:45:09,InvestorPlace
ma,Why Mastercard Is a Golden Ticket for Long-Term Investors,2023-10-15 13:00:02,InvestorPlace
ma,Seeking Stability? Goldman Sachs Says These 2 ‘Blue Chip’ Stocks Are Less Vulnerable to Rising Rates,2023-10-13 19:09:31,TipRanks
ma,"Benzinga's Top Ratings Upgrades, Downgrades For October 13, 2023",2023-10-13 17:00:31,Benzinga
ma,Will PayPal Stock (NASDAQ:PYPL) Recover from Ongoing Pressures?,2023-10-13 15:01:37,TipRanks
ma,"Fintech Stocks: Analyst Foresees Revenue Surge for BILL, Flywire, Global Payments, Mastercard and Shopify",2023-10-12 21:46:32,Benzinga
ma,7 Tech Stocks Shining Bright in a Mixed Market,2023-10-12 20:17:25,InvestorPlace
ma,"Benzinga's Top Ratings Upgrades, Downgrades For October 12, 2023",2023-10-12 17:00:36,Benzinga
ma,3 Millionaire-Maker Growth Stocks the Market Is Totally Overlooking,2023-10-11 19:18:33,InvestorPlace
ma,MA Stock Forecast: Where Is MasterCard Heading in 2024?,2023-10-11 14:44:09,InvestorPlace
ma,Why Is SoFi Stock Up Today?,2023-10-11 13:40:42,InvestorPlace
ma,The Top 7 Stocks to Own During a Downturn,2023-10-11 10:15:09,InvestorPlace
ma,Analysts Offer Insights on Financial Companies: Bok Financial (BOKF) and Mastercard (MA),2023-10-11 10:00:57,TipRanks
ma,"MA, SQ, NVEI: 3 Fintech Stocks Wall Street’s Pounding the Table On",2023-10-11 03:23:24,TipRanks
ma,Analyst Ratings for Mastercard,2023-10-09 21:00:25,Benzinga
ma,Mastercard Buy Rating: A Comprehensive Analysis of Growth Potential and Future Outlook,2023-10-09 05:15:36,TipRanks
ma,"Mastercard Adds On-demand Grocery Delivery, Streaming Services To Card Benefits",2023-10-05 16:01:47,RTTNews
ma,How to (Actually) Get Rich With AI Investing,2023-10-05 15:50:40,InvestorPlace
ma,Sure Winners: 7 Stocks Set to Outperform in the Next Recession,2023-10-04 10:45:07,InvestorPlace
ma,"Higher Rates, Lower Leverage: Growth Stocks To Struggle While AI Offers Hope, Goldman Sachs Analysts Say",2023-10-03 15:13:57,Benzinga
ma,Q4 Stock Predictions: 3 Blockchain Stocks Ready to Break Out in 2024,2023-10-03 14:39:41,InvestorPlace
ma,SCHX ETF: A Large-Cap ETF for Large Gains,2023-09-29 01:52:14,TipRanks
ma,Investment Time Machine: 3 Growth Stocks for a Regret-Free 2033,2023-09-28 11:37:39,InvestorPlace
ma,7 Perfect Stock Picks for a Moody Market,2023-09-27 20:44:45,InvestorPlace
ma,Don’t Miss the Boom: 3 Blockchain Stocks Set to Explode Higher,2023-09-27 20:04:14,InvestorPlace
ma,Mastercard Stock: A Solid Investment Amid Retail Sales Growth and Potential Challenges – An Analysis by Paul Golding,2023-09-27 14:26:33,TipRanks
ma,7 Stocks That Could Soar Following the Fed’s Latest Decision,2023-09-26 00:19:29,InvestorPlace
ma,USMC: Bigger is Better with This Mega-Cap ETF,2023-09-25 23:01:46,TipRanks
ma,Mastercard's ePayment Growth and B2B Potential: Why One Analyst Raised Their Forecast,2023-09-25 22:02:14,Benzinga
ma,Baidu To Rally Over 29%? Here Are 10 Other Analyst Forecasts For Monday,2023-09-25 14:39:32,Benzinga
ma,'Shark Tank' investor Kevin O'Leary likely made over 20 times his money on a startup selling genetic-testing kits for cats,2023-09-23 13:46:01,Business Insider
ma,DBS Remains a Buy on Mastercard (MA),2023-09-23 06:25:05,TipRanks
ma,Analysts Offer Insights on Financial Companies: JPMorgan Chase & Co. (JPM) and Mastercard (MA),2023-09-23 06:12:20,TipRanks
ma,"Analysts Are Bullish on Top Financial Stocks: JPMorgan Chase & Co. (JPM), Mastercard (MA)",2023-09-23 06:01:50,TipRanks
ma,"AMZN, V, MA: 3 Payment Plays Set to Outperform",2023-09-20 20:05:04,TipRanks
ma,3 Blue-Chip Stocks That Should Be on Every Investor’s Radar This Fall,2023-09-19 17:14:11,InvestorPlace
ma,"Cerebral Valley, the AI conference that spawned a $1.3 billion deal, is coming back to San Francisco this year",2023-09-19 16:02:01,Business Insider
ma,Mastercard Stock (NYSE:MA): There’s Still More Upside Potential,2023-09-18 19:20:44,TipRanks
ma,Warren Buffett poured $3 billion into Dow Chemical during the financial crisis. Here's the story of how he helped the manufacturing titan – and doubled his money.,2023-09-16 11:40:01,Business Insider
ma,The Latest Analyst Ratings for Mastercard,2023-09-15 21:00:40,Benzinga
ma,Betting With the ‘Big Short’: 3 Michael Burry Stocks to Bank On,2023-09-15 13:57:06,InvestorPlace
ma,The 3 Most Undervalued Blockchain Stocks to Buy in September 2023,2023-09-14 19:11:03,InvestorPlace
ma,The 7 Most Undervalued Financial Services Stocks to Buy in September 2023,2023-09-14 12:42:20,InvestorPlace
ma,Feeling Bold? Buy PayPal Stock While It’s Oversold.,2023-09-14 10:20:36,InvestorPlace
ma,Adtech firm GroundTruth hires bankers to pursue a possible sale,2023-09-13 21:08:01,Premium
ma,"Xbox to Launch the Xbox Mastercard, Its First-Ever Credit Card in the US, Issued by Barclays",2023-09-11 18:00:00,PR Newswire
ma,The 3 Best Safe Stocks to Buy Now: September 2023,2023-09-08 12:36:54,InvestorPlace
ma,"7 Tech Stocks to Invest In for Big-Time, Long-Term Gains",2023-09-08 10:10:08,InvestorPlace
ma,The 3 Best Blockchain Stocks to Buy Now: September 2023,2023-09-05 19:00:02,InvestorPlace
ma,Mastercard says report on credit-card fee hikes is wrong,2023-09-05 14:39:04,Seeking Alpha
ma,7 Tech Stocks to Buy to Go Beyond the ‘Magnificent 7’,2023-09-05 09:55:29,InvestorPlace
ma,"Vanguard Mega Cap Growth ETF (MGK): Go Big, or Go Home",2023-09-01 01:38:50,TipRanks
ma,"Visa, Mastercard Set To Raise Credit-Card Fees",2023-08-31 15:46:23,RTTNews
ma,"Visa, Mastercard said to be planning hikes in credit card fees",2023-08-30 14:43:10,Seeking Alpha
ma,7 Millionaire-Maker Blockchain Stocks to Hold Through Thick and Thin,2023-08-30 10:10:38,InvestorPlace
ma,SPLG: The Market’s Lowest-Cost S&P 500 ETF,2023-08-30 00:58:15,TipRanks
ma,Mastercard (MA) Receives a Buy from Mizuho Securities,2023-08-30 00:16:15,TipRanks
ma,"Champions Round, a Gen-Z fantasy sports app that raised $10 million, is winding down and looking to sell its assets",2023-08-29 18:28:01,Premium
ma,BMO Commercial Bank launches mobile wallet for virutal cards with Mastercard,2023-08-28 16:44:12,Seeking Alpha
ma,BMO Launches Mobile Wallet for Virtual Cards with Mastercard and Extend,2023-08-28 14:00:00,PR Newswire
ma,Hedge and mutual funds rotate from tech; see the stocks they love and shun,2023-08-28 10:35:42,Seeking Alpha
ma,"WeWork's Journey From $47B Valuation To Possible Bankruptcy, Mastercard and Visa Reassess Ties with Binance Card, Hawaiian Electric Accused Of Jeopardizing Investigation Of Maui Wildfires:",2023-08-25 15:40:21,Benzinga
ma,"Mastercard to end crypto card pact with Binance in LatAm, Middle East",2023-08-25 13:24:00,Seeking Alpha
ma,Play It Safe With B-Rated Mastercard Stock,2023-08-25 10:20:54,InvestorPlace
ma,3 Stocks to Bet On for Their Top-Ranked Workplaces,2023-08-24 12:00:14,InvestorPlace
ma,3 Wide-Moat Stocks That Warren Buffett Loves,2023-08-23 19:05:44,InvestorPlace
ma,Mastercard (MA) Receives a Buy from Robert W. Baird,2023-08-23 08:15:12,TipRanks
ma,Want to Get Rich? 3 Game-Changing Blockchain Stocks to Buy Right Now,2023-08-22 15:42:08,InvestorPlace
ma,Analyst Expectations for Mastercard's Future,2023-08-22 15:00:22,Benzinga
ma,Infillion emerges as buyer for bankrupt adtech company MediaMath,2023-08-22 11:50:02,Premium
ma,These Are the ONLY 7 Warren Buffett Stocks to Consider in August 2023,2023-08-21 20:02:32,InvestorPlace
ma,The 3 Most Undervalued Cannabis Stocks to Buy Now: August 2023,2023-08-18 00:37:27,InvestorPlace
ma,Trillion-Dollar Trio: These 3 Super Growth Stocks Will Dominate the Market by 2035,2023-08-18 00:31:21,InvestorPlace
ma,"Jim Cramer: This Stock Moved So High 'It Doesn't Make Any Money,' Plus: A 'Hard Pass' On DWAC",2023-08-17 14:58:23,Benzinga
ma,5 Blue-Chip Stocks AI Thinks Will Double Your Money by 2027,2023-08-16 16:42:18,InvestorPlace
ma,"PayPal Has a New CEO, But Old Challenges Remain - Analysts Discuss Future Path",2023-08-15 20:13:50,Benzinga
ma,"Jim Cramer Says Forget PayPal And Block, These 2 Payment Processors Are Better Investments",2023-08-15 14:01:17,Benzinga
ma,"Soroban Capital exits Mosaic, boosts Mastercard",2023-08-14 22:08:16,Seeking Alpha
ma,"Ray Dalio's Bridgewater sells Netflix, Home Depot, adds AT&T, Micron",2023-08-14 21:32:24,Seeking Alpha
ma,"Tiger Global reduces holdings in tech, boosts stakes in Grab, Apollo, adds Eli Lilly",2023-08-14 19:06:48,Seeking Alpha
ma,3 Stocks That Could Soar From the Rise in Paycheck-to-Paycheck Living,2023-08-08 19:10:08,InvestorPlace
ma,3 Strong and Steady Blue-Chip Stocks for the Long-Term Investor,2023-08-08 13:20:48,InvestorPlace
ma,"Regions Financial unveils tool to let businesses streamline billing, payments",2023-08-07 15:58:23,Seeking Alpha
ma,3 Cheap Blockchain Stocks That Smart Investors Will Snap Up Now,2023-08-06 16:00:01,InvestorPlace
ma,Investing in Expedia: Analysts Weigh in on Value and Risks Amid Revenue Shortfalls and Marketing Spend Shifts,2023-08-04 21:18:09,Benzinga
ma,"Catalyst Watch: Wayfair and Kellogg events, Alibaba earnings and AI hacking test at Def Con",2023-08-04 19:00:42,Seeking Alpha
ma,RBC Capital Remains a Buy on Mastercard (MA),2023-08-03 01:45:46,TipRanks
ma,7 ‘Strong Buy’ Tech Stocks You Should Be Loading Up On Now,2023-08-03 00:18:13,InvestorPlace
ma,Citi Sticks to Their Buy Rating for Mastercard (MA),2023-08-01 12:15:43,TipRanks
ma,"Analysts Offer Insights on Financial Companies: Cullen/Frost Bankers (CFR), Assurant (AIZ) and Mastercard (MA)",2023-08-01 02:30:21,TipRanks
