Ticker,Title,Datetime,Source
tsm,Donald Trump And 5 Other Business Bosses Who Invoked Their Fifth Amendment Rights,2022-08-10 22:00:06,Benzinga
tsm,Can New Investments Help Micron (MU) Stock Turn Around?,2022-08-09 20:44:08,InvestorPlace
tsm,Biden poised to sign off on CHIPS and Science Act,2022-08-09 10:27:34,Seeking Alpha
tsm,"Tech Roundup: Pelosi, Taiwan, chips and AMTD Digital's wild stock-price swings",2022-08-06 16:00:00,Seeking Alpha
tsm,The 7 Best Blockchain Stocks to Buy Now,2022-08-04 19:31:23,InvestorPlace
tsm,Is Nancy Pelosi Making a Big Bet on Taiwan Semi (TSM) Stock?,2022-08-03 16:26:07,InvestorPlace
tsm,AMD climbs ahead of Q2 results; chip stocks mixed as Taiwan tensions rise,2022-08-02 15:58:51,Seeking Alpha
tsm,Markets drop as tensions flare ahead of Pelosi visit to Taiwan,2022-08-02 08:23:23,Seeking Alpha
tsm,"Why Are Chip Stocks AMD, NVDA, TSM, ON in the Spotlight Today?",2022-08-01 17:55:47,InvestorPlace
tsm,"AMD Could Beat Q2 Consensus Driven By Robust CPU, GPU Share Gains, Says This Analyst",2022-07-29 19:23:37,Benzinga
tsm,3 Under-the-Radar Chip Stocks to Buy Before Spending Boom,2022-07-29 17:59:35,InvestorPlace
tsm,"Micron downgrade hits chip stocks as Marvell, Nvidia, AMD lead sector lower",2022-07-22 19:55:51,Seeking Alpha
tsm,Morgan Stanley unveils its Deflation Enablers stock shopping list,2022-07-22 16:20:13,Seeking Alpha
tsm,7 Best Nanotech Stocks to Buy Now,2022-07-22 11:30:24,InvestorPlace
tsm,7 Best Nasdaq Stocks to Buy in July,2022-07-22 10:28:54,InvestorPlace
tsm,"Citi Launches Positive Catalyst Watch On NXP, ON; Negative On Intel",2022-07-21 21:29:00,Benzinga
tsm,Volkswagen looks to secure chip supply through new development deal with STMicroelectronics,2022-07-20 13:12:32,Seeking Alpha
tsm,3 Chip Stocks to Buy on CHIPS Act Boost,2022-07-19 16:26:17,InvestorPlace
tsm,TSM Leads Semiconductor Stocks Higher,2022-07-14 13:43:11,InvestorPlace
tsm,"Semiconductors mixed despite Taiwan Semiconductor strong Q2 results, guidance",2022-07-14 12:20:35,Seeking Alpha
tsm,5 Semiconductor Stocks to Look at After the CHIPS Act Passes,2022-07-14 11:02:09,InvestorPlace
tsm,The 7 Best Tech Dividend Stocks to Buy Right Now,2022-07-14 11:00:19,InvestorPlace
tsm,Analyst Says Qualcomm Shifting Allegiance Will Help This Apple Supplier Stay Markedly Ahead Of Samsung,2022-07-14 09:17:02,Benzinga
tsm,"Taiwan Semiconductor GAAP EPADR of $1.55 beats by $0.05, revenue of $18.16B beats by $580M; issues Q3 revenue guidance above estimates",2022-07-14 07:24:30,Seeking Alpha
tsm,Taiwan Semiconductor Q2 preview: Can strong earnings catalyze stock performance?,2022-07-13 18:39:35,Seeking Alpha
tsm,Notable earnings before Thursday's open,2022-07-13 15:10:21,Seeking Alpha
tsm,Cboe's Weekly Market Recap: July 5th to July 8th,2022-07-12 20:46:43,Benzinga
tsm,Did AQR’s Clifford Asness Delete His Twitter After Shorting AMC Stock?,2022-07-12 18:55:47,InvestorPlace
tsm,7 Cheap Semiconductor Stocks to Buy Now,2022-07-12 12:39:39,InvestorPlace
tsm,Good News Is Bear News for Nvidia Stock,2022-07-11 10:30:58,InvestorPlace
tsm,Tech Roundup: Musk pulls the plug on his big Twitter deal,2022-07-09 15:00:00,Seeking Alpha
tsm,Needham Reasons How TSMC's N3E May Become Industry's Most Favored FinFET Node,2022-07-08 17:56:15,Benzinga
tsm,Why Is Taiwan Semiconductor (TSM) Stock Up Today?,2022-07-07 18:39:43,InvestorPlace
tsm,Rumors Of iPhone 14 Production Cuts Surface: Why Prominent Apple Analyst Isn't Concerned,2022-07-02 18:27:51,Benzinga
tsm,Plunge in Semiconductor Stocks Today Drags the SOXL ETF Down,2022-07-01 19:06:43,InvestorPlace
tsm,This Is When You Can Be Aggressive in Buying AMD Stock,2022-07-01 15:00:26,InvestorPlace
tsm,"Why Are Semiconductor Stocks MU, AMD, TSM Down Today?",2022-07-01 14:49:10,InvestorPlace
tsm,Rosenblatt Points Out How Intel's Price War Could Prove Costly For AMD,2022-06-29 21:14:21,Benzinga
tsm,"Nvidia Stock Is Down, But Still Expensive",2022-06-25 10:08:09,InvestorPlace
tsm,Why Apple Could Still Go Lower,2022-06-13 20:15:43,InvestorPlace
tsm,5 Undervalued Semiconductor Stocks to Buy and Hold,2022-06-11 11:00:34,InvestorPlace
tsm,5 High-Quality Stocks Sizzling this Summer,2022-06-10 20:03:52,InvestorPlace
tsm,Analysts Tout This Apple Supplier's $100B Meltdown As Buying Opportunity - Read Why,2022-06-10 13:39:19,Benzinga
tsm,Is Samsung Buying NXP? NXPI Stock Surges on Report.,2022-06-09 19:43:35,InvestorPlace
tsm,7 of the Safest Stocks to Buy Now,2022-06-06 23:00:12,InvestorPlace
tsm,Jim Cramer Prefers This Oil Stock Over Occidental Petroleum,2022-06-06 14:57:39,Benzinga
tsm,"Micron plunges as Piper Sandler downgrades, cites 'oversized exposure' to consumer",2022-06-03 14:44:57,Seeking Alpha
tsm,3 Best Semiconductor Stocks to Buy for June 2022,2022-06-03 11:00:12,InvestorPlace
tsm,Ongoing tension with China over Taiwan puts semiconductor ETFs in the spotlight,2022-06-02 17:42:18,Seeking Alpha
tsm,"Nvidia, Advanced Micro Devices lead chip gains as AMD sets analyst day for June 9",2022-06-02 17:34:56,Seeking Alpha
tsm,Billionaire Ray Dalio Says ‘Cash Is Trash.’ Here’s Where He’s Putting His Money Instead.,2022-06-01 19:53:18,InvestorPlace
tsm,Noted Tesla Analyst Sees Auto Pricing Power Shift From Dealers Toward Suppliers,2022-06-01 14:40:51,Benzinga
tsm,The 7 Best Tech Stocks to Buy for June 2022,2022-05-30 14:16:01,InvestorPlace
tsm,Semiconductor Supply Glut Coming? 3 Chip Stocks to Sell Now.,2022-05-28 11:32:22,InvestorPlace
tsm,"Marvell Technology rises after 'strong' Q1, guidance, analysts note potential for acceleration",2022-05-27 12:54:02,Seeking Alpha
tsm,Is Nvidia Stock Still a Buy If It Flops on Earnings Expectations?,2022-05-25 16:26:08,InvestorPlace
tsm,Apple Can’t Lift the Market by Itself,2022-05-25 11:41:21,InvestorPlace
tsm,"13F Watch: What Buffett, SoftBank, Ackman and more bought and sold",2022-05-18 10:49:04,Seeking Alpha
tsm,"Lone Pine Capital raises stakes in Square, adds Meta Platforms, exits Adobe, slashes MasterCard",2022-05-17 16:50:08,Seeking Alpha
tsm,"The Time is Coming to Buy Nvidia Stock, but It’s Not Now",2022-05-13 01:18:00,InvestorPlace
tsm,How to Trade Advanced Micro Devices Stock After the Print,2022-05-03 16:34:04,InvestorPlace
tsm,Buy Nvidia Stock As Semiconductor Companies Start to Recover,2022-05-02 17:42:03,InvestorPlace
tsm,Global semiconductor sales in March up 1.1% M/M; Q1 sales up 23% Y/Y,2022-05-02 08:57:03,Seeking Alpha
tsm,"Nvidia, Marvell, AMD and Broadcom may benefit from strong cloud results",2022-05-01 14:00:00,Seeking Alpha
tsm,"With earnings on tap, anticipation rises for big-name chipmakers",2022-04-24 17:00:00,Seeking Alpha
tsm,8 Semiconductor Stocks on Sale as Intel Readies Mobileye IPO,2022-04-20 10:15:30,InvestorPlace
tsm,"Intel, Advanced Micro Devices may have PC weakness 'already baked in,' BofA says",2022-04-18 12:33:49,Seeking Alpha
tsm,Why Is Borqs Technologies (BRQS) Stock Up Today?,2022-04-14 15:45:48,InvestorPlace
tsm,Why Is Taiwan Semiconductor (TSM) Stock in the Spotlight Today?,2022-04-14 15:18:17,InvestorPlace
tsm,"Benzinga's Daily Brief On Trending Tickers For April 14, 2022: Morgan Stanley, Rite Aid, Twitter And More",2022-04-14 15:07:59,Benzinga
tsm,Taiwan Semiconductor declares NT$2.75 dividend,2022-04-14 05:59:55,Seeking Alpha
tsm,"Taiwan Semiconductor Non-GAAP EPS of $1.40 beats by $0.09, revenue of $17.57B beats by $1.31B",2022-04-14 05:47:13,Seeking Alpha
tsm,Is Taiwan Semiconductor a Buying opportunity amid falling price and rising revenue led by stable demand?,2022-04-13 17:31:54,Seeking Alpha
tsm,"Nvidia Stock Is a Buy, but the Question Is When?",2022-04-13 17:22:08,InvestorPlace
tsm,Taiwan Semiconductor Manufacturing is about to announce its earnings — here's what Wall Street expects,2022-04-13 15:01:13,Markets Insider Automation
tsm,Notable earnings before Thursday's open,2022-04-13 14:42:12,Seeking Alpha
tsm,Here's Why BofA Views Nvidia As Leading Growth Company In Semis,2022-04-12 21:08:30,Benzinga
tsm,"4 Top Stock Trades for Wednesday: WMT, SMH, DAL, ABBV",2022-04-12 20:42:11,InvestorPlace
tsm,"Thinking About Buying Stock Or Options In Wells Fargo, Taiwan Semiconductor Manufacturing Or Rite Aid?",2022-04-12 15:06:31,Benzinga
tsm,Taiwan Semiconductor rises after reporting record Q1 revenue,2022-04-08 12:42:05,Seeking Alpha
tsm,Advanced Micro Devices: What’s Good Is Good,2022-04-08 12:00:25,InvestorPlace
tsm,Apple Analyst Doesn't See 3M Coolant Plant Shutdown In Belgium Affecting Chip Supply,2022-04-04 08:55:21,Benzinga
tsm,3 Semiconductor Stocks Setting Up to Make New Highs,2022-04-01 16:33:36,InvestorPlace
tsm,"Chip Stocks News: Why Are AMD, INTC, NVDA, MU, GFS Stocks Up Today?",2022-03-24 19:51:12,InvestorPlace
tsm,7 Growth Stocks to Buy Now for the Coming Recession,2022-03-21 10:30:46,InvestorPlace
tsm,Why Buy Taiwan Semiconductor Stock At Every Dip,2022-03-18 12:15:28,InvestorPlace
tsm,Alibaba Stock Is Still an Investable Bottom,2022-03-16 22:25:08,InvestorPlace
tsm,Taiwan Semiconductor goes ex-dividend tomorrow,2022-03-15 18:14:41,Seeking Alpha
tsm,"Semiconductor market seen as 'a den of bears' due to recession, Taiwan invasion fears",2022-03-14 17:41:39,Seeking Alpha
tsm,TSM Stock Is a Play on Semiconductor Industry’s Secular Growth Trends,2022-03-14 10:32:23,InvestorPlace
tsm,Advanced Micro Devices: The Snapback Rally Is On,2022-03-10 23:10:55,InvestorPlace
tsm,7 Stocks That Will Survive Supply Chain Woes Unscathed,2022-03-09 12:00:52,InvestorPlace
tsm,"Global semiconductor sales remained strong in January, up 26.8% Y/Y",2022-03-04 12:56:24,Seeking Alpha
tsm,"4 Top Stock Trades for Tuesday: RSX, LCID, TSM, OXY",2022-02-28 22:26:15,InvestorPlace
tsm,Wait for Intel’s Turnaround to Really Take Hold Before Buying,2022-02-25 20:15:43,InvestorPlace
tsm,7 Blockchain Stocks to Buy If You Are Bullish on Crypto,2022-02-24 15:44:34,InvestorPlace
tsm,"Apple, Ericsson shares perform mildly following latest lawsuit dealings",2022-02-22 15:27:33,Seeking Alpha
tsm,"Taiwan Semi takes all 5G RF iPhone chip orders, pushing Samsung out: report",2022-02-22 14:42:03,Seeking Alpha
tsm,The Xilinx Deal Will Accelerate Growth in Advanced Micro Devices,2022-02-17 16:04:23,InvestorPlace
tsm,"AMD, Nvidia stand out as chip stocks join in broad-market rally",2022-02-15 19:19:11,Seeking Alpha
tsm,How to Trade Nvidia Stock Ahead of Earnings,2022-02-15 18:55:38,InvestorPlace
tsm,DENSO to Take Minority Stake in JASM,2022-02-15 17:54:00,PR Newswire
tsm,Taiwan Semi rises even as U.S. chip plant is behind schedule: report,2022-02-15 15:12:27,Seeking Alpha
tsm,Applied Materials Stock Has Tailwinds That Should Let It Outperform the Market,2022-02-14 11:00:57,InvestorPlace
tsm,Nvidia: After the Arm Failure,2022-02-11 15:27:45,InvestorPlace
tsm,7 Stocks That Will Win Whether It’s a Bull or Bear Market,2022-02-08 19:02:52,InvestorPlace
tsm,Here Are Two IT Stocks That Morgan Stanley Upgraded Today,2022-02-07 18:19:32,Benzinga
tsm,Taiwan Semi rises as Morgan Stanley upgrades to overweight,2022-02-07 13:47:21,Seeking Alpha
tsm,7 Best Blue-Chip Stocks to Buy for Safety in This Volatile Market,2022-02-07 11:00:34,InvestorPlace
tsm,Look for Your Buy Point and Pounce on Nvidia Stock,2022-02-04 20:08:24,InvestorPlace
tsm,4 Great Global Stocks to Buy for a Diversified Portfolio,2022-02-03 11:00:22,InvestorPlace
tsm,Micron Is a Great Bargain at Current Prices,2022-02-02 19:19:17,InvestorPlace
tsm,AMD surges almost 12%; results show 'zero red flags',2022-02-02 13:37:56,Seeking Alpha
tsm,Intel’s Government-Fueled Comeback,2022-02-01 20:14:56,InvestorPlace
tsm,Will strong growth momentum continue for AMD in Q4?,2022-01-31 17:34:27,Seeking Alpha
tsm,GOOGL Stock Will Ride High on Alphabet’s Hardware Transition,2022-01-31 12:54:49,InvestorPlace
tsm,7 Technology Stocks Reporting Earnings the Week of January 31,2022-01-28 18:15:32,InvestorPlace
tsm,7 Big Tech Stocks Likely to Outperform the Nasdaq in 2022,2022-01-27 19:27:02,InvestorPlace
tsm,The Powerful Catalysts Behind Taiwan Semiconductor Stock Are Intact,2022-01-26 20:53:51,InvestorPlace
tsm,Investment Opportunity Breakdown: Semiconductor Stocks,2022-01-24 20:01:44,InvestorPlace
tsm,"Texas Instruments investor day likely to overshadow Q4 earnings, BofA says",2022-01-24 13:58:29,Seeking Alpha
tsm,Flip the Script On Chip-Market Challenges with Taiwan Semiconductor Stock,2022-01-21 20:50:39,InvestorPlace
tsm,Intel is spending at least $20B on chip manufacturing in Ohio,2022-01-21 09:18:42,Seeking Alpha
tsm,Nvidia Stock Is a Buy on Every Dip as It Heads Toward a Trillion,2022-01-20 11:56:16,InvestorPlace
tsm,Watch for a Buy Point in Advanced Micro Devices,2022-01-19 20:50:07,InvestorPlace
tsm,"Top Stock Trades for the Week of Jan. 18, 2022",2022-01-18 16:25:03,InvestorPlace
tsm,Why did Applied Materials shares rise 5% today? Jefferies sees rising chip-equipment spending.,2022-01-14 20:22:56,Seeking Alpha
tsm,48 Biggest Movers From Yesterday,2022-01-14 10:43:03,Benzinga
tsm,Why did Taiwan Semiconductor stock go up today? Strong earnings and spending,2022-01-13 21:15:24,Seeking Alpha
tsm,Mid-Afternoon Market Update: Nasdaq Dips 250 Points; Taiwan Semiconductor Shares Gain,2022-01-13 20:35:06,Benzinga
tsm,Taiwan Semiconductor Manufacturing among tech gainers; Confluent and Cloudflare among losers,2022-01-13 20:00:03,Seeking Alpha
tsm,26 Stocks Moving In Thursday's Mid-Day Session,2022-01-13 18:07:53,Benzinga
tsm,"Investors favor financial, energy and semiconductor ETFs in 2022",2022-01-13 16:54:26,Seeking Alpha
tsm,UAMM Stock: UA Multimedia Makes Metaverse Move by Digging In With Sandbox,2022-01-13 16:34:16,InvestorPlace
tsm,TSM Stock: 9 Reasons Why Taiwan Semiconductor Investors Are Feeling Chipper Today,2022-01-13 16:10:05,InvestorPlace
tsm,"Taiwan Semi to spend as much as $44B this year, as chip surge continues",2022-01-13 14:14:59,Seeking Alpha
tsm,20 Stocks Moving in Thursday's Pre-Market Session,2022-01-13 12:33:04,Benzinga
tsm,"A Peek Into The Markets: US Stock Futures Mostly Flat Ahead Of PPI, Jobless Claims",2022-01-13 11:30:06,Benzinga
tsm,"5 Stocks To Watch For January 13, 2022",2022-01-13 10:31:48,Benzinga
tsm,"Taiwan Semiconductor GAAP EPS of $1.15 beats by $0.04, revenue of $15.74B misses by $30M",2022-01-13 06:57:07,Seeking Alpha
tsm,What to expect from Taiwan Semiconductor's Q4 earnings?,2022-01-12 18:44:37,Seeking Alpha
tsm,Notable earnings before Thursday's open,2022-01-12 15:29:07,Seeking Alpha
tsm,Taiwan Semiconductor Manufacturing is about to announce its earnings — here's what to expect,2022-01-12 15:01:13,Markets Insider Automation
tsm,7 Semiconductor Stocks With the Most Upside in the New Year,2022-01-11 19:20:28,InvestorPlace
tsm,7 Best Country ETFs to Buy for 2022,2022-01-07 20:48:37,InvestorPlace
tsm,"Catalyst watch for next week: Biogen, Five Below, Tritium and Monster Beverage in the spotlight",2022-01-07 19:00:35,Seeking Alpha
tsm,New Street Explains Why Intel Scores Ahead Of AMD On Single-Thread Performance Metrics,2022-01-05 17:09:08,Benzinga
tsm,"3 Top Stock Trades for the Week of Jan. 3, 2022",2022-01-03 19:27:46,InvestorPlace
tsm,7 of the Best Metaverse Stocks for 2022 to Buy Now,2022-01-03 19:19:59,InvestorPlace
tsm,"Read Why Nvidia, AMD, Taiwan Semiconductor And Other Chip Stocks Gained Steam",2022-01-03 18:24:40,Benzinga
tsm,CCL Stock: Why Carnival Is Cruising Higher Despite the CDC’s Covid Call,2022-01-03 18:08:53,InvestorPlace
tsm,TSM Stock: What Investors Are Saying About the Taiwan Semiconductor Breakout Today,2022-01-03 17:46:37,InvestorPlace
tsm,Chip Sales Set To Grow Nearly 10% In 2022: Report,2022-01-03 11:58:46,Benzinga
tsm,7 of the Best Robinhood Stocks for 2022 to Buy Now,2022-01-03 11:00:58,InvestorPlace
tsm,Avoid Alibaba Stock Amid Chinese Government Regulations,2021-12-15 21:41:58,InvestorPlace
tsm,Intel Stock Should Be a Long-term Winner,2021-12-15 19:54:11,InvestorPlace
tsm,"10 Stocks to Buy if You Have $5,000 in Starter Money",2021-12-14 19:27:38,InvestorPlace
tsm,Qualcomm Finds Way To JPMorgan's Analyst Focus List,2021-12-13 16:10:33,Benzinga
tsm,How to Play the Shortage in This “Lifeblood” Tech,2021-12-10 22:35:16,InvestorPlace
tsm,TSMC's November revenue grew 19% YoY and 10% from prior,2021-12-10 11:03:43,Seeking Alpha
tsm,Hewlett Packard Enterprise CEO says end of chip shortage could happen in 2H2022,2021-12-02 14:12:12,Seeking Alpha
tsm,3 Metaverse Moonshots With Actual 10x Potential,2021-11-30 15:34:46,InvestorPlace
tsm,3 Top Stock Trades for the Week,2021-11-29 19:10:31,InvestorPlace
tsm,7 Top Tech Stocks to Buy Despite Recent Tapering Concerns,2021-11-23 17:43:24,InvestorPlace
tsm,GlobalFoundries rises 9% on high marks from multiple analysts,2021-11-22 15:51:29,Seeking Alpha
tsm,GM says it's looking at North America for semiconductors to alleviate chip shortages,2021-11-18 18:15:42,Seeking Alpha
tsm,Why Nvidia Analysts Reaffirm Bullish Stance And Hike Price Targets Following Blowout Quarter;  'Path to $1 Trillion Club Evident',2021-11-18 17:29:39,Benzinga
tsm,Nvidia: Metaverse Turns its Hype Factor to 11,2021-11-16 21:27:01,InvestorPlace
tsm,TSMC reports revenue down in October compared to previous month,2021-11-10 10:58:19,Seeking Alpha
tsm,7 Stocks to Buy That Could Be the Next Trillion-Dollar Company,2021-11-09 11:00:39,InvestorPlace
tsm,3 Sizzling Semiconductor Stocks to Buy After Thursday’s Surge,2021-11-05 13:40:12,InvestorPlace
tsm,This Are The 5 Largest European Stocks,2021-11-04 18:27:12,Benzinga
tsm,Taiwan Semi may see delays making chips for the next iPhone--report,2021-11-02 19:07:40,Seeking Alpha
tsm,7 Best Tech Stocks to Buy for Q4 Earnings Season,2021-11-01 17:35:16,InvestorPlace
tsm,Semiconductor shipments swelled to a record high of $145 billion in Q3 2021,2021-11-01 13:12:58,Seeking Alpha
tsm,A Solid October for Alibaba Stock Is a Good Sign for Future Months,2021-10-29 15:11:07,InvestorPlace
tsm,GFS Stock IPO: 10 Things to Know as GlobalFoundries Starts Trading Today,2021-10-28 13:05:31,InvestorPlace
tsm,7 Best Stocks Under $20 to Add to Your Buy List,2021-10-19 18:55:50,InvestorPlace
tsm,Buy Advanced Micro Devices as It Rallies to New Heights,2021-10-19 14:41:58,InvestorPlace
tsm,Taiwan Semiconductor Manufacturing Co Ltd -- Moody's assigns (P)Aa3 to TSMC's shelf registration and Aa3 to the proposed notes issuance,2021-10-19 03:54:00,Moodys
tsm,Current Valuation Levels and Prospects Make Intel Stock a Buy,2021-10-18 10:30:08,InvestorPlace
tsm,"Tech Roundup: Facebook drama, Apple's next event and a Jack Ma sighting",2021-10-16 11:25:00,Seeking Alpha
tsm,Piper Sandler starts coverage on a raft of chip-equipment stocks,2021-10-15 14:08:13,Seeking Alpha
tsm,Buy Intel Stock While Shares Are Still a Bargain,2021-10-15 10:00:09,InvestorPlace
tsm,"Teradyne, Keysight rise as chip-testing companies join in sector rally",2021-10-14 19:17:51,Seeking Alpha
tsm,Taiwan Semiconductor Earnings Reflects Problems with Supply Chain,2021-10-14 16:25:58,Benzinga
tsm,NKLA Stock: The Trucking Collab News Nikola Movement Today,2021-10-14 16:23:31,InvestorPlace
tsm,SOLO Stock: The Bosch Deal Moving ElectraMeccanica Vehicles Today,2021-10-14 16:05:53,InvestorPlace
tsm,TSM Stock: 10 Reasons Why Taiwan Semiconductor Investors Are Feeling Chipper Today,2021-10-14 15:49:12,InvestorPlace
tsm,"INTC Stock Looks Interesting, But Intel Has Too Much Catching up to Do",2021-10-14 11:32:34,InvestorPlace
tsm,7 Best Index Funds To Buy For October,2021-10-13 20:12:17,InvestorPlace
tsm,Notable earnings before Thursday's open,2021-10-13 15:11:55,Seeking Alpha
tsm,Here's what Wall Street expects from Taiwan Semiconductor Manufacturing's earnings report,2021-10-12 15:01:20,Markets Insider Automation
tsm,7 Stocks to Watch as China Trade Concerns Heat Up,2021-10-12 14:29:02,InvestorPlace
tsm,What Makes This Analyst Cautious On TSMC?,2021-10-11 21:07:39,Benzinga
tsm,"Catalyst Watch for next week: JPMorgan leads out big bank earnings; eyes on Plug Power, Alibaba and HubSpot",2021-10-08 18:30:13,Seeking Alpha
tsm,Elevated chip prices power Samsung's best quarterly profit in 3 years,2021-10-08 10:13:28,Seeking Alpha
tsm,"Global semiconductor sales remained strong in August, up 30% Y/Y",2021-10-05 07:02:12,Seeking Alpha
tsm,GlobalFoundries files for initial public offering,2021-10-04 16:49:13,Seeking Alpha
tsm,"EV Week In Review: Cathie Wood's Big Statement On Tesla, Chip Crunch Scare For Li Auto, Workshorse's Travails Continue, Nio Updates On Norway",2021-09-25 17:39:48,Benzinga
tsm,Why AMD Is Looking 'Solid' Into The Year-End,2021-09-23 21:52:06,Benzinga
tsm,Only Time Will Tell Whether Recent Plans Pay Off for Intel,2021-09-21 10:00:13,InvestorPlace
tsm,Intel Is the Most Essential Company in the Country,2021-09-16 20:11:57,InvestorPlace
tsm,"Investors Cheer Cisco's Investor Day Outlook, Credit Suisse Upgrades Stock",2021-09-16 12:22:18,Benzinga
tsm,Micron Technology Stock Is Absolutely a Buy Now With These Massive Tailwinds,2021-09-14 10:00:41,InvestorPlace
tsm,A Peek Into The Markets: US Stock Futures Signal Higher Start On Wall Street; Crude Oil Rises 1%,2021-09-13 12:11:16,Benzinga
tsm,Buy Intel Before It Brings Chip Production to America,2021-09-10 19:57:58,InvestorPlace
tsm,Nvidia Stock May Be Ripe for Profit-Taking Right Here,2021-09-10 10:00:10,InvestorPlace
tsm,7 Meme Stocks You Should Keep a Close Eye on for Real Potential,2021-09-07 15:47:55,InvestorPlace
tsm,Apple's VR/AR headset to require phone or device connection - report,2021-09-02 16:50:25,Seeking Alpha
tsm,7 Semiconductor Stocks to Buy for an Ongoing Chip Shortage,2021-09-02 12:17:05,InvestorPlace
tsm,Intel Stock Is a Steal Here If You’re Willing to Play the Long Game,2021-08-31 10:00:33,InvestorPlace
tsm,"Tech Roundup: Apple's App Store, China dealings, and PC sales",2021-08-28 11:30:00,Seeking Alpha
tsm,"What Did the Stock Market Do Today, Aug. 26? 3 Big Stories to Catch Up On.",2021-08-26 20:31:40,InvestorPlace
tsm,AMD Stock Is a ‘Cheaper’ Way to Play Semiconductor Success,2021-08-26 19:17:37,InvestorPlace
tsm,Higher Chip Prices To Bite Apple? iPhone 13 May Get More Expensive As TSMC Reportedly Plans Up To 20% Price Hikes,2021-08-26 16:56:54,Benzinga
tsm,HOOD Stock: Is the Robinhood ‘Free Share of Stock’ Promotion in Danger?,2021-08-25 15:59:36,InvestorPlace
tsm,CPOP Stock: 5 Things to Know About Penny Stock Pop Culture Group as Shares Surge Today,2021-08-25 15:36:54,InvestorPlace
tsm,TSM Stock: The Taiwan Semiconductor Price Hike News Giving Shares a Lift Today,2021-08-25 14:53:39,InvestorPlace
tsm,10 Stocks to Buy Owned by the Top Female Portfolio Managers in America,2021-08-24 17:46:52,InvestorPlace
tsm,"Samsung unlikely to target NXP Semiconductors for acquisition, report says",2021-08-24 14:04:16,Seeking Alpha
tsm,GlobalFoundries is said to file confidentially for IPO,2021-08-18 17:59:48,Seeking Alpha
tsm,It’s Time to Double Down on Intel Stock,2021-08-17 20:56:38,InvestorPlace
tsm,7 Semiconductor Stocks to Buy in August,2021-08-17 18:01:25,InvestorPlace
tsm,"Advanced Micro Devices, Inc. -- Moody's upgrades Advanced Micro Devices to Baa1 and keeps under review for upgrade",2021-08-10 19:11:00,Moodys
tsm,7 Beat-Up Stocks to Buy Before They Break Out on Strong Catalysts,2021-08-04 15:51:20,InvestorPlace
tsm,These semiconductor ETFs are beating the S&P 500 YTD and in the past week,2021-08-03 20:00:57,Seeking Alpha
tsm,"Worldwide semiconductor sales reached ~$134B in Q2, up 8% Q/Q.",2021-08-03 13:44:30,Seeking Alpha
tsm,7 Stocks To Buy After The Market Crash,2021-08-02 21:50:32,InvestorPlace
tsm,7 Best Robinhood Stocks to Buy for August,2021-07-28 18:34:02,InvestorPlace
tsm,Why 3 AMD Analysts Are Projecting Continued Market Share Gain Following Blowout Q2,2021-07-28 17:45:27,Benzinga
tsm,TSMC moves ahead with most advanced chip plant days after Intel challenge,2021-07-28 15:43:36,Seeking Alpha
tsm,Why This Money Manager Is Keeping His Money In The Markets For Q3,2021-07-27 21:10:05,Benzinga
tsm,"Intel Stock Will Be Back, but It Is Going to Take a While",2021-07-26 10:00:20,InvestorPlace
tsm,5 Best Nanotech Stocks To Snap Up for 10X Potential,2021-07-23 10:00:54,InvestorPlace
tsm,"There Isn't A Bitcoin ETF Yet, But This New Crypto Mining ETF Offers An Alternative",2021-07-22 23:10:43,Benzinga
tsm,How to Trade Advanced Micro Devices Stock into Earnings,2021-07-22 18:50:03,InvestorPlace
tsm,What Will the Stock Market Do Today? 3 Big Stories to Watch.,2021-07-22 14:40:46,InvestorPlace
tsm,Nvidia: When Do You Get Back In,2021-07-20 16:01:04,InvestorPlace
tsm,"Goldman Sachs Upgrades Qualcomm To Neutral, Increased Price Target Signifies 6% Upside",2021-07-19 14:36:49,Benzinga
tsm,The Best Chip Plays Behind the Semiconductor Supply Crunch,2021-07-19 13:41:30,InvestorPlace
tsm,Taiwan Semiconductor Isn’t Overvalued in the Way Some Analysts Claim,2021-07-19 10:00:21,InvestorPlace
tsm,Moody's  publishes July 2021 edition of Asia TMT Quarterly,2021-07-19 03:33:00,Moodys
tsm,What Will the Stock Market Do Today? 3 Big Stories to Watch.,2021-07-16 15:00:08,InvestorPlace
tsm,Taiwan Semiconductor had declared $0.50 per ADR dividend,2021-07-15 14:20:10,Seeking Alpha
tsm,TSMC Q2 Results Rise; Sees Sequentially Higher Revenues In Q3 On Strong Demand,2021-07-15 10:53:35,RTTNews
tsm,"Taiwan Semiconductor slips 1.5% after a slight miss on revenue, guides Q3 revenue in line",2021-07-15 08:29:41,Seeking Alpha
tsm,"Taiwan Semiconductor EPS beats by $0.02, misses on revenue",2021-07-15 06:45:30,Seeking Alpha
tsm,"Will Taiwan Semiconductor have a soft price reaction to Q2 Earnings, just like Q1?",2021-07-14 18:57:21,Seeking Alpha
tsm,Apple Shares Hit Record High: What The Street Is Saying,2021-07-14 17:16:35,Benzinga
tsm,Notable earnings before Thursday's open,2021-07-14 14:50:31,Seeking Alpha
tsm,"It’s Been An Incredible Run for Nvidia, But Now Is the Time to Exit",2021-07-14 13:38:51,InvestorPlace
tsm,TSM To Announce Additional Fab Expansion Plans: Digitimes Asia,2021-07-13 18:31:04,Benzinga
