Ticker,Title,Datetime,Source
tsm,AI Daily: White House order opens federal land to AI data centers,2025-01-15 18:55:23,TipRanks
tsm,"Big banks report Q4 beats, QXO proposes to buy Beacon: Morning Buzz",2025-01-15 17:00:56,TipRanks
tsm,TSMC Q4 Earnings Ahead: Street expects biggest profit jump in two years,2025-01-15 16:33:14,Seeking Alpha
tsm,"U.S. to unveil more regulations to keep chips from China, Bloomberg says",2025-01-15 11:15:31,TipRanks
tsm,"Apple now verifying TSMC’s ‘Made in USA’ chips, Nikkei Asia reports",2025-01-15 10:50:57,TipRanks
tsm,AI Daily: White House announces new controls on AI chips,2025-01-14 18:10:39,TipRanks
tsm,"J&J to acquire Intra-Cellular, Clearwater to buy Enfusion: Morning Buzz",2025-01-13 17:10:43,TipRanks
tsm,"White House announces new controls on AI chips, further restricting exports",2025-01-13 13:12:35,TipRanks
tsm,"Onto Innovation named 2025 Top Pick, added to Conviction List at Needham",2025-01-13 13:05:13,TipRanks
tsm,"TSMC produces advanced four-nanometer chips in Arizona, Reuters reports",2025-01-13 11:15:31,TipRanks
tsm,"TSMC cuts ties with PowerAIR over chip found in Huawei processor, SCMP says",2025-01-13 11:11:44,TipRanks
tsm,"Earnings week ahead: JPM, BAC, C, GS, TSM, UNH and more",2025-01-12 13:01:00,Seeking Alpha
tsm,"Catalyst Watch: Bank earnings, oil updates, powerhouse conferences in retail and healthcare",2025-01-10 20:00:50,Seeking Alpha
tsm,"4 stocks to watch on Friday: DAL, WBA and more",2025-01-10 13:19:54,Seeking Alpha
tsm,"TSMC reports December revenue NT$278.2B, up 58% y/y",2025-01-10 12:40:32,TipRanks
tsm,TSMC Reports Robust Revenue Growth in December 2024,2025-01-10 11:30:20,TipRanks
tsm,Strong Growth Potential and Attractive Valuation Drive Buy Rating for TSMC,2025-01-08 16:15:26,TipRanks
tsm,Taiwan Semiconductor Manufacturing (TSM) Receives a Buy from Barclays,2025-01-08 06:26:17,TipRanks
tsm,TSMC Announces Strategic Updates in Shareholdings and Capital Investments,2024-12-23 11:29:15,TipRanks
tsm,"U.S. to blacklist Sophgo over TSMC chip in Huawei processor, Reuters says",2024-12-20 17:00:58,TipRanks
tsm,"Nvidia’s AI business colliding with U.S.-Chinese tensions, NY Times reports",2024-12-20 11:10:43,TipRanks
tsm,TSMC Appoints New Chief Information Security Officer,2024-12-19 11:30:51,TipRanks
tsm,"White House to target Chinese chips with trade probe, NY Times reports",2024-12-16 17:15:30,TipRanks
tsm,"Honeywell still exploring alternatives, Capri weighs Versace sale: Morning Buzz",2024-12-16 17:01:01,TipRanks
tsm,"TSMC’s $20B Arizona fab ‘dang near back’ on schedule, CNBC reports",2024-12-16 10:45:06,TipRanks
tsm,Taiwan Semi call volume above normal and directionally bullish,2024-12-13 15:25:11,TipRanks
tsm,Unusually active option classes on open December 13th,2024-12-13 14:40:19,TipRanks
tsm,"Intel co-CEOs say they remain invested in Foundry, not writing off separation",2024-12-12 18:55:38,Seeking Alpha
tsm,"Apple to use in-house chips over Broadcom in 2025, Bloomberg says",2024-12-12 18:15:49,TipRanks
tsm,"Himax jumps as analyst says it may be Nvidia, Taiwan Semi supplier",2024-12-12 14:46:53,Seeking Alpha
tsm,Chips mostly lower as investors await key results from Broadcom,2024-12-10 17:39:22,Seeking Alpha
tsm,"TSMC reports November revenue NT$276.1B, up 34% y/y",2024-12-10 14:06:07,TipRanks
tsm,TSMC Reports Strong Revenue Growth Amid Monthly Dip,2024-12-10 11:32:00,TipRanks
tsm,Taiwan Semi put volume heavy and directionally bearish,2024-12-09 19:55:09,TipRanks
tsm,"HP Enterprise, Ulta Beauty report quarterly beats: Morning Buzz",2024-12-06 17:10:35,TipRanks
tsm,"TSMC, Nvidia in talks for AI chip production in Arizona, Reuters reports",2024-12-06 10:50:32,TipRanks
tsm,"Intel appoints former ASML exec Meurice, Microchip chair Sanghi to its board",2024-12-05 13:42:40,Seeking Alpha
tsm,"Salesforce up after Q3, GM outlines $5B in China business charges: Morning Buzz",2024-12-04 17:15:25,TipRanks
tsm,"NXP, TSMC affiliate plan expansion of Singapore plant, Bloomberg reports",2024-12-04 11:20:32,TipRanks
tsm,Intel announces CEO Gelsinger retiring; replaced with co-CEOs (update),2024-12-02 15:14:42,Seeking Alpha
tsm,Taiwan Semi call volume above normal and directionally bullish,2024-12-02 15:05:10,TipRanks
tsm,TSMC Adjusts Q2 2024 Cash Dividend Slightly,2024-11-27 12:31:37,TipRanks
tsm,TSMC Reports Asset Changes and Shareholding Updates,2024-11-25 11:30:57,TipRanks
tsm,Nvidia's results and guidance were exceptional. Wall Street says ignore the noise.,2024-11-21 12:59:26,Seeking Alpha
tsm,Nvidia just reported Q3 results. Wall Street wanted guidance a touch higher.,2024-11-20 21:41:49,Seeking Alpha
tsm,"Biden Administration races to deliver chip grants, WSJ reports",2024-11-19 11:20:20,TipRanks
tsm,TSMC price target raised to $240 from $215 at Barclays,2024-11-18 10:55:10,TipRanks
tsm,Taiwan Semiconductor Manufacturing (TSM): New Buy Recommendation for This Technology Giant,2024-11-18 06:37:19,TipRanks
tsm,"David Tepper's Appaloosa exits Boeing & UPS, cuts Meta & Microsoft among top Q3 moves",2024-11-15 18:00:50,Seeking Alpha
tsm,"Soros boosts stake in AstraZeneca, exits Apple position",2024-11-15 16:40:39,TipRanks
tsm,"Lone Pine takes new positions in Salesforce and Starbucks, exits Mastercard",2024-11-15 15:45:32,TipRanks
tsm,"4 stocks to watch on Friday: BABA, SPB and more",2024-11-15 14:23:00,Seeking Alpha
tsm,"TSMC’s $6.6B CHIPS Act grant finalized, Nikkei Asia reports",2024-11-15 11:05:10,TipRanks
tsm,"Coatue Management top Q3 moves: cuts Nvidia, exits CRM & UNH, piles into Chinese stocks",2024-11-14 23:27:00,Seeking Alpha
tsm,"Soroban Capital buys CenterPoint Energy, exits Exelon, others in Q3",2024-11-14 22:09:33,Seeking Alpha
tsm,"Lone Pine buys UnitedHealth, exits Workday in Q3",2024-11-14 22:02:11,TipRanks
tsm,"Tiger Global's top Q3 trades include DexCom exit, new stake in Sherwin-Williams",2024-11-14 20:16:37,Seeking Alpha
tsm,"Tiger Global take new stake in Flutter, cuts stake in Uber",2024-11-14 20:10:22,TipRanks
tsm,Taiwan Semiconductor Manufacturing Is Overvalued amid AI Demand,2024-11-14 17:37:59,TipRanks
tsm,"Disney reports Q4 beat, Capri-Tapestry call off deal: Morning Buzz",2024-11-14 17:05:42,TipRanks
tsm,Taiwan Semiconductor declares $0.6165 dividend,2024-11-14 13:48:26,Seeking Alpha
tsm,Taiwan Semiconductor Shows Stable Financial Performance,2024-11-14 11:30:53,TipRanks
tsm,"TSMC sued for ‘discriminatory scheme’ at U.S. plants, Forbes reports",2024-11-14 11:00:29,TipRanks
tsm,AMD vs INTC vs TSM: Will These Chipmakers Rally as High as NVDA?,2024-11-13 22:45:01,TipRanks
tsm,"Soros Capital exits TeraWulf, takes new stake in Affirm, among Q3 top trades",2024-11-13 22:17:36,Seeking Alpha
tsm,Semiconductor foundry stocks mixed amid strong Tower Semiconductor Q3 results,2024-11-13 17:09:31,Seeking Alpha
tsm,"Camtek can recapture higher multiples as visibility improves, says Stifel",2024-11-12 20:20:35,TipRanks
tsm,TSMC Announces Robust Q3 Results and Major Investments,2024-11-12 15:31:58,TipRanks
tsm,Taiwan Semi call volume above normal and directionally bullish,2024-11-12 15:05:10,TipRanks
tsm,Cigna drops pursuit of Humana: Morning Buzz,2024-11-11 17:06:23,TipRanks
tsm,"U.S. ordered TSMC to halt China shipments of chips used in AI, Reuters says",2024-11-10 13:25:17,TipRanks
tsm,"Catalyst Watch: Alibaba earnings, Disney drama, CPI print, 13F filings and more election scrambling",2024-11-08 20:00:23,Seeking Alpha
tsm,"TSMC to suspend production of advanced AI chips for China, FT reports",2024-11-08 12:31:04,TipRanks
tsm,TSMC Sees Impressive Revenue Growth in October 2024,2024-11-08 11:33:16,TipRanks
tsm,TSMC Oct. Revenue Up 29.2% YoY - Quick Facts,2024-11-08 10:35:16,RTTNews
tsm,"Boeing union to end strike, Palantir reports Q3 beat: Morning Buzz",2024-11-05 17:05:54,TipRanks
tsm,"Chip roundup: GlobalFoundries, Astera Lab rise on earnings; Cirrus Logic, Navitas fall",2024-11-05 14:57:21,Seeking Alpha
tsm,"TSMC hit by Tawain’s soaring energy prices, FT reports",2024-11-05 11:20:40,TipRanks
tsm,"iPhone 17 to use Wi-Fi chips made by TSMC’s N7 process, Kuo says",2024-11-01 09:50:18,TipRanks
tsm,"Alphabet, AMD report Q3 earnings beats: Morning Buzz",2024-10-30 16:15:41,TipRanks
tsm,"TSMC cuts off at least two chip clients over possible Huawei links, Nikkei says",2024-10-30 09:45:15,TipRanks
tsm,"Intel ‘made a big mistake’ when CEO offended TSMC, Reuters says",2024-10-29 17:45:21,TipRanks
tsm,"OpenAI working on in-house AI chip, scales back foundry ambitions, Reuters says",2024-10-29 16:55:17,TipRanks
tsm,"Biggest stock movers Monday: DJT, crypto stocks, and more",2024-10-28 14:09:21,Seeking Alpha
tsm,Morning Movers: Philips plummets following third quarter results,2024-10-28 12:55:56,TipRanks
tsm,TSMC Schedules Board Meeting for Q3 Financial Review,2024-10-28 11:09:13,TipRanks
tsm,"TSMC facing challenges as free trade falters, Bloomberg reports",2024-10-28 09:55:06,TipRanks
tsm,"TSMC halts shipments to Sophgo after chip found on Huawei product, Reuters says",2024-10-27 12:50:05,TipRanks
tsm,"Judge blocks Tapestry-Capri deal, Centene reports Q3 beat: Morning Buzz",2024-10-25 16:10:36,TipRanks
tsm,TSMC Updates on Shareholdings and Investment Moves,2024-10-25 10:33:58,TipRanks
tsm,"TSMC’s Arizona production yields 4PP higher than in Taiwan, Bloomberg reports",2024-10-24 20:30:57,TipRanks
tsm,"Boeing union rejects latest offer, Tesla reports Q3 beat: Morning Buzz",2024-10-24 16:15:59,TipRanks
tsm,"Nvidia says flaw in Blackwell AI chips fixed with TSMC’s help, Reuters reports",2024-10-24 09:50:52,TipRanks
tsm,Intel Faces Export Restrictions But Remains Cheaply Valued,2024-10-23 10:28:07,TipRanks
tsm,TSMC price target raised to $215 from $200 at Barclays,2024-10-23 09:45:37,TipRanks
tsm,Taiwan Semiconductor Manufacturing (TSM) Receives a Buy from Barclays,2024-10-23 07:16:47,TipRanks
tsm,IFPI supports AI Training Statement on unlicensed use of creative works,2024-10-22 21:40:33,TipRanks
tsm,"GE Aerospace, GM report quarterly earnings beats: Morning Buzz",2024-10-22 16:01:16,TipRanks
tsm,"TSMC alerted U.S. to potential violation of China AI export controls, FT says",2024-10-22 13:55:42,TipRanks
tsm,Trending stories in another bullish week for Wall Street,2024-10-19 16:11:00,Seeking Alpha
tsm,"New Buy Rating for Taiwan Semiconductor Manufacturing (TSM), the Technology Giant",2024-10-18 07:06:03,TipRanks
tsm,Nvidia touches new high as AI trade rolls on,2024-10-17 15:22:14,Seeking Alpha
tsm,TSMC CFO expects 2025 capex 'very likely' to outpace 2024,2024-10-17 15:08:34,Seeking Alpha
tsm,Taiwan Semi surges after 'blowout quarter' and outlook keeps Wall Street upbeat,2024-10-17 14:45:05,Seeking Alpha
tsm,ETFs with heavy weightings in Taiwan Semi catch a ride higher,2024-10-17 14:26:32,Seeking Alpha
tsm,"Biggest stock movers Thursday: BX, TSM, NOK, and more",2024-10-17 11:51:52,Seeking Alpha
tsm,Taiwan Semi soars after AI demand boosts outlook; will not buy Intel foundry (update),2024-10-17 11:36:43,Seeking Alpha
tsm,Strong Financial Performance and Strategic Investments Drive Buy Rating for TSMC,2024-10-17 10:45:37,TipRanks
tsm,Global stock indices mixed ahead of a series of economic data release,2024-10-17 10:00:12,Seeking Alpha
tsm,"Taiwan Semiconductor in charts: 3nm, 5nm, 7nm, and 16nm chips propel Q3 revenue growth",2024-10-17 08:30:33,Seeking Alpha
tsm,"Earnings Snapshot: Taiwan Semiconductor Manufacturing tops Q3 estimates, issues Q4 outlook",2024-10-17 07:23:58,Seeking Alpha
tsm,"Taiwan Semiconductor GAAP EPS of $1.94 beats by $0.15, revenue of $23.5B beats by $210M",2024-10-17 05:34:32,Seeking Alpha
tsm,Here's the major earnings before the open tomorrow,2024-10-16 22:00:13,Seeking Alpha
tsm,ASML leads semi maker stocks lower for second consecutive session,2024-10-16 20:35:20,Seeking Alpha
tsm,TSMC Q3 Earnings: Chipmaker expected to report jump in profits amid AI boom,2024-10-16 14:20:55,Seeking Alpha
tsm,ASML's stock falls after Q3 bookings miss estimates; chip stocks slide (update),2024-10-15 19:10:41,Seeking Alpha
tsm,"Wolfspeed stock jumps after securing $1.5B in funding from CHIPS Act, Apollo",2024-10-15 09:33:44,Seeking Alpha
tsm,Buy Rating Affirmed for TSM on Strong Q3 Performance and Strategic Supply-Chain Initiatives,2024-10-13 14:35:17,TipRanks
tsm,"Earnings week ahead: BAC, GS, JNJ, TSM, UNH, ABT, UAL, NFLX, PG, AXP and more",2024-10-13 12:00:00,Seeking Alpha
tsm,"Intel (INTC) Stock Looks Cheaper than NVDA & AMD on a Forward Basis, but I’m Cautious",2024-09-30 15:16:22,TipRanks
tsm,The top stocks in Asia Emerging Markets rated by quant,2024-09-27 18:59:50,Seeking Alpha
tsm,"With tech the top performing sector in 2024, these names could have more room to run",2024-09-27 12:30:54,Seeking Alpha
tsm,SMH vs. FTXL: Which Semiconductor ETF Is Better?,2024-09-26 22:08:11,TipRanks
tsm,ASML Is Positioned for Exceptional Growth in 2025,2024-09-25 17:58:22,TipRanks
tsm,"Tech is the top performing sector through Q3, see what names stick out",2024-09-24 14:00:46,Seeking Alpha
tsm,Strong GDP growth has been ‘disproportionally’ supported by strong productivity growth,2024-09-23 17:42:18,Seeking Alpha
tsm,"TSMC, Samsung Reportedly In Talks To Build Mega Chip Factories In UAE",2024-09-23 09:22:50,RTTNews
tsm,Wall Street Analysts Are Bullish on Top Technology Picks,2024-09-19 07:20:08,TipRanks
tsm,"Intel in spotlight as Wall Street weighs in foundry, AWS, construction updates",2024-09-17 11:47:48,Seeking Alpha
tsm,"4 stocks to watch on Tuesday: AAPL, GME and more",2024-09-10 13:05:00,Seeking Alpha
tsm,Analysts Offer Insights on Technology Companies: Markforged Holding (MKFG) and Taiwan Semiconductor Manufacturing (TSM),2024-09-10 13:02:16,TipRanks
tsm,Taiwan Semiconductor Manufacturing (TSM): New Buy Recommendation for This Technology Giant,2024-09-10 13:01:56,TipRanks
tsm,Semiconductor stocks remain volatile despite surging sales,2024-09-03 18:47:08,Seeking Alpha
tsm,'Masterpiece performance:' Nvidia's results show the AI train is still chugging along,2024-08-29 20:30:07,Seeking Alpha
tsm,"Nvidia slips even as Q2 results, guidance top expectations; unveils $50B buyback",2024-08-28 20:41:43,Seeking Alpha
tsm,Super Micro's plummet leads several other AI hardware stocks down as well,2024-08-28 16:03:59,Seeking Alpha
tsm,"Catalyst Watch: Nvidia's blockbuster earnings, CrowdStrike on the hot seat, and PCE inflation watch",2024-08-23 19:00:15,Seeking Alpha
tsm,Delays impact 40% of Biden administration's biggest climate projects - FT,2024-08-18 00:25:00,Seeking Alpha
tsm,Philippe Laffont's Coatue Management ups Nvidia stake by nearly tenfold among top Q2 moves,2024-08-15 21:21:59,Seeking Alpha
tsm,7 Chip Stocks to Ride the 2024 AI Wave,2024-08-15 10:50:00,InvestorPlace
tsm,"Third Point adds new Apple stake, sheds Marvell Technology among Q2 buys/sells",2024-08-14 22:21:03,Seeking Alpha
tsm,What Are the Hottest Semiconductor Stocks Right Now? 3 Top Picks.,2024-08-14 15:21:08,InvestorPlace
tsm,3 Great Growth Stocks to Buy Before Summer Ends,2024-08-14 15:18:16,InvestorPlace
tsm,"Needham Just Boosted Its Price Target on These 3 Stocks: August 13, 2024",2024-08-14 13:26:07,InvestorPlace
tsm,Why TSM Stock Remains a Top Buy in 2024 Despite The Incredible Run-Up,2024-08-14 10:20:00,InvestorPlace
tsm,Nvidia’s Q2 Earnings: The Stage Is Set for Another Blowout Quarter,2024-08-14 10:13:01,TipRanks
tsm,3 Semiconductor Stocks Poised for a Comeback After Last Week’s Market Meltdown,2024-08-13 18:34:24,InvestorPlace
tsm,3 Smart Stocks to Buy on the Dip In August,2024-08-12 20:00:00,InvestorPlace
tsm,The 3 Best AI Stocks to Buy in August 2024,2024-08-10 10:57:00,InvestorPlace
tsm,TSM Stock Alert: Why Is Taiwan Semiconductor in the News Today?,2024-08-09 18:36:35,InvestorPlace
tsm,3 Semiconductor Stocks With Trillion-Dollar Valuation Potential by 2030,2024-08-09 14:45:38,InvestorPlace
tsm,"4 stocks to watch on Friday: TSM, TTWO and more",2024-08-09 13:28:00,Seeking Alpha
tsm,"China's Semiconductor Manufacturing International's Q2 revenue jumps, profit beats estimates despite decline",2024-08-08 13:57:42,Seeking Alpha
tsm,7 Set-and-Forget Retirement Stocks With Potential to Pay You Forever,2024-08-07 20:30:00,InvestorPlace
tsm,The 3 Best Virtual Reality Stocks to Buy in August 2024,2024-08-07 20:09:32,InvestorPlace
tsm,Super Micro CEO indicates Nvidia's Blackwell likely delayed until early 2025,2024-08-07 15:59:16,Seeking Alpha
tsm,7 Undervalued Stocks That Wall Street Is Mistakenly Ignoring,2024-08-06 16:36:15,InvestorPlace
tsm,"GlobalFoundries' Q2 results beat estimates, remains focused on 'disciplined capex strategy'",2024-08-06 14:55:56,Seeking Alpha
tsm,International stocks beneficiaries of the ‘AI Revolution’ - BofA,2024-08-05 16:46:14,Seeking Alpha
tsm,"Biggest stock movers today: AAPL, NVDA, crypto stocks, and more",2024-08-05 13:41:18,Seeking Alpha
tsm,The Top 3 Semiconductor Stocks to Buy Now: Summer 2024,2024-08-05 10:00:00,InvestorPlace
tsm,"Intel leads chip stocks decline after results, outlook weighs on investor sentiment",2024-08-02 15:56:46,Seeking Alpha
tsm,"Intel loses quarter of its market cap after weak guidance, margins worry markets and analysts",2024-08-02 13:09:17,Seeking Alpha
tsm,The 3 Best Chip Stocks to Buy Amid the Ongoing Correction,2024-07-31 19:51:54,InvestorPlace
tsm,Is Taiwan Semiconductor a Buy? The Risks & Catalysts for TSM Stock.,2024-07-31 19:29:09,InvestorPlace
tsm,Why Are Chip Stocks Up Today?,2024-07-31 14:20:20,InvestorPlace
tsm,ASML rises after US mulls new chip export rules for China that exempt some allies - report,2024-07-31 11:27:43,Seeking Alpha
tsm,7 Stocks Set for a Major Bull Run,2024-07-31 10:22:00,InvestorPlace
tsm,Get Your Money Out of These 3 Semiconductor Stocks by 2025,2024-07-30 19:50:54,InvestorPlace
tsm,Unlocking the Next 3 Trillion-Dollar Stock Opportunities,2024-07-30 11:45:00,InvestorPlace
tsm,7 Top Tech Stocks to Buy and Hold for the Long Haul,2024-07-30 10:45:00,InvestorPlace
tsm,Q3’s Rising Stars: 3 Tech Stocks for Your Must-Watch List,2024-07-29 18:56:02,InvestorPlace
tsm,3 Semiconductor Stocks to Buy on the Dip: July 2024,2024-07-29 12:00:00,InvestorPlace
tsm,Why Smart Investors Should Consider Selling Nvidia Stock Now,2024-07-27 19:00:00,InvestorPlace
tsm,TSM Stock Analysis: Why You Should Wait for Taiwan Semiconductor to Drop to $150,2024-07-26 19:24:16,InvestorPlace
tsm,7 Fantastic Forever Stocks to Buy and Never Let Go,2024-07-26 11:00:00,InvestorPlace
tsm,3 Promising Semiconductor Stocks to Scoop Up in July 2024,2024-07-25 10:38:00,InvestorPlace
tsm,5 Things To Know In Investing This Week: The Rate Cut Expectations Are 100% Issue,2024-07-24 20:15:35,Benzinga
tsm,Don’t Be Left Behind! 3 AI Stocks Powering the Technological Revolution,2024-07-24 10:47:00,InvestorPlace
tsm,All 7 Magnificent 7 Stocks Rated From Worst to First,2024-07-24 10:00:00,InvestorPlace
tsm,Cash Machine Activation: 3 Growth Stocks With Explosive Earnings Potential,2024-07-23 13:16:00,InvestorPlace
tsm,3 Stocks the Biggest Hedge Funds Are Buying Now: July 2024,2024-07-23 13:00:00,InvestorPlace
tsm,7 Meme Mania Stocks: Which Are FOMO and Which Are Free Money?,2024-07-23 10:45:00,InvestorPlace
tsm,3 Nantotech Stocks to Bet On for Market-Crushing Returns,2024-07-23 10:15:00,InvestorPlace
tsm,"No Worries, No Stress! Just Sit Tight With Intel Stock.",2024-07-23 10:15:00,InvestorPlace
tsm,3 Tech Stock Giants Poised for Second-Half Domination,2024-07-22 17:15:39,InvestorPlace
tsm,"Trending stocks this week as Trump, IT scares hit markets",2024-07-20 14:03:00,Seeking Alpha
tsm,"If You Can Only Buy One Growth Stock in July, It Better Be One of These 3 Names",2024-07-20 10:40:00,InvestorPlace
tsm,3 Semiconductor Stocks That Could Grow Your Wealth,2024-07-20 10:00:00,InvestorPlace
tsm,"If You Can Only Buy One Tech Stock In July, It Better Be One Of These 3 Names",2024-07-19 20:45:00,InvestorPlace
tsm,AMD continued losses for seven consecutive sessions,2024-07-19 20:01:48,Seeking Alpha
tsm,"Taiwan Semiconductor Sees Boost from 3nm and 5nm Nodes, Analyst Highlights Q3 Outlook",2024-07-19 19:26:30,Benzinga
tsm,What's Going On With Arm Stock On Friday?,2024-07-19 19:12:26,Benzinga
tsm,3 Underrated AI-Leveraging Tech Stocks to Watch in 2024,2024-07-19 18:07:21,InvestorPlace
tsm,TSM Stock Analysis: New Highs Should Be No Surprise for Taiwan Semi Investors,2024-07-19 16:03:29,InvestorPlace
tsm,Outstanding TSM Earnings: A Strong Signal for AI Stocks,2024-07-19 15:34:48,InvestorPlace
tsm,3 Semiconductor Stocks That Could Be Multibaggers in the Making: July Edition,2024-07-19 10:24:00,InvestorPlace
tsm,Taiwan Semiconductor Manufacturing (TSM) Gets a Buy from Barclays,2024-07-19 06:57:14,TipRanks
tsm,"VIX Stages Double-Digit Spike As Risk Off Takes Over; Chipmakers Fail To Rebound, Weight Loss Giants Eli Lilly, Novo Tumble: What's Driving Markets Thursday?",2024-07-18 20:05:29,Benzinga
tsm,"Chips may be 'volatile' through election, but fundamentals are intact: analysts",2024-07-18 18:53:18,Seeking Alpha
tsm,"Biggest stock movers today: DPZ, NOK, TSM, and more",2024-07-18 14:00:30,Seeking Alpha
tsm,3 Top Mega-Cap Chip Stocks to Watch for Major Moves,2024-07-18 13:03:30,InvestorPlace
tsm,"Taiwan Semi's results highlight AI's impact on die size, chiplets: Barclays",2024-07-18 12:47:27,Seeking Alpha
tsm,"TSM Stock Earnings: Taiwan Semiconductor Beats EPS, Beats Revenue for Q2 2024",2024-07-18 10:52:49,InvestorPlace
tsm,Analysts Offer Insights on Technology Companies: Lattice Semiconductor (LSCC) and Taiwan Semiconductor Manufacturing (TSM),2024-07-18 10:31:25,TipRanks
tsm,TSMC’s Strategic Growth and Market Positioning: A Buy Rating Justification,2024-07-18 10:30:17,TipRanks
tsm,Taiwan Semiconductor rises after AI demand boosts outlook; No change in strategy amid Trump's comments,2024-07-18 10:26:28,Seeking Alpha
tsm,Taiwan Semiconductor declares NT$4.00 quarterly dividend,2024-07-18 09:11:49,Seeking Alpha
tsm,"TSMC Q2 Profit, Revenues Climb",2024-07-18 08:34:20,RTTNews
tsm,"Earnings summary: Taiwan Semiconductor beats Q2 earnings estimates, profit soars 36% on robust AI demand",2024-07-18 07:01:33,Seeking Alpha
tsm,"Taiwan Semiconductor in charts: Advanced chips 3nm, 5nm, 7nm boost revenue in Q2, China accounts for 16% of sales",2024-07-18 06:52:55,Seeking Alpha
tsm,"Taiwan Semiconductor GAAP EPADR of $1.48 beats by $0.06, revenue of $20.82B beats by $730M",2024-07-18 05:33:47,Seeking Alpha
tsm,"Trump's Taiwan Talk, Biden's Trade Restriction Plans Trigger Nvidia, AMD And Other Semiconductor Selloff: 'I'm Having Flashbacks,' Says Analyst",2024-07-18 04:07:02,Benzinga
tsm,Taiwan Semiconductor Stock (NYSE:TSM): Still Attractive on Multiple Tailwinds,2024-07-17 23:10:51,TipRanks
tsm,Intel Stock Pops After Trump Sinks TSM. What’s Going On?,2024-07-17 21:10:02,InvestorPlace
tsm,Nasdaq 100 Suffers Worst Day In 11 Months As Chipmakers Tumble On China Curbs; Magnificent 7 Wipe Out $500B : What's Driving Markets Wednesday?,2024-07-17 20:27:47,Benzinga
tsm,"Chips lose $500B in market cap amid export control fears, Trump's Taiwan comments",2024-07-17 20:04:31,Seeking Alpha
tsm,Taiwan Semiconductor Charts Show Mixed Signals As Q2 Earnings Loom: What To Expect,2024-07-17 19:08:01,Benzinga
tsm,Why Are Stocks Down Today?,2024-07-17 19:00:58,InvestorPlace
tsm,AI Earthquake: Semiconductors Suffer Worst Selloff In Years On Stricter US Chip Exports To China,2024-07-17 18:42:47,Benzinga
tsm,Prudent Investors Watching Risk To AI Stocks Like NVIDIA And AMD – Momo Monster Buying On Trump 2.0,2024-07-17 18:02:15,Benzinga
tsm,Why Is Nvidia (NVDA) Stock Falling Today?,2024-07-17 17:37:12,InvestorPlace
tsm,Nvidia and other chip stocks tumble on report the Biden administration is weighing tighter China trade restrictions,2024-07-17 16:36:02,Business Insider
tsm,ASML Stock Alert: ASML Rocks Chip Stocks with China Warning,2024-07-17 15:09:04,InvestorPlace
tsm,Taiwan Semiconductor Manufacturing earnings preview: what Wall Street is expecting,2024-07-17 15:01:13,Markets Insider Automation
tsm,Warner Bros Layoffs 2024: What to Know About the Latest Round of WBD Job Cuts,2024-07-17 14:55:07,InvestorPlace
tsm,Notable earnings before Thursday's open,2024-07-17 14:51:20,Seeking Alpha
tsm,Taiwan Semiconductor Q2 earnings: Eyes on guidance amid AI boom,2024-07-17 14:33:08,Seeking Alpha
tsm,LGVN Stock Alert: Longeveron Pops 18% on FDA Fast-Track Designation,2024-07-17 14:19:08,InvestorPlace
tsm,"Biggest stock movers today: Semiconductor stocks, GTLB, SAVE, and more",2024-07-17 14:00:39,Seeking Alpha
tsm,How Donald Trump Rocked Taiwan Semi (TSM) Stock Today,2024-07-17 13:51:13,InvestorPlace
tsm,Broadcom Stock Is Still a Buy After 10-for-1 Split,2024-07-17 10:20:00,InvestorPlace
tsm,3 Long-Term Stocks to Buy Now: Q3 Edition,2024-07-16 10:39:00,InvestorPlace
tsm,Should You Invest in the First Trust Indxx NextG ETF?,2024-07-15 22:06:31,Benzinga
tsm,7 Top-Quality Stocks to Buy Now: July 2024,2024-07-15 17:00:00,InvestorPlace
tsm,3 Overlooked Stocks Ready to Heat Up This July,2024-07-15 14:56:09,InvestorPlace
tsm,Apple To Rally More Than 18%? Here Are 10 Top Analyst Forecasts For Monday,2024-07-15 14:07:52,Benzinga
tsm,3 AI Stocks Ready to Come Out of the Shadows and Shine,2024-07-15 14:00:00,InvestorPlace
tsm,"Taiwan Semiconductor likely to boost sales outlook, keep spending steady: Needham",2024-07-15 13:56:23,Seeking Alpha
tsm,7 Terrible Tech Stocks to Avoid at All Costs,2024-07-15 11:10:00,InvestorPlace
tsm,Dear Taiwan Semiconductor Stock Fans: Mark Your Calendars for July 18,2024-07-15 10:12:00,InvestorPlace
tsm,7 Semiconductor Stocks Surging on the Back of the Tech Boom,2024-07-15 10:00:00,InvestorPlace
tsm,Intel Stock: Last Chance for a Comeback or Time to Abandon Ship?,2024-07-14 12:54:02,InvestorPlace
tsm,"Earnings week ahead: BAC, GS, JNJ, TSM, UNH, ABT, UAL, NFLX, AXP and more",2024-07-14 12:00:00,Seeking Alpha
tsm,3 AI Stocks Paving Your Path to Seven-Figure Wealth,2024-07-13 18:00:00,InvestorPlace
