Ticker,Title,Datetime,Source
acn,Accenture agrees to acquire industrial AI company Flutura,2023-03-21 07:17:56,Seeking Alpha
acn,Accenture To Buy Indian Industrial AI Firm Flutura; Terms Not Disclosed,2023-03-21 05:32:41,RTTNews
acn,"Analysts Offer Insights on Technology Companies: Accenture (ACN), Datadog (DDOG) and WalkMe (WKME)",2023-03-20 16:40:25,TipRanks
acn,"Catalyst watch: Spotlight on the Fed meeting, Nvidia, Nike And Foot Locker",2023-03-17 19:00:22,Seeking Alpha
acn,"Earnings week ahead: Nike, Chewy, General Mills, GameStop and more",2023-03-17 18:24:28,Seeking Alpha
acn,Analysts Offer Insights on Technology Companies: Accenture (ACN) and Block (SQ),2023-03-16 10:51:02,TipRanks
acn,"Analysts Are Bullish on Top Technology Stocks: Accenture (ACN), Block (SQ)",2023-03-16 10:50:04,TipRanks
acn,Wall Street Analysts Are Bullish on Top Technology Picks,2023-03-16 10:30:32,TipRanks
acn,Meta Platforms To Rally Over 36%? Here Are 10 Other Analyst Forecasts For Wednesday,2023-03-15 13:25:37,Benzinga
acn,"Analysts Offer Insights on Technology Companies: Accenture (ACN), Northrop (NOC) and Smartsheet (SMAR)",2023-03-15 09:40:17,TipRanks
acn,Analyst Ratings for Accenture,2023-03-13 17:00:24,Benzinga
acn,Wedbush Reaffirms Their Buy Rating on Accenture (ACN),2023-03-13 16:25:14,TipRanks
acn,The Top 3 Growth Stocks in Quantum Computing,2023-03-13 13:43:46,InvestorPlace
acn,Accenture (ACN): New Buy Recommendation for This Technology Giant,2023-03-13 09:25:24,TipRanks
acn,"Analysts Offer Insights on Technology Companies: Accenture (ACN), AeroVironment (AVAV) and BlackLine (BL)",2023-03-09 04:20:14,TipRanks
acn,"Apple, Amazon, AMD And 10 More Tech Stocks Morgan Stanley Recommends Through Market Trough, Into Next Bull Run",2023-03-07 17:17:07,Benzinga
acn,The Only 3 Tech Stocks That Matter,2023-02-27 19:32:53,InvestorPlace
acn,AI Stocks: The ACTUAL Winners and Losers from the AI Revolution,2023-02-17 17:51:32,InvestorPlace
acn,"Analysts Conflicted on These Technology Names: Accenture (ACN), Littelfuse (LFUS) and Instructure Holdings (INST)",2023-02-15 05:20:07,TipRanks
acn,Accenture buys Brazilian cybersecurity company Morphus,2023-02-13 23:19:11,Seeking Alpha
acn,Fidelity National Information sum-of-the-parts value $95 to $120 a share - analyst,2023-02-10 19:37:43,Seeking Alpha
acn,Want To Copy 'Master Trader' Nancy Pelosi's Investments? There's An ETF For That. Here Are The Holdings,2023-02-07 17:34:32,Benzinga
acn,"Analysts Offer Insights on Technology Companies: Accenture (ACN), Qualcomm (QCOM) and 2U (TWOU)",2023-02-06 08:30:37,TipRanks
acn,The 7 Most Promising AI Stocks to Buy in February,2023-02-05 14:06:55,InvestorPlace
acn,The 5 Most Undervalued Tech Stocks for Your February Buy List,2023-02-02 20:17:28,InvestorPlace
acn,Accenture buys strategy and consulting firm Bionest,2023-02-02 16:21:40,Seeking Alpha
acn,Accenture (ACN): New Buy Recommendation for This Technology Giant,2023-02-01 13:56:46,TipRanks
acn,Quant Ratings Updated on 105 Stocks,2023-01-31 21:30:04,InvestorPlace
acn,"Benzinga's Top Ratings Upgrades, Downgrades For January 30, 2023",2023-01-30 16:00:50,Benzinga
acn,"Insiders Selling DocuSign, Adobe And 2 Other Stocks",2023-01-24 13:36:41,Benzinga
acn,Fidelity National Information may fetch $85 to $105 a share in takeover,2023-01-19 18:09:33,Seeking Alpha
acn,"Analysts’ Opinions Are Mixed on These Technology Stocks: Accenture (ACN), Veeva Systems (VEEV) and Sprout Social (SPT)",2023-01-12 05:20:58,TipRanks
acn,"Accenture agrees to acquire SKS Group for banking clients in Germany, Austria and Switzerland",2023-01-10 09:01:08,Seeking Alpha
acn,Accenture Widens Its Oracle Cloud Capabilities With Inspirage,2023-01-04 15:12:07,RTTNews
acn,"Analysts Offer Insights on Technology Companies: Accenture (ACN), HEICO (HEI) and Verisk Analytics (VRSK)",2022-12-21 01:50:31,TipRanks
acn,"Accenture Likely To Gain Share Through Downturn, Counted On Total Enterprise Reinvention, Analyst Says",2022-12-19 21:47:50,Benzinga
acn,"New Sell Rating for Accenture (ACN), the Technology Giant",2022-12-16 20:25:09,TipRanks
acn,"S&P, Dow, Nasdaq set to end week lower as post-Fed selloff continues",2022-12-16 18:55:57,Seeking Alpha
acn,Dow Drops 200 Points; Accenture Posts Upbeat Results,2022-12-16 16:03:08,Benzinga
acn,Accenture Raises FY23 EPS Outlook; Boosts Dividend 15% - Update,2022-12-16 13:12:59,RTTNews
acn,Accenture declares $1.12 dividend,2022-12-16 12:05:30,Seeking Alpha
acn,"US Stocks Set To End The Week With A Whimper As S&P 500 Futures Slide Amid Recession Fears — Energy Stocks, Novavax, Adobe, Meta In Focus",2022-12-16 11:58:03,Benzinga
acn,"Accenture GAAP EPS of $3.08 beats by $0.18, revenue of $15.75B beats by $160M",2022-12-16 11:51:37,Seeking Alpha
acn,CNN Fear & Greed Index Moves To 'Neutral' Zone After Dow Tumbles Over 700 Points,2022-12-16 10:45:45,Benzinga
acn,"Accenture, Adobe And 3 Stocks To Watch Heading Into Friday",2022-12-16 10:17:06,Benzinga
acn,"Planet Labs' 3Q Beat, Big Tech Partnerships Wins Analyst Conviction",2022-12-15 20:38:41,Benzinga
acn,Accenture FQ1 2023 Earnings Preview,2022-12-15 17:20:09,Seeking Alpha
acn,Accenture earnings preview: what Wall Street is expecting,2022-12-15 15:01:13,Markets Insider Automation
acn,Notable earnings before Friday's open,2022-12-15 14:55:53,Seeking Alpha
acn,"Benzinga's Top Ratings Upgrades, Downgrades For December 12, 2022",2022-12-12 16:01:31,Benzinga
acn,What 9 Analyst Ratings Have To Say About Accenture,2022-12-12 13:03:28,Benzinga
acn,"Catalyst Watch: FOMC, CPI print and spotlight on Yum Brands",2022-12-09 19:30:48,Seeking Alpha
acn,"Analysts Offer Insights on Technology Companies: Accenture (ACN), Autodesk (ADSK) and Nvidia (NVDA)",2022-11-18 04:40:32,TipRanks
acn,"Ray Dalio's Bridgewater boosts stakes in Visa, Mondelez, Microsoft, exits Medtronic",2022-11-15 13:28:29,Seeking Alpha
acn,Accenture to acquire data science company ALBERT,2022-11-15 11:14:02,Seeking Alpha
acn,Accenture To Acquire Japanese Data Science Company ALBERT,2022-11-15 07:45:09,RTTNews
acn,7 Tech Stocks to Buy Before the Market Blasts Higher in 2023,2022-11-04 16:26:53,InvestorPlace
acn,7 Blue-Chip Stocks Set to Soar From 52-Week Lows,2022-10-31 16:28:38,InvestorPlace
acn,7 Best Bargain Stocks to Buy Now,2022-10-17 15:32:37,InvestorPlace
acn,"Accenture, Atlassian In Strategic Partnership To Help Organizations Gain Enterprise Agility",2022-10-17 11:18:00,RTTNews
acn,3 Quantum Computing Sleeper Stocks to Buy Before Wall Street Wakes Up,2022-10-12 22:43:18,InvestorPlace
acn,"Analysts See Meta Connect Shows Progress With Partnerships, Admire Mark Zuckerberg's Vision",2022-10-12 18:37:09,Benzinga
acn,"Accenture and Google Cloud Expand Partnership to Accelerate Value from Technology, Data, and AI",2022-10-11 14:03:00,PR Newswire
acn,"Three Mid-band Spectrum Bands Offer Greatest Potential to Meet 5G Demand in the US, Study Finds",2022-09-28 17:23:00,PR Newswire
acn,"Accenture, Toshiba To Provide Consulting Services To Support Green Transformation Across Enterprise",2022-09-27 03:16:24,RTTNews
acn,Here's Why Wells Fargo Continues To Recommend Zscaler As A 'Top Pick',2022-09-26 19:03:02,Benzinga
acn,Robert W. Baird Reaffirms Their Hold Rating on Accenture (ACN),2022-09-26 03:15:15,TipRanks
acn,"New Buy Rating for Accenture (ACN), the Technology Giant",2022-09-26 01:15:12,TipRanks
acn,"Analysts Slash Accenture's Price Targets Over Softer Booking Potential, Guidance & Economic Weakness",2022-09-23 20:08:51,Benzinga
acn,Spero Therapeutics To Rally Around 240%? Plus This Analyst Slashes PT On Salesforce,2022-09-23 15:59:12,Benzinga
acn,Where Accenture Stands With Analysts,2022-09-23 15:20:16,Benzinga
acn,"Accenture Price Target Cut By This Analyst, Plus Deutsche Bank Predicts $483 For FactSet Research",2022-09-23 14:14:26,Benzinga
acn,"Analysts’ Opinions Are Mixed on These Technology Stocks: Accenture (ACN), Factset Research (FDS) and Fidelity National Info (FIS)",2022-09-23 12:30:34,TipRanks
acn,3 Stocks Recently Traded by US Politicians,2022-09-23 12:07:32,TipRanks
acn,"Why Are APE, AMC Stocks Falling Today?",2022-09-22 16:29:01,InvestorPlace
acn,"Accenture FQ4 results seen solid but Wall Street feels outlook is mixed, may disappoint",2022-09-22 16:16:28,Seeking Alpha
acn,Is Amprius (AMPX) Stock the Next Big Short Squeeze?,2022-09-22 15:57:53,InvestorPlace
acn,RLH Equity Partners: Inspirage To Be Acquired By Accenture,2022-09-22 14:34:36,RTTNews
acn,What Is Going on With Accenture (ACN) Stock Today?,2022-09-22 14:26:00,InvestorPlace
acn,Inspirage to be Acquired by Accenture,2022-09-22 14:00:00,PR Newswire
acn,Accenture Guides FY23 EPS Below Estimates; Raises Dividend 15%,2022-09-22 13:13:32,RTTNews
acn,Accenture to acquire Inspirage,2022-09-22 12:10:25,Seeking Alpha
acn,Accenture hikes dividend by 15.5% to $1.12; approves $3B in additional share repurchase authority,2022-09-22 10:51:39,Seeking Alpha
acn,"Accenture GAAP EPS of $2.60 beats by $0.03, revenue of $15.42B in-line",2022-09-22 10:48:44,Seeking Alpha
acn,Accenture Q4 2022 Earnings Preview,2022-09-21 19:50:59,Seeking Alpha
acn,Here's what Wall Street expects from Accenture's earnings report,2022-09-21 15:01:13,Markets Insider Automation
acn,BMO Capital Sticks to Its Hold Rating for Accenture (ACN),2022-09-21 12:35:36,TipRanks
acn,7 Stocks Reporting Earnings the Week of Sept. 19,2022-09-19 02:55:38,InvestorPlace
acn,"Earnings week ahead: FedEx, Costco, AutoZone, General Mills, Lennar, KB Home and more",2022-09-16 16:29:13,Seeking Alpha
acn,Ohio National Teams join hands with Accenture to accelerate technology modernization,2022-09-14 11:13:57,Seeking Alpha
acn,Accenture acquires The Beacon Group,2022-09-08 14:01:07,Seeking Alpha
acn,Analyst Ratings for Accenture,2022-09-07 20:03:09,Benzinga
acn,Expert Ratings for Accenture,2022-09-07 19:57:46,Benzinga
acn,"Accenture to acquire Inspirage, enhancing supply chain transformation capabilities",2022-09-06 15:08:58,Seeking Alpha
acn,Accenture acquires MacGregor Partners; terms undisclosed,2022-09-01 15:45:48,Seeking Alpha
acn,Accenture Buys Carbon Intelligence For Undisclosed Terms,2022-09-01 12:48:10,RTTNews
acn,Accenture acquires Carbon Intelligence; terms undisclosed,2022-09-01 09:26:41,Seeking Alpha
acn,Accenture Announces Investment In Pixxel,2022-08-30 09:00:35,RTTNews
acn,7 Tech Stocks That Are Screaming Buys Right Now,2022-08-26 18:19:45,InvestorPlace
acn,Where Accenture Stands With Analysts,2022-08-09 22:07:34,Benzinga
acn,QBTS Stock Alert: D-Wave Quantum Surges After SPAC Debut,2022-08-09 17:08:51,InvestorPlace
acn,Analyst Ratings for Accenture,2022-08-09 16:12:25,Benzinga
acn,Accenture To Buy Indonesian Creative Agency Romp; Financial Terms No Disclosed,2022-08-08 10:03:29,RTTNews
acn,Accenture agrees to acquire Romp for an undisclosed sum,2022-08-08 08:45:28,Seeking Alpha
acn,"Inside the 'messy' end of a Facebook contractor's job. Break time was tracked intensely, perks evaporated, and workers were put on performance plans for showing up late.",2022-08-07 20:41:42,Premium
acn,Accenture to acquire Sentia for enhancing infrastructure engineering capabilities,2022-08-02 09:25:45,Seeking Alpha
acn,Accenture acquires cloud data firm Tenbu,2022-08-01 13:18:50,Seeking Alpha
acn,Accenture acquires digital transformation firm Solvera Solutions,2022-07-25 18:42:57,Seeking Alpha
acn,"Accenture to acquire Eclipse Automation, terms not disclosed",2022-07-21 14:14:57,Seeking Alpha
acn,7 Oversold Tech Stocks to Buy for July,2022-07-15 10:45:30,InvestorPlace
acn,Accenture acquires The Stable to enhance its commerce transformation expertise in North America,2022-07-13 18:19:40,Seeking Alpha
acn,7 Blue-Chip Stocks to Buy After Last Month’s Massive Beating,2022-07-11 23:00:48,InvestorPlace
acn,"umlaut Launches ""5G Campus Lab,"" an Open RAN Private Network to Accelerate the Development of Connectivity Solutions for Clients",2022-06-30 16:30:00,PR Newswire
acn,"Benzinga's Top Ratings Upgrades, Downgrades For June 29, 2022",2022-06-29 16:06:22,Benzinga
acn,"Tesla To $1,150? Here's The Biggest Price Target Changes For Monday",2022-06-27 15:38:11,Benzinga
acn,Accenture To Acquire XtremeEDA - Quick Facts,2022-06-27 13:13:12,RTTNews
acn,Accenture agrees to acquire silicon design services firm XtremeEDA,2022-06-27 11:18:54,Seeking Alpha
acn,Amazon.com To $180? Here's The Biggest Price Target Changes For Friday,2022-06-24 21:22:54,Benzinga
acn,"Catalyst watch: FedEx event, Shopify split, Micron earnings and key Nikola vote",2022-06-24 19:00:00,Seeking Alpha
acn,Piper Sandler Cuts Accenture Price Target By 17% - Read Why,2022-06-24 18:55:11,Benzinga
acn,RBC Capital Maintains Outperform Rating for Accenture: Here's What You Need To Know,2022-06-24 18:02:29,Benzinga
acn,Johnson Controls and Accenture Join Forces on New AI-enabled OpenBlue Innovation Centers,2022-06-23 18:00:00,PR Newswire
acn,Accenture Trims FY22 EPS Outlook; Raises Dividend 10% - Update,2022-06-23 13:01:21,RTTNews
acn,"US Stock Futures Mixed Ahead Of Jobless Claims, Powell Testimony",2022-06-23 11:05:07,Benzinga
acn,Accenture declares $0.97 dividend,2022-06-23 10:52:24,Seeking Alpha
acn,"Accenture reports mixed FQ3 results, raises revenue growth outlook for FY2022",2022-06-23 10:50:39,Seeking Alpha
acn,"5 Stocks To Watch For June 23, 2022: FedEx, Accenture And More",2022-06-23 09:30:54,Benzinga
acn,What Wall Street expects from Accenture's earnings,2022-06-22 15:01:13,Markets Insider Automation
acn,Notable earnings before Thursday's open,2022-06-22 14:01:50,Seeking Alpha
acn,Goldman touts stable stocks for this market; here is their rebalanced portfolio,2022-06-19 19:22:30,Seeking Alpha
acn,Where Accenture Stands With Analysts,2022-06-14 16:05:19,Benzinga
acn,Accenture acquires Advocate Networks for expanding tech business management capabilities,2022-06-06 18:14:58,Seeking Alpha
acn,Accenture To Buy Austrian Banking Technology Service Provider ARZ; Terms Not Disclosed,2022-06-01 10:40:11,RTTNews
acn,Accenture scoops up Allgemeines Rechenzentrum to expand cloud-based banking platform-as-a-service offerings across Europe,2022-06-01 07:50:57,Seeking Alpha
acn,"Dan Loeb's Third Point adds stakes in CSX, Alcoa; exits Alphabet, Upstart",2022-05-16 21:49:34,Seeking Alpha
acn,Palantir Stock Is on its Way to a Fair Price,2022-05-06 14:05:13,InvestorPlace
acn,Why Cramer Recommends Buying Marvell Technology,2022-05-05 13:40:21,Benzinga
acn,Morgan Stanley issues list of 45 highest conviction stock picks,2022-05-02 10:15:00,Seeking Alpha
acn,Accenture acquires akzente strengthens sustainability capabilities,2022-05-02 09:34:21,Seeking Alpha
acn,"Accenture acquired Ergo for expanding data & AI capabilities, sixth acquisition in a month",2022-04-21 14:04:58,Seeking Alpha
acn,"Accenture acquires Greenfish, an independent sustainability engineering and advisory company",2022-04-20 10:11:23,Seeking Alpha
acn,10 Biggest Price Target Changes For Friday,2022-04-08 14:09:30,Benzinga
acn,Accenture to acquire Avieco to expand sustainability capabilities in the UK,2022-04-08 09:01:26,Seeking Alpha
acn,Accenture acquires AFD.TECH,2022-04-04 09:13:25,Seeking Alpha
acn,"Catalyst watch for next week: Major Bitcoin conference, Tilray earnings and Ontario iGaming/sports betting",2022-04-01 19:00:57,Seeking Alpha
acn,"Accenture to acquire Trancom ITS, terms not disclosed",2022-03-28 10:19:11,Seeking Alpha
acn,Accenture To Acquire Capabilities From Trancom ITS; Terms Undisclosed,2022-03-28 08:30:05,RTTNews
acn,10 Biggest Price Target Changes For Thursday,2022-03-24 17:07:46,Benzinga
acn,Accenture acquires Alfa Consulting for undisclosed sum,2022-03-24 09:23:07,Seeking Alpha
acn,7 Stocks to Buy Giving Russia the Cold Shoulder,2022-03-23 15:24:54,InvestorPlace
acn,10 Biggest Price Target Changes For Friday,2022-03-18 12:53:02,Benzinga
acn,"Accenture delivers Q2 earnings beats, but warns of impact from Russia-Ukraine war",2022-03-17 14:41:38,Seeking Alpha
acn,Accenture Boosts FY22 Outlook; Raises Dividend 10% - Update,2022-03-17 12:18:26,RTTNews
acn,A Peek Into The Markets: US Stock Futures Edge Lower Following Wednesday's Fed Rate Hike,2022-03-17 11:04:28,Benzinga
acn,Accenture declares $0.97 dividend,2022-03-17 11:00:04,Seeking Alpha
acn,"Accenture GAAP EPS of $2.54 beats by $0.13, revenue of $15.05B beats by $380M",2022-03-17 10:47:24,Seeking Alpha
acn,"5 Stocks To Watch For March 17, 2022",2022-03-17 10:04:18,Benzinga
acn,Accenture Q2 2022 Earnings Preview,2022-03-16 16:27:26,Seeking Alpha
acn,Notable earnings before Thursday's open,2022-03-16 15:23:32,Seeking Alpha
acn,Accenture is about to announce its earnings — here's what Wall Street expects,2022-03-16 15:01:13,Markets Insider Automation
acn,Where Accenture Stands With Analysts,2022-03-07 18:02:02,Benzinga
acn,Accenture Discontinues Business In Russia,2022-03-04 03:49:29,RTTNews
acn,U.S. banks prepare for cyber attacks after new sanctions against Russia - Reuters,2022-02-28 01:40:18,Seeking Alpha
acn,"Amazon has $1 trillion of untapped value, Third Point's Dan Loeb is said to argue",2022-02-17 03:07:28,Seeking Alpha
acn,3 Moonshot Stocks For 2022,2022-02-16 22:00:31,InvestorPlace
acn,Accenture Invests In Cloud-Based Reality Data Solutions Provider Cintoo; Terms Undisclosed,2022-01-27 11:46:49,RTTNews
acn,XELA Stock Alert: There Are 100 Million Reasons Exela Technologies Is Soaring Today,2022-01-26 17:54:49,InvestorPlace
acn,"5G-Enabled Technologies Could Solve for One-Fifth of U.S. Climate Change Target by 2025, New Study Finds",2022-01-26 17:34:00,PR Newswire
acn,Once Top-Ranked IBM’s Been Relegated Among the Second-Tier Outsourcers,2022-01-18 11:00:24,InvestorPlace
acn,"Benzinga's Top Ratings Upgrades, Downgrades For January 10, 2022",2022-01-10 16:05:40,Benzinga
acn,A Peek Into The Markets: US Stock Futures Edge Higher; Crude Oil Up 0.5%,2022-01-10 11:51:51,Benzinga
acn,7 of the Best Cheap Stocks Under $10 for 2022 to Buy Now,2022-01-06 19:53:02,InvestorPlace
acn,PayPal tops Evercore ISI's payment stock picks for 2022,2022-01-05 16:47:53,Seeking Alpha
acn,Cardano Is One of the Better Cryptos for 2022,2022-01-03 17:23:01,InvestorPlace
acn,2022 Tech Trends That Will Change Our World And The Potential Beneficiaries: Deloitte Report,2021-12-30 19:08:46,Benzinga
acn,Expert Ratings For Accenture,2021-12-17 15:37:31,Benzinga
acn,Read How Analysts Laud Accenture's Q1,2021-12-17 13:42:17,Benzinga
acn,10 Biggest Price Target Changes For Friday,2021-12-17 13:22:15,Benzinga
acn,Mid-Afternoon Market Update: Nasdaq Down 2.5%; Calliditas Therapeutics Shares Spike Higher,2021-12-16 20:31:29,Benzinga
acn,Mid-Day Market Update: Gold Rises 2%; IronNet Shares Plummet,2021-12-16 18:22:34,Benzinga
acn,Mid-Morning Market Update: Markets Mixed; Accenture Beats Q1 Estimates,2021-12-16 16:24:14,Benzinga
acn,"Accenture acquires Zestgroup, terms undisclosed",2021-12-16 14:48:33,Seeking Alpha
acn,"AGEN, LYG and ARVL among pre market gainers",2021-12-16 13:44:22,Seeking Alpha
acn,"Accenture Q1 Profit Beats Estimates, Revenues Up 27%; Raises FY22 Guidance",2021-12-16 13:20:54,RTTNews
acn,Accenture declares $0.97 dividend,2021-12-16 12:01:24,Seeking Alpha
acn,"Accenture EPS beats by $0.15, beats on revenue; raises full year outlook",2021-12-16 11:48:51,Seeking Alpha
acn,Accenture Q1 2022 Earnings Preview,2021-12-15 16:47:52,Seeking Alpha
acn,Notable earnings before Thursday's open,2021-12-15 15:16:11,Seeking Alpha
acn,Accenture is about to announce its earnings — here's what Wall Street expects,2021-12-15 15:01:13,Markets Insider Automation
acn,Accenture To Acquire France's AFD.TECH For Undisclosed Terms - Quick Facts,2021-12-15 13:02:22,RTTNews
acn,"Catalyst watch for next week: FOMC drama, events for Lowe's and Delta Air Lines, Rivian earnings",2021-12-10 20:00:40,Seeking Alpha
acn,Accenture makes strategic investment in Interos; terms undisclosed,2021-12-07 11:35:28,Seeking Alpha
acn,What 6 Analyst Ratings Have To Say About Accenture,2021-12-01 17:12:09,Benzinga
acn,"Accenture Promotes 1,030 New Managing Directors - Quick Facts",2021-12-01 13:14:53,RTTNews
acn,7 Growth Stocks to Benefit From a Mark Mobius-Like India,2021-11-23 14:51:11,InvestorPlace
acn,"Accenture to buy Tambourine, terms not disclosed",2021-11-19 11:10:47,Seeking Alpha
acn,"5G Fixed Wireless Access Could Serve Nearly Half of U.S. Rural Households with High-Speed Broadband, New Study Finds",2021-11-18 16:30:00,PR Newswire
acn,Exela Stock Is an Incredibly Risky Play With Limited Upside,2021-11-18 14:48:22,InvestorPlace
acn,Accenture acquires strategy consulting firm Founders Intelligence,2021-11-16 13:30:29,Seeking Alpha
acn,Accenture acquires management consulting firm T.A. Cook,2021-11-15 16:09:34,Seeking Alpha
acn,UBS taps 30 stocks for 2030 in disruptor sectors: Alpha Tactics,2021-11-13 21:17:03,Seeking Alpha
acn,Accenture Federal Services Gets $618 Mln U.S. Marshals Service Task Order - Quick Facts,2021-11-10 15:21:28,RTTNews
acn,BrightTower Advises Procurement Spend Management Firm ClearEdge Partners in Sale to Accenture,2021-11-09 16:30:00,PR Newswire
acn,Accenture Announces Investment In Israel-based Geneyx - Quick Facts,2021-11-09 15:04:16,RTTNews
acn,Accenture invests in Geneyx Genomex; terms undisclosed,2021-11-09 13:14:15,Seeking Alpha
acn,Accenture Buys Xoomworks Group - Quick Facts,2021-10-19 12:23:43,RTTNews
acn,Taiwan Semiconductor Earnings Reflects Problems with Supply Chain,2021-10-14 16:25:58,Benzinga
acn,Expert Ratings For Accenture,2021-09-24 19:53:17,Benzinga
acn,How Analysts Rate Accenture Post Q4 Results?,2021-09-24 15:43:08,Benzinga
acn,10 Biggest Price Target Changes For Friday,2021-09-24 12:54:50,Benzinga
acn,Mid-Afternoon Market Update: Crude Oil Surges 1.5%; BlackBerry Shares Spike Higher,2021-09-23 20:47:06,Benzinga
acn,Mid-Day Market Update: Dow Jumps Over 500 Points; Eargo Shares Plunge,2021-09-23 18:39:02,Benzinga
acn,Mid-Morning Market Update: Markets Open Higher; Accenture Profit Beats Views,2021-09-23 16:18:04,Benzinga
acn,Accenture Guides FY22 Above Estimates; Raises Dividend 10% - Quick Facts,2021-09-23 13:00:57,RTTNews
acn,A Peek Into The Markets: US Stock Futures Climb Ahead Of Economic Reports,2021-09-23 12:10:03,Benzinga
acn,Accenture earnings preview: what to expect,2021-09-21 15:01:18,Markets Insider Automation
acn,Accenture Intends To Acquire Experity - Quick Facts,2021-09-20 15:25:16,RTTNews
acn,Analyst Ratings For Accenture,2021-09-16 19:21:12,Benzinga
acn,TWKS Stock IPO: When Does Thoughtworks Go Public? What Is the Thoughtworks IPO Price Range?,2021-09-14 20:44:28,InvestorPlace
acn,What 13 Analyst Ratings Have To Say About Accenture,2021-09-10 18:43:16,Benzinga
acn,7 Blockchain Stocks to Buy Now For the Bitcoin Bounceback,2021-09-08 19:40:44,InvestorPlace
acn,Analyst Ratings For Accenture,2021-09-08 18:30:47,Benzinga
acn,Accenture To Buy King James Group For Undisclosed Terms - Quick Facts,2021-09-07 12:51:33,RTTNews
acn,Accenture To Acquire BENEXT In France - Quick Facts,2021-09-07 10:53:27,RTTNews
acn,"7 Stocks To Watch For Tech, Fintech and Inflation Catalysts",2021-08-31 19:28:37,InvestorPlace
acn,5 Blockchain ETFs to Buy If You’re Excited About Cryptocurrency,2021-08-24 19:29:23,InvestorPlace
acn,"Duke Energy teams with Accenture, Microsoft in methane emissions monitoring platform",2021-08-23 14:58:42,Seeking Alpha
acn,Expert Ratings For Accenture,2021-08-21 17:22:57,Benzinga
acn,Accenture: David Droga Named CEO & Creative Chairman Of Accenture Interactive,2021-08-19 13:53:24,RTTNews
acn,Accenture acquires supply chain logistics firm Blue Horseshoe,2021-08-04 14:32:50,Seeking Alpha
acn,Accenture Buys LEXTA - Quick Facts,2021-08-02 09:53:17,RTTNews
acn,Accenture buys consulting firm LEXTA,2021-08-02 09:43:27,Seeking Alpha
acn,Accenture Buys Italian Boutique Commerce Agency Openmind; Terms Not Disclosed,2021-07-29 11:08:16,RTTNews
acn,Accenture scoops up Openmind; terms not disclosed,2021-07-29 09:44:59,Seeking Alpha
acn,Accenture To Acquire HRC Retail Advisory For Undisclosed Sum To Drive Retail Abilities,2021-07-27 19:38:37,Benzinga
acn,Accenture agrees to buy HRC Retail Advisory,2021-07-27 17:49:42,Seeking Alpha
acn,Pega and Accenture Join Forces to Help Transform Australian Defence Force Postings,2021-07-26 17:46:00,PR Newswire
acn,"Benzinga's Top Ratings Upgrades, Downgrades For July 26, 2021",2021-07-26 16:05:18,Benzinga
acn,"A 'Work Anywhere' Workplace is What Canadian Employees Actually Want Today, According to New Report by Accenture",2021-07-21 13:00:00,PR Newswire
acn,"A 'Work Anywhere' Workplace is What Canadian Employees Actually Want Today, According to New Report by Accenture",2021-07-21 13:00:00,PR Newswire
acn,Accenture concludes the acquisition of France-based cybersecurity services firm Openminded,2021-07-21 12:45:15,Seeking Alpha
acn,Accenture acquires Workforce Insight for workforce management,2021-07-20 14:48:43,Seeking Alpha
acn,Accenture Expands Oracle Capabilities in Canada with Cloudworks Acquisition,2021-07-19 17:15:00,PR Newswire
acn,Accenture Expands Oracle Capabilities in Canada with Cloudworks Acquisition,2021-07-19 17:15:00,PR Newswire
acn,Accenture acquires Toronto-based Cloudworks to bolster Oracle capabilities in Canada,2021-07-19 15:31:50,Seeking Alpha
acn,Accenture Agrees To Acquire Wabion - Quick Facts,2021-07-14 11:15:59,RTTNews
acn,"Accenture acquires a Google Cloud services boutique Wabion, terms undisclosed",2021-07-14 09:21:32,Seeking Alpha
acn,Accenture completes acquisition of Linkbynet for cloud first services,2021-07-09 12:09:18,Seeking Alpha
acn,Accenture and Avanade Recognized as 2021 Microsoft Canada Country Partner of the Year,2021-07-08 21:15:00,PR Newswire
acn,Accenture and Avanade Recognized as 2021 Microsoft Canada Country Partner of the Year,2021-07-08 21:15:00,PR Newswire
acn,"Casino Group In Deal With Google Cloud, Accenture To Accelerate Digital Strategy",2021-07-06 08:50:22,RTTNews
acn,Accenture Buys CS Technology For Undisclosed Terms - Quick Facts,2021-07-01 15:03:21,RTTNews
