Ticker,Title,Datetime,Source
ma,5 Ways to Play the Launch of 5G Through Innovative Stocks,2022-01-20 12:57:19,InvestorPlace
ma,I Hate to Say It But Here’s Why Cardano Could Fall 25%,2022-01-19 20:31:05,InvestorPlace
ma,BKKT Stock Alert: Why Is Bakkt in the Spotlight Today?,2022-01-19 18:51:20,InvestorPlace
ma,Mastercard fined $43M by U.K. regulator for prepaid card cartel,2022-01-19 15:36:43,Seeking Alpha
ma,"Chase, Instacart, Mastercard Partner To Launch Credit Card",2022-01-19 15:26:51,RTTNews
ma,Stay Away From Southeast Asian Loyalty Play Society Pass,2022-01-19 11:00:26,InvestorPlace
ma,Coinbase NFT Partnership: 6 Things to Know About the Coinbase-Mastercard Collaboration,2022-01-18 21:41:17,InvestorPlace
ma,Mastercard Fined In The UK For Cartel Behaviour In Prepaid Cards Market,2022-01-18 10:40:53,RTTNews
ma,Affirm Stock Is a Hidden Success Story in the Making,2022-01-17 17:07:18,InvestorPlace
ma,Mastercard CEO says 2022 retail sales stay 'relatively positive' - CNBC,2022-01-13 22:07:33,Seeking Alpha
ma,"Mastercard Track signs on BMO, Moneris Solutions for B2B payments in Canada",2022-01-13 13:25:25,Seeking Alpha
ma,"Down 13%, Visa Stock Looks Like a Buy for Long-term Growth and Profits",2022-01-13 12:20:15,InvestorPlace
ma,"Big News with Stablecoins: “PayPal Coin,” Powell’s Approval",2022-01-12 15:48:36,InvestorPlace
ma,"APEXX Global enters U.S. 'Buy Now, Pay Later' market",2022-01-12 14:00:00,Seeking Alpha
ma,"PayPal, Visa downgraded at BNP Paribas on outlook for 2022 consumer spending",2022-01-10 19:05:10,Seeking Alpha
ma,Asian fintech startup Pine Labs is said to seek $500M in U.S. IPO,2022-01-10 17:09:46,Seeking Alpha
ma,Alchemy Pay expands reach through partnership with NIUM,2022-01-10 13:08:52,Seeking Alpha
ma,"Affirm, Lightspeed, Block among Truist's favorites to ride fintech revolution",2022-01-07 18:25:54,Seeking Alpha
ma,Visa stock slips after Mizuho downgrades on shift in key revenue driver,2022-01-07 14:28:02,Seeking Alpha
ma,"Meta, Netflix move up list of crowded trades, even as funds dump tech: At the Open",2022-01-06 12:38:01,Seeking Alpha
ma,"Block Stock May Get More Volatile, But It’s Still a Good Buy on This Dip",2022-01-05 11:00:17,InvestorPlace
ma,Ignore the Bearish Noise and Invest in Visa Stock,2022-01-04 21:02:25,InvestorPlace
ma,Optimists Toward Paysafe Stock Have Left the Building … Should You?,2022-01-04 16:54:09,InvestorPlace
ma,Polkadot Gets Boost from SPAC-trepreneur Palihapitiya’s Alt-Coin Views,2022-01-04 11:00:52,InvestorPlace
ma,POSAF Stock: My No. 1 Moonshot Pick for 2022,2022-01-03 20:55:44,InvestorPlace
ma,Paypal upgraded to Outperform at BMO on normalized 2023 estimates for valuation,2022-01-03 14:27:58,Seeking Alpha
ma,BMO Capital Upgrades PayPal To Outperform; Cuts Price Target By 19.4%,2022-01-03 11:17:03,Benzinga
ma,Best Stocks for 2022: Deep Value Tech Stock POSaBIT Is A Can’t Miss Cannabis Play,2021-12-30 19:36:14,InvestorPlace
ma,Affirm Holdings Stock Has Likely Ridden This BNPL Wave as Far as It Can,2021-12-29 11:00:50,InvestorPlace
ma,A Peek Into The Markets: US Stock Futures Edge Higher Following Thursday's Rally,2021-12-27 12:00:32,Benzinga
ma,"U.S. Retail Sales, Excl. Automotive, Up 8.5% In This Holiday Season : Mastercard SpendingPulse",2021-12-27 02:07:25,RTTNews
ma,7 Safe Stocks Immune From Omicron and Future Covid-19 Variants,2021-12-23 17:26:46,InvestorPlace
ma,Here’s Why SoFi Technologies Stock Is a Fintech Buy on the Dip,2021-12-23 11:00:38,InvestorPlace
ma,BKKT Stock: What to Know About the Latest Crypto Deal Powering Bakkt Higher,2021-12-21 22:03:47,InvestorPlace
ma,"S&P 500 buybacks hit new record high in Q3, could be higher in Q4",2021-12-21 20:43:35,Seeking Alpha
ma,Mastercard To Acquire McDonald's Dynamic Yield; Terms Undisclosed,2021-12-21 15:39:50,RTTNews
ma,S&P 500 Buybacks Set A Record High,2021-12-21 15:00:00,PR Newswire
ma,"Meta hits UBS list of most crowded trades, most megacaps still uncrowded: At the Open",2021-12-21 12:00:59,Seeking Alpha
ma,Bakkt: A Hot IPO Turns Cold in a Hurry,2021-12-15 21:14:51,InvestorPlace
ma,Buy SoFi Stock While It’s Cheap,2021-12-13 23:23:35,InvestorPlace
ma,Visa Stock Will Reward Patient Investors,2021-12-13 16:43:05,InvestorPlace
ma,Bottomline Technologies gets upgrade to buy on news of potential takeover,2021-12-10 15:40:17,Seeking Alpha
ma,SoFi Is Back to a Strong Investable Base,2021-12-10 15:39:24,InvestorPlace
ma,Household net worth rises to record as home prices climb,2021-12-09 18:37:28,Seeking Alpha
ma,Mastercard revamps international operation leadership to support new goals,2021-12-07 12:55:29,Seeking Alpha
ma,Goldman says a payment stocks sector reshuffle will 'redefine' Financials: At the Open,2021-12-06 14:05:53,Seeking Alpha
ma,7 Cryptos to Buy in December After the Recent Decline,2021-12-02 19:50:01,InvestorPlace
ma,3 Stocks to Buy on Dips for 2022 and Beyond,2021-12-02 16:09:44,InvestorPlace
ma,PayPal stock rises after use of its BNPL service jumps on Black Friday (updated),2021-12-01 13:15:33,Seeking Alpha
ma,This Is Why SoFi Stock Has Fallen So Much Lately,2021-12-01 12:00:00,InvestorPlace
ma,"Mastercard Raises Quarterly Dividend By 11%, Authorizes $8 Bln Buy Back",2021-11-30 23:09:57,RTTNews
ma,Mastercard raises dividend by 11% to $0.49,2021-11-30 21:07:20,Seeking Alpha
ma,3 Cheap Growth Stocks to Buy for December,2021-11-30 19:07:21,InvestorPlace
ma,New York Fed launches innovation center in partnership with BIS,2021-11-29 21:24:41,Seeking Alpha
ma,"Consumers expect to use BNPL more this holiday season, survey says",2021-11-29 19:17:14,Seeking Alpha
ma,Visa complains to U.S. government about India promoting rival RuPay - Reuters,2021-11-29 12:36:27,Seeking Alpha
ma,"Affirm Holdings and Adyen stocks extend gains as PayPal, Visa, other peers slip",2021-11-28 22:40:00,Seeking Alpha
ma,Meme stocks and megacaps make UBS list of most and least crowded trades: Alpha Tactics,2021-11-27 18:52:48,Seeking Alpha
ma,"Global Fintech, Jeeves, and MasterCard Join Forces to Offer Fully Locally-Issued Physical and Virtual Cards for Mexican Businesses",2021-11-26 19:18:00,PR Newswire
ma,"Mastercard, Jeeves to offer physical, virtual cards to businesses in Mexico",2021-11-26 19:03:56,Seeking Alpha
ma,"JPMorgan among bank, credit card stocks dip amid renewed COVID variant worries",2021-11-26 13:40:54,Seeking Alpha
ma,Mastercard to support real-time payments in Latin America with acquisition of Arcus,2021-11-24 15:02:03,Seeking Alpha
ma,"Marqeta, Mastercard team up with Paycast to launch digital card product",2021-11-24 14:08:00,Seeking Alpha
ma,PayPal stock falls to 52-week low amid payment tech weakness,2021-11-22 18:39:32,Seeking Alpha
ma,Downtrodden Square Stock Will Climb to the Top Again,2021-11-22 15:55:23,InvestorPlace
ma,7 Stocks to Buy for Their Resistance to the 6.2% Monthly Inflation,2021-11-22 11:00:16,InvestorPlace
ma,"Fintech Focus For November 22, 2021",2021-11-22 02:40:16,Benzinga
ma,Goldman picks best high-growth stocks for rising rates in '22: Alpha Tactics,2021-11-20 21:19:41,Seeking Alpha
ma,Analysts Remain Divided Over Amazon's Crusade On Visa,2021-11-18 21:58:29,Benzinga
ma,Bakkt sees partnerships activating services toward end of Q1,2021-11-18 17:02:21,Seeking Alpha
ma,Voyager Price Predictions: How High Can a Coinbase Listing Take the VGX Crypto?,2021-11-18 16:00:45,InvestorPlace
ma,Amazon Just Dealt Visa a Blow. What Does It Really Mean for V Stock Holders?,2021-11-17 21:18:18,InvestorPlace
ma,"Visa defended by Barclays, Morgan Stanley after Amazon U.K. move",2021-11-17 16:04:51,Seeking Alpha
ma,Amazon to stop accepting Visa credit cards issued in U.K. next year - Bloomberg,2021-11-17 13:13:22,Seeking Alpha
ma,"Credit card metrics, loan growth tread path to 'normalization' in October",2021-11-16 20:30:30,Seeking Alpha
ma,Bakkt Will Return to $50 if It Can Curb Its Spending,2021-11-16 17:15:37,InvestorPlace
ma,7 Best Cryptos to Buy Before 2022 If You Dream of Getting Rich,2021-11-16 16:09:51,InvestorPlace
ma,ETFs face potential large-scale sector shake-ups,2021-11-16 15:46:28,Seeking Alpha
ma,Voyager Digital introduces crypto-based debit Mastercard based on USD Coin,2021-11-16 14:29:45,Seeking Alpha
ma,Mastercard stock treads water while Visa slips; what's behind the split?,2021-11-14 22:18:00,Seeking Alpha
ma,UBS taps 30 stocks for 2030 in disruptor sectors: Alpha Tactics,2021-11-13 21:17:03,Seeking Alpha
ma,Under-the-Weather PayPal Stock Will Rise Again Soon,2021-11-12 15:55:23,InvestorPlace
ma,Baird likes it 'a lot': A payments firm with 39%-plus upside and sunny growth ahead,2021-11-12 14:35:00,Seeking Alpha
ma,"With Affirm, All They Want Is Growth",2021-11-11 21:21:15,InvestorPlace
ma,"Mastercard sees cross-border activity rising, introduces new long-term goals",2021-11-11 19:43:29,Seeking Alpha
ma,Affirm Stock Is a Hot Buy on Any Dip,2021-11-10 18:38:32,InvestorPlace
ma,"Mastercard signs up more partners for its Buy Now, Pay Later program",2021-11-10 13:02:08,Seeking Alpha
ma,"Mastercard Launches Crypto-Linked Credit, Debit Cards For Asia Pacific Region",2021-11-09 16:58:58,Benzinga
ma,It’s Finally Safe To Buy Paysafe Stock Now,2021-11-09 16:46:22,InvestorPlace
ma,PayPal stock dips as analysts cut price targets on weak guidance,2021-11-09 13:16:17,Seeking Alpha
ma,Mastercard partners with digital asset firms to launch crypto-linked payment cards in Asia Pacific,2021-11-08 19:41:33,Seeking Alpha
ma,3 Stocks to Buy on Misguided Dips,2021-11-08 18:26:17,InvestorPlace
ma,5 Stocks Set to 10x Next Year,2021-11-05 19:31:58,InvestorPlace
ma,Mastercard stock climbs 4% after Tigress highlights buying opportunity,2021-11-05 16:16:16,Seeking Alpha
ma,OLB Stock: The Big Crypto Catalyst Sending OLB Group Up 100% Today,2021-11-02 18:29:19,InvestorPlace
ma,OLB Group stock doubles after enabling bitcoin payments through Mastercard,2021-11-02 14:33:35,Seeking Alpha
ma,Mastercard narrows net zero timeline to 2040 as it accelerates sustainable solutions,2021-11-01 13:05:25,Seeking Alpha
ma,Mastercard Accelerates Its Net Zero Timeline To 2040 - Quick Facts,2021-11-01 10:21:52,RTTNews
ma,Loyalty Points Market Bakkt Now Backed by the Finance Industry,2021-10-29 19:59:02,InvestorPlace
ma,Bakkt shares push up 50% just days after cryptocurrency exchange's ultra rally,2021-10-29 19:37:01,Seeking Alpha
ma,Where Mastercard Stands With Analysts,2021-10-29 18:10:13,Benzinga
ma,Mastercard Q3 Profit Tops Estimates,2021-10-28 14:44:55,RTTNews
ma,Mastercard Incorporated Q3 Income Climbs,2021-10-28 14:13:30,RTTNews
ma,2 Moonshots to Sell as Crypto Slides (and 3 to Snatch Up!),2021-10-28 13:50:50,InvestorPlace
ma,"Mastercard sees Q4 revenue growth in mid-20s, as cross-border spending rebounds",2021-10-28 12:20:57,Seeking Alpha
ma,"Mastercard EPS beats by $0.18, beats on revenue",2021-10-28 12:02:18,Seeking Alpha
ma,What's Next For Bakkt Holdings?,2021-10-27 21:02:36,Benzinga
ma,Notable earnings before Thursday's open,2021-10-27 14:40:31,Seeking Alpha
ma,MasterCard is about to announce its earnings — here's what to expect,2021-10-26 15:02:03,Markets Insider Automation
ma,"Tesla Top-Discussed Stock On WallStreetBets Today; Bakkt, Snap, Trump's SPAC Partner And These Are Other Top Trends",2021-10-26 13:33:07,Benzinga
ma,"Bakkt shares extend climb after agreements with Fiserv, Mastercard",2021-10-26 12:13:54,Seeking Alpha
ma,Today’s Biggest Pre-Market Stock Movers: 10 Top Gainers and Losers on Tuesday,2021-10-26 11:36:52,InvestorPlace
ma,How Bakkt And Mastercard Partnership Is Yet Another Step Toward 'Normalization' Of Crypto,2021-10-26 09:22:30,Benzinga
ma,Why Did Bakkt Shares More Than Triple Today?,2021-10-25 23:04:42,Benzinga
ma,GRNQ Stock: 8 Things to Know About Greenpro Capital as Satellite News Sends It Into Orbit,2021-10-25 16:49:13,InvestorPlace
ma,Mastercard Crypto News: 10 Things for BKKT Stock Investors to Know About the Partnership,2021-10-25 15:45:57,InvestorPlace
ma,7 Stocks to Buy for a Spooky Halloween and Beyond,2021-10-21 16:08:56,InvestorPlace
ma,SoFi Is Poised to Do So Much More,2021-10-20 14:56:59,InvestorPlace
ma,AVDX Stock IPO: 9 Things to Know as AvidXchange Starts Trading Today,2021-10-13 19:20:33,InvestorPlace
ma,7 Best Blue-Chip Stocks to Buy as China Shakes the Market,2021-10-11 16:23:01,InvestorPlace
ma,3 Stocks to Buy While Investor Confidence Is Shaky,2021-09-30 18:27:50,InvestorPlace
ma,Mastercard declares $0.44 dividend,2021-09-20 20:07:35,Seeking Alpha
ma,Mastercard Announces Launch Of New Sustainability Innovation Lab,2021-09-20 09:16:46,RTTNews
ma,3 Cheap Stocks to Buy for the Fourth Quarter,2021-09-19 16:56:08,InvestorPlace
ma,"Add Affirm to the Wish List, Not the Shopping Cart",2021-09-17 16:41:26,InvestorPlace
ma,Here’s Why Square Remains a Bullish Play,2021-09-15 19:01:18,InvestorPlace
ma,Buy SoFi Stock While It Is Still a Hidden Gem,2021-09-13 18:21:14,InvestorPlace
ma,3 Reasons to Buy Ethereum Right Now,2021-09-13 10:00:05,InvestorPlace
ma,Mastercard Crypto News: 7 Things to Know About Mastercard’s Big Bet on CipherTrace,2021-09-09 18:33:02,InvestorPlace
ma,3 Financial Tech Stocks to Buy While They’re Out of Favor,2021-09-09 16:53:21,InvestorPlace
ma,Mastercard To Acquire CipherTrace - Quick Facts,2021-09-09 15:42:53,RTTNews
ma,"PayPal expands into Europe with Mastercard debit program, epay's POS product",2021-09-07 16:25:15,Seeking Alpha
ma,Mastercard To Acquire Aiia For Undisclosed Terms - Quick Facts,2021-09-07 15:51:05,RTTNews
ma,"Dow Jones, S&P 500 post slight gains, Nasdaq edges lower ahead of Friday's jobs report",2021-09-02 20:12:12,Seeking Alpha
ma,7 Stocks for Beginners to Buy This Back-to-School Season,2021-09-01 16:48:52,InvestorPlace
ma,How Important Is Porn To OnlyFans?,2021-09-01 13:20:59,Benzinga
ma,"7 Stocks To Watch For Tech, Fintech and Inflation Catalysts",2021-08-31 19:28:37,InvestorPlace
ma,Analyst Ratings For Mastercard,2021-08-31 19:25:34,Benzinga
ma,Financial stocks rise after Powell speech even as Treasury yields dip,2021-08-27 17:39:50,Seeking Alpha
ma,Square Stock Is so Much More Vulnerable as It Adds Even More Credit Risk,2021-08-27 10:00:02,InvestorPlace
ma,3 High-Growth Dividend Stocks to Buy for the Long Run,2021-08-26 19:35:37,InvestorPlace
ma,5 Blockchain ETFs to Buy If You’re Excited About Cryptocurrency,2021-08-24 19:29:23,InvestorPlace
ma,7 Retail Stocks to Buy for a Back-to-School Boom,2021-08-24 14:58:43,InvestorPlace
ma,7 Strong Mega-Cap Stocks to Snap Up For Dividends and Growth,2021-08-18 19:57:14,InvestorPlace
ma,7 Best Fintech Stocks to Buy as Digital Transactions Dominate,2021-08-17 18:46:20,InvestorPlace
ma,Analyst Ratings For Mastercard,2021-08-17 18:42:01,Benzinga
ma,"4 Top Stock Trades for Tuesday: FSLY, SOFI, TDOC, CLOV",2021-08-16 21:45:30,InvestorPlace
ma,ContextLogic Stock Could Pop as It Moves Into the Fintech Arena,2021-08-16 15:00:54,InvestorPlace
ma,Expert Ratings For Mastercard,2021-08-12 18:23:53,Benzinga
ma,"Benzinga's Top Ratings Upgrades, Downgrades For August 12, 2021",2021-08-12 16:04:36,Benzinga
ma,Amazon to impose surcharge on Visa card transactions in Singapore,2021-08-12 14:30:10,Seeking Alpha
ma,7 Top Tech Stocks to Buy for August,2021-08-09 20:43:26,InvestorPlace
ma,7 Recession-Resistant Stocks To Buy if You’re Feeling Nervous,2021-08-05 20:42:08,InvestorPlace
ma,Affirm stock gains on reported Apple partnership in Canada,2021-08-04 12:24:42,Seeking Alpha
ma,Square Stock Gets Goosed as Markets React To Its Afterpay Acquisition,2021-08-04 12:24:31,InvestorPlace
ma,What 13 Analyst Ratings Have To Say About Mastercard,2021-08-02 19:18:39,Benzinga
ma,Where Mastercard Stands With Analysts,2021-08-02 19:18:03,Benzinga
ma,Square agrees to buy Australia's Afterpay for $29B in stock,2021-08-01 22:49:32,Seeking Alpha
ma,Mid-Afternoon Market Update: Dow Jumps Over 200 Points; Tempur Sealy Shares Spike Higher,2021-07-29 20:30:10,Benzinga
ma,Mid-Day Market Update: LendingClub Surges Following Strong Q2 Results; Atreca Shares Plummet,2021-07-29 18:10:27,Benzinga
ma,Mid-Morning Market Update: Markets Open Higher; Mastercard Profit Beats Estimates,2021-07-29 16:26:42,Benzinga
ma,Mastercard Incorporated Q2 adjusted earnings Beat Estimates,2021-07-29 14:06:04,RTTNews
ma,"Mastercard EPS beats by $0.20, beats on revenue",2021-07-29 12:01:05,Seeking Alpha
ma,Notable earnings before Thursday's open,2021-07-28 14:01:13,Seeking Alpha
ma,Here's what to expect from MasterCard's earnings,2021-07-27 15:02:14,Markets Insider Automation
ma,"Mastercard launches program for cryptocurrency, digital assets-focused startups",2021-07-27 13:41:47,Seeking Alpha
ma,7 Overvalued Stocks to Sell Now Ahead of a Potential Correction,2021-07-26 16:00:23,InvestorPlace
ma,7 Fintech Stocks To Buy Before They Explode,2021-07-21 17:08:42,InvestorPlace
ma,"Ripple: Despite the Legal Saga, XRP Is A Leading Name In Cross-Border Payments",2021-07-21 15:54:36,InvestorPlace
ma,MA Stock Takes Off As Mastercard Teams Up With Circle to Help People Spend Their Crypto,2021-07-20 18:17:29,InvestorPlace
ma,Will 5G tailwinds buoy Verizon's Q2 performance?,2021-07-20 15:34:54,Seeking Alpha
ma,Mastercard Upgrades Card Payments/Wallets For Cryptocurrency Exchanges,2021-07-20 14:30:46,RTTNews
ma,Mastercard seeks to simplify payments card offering for cryptocurrency companies,2021-07-20 12:02:00,Seeking Alpha
ma,Analyst Ratings For Mastercard,2021-07-15 20:31:02,Benzinga
ma,Don't we already have digital currency? What's all the hype about CBDCs?,2021-07-15 14:56:48,Seeking Alpha
ma,India restricts Mastercard Asia Pacific from issuing new cards on data storage issues,2021-07-14 20:27:15,Seeking Alpha
ma,Sofi Deserves More Love Than it Gets,2021-07-14 16:40:20,InvestorPlace
ma,Payment tech stocks climb as consumer spending stays strong,2021-07-13 16:10:49,Seeking Alpha
ma,Mastercard and Verizon partner to apply 5G to global payments industry,2021-07-13 15:22:54,Seeking Alpha
ma,Mastercard and Major League Baseball extend 20+-year partnership,2021-07-12 14:13:19,Seeking Alpha
ma,Here’s What You Should Know Before You Buy Litecoin,2021-07-12 13:40:07,InvestorPlace
ma,3 Stocks to Buy After a Correction,2021-07-06 15:05:05,InvestorPlace
ma,GoDaddy Venture Forward Partners with Mastercard's City Possible Initiative,2021-06-30 17:00:00,PR Newswire
ma,"Mastercard invests in India's Instamojo to boost , small-business ecommerce",2021-06-28 18:16:07,Seeking Alpha
ma,10 Best Stocks to Buy to Build Up Passive Income Streams,2021-06-24 14:26:07,InvestorPlace
ma,7 Overlooked Blue-Chip Stocks to Buy for Eagle-Eyed Investors,2021-06-23 19:26:26,InvestorPlace
ma,"America's SBDC Collaborates with Coalition of Small Business Providers for ""Launchpad America"" to Help Entrepreneurs, Startups Succeed as Nation Emerges from Pandemic",2021-06-22 12:00:00,PR Newswire
ma,"The Facebook trade is crowded, but Apple isn't; here's the global list: Alpha Tactics",2021-06-19 18:38:00,Seeking Alpha
ma,Mastercard Incorporated -- Moody's announces completion of a periodic review of ratings of Mastercard Incorporated,2021-06-15 22:20:00,Moodys
ma,Top stocks with pricing power for a sputtering reflation trade: Alpha Tactics,2021-06-12 21:36:53,Seeking Alpha
ma,Mastercard takes its name off of soccer tournament in Brazil,2021-06-09 13:44:56,Seeking Alpha
ma,Mastercard expands True Name feature with new partners,2021-06-09 12:49:03,Seeking Alpha
ma,Mastercard Foundation To Donate $1.3 Bln To Vaccinate Africans,2021-06-08 15:51:17,RTTNews
ma,Where Mastercard Stands With Analysts,2021-06-07 18:00:45,Benzinga
ma,10 Biggest Price Target Changes For Monday,2021-06-07 13:48:24,Benzinga
ma,3 Financial Stocks to Buy That Are Charging Higher,2021-06-02 20:04:21,InvestorPlace
ma,Teething Problems for Dogecoin Prevent Mainstream Integration,2021-05-27 17:05:11,InvestorPlace
ma,Balancing Portfolio Risk And Reward: Asset Allocation for New Graduates,2021-05-27 16:53:01,InvestorPlace
ma,"Mastercard-Gemini credit card reflects consumers' shift toward crypto, exec says",2021-05-27 16:29:59,Seeking Alpha
ma,7 Best Stocks for Upcoming Grads to Buy and Hold Forever,2021-05-27 16:10:51,InvestorPlace
ma,4 Dividend Stocks to Buy as Uncertainty Looms,2021-05-26 23:16:56,InvestorPlace
ma,7 Best Tech Index Funds for the Long-Haul Despite the Current Selloff,2021-05-24 17:23:14,InvestorPlace
ma,Square Stock Remains Charged With Years Worth of Potential,2021-05-21 14:12:09,InvestorPlace
ma,"Tech focused, Lone Pine Capital acquires new position in Workday, exits Docusign, expands stake in Snowflake",2021-05-18 16:39:32,Seeking Alpha
ma,"Benzinga's Top Ratings Upgrades, Downgrades For May 18, 2021",2021-05-18 16:05:31,Benzinga
ma,"York Capital takes new position in Baidu, closes Willis, adds Intel, cuts Mastercard",2021-05-17 19:10:54,Seeking Alpha
ma,"Temasek takes new position in Roblox, trims BABA, adds Visa, Mastercard",2021-05-17 18:12:48,Seeking Alpha
ma,"Uphold Crypto: What to Know About Bitcoin Zero, Elon Musk and the Crypto Exchange",2021-05-17 17:00:10,InvestorPlace
ma,4 Smart Fintech Stocks To Buy on Hot Deal Speculation,2021-05-13 19:18:45,InvestorPlace
ma,The 7 Best Stocks and Cryptos to Buy in May,2021-05-13 18:41:24,InvestorPlace
ma,Vontier Corporation -- Moody's announces completion of a periodic review of ratings of Vontier Corporation,2021-05-11 19:05:00,Moodys
ma,Why Visa & Mastercard Investors Shouldn't Sweat Fed's New Debit Routing Rule Change,2021-05-10 20:15:07,Benzinga
ma,7 Stocks To Buy Right Now Before They Soar on the Broader Recovery,2021-05-10 20:11:44,InvestorPlace
ma,"Mastercard sees 'green shoots' in cross-border transactions, CFO says",2021-05-10 13:15:43,Seeking Alpha
ma,"Mastercard CFO discusses opportunities for data analytics, ID verification, CBDCs",2021-05-10 12:42:00,Seeking Alpha
ma,Seeking Alpha Catalyst Watch,2021-05-07 19:30:30,Seeking Alpha
ma,7 Warren Buffett Stocks to Buy for the Next Decade,2021-05-07 17:13:44,InvestorPlace
ma,PayPal Stock Is A Buy On Any Dip For Your Long-Term Portfolio,2021-05-07 16:12:43,InvestorPlace
ma,3 Mega-Cap Stocks to Fade After this Monster Rally,2021-05-03 15:31:47,InvestorPlace
ma,Wells Fargo debuts riskier 'Signature Picks' portfolio with four megacaps featured,2021-05-03 15:03:10,Seeking Alpha
ma,Coinbase Has Significant Upside Potential From Current Levels,2021-04-29 18:27:08,InvestorPlace
ma,Mastercard Incorporated Q1 adjusted earnings Beat Estimates,2021-04-29 14:11:31,RTTNews
ma,What Will the Stock Market Do Today? 3 Big Stories to Watch.,2021-04-29 13:57:10,InvestorPlace
ma,"Mastercard EPS beats by $0.18, beats on revenue",2021-04-29 12:01:34,Seeking Alpha
ma,Time100 Most Influential Companies: What 61 Publicly Traded Companies Are On The Inaugural List?,2021-04-28 20:23:40,Benzinga
ma,Mastercard Q1 2021 Earnings Preview,2021-04-28 17:21:00,Seeking Alpha
ma,5 Things We Know About the New MasterCard and Gemini Crypto Rewards Credit Card,2021-04-27 15:38:52,InvestorPlace
ma,MasterCard earnings: here's what Wall Street expects,2021-04-27 15:02:23,Markets Insider Automation
ma,What Will the Stock Market Do Today? 3 Big Stories to Watch.,2021-04-27 14:14:40,InvestorPlace
ma,19 Stocks That Could Get a Crypto Boost If Bitcoin Prices Rally,2021-04-27 13:37:01,InvestorPlace
ma,Mastercard partners with Gemini for cryptocurrency rewards credit card,2021-04-27 12:38:13,Seeking Alpha
ma,Goldman's blockchain screen stocks are trouncing the S&P: At the Open,2021-04-27 12:15:49,Seeking Alpha
ma,"Saudi Payments Launches Instant Payments System In Collaboration With IBM, Mastercard",2021-04-21 10:13:35,RTTNews
ma,Mastercard Continues Support For Black Women Entrepreneurs,2021-04-20 15:24:15,RTTNews
ma,Greenwood teams up with Mastercard for debit card offering,2021-04-20 11:29:14,Seeking Alpha
ma,Mastercard Acquires Ekata - Quick Facts,2021-04-19 15:26:14,RTTNews
ma,Mastercard to acquire Ekata for advancing digital identity efforts,2021-04-19 14:10:05,Seeking Alpha
ma,"SQ, PYPL, MA, V: Digital Wallet Stocks on Watch Thanks to Cathie Wood",2021-04-15 19:22:56,InvestorPlace
ma,Mastercard names new Chief Administrative Officer,2021-04-15 14:16:02,Seeking Alpha
ma,Ethereum (ETH) Price Predictions: Where Will ETH Go After New Record Highs?,2021-04-13 21:13:03,InvestorPlace
ma,What is ConsenSys? What to Know About the Crypto Startup Right Now,2021-04-13 19:08:05,InvestorPlace
ma,"Barclays To Become Issuer Of Gap Inc.'s Co-branded, Private Label Credit Card Program",2021-04-13 15:32:26,RTTNews
ma,"When it comes to SOS Limited, Investors Are Playing With Fire",2021-04-12 19:53:58,InvestorPlace
ma,"SQ, PYPL: The Huge Report That Has Digital Payment Stocks on Watch",2021-04-12 17:55:54,InvestorPlace
ma,7 Top Blue-Chip Stocks for the Rest of 2021,2021-04-07 20:03:52,InvestorPlace
ma,If corporate tax hike comes to business process outsourcing: Baird weighs impacts,2021-04-05 23:30:08,Seeking Alpha
ma,Dogecoin Shows No Sign of Slowing As the Endorsements Keep Piling Up,2021-04-05 19:29:29,InvestorPlace
ma,Mastercard To Invest $100 Mln In Airtel Africa Mobile Money Business,2021-04-01 09:38:29,RTTNews
ma,9 First Stocks a New Investor Should Buy,2021-03-26 18:30:51,InvestorPlace
ma,7 Sector Index Funds To Keep On Your Radar,2021-03-26 18:25:51,InvestorPlace
ma,Six big banks invest in digital banking platform for Black and Latino community,2021-03-25 13:58:24,Seeking Alpha
ma,5 Stable Cryptocurrencies With Room to Run Higher,2021-03-24 17:35:05,InvestorPlace
ma,Mastercard ties top executives' compensation to ESG goals,2021-03-24 14:32:41,Seeking Alpha
ma,Foley Trasimene II Stock Still Looks Like a Winning SPAC,2021-03-22 18:05:26,InvestorPlace
ma,7 Stocks That Could Make You A Millionaire,2021-03-22 17:07:52,InvestorPlace
ma,3 Financial Stocks That Will Do Well This Year,2021-03-22 15:39:41,InvestorPlace
ma,Place Your Bets on DraftKings Stock Because It Is Going Places,2021-03-22 14:50:33,InvestorPlace
ma,Visa DOJ News: Why Is Visa Stock Down Today?,2021-03-19 17:44:13,InvestorPlace
