Ticker,Title,Datetime,Source
ma,Analysts Offer Insights on Services Companies: Mastercard (MA) and Walt Disney (DIS),2022-10-18 12:52:08,TipRanks
ma,The 7 Worst Performing Warren Buffett Stocks of 2022,2022-10-17 23:01:53,InvestorPlace
ma,"Visa, Mastercard said to be subject of FTC probe on debit-card routing - report",2022-10-17 17:51:08,Seeking Alpha
ma,Here’s Why Mastercard (NYSE:MA) is Up Today,2022-10-17 15:49:20,TipRanks
ma,"Mastercard Unveils Offering For Banks, Fintechs To Enable Buy, Hold, Sell Of Select Crypto Assets",2022-10-17 14:57:09,RTTNews
ma,Mastercard to roll out program that will help banks offer crypto trading,2022-10-17 12:25:33,Seeking Alpha
ma,7 Best Blockchain Stocks to Buy for the Rest of 2022,2022-10-16 23:55:35,InvestorPlace
ma,Truist Securities Maintains Buy Rating for Mastercard: Here's What You Need To Know,2022-10-13 18:06:47,Benzinga
ma,7 Warren Buffett Stocks to Buy to Ride Out This Bear Market,2022-10-10 10:00:15,InvestorPlace
ma,Domino's Pizza To Drop Around 3%? Here Are 5 Other Price Target Changes For Friday,2022-10-07 13:48:54,Benzinga
ma,Wells Fargo Sticks to Their Buy Rating for Mastercard (MA),2022-10-07 12:35:15,TipRanks
ma,"Uber teams up with Marqeta, Mastercard to offer drivers faster payouts, fuel rewards",2022-10-06 17:04:18,Seeking Alpha
ma,3 Stocks Hedge Funds Love in a Bear Market,2022-10-05 17:15:23,InvestorPlace
ma,This Is the Best Time to Buy These 3 Long-Term Fintech Stocks,2022-10-05 15:48:17,InvestorPlace
ma,Mastercard to roll out new crypto anti-fraud tool for banks,2022-10-04 12:54:25,Seeking Alpha
ma,Where Mastercard Stands With Analysts,2022-10-03 21:21:04,Benzinga
ma,7 Blue-Chip Sleeper Stocks to Buy Before Wall Street Wakes Up,2022-09-28 10:00:08,InvestorPlace
ma,7 Dow Stocks to Buy to Tap Into a Hidden Bull Market,2022-09-27 18:50:42,InvestorPlace
ma,Morgan Stanley sees opportunity for more comprehensive card network legislation,2022-09-27 18:47:52,Seeking Alpha
ma,"Chase, DoorDash To Launch DoorDash Credit Card - Quick Facts",2022-09-27 15:28:20,RTTNews
ma,"JPMorgan, DoorDash, Mastercard team up to launch rewards credit card",2022-09-27 14:18:27,Seeking Alpha
ma,V vs. MA vs. AAPL: Which Stock is Best for Fintech Exposure?,2022-09-26 21:03:50,TipRanks
ma,"Analyst Believes Value Of Core Square Seller, Branded Paypal Checkout, FIS Bank Software Assets 'Undemanding'",2022-09-23 20:23:57,Benzinga
ma,Mastercard extends cross-border payment capabilities to Hamilton Reserve Bank,2022-09-22 16:21:17,Seeking Alpha
ma,Algorand Price Predictions: What’s Next for the ALGO Crypto?,2022-09-22 14:45:52,InvestorPlace
ma,"Visa, GM Sectec bolster alliance in fraud prevention, cyber defense in Latin America",2022-09-21 12:34:16,Seeking Alpha
ma,"Mastercard, Amex, Visa warned to desert gun store merchant code - report",2022-09-20 14:17:25,Seeking Alpha
ma,Bipartisan House bill seeks to increase competition in credit card payment networks (Updated),2022-09-19 19:51:15,Seeking Alpha
ma,Bipartisan House bill seeks to increase competition in credit card payment networks,2022-09-19 18:26:06,Seeking Alpha
ma,American Express embarks on technology hiring spree,2022-09-19 16:06:37,Seeking Alpha
ma,Mastercard declares $0.49 dividend,2022-09-19 13:02:21,Seeking Alpha
ma,Morgan Stanley's quant screen chooses dividend stocks to own and avoid,2022-09-19 10:25:54,Seeking Alpha
ma,Finding the Next Big Thing in Clean Energy Storage,2022-09-16 18:20:39,InvestorPlace
ma,"V, MA: Watch These Stocks as U.S. Retailers Seek to End Credit Card Duopoly",2022-09-16 06:12:58,TipRanks
ma,"CFPB plans to start regulating Affirm, PayPal, other 'Buy Now, Pay Later' providers",2022-09-15 14:43:18,Seeking Alpha
ma,7 Screaming Buy Stock Picks to Beat the September Market Slump,2022-09-13 10:30:24,InvestorPlace
ma,"AMZN, MA, MSFT: Mega Stocks to Watch as the U.S. Dollar Strengthens",2022-09-12 11:40:32,TipRanks
ma,Al Gore Bought The Dip On This Bill Gates Company,2022-09-07 22:08:16,Benzinga
ma,"American Express, Visa, Mastercard urged to support merchant code for guns",2022-09-06 17:07:26,Seeking Alpha
ma,"Ajman Bank to Launch World's First Mastercard Touch Card, Driving Inclusion across UAE",2022-09-01 15:07:00,PR Newswire
ma,The Top 5 Growth Stocks That Hedge Funds Are Buying Now,2022-08-29 18:30:48,InvestorPlace
ma,7 Stocks to Sell When Consumer Confidence Is Falling,2022-08-25 10:45:47,InvestorPlace
ma,Wall Street Loves These 3 Payments Stocks,2022-08-22 17:15:26,TipRanks
ma,7 F-Rated Growth Stocks to Sell While You Can,2022-08-22 10:30:06,InvestorPlace
ma,7 Stocks That Win When the Fed Hikes Interest Rates,2022-08-18 16:59:56,InvestorPlace
ma,"Lone Pine takes new stakes in Alphabet, LPL; exits Snap, DoorDash while boosting Thermo Fisher",2022-08-16 16:20:13,Seeking Alpha
ma,HELLO ALICE LAUNCHES BEST-IN-CLASS SMALL BUSINESS CREDIT CARD WITH MASTERCARD,2022-08-16 15:00:00,PR Newswire
ma,"PayPal upgraded to Outperform at Daiwa, Visa, Mastercard cut to Neutral",2022-08-16 12:19:46,Seeking Alpha
ma,"Ray Dalio's Bridgewater takes fresh stakes in Rivian, Amazon, exits Alibaba, JD.com",2022-08-15 22:20:32,Seeking Alpha
ma,Binance secures preliminary regulatory approval to offer crypto trading in Kazakhstan,2022-08-15 20:20:26,Seeking Alpha
ma,REI Co-op and Capital One Announce New REI Co-op Mastercard,2022-08-08 15:00:00,PR Newswire
ma,Ebang's Ebonex partners with Mastercard to launch crypto-linked card,2022-08-05 13:45:52,Seeking Alpha
ma,"Mastercard, Binance launch cryptocurrency prepaid card in Argentina",2022-08-04 17:20:04,Seeking Alpha
ma,Visa suspends Pornhub advertising arm from its payment network (updated),2022-08-04 17:13:46,Seeking Alpha
ma,Bill Ackman urges Visa to cut off Pornhub from its payments network,2022-08-02 18:14:51,Seeking Alpha
ma,"June's credit card data shows no recession, but cracks start to emerge",2022-07-31 14:24:00,Seeking Alpha
ma,Apple To $185? Plus This Analyst Lowers Price Target On Intel,2022-07-29 15:40:14,Benzinga
ma,Amazon To $175? Here Are 5 Other Price Target Changes For Friday,2022-07-29 15:19:45,Benzinga
ma,7 Warren Buffett Stocks Trading at a Huge Discount Right Now,2022-07-28 23:00:38,InvestorPlace
ma,Why Is Mastercard (MA) Stock in the Spotlight Today?,2022-07-28 16:04:27,InvestorPlace
ma,"Mastercard Incorporated Q2 Profit Increases, beats estimates",2022-07-28 14:11:54,RTTNews
ma,Mastercard Q2 earnings bolstered by robust consumer spending,2022-07-28 12:15:33,Seeking Alpha
ma,"Mastercard Non-GAAP EPS of $2.56 beats by $0.20, revenue of $5.5B beats by $240M",2022-07-28 12:02:02,Seeking Alpha
ma,7 S&P 500 Stocks to Buy on the Dip,2022-07-28 11:39:23,InvestorPlace
ma,"Two senators target Visa, Mastercard in bill to increase card network competition",2022-07-27 17:44:49,Seeking Alpha
ma,Here's what Wall Street expects from MasterCard's earnings report,2022-07-27 15:01:13,Markets Insider Automation
ma,"External factors in favor of Mastercard, analysts optimistic on Q2 earnings",2022-07-27 14:47:36,Seeking Alpha
ma,Notable earnings before Thursday's open,2022-07-27 14:38:51,Seeking Alpha
ma,Credit Suisse reevaluates fintech/payment stocks for dimmer macro outlook,2022-07-24 14:10:00,Seeking Alpha
ma,PayPal gains after analysts speculate on possible activist interest,2022-07-21 14:52:05,Seeking Alpha
ma,JP Morgan Maintains Overweight Rating for Mastercard: Here's What You Need To Know,2022-07-20 18:07:41,Benzinga
ma,Expert Ratings for Mastercard,2022-07-20 15:30:06,Benzinga
ma,"Mastercard to $425? Plus Raymond James Predicts $2,350 For This Stock",2022-07-20 14:24:43,Benzinga
ma,EXCLUSIVE: D-Wave And Mastercard Take Quantum Leap Into Future Of Financial Services,2022-07-18 12:30:14,Benzinga
ma,Mastercard and D-Wave collaborate for quantum computing solutions,2022-07-18 12:10:39,Seeking Alpha
ma,7 Best Fidelity ETFs to Buy in July,2022-07-18 10:41:32,InvestorPlace
ma,7 Best S&P 500 Stocks to Buy in July,2022-07-14 23:40:15,InvestorPlace
ma,Why did Affirm Holdings stock go up today?,2022-07-14 20:27:25,Seeking Alpha
ma,Mastercard expands Engage network to include open banking services,2022-07-14 15:03:01,Seeking Alpha
ma,"Players Leaving PGA Tour For LIV Golf 'Turned Their Back' On Sport, Tiger Woods Says Ahead Of British Open",2022-07-12 19:00:06,Benzinga
ma,SoFi Stock Will Reward Patient Investors,2022-07-08 15:13:40,InvestorPlace
ma,"This Analyst Lowers Price Targets On Visa, Mastercard, American Express; Here's The Biggest Price Target Changes For Wednesday",2022-07-06 13:47:51,Benzinga
ma,Crypto Regulation News: U.S. Government Sources Input From Crypto Bigwigs,2022-07-05 21:26:09,InvestorPlace
ma,"Mizuho Slashes Price Targets Of Mastercard, Visa Out Of Precaution - Read Why",2022-07-01 18:52:34,Benzinga
ma,What Companies Will Pay for Abortion Travel?,2022-07-01 16:34:01,InvestorPlace
ma,Where Mastercard Stands With Analysts,2022-06-30 20:11:46,Benzinga
ma,PayPal Unveils Cashback Business Credit Card For US Small Businesses,2022-06-28 13:25:22,RTTNews
ma,7 Top Stocks to Buy and Hold,2022-06-28 11:30:04,InvestorPlace
ma,7 Growth Stocks to Buy After the Market Crash,2022-06-28 10:32:07,InvestorPlace
ma,LUNA Crypto News: Anonymous Takes Aim at Do Kwon After Terra Collapse,2022-06-27 16:42:52,InvestorPlace
ma,7 Blue-Chip Stocks That Will Outlast Any Market Downturn,2022-06-22 11:03:13,InvestorPlace
ma,"Benzinga Before The Bell: Elon Musk Confirms Tesla Cutting Workforce, Kellogg Splitting In 3 Companies And Other Top Financial Stories Tuesday, June 21",2022-06-21 14:38:03,Benzinga
ma,Mastercard declares $0.49 dividend,2022-06-20 16:54:38,Seeking Alpha
ma,India's central bank allows Mastercard Asia Pacific to onboard new customers,2022-06-16 19:19:22,Seeking Alpha
ma,3 Stocks to Buy and Hold for Long-Term Profit Potential,2022-06-16 14:22:43,InvestorPlace
ma,CEO’s Confidence Isn’t What Affirm Stock Needs Now,2022-06-15 16:00:19,InvestorPlace
ma,Visa Stock Is Approaching Critical Buy Levels,2022-06-14 14:19:28,InvestorPlace
ma,7 Stocks to Jump on During Any Market Correction,2022-06-14 13:40:56,InvestorPlace
ma,7 High-Quality Large Cap Stocks to Buy at a Discount,2022-06-14 10:45:15,InvestorPlace
ma,Bill Gates Stocks: 7 Top Picks From the Gates Foundation Portfolio,2022-06-13 22:32:52,InvestorPlace
ma,"RBC Shares Its Insight On Fintechs, Apple Buy Now Pay Later, Ultimate Winners",2022-06-13 20:34:25,Benzinga
ma,"Top News In Fintech And Beyond For June 13, 2022",2022-06-12 18:06:44,Benzinga
ma,U.S. CEOs' 2021 compensation increased the most in seven years,2022-06-12 14:18:00,Seeking Alpha
ma,American Express adds crypto rewards credit card to its network - CoinDesk,2022-06-10 20:41:55,Seeking Alpha
ma,A Peek Into The Markets: US Stock Futures Mixed; Inflation Data In Focus,2022-06-10 11:16:02,Benzinga
ma,"Mastercard opens up its payment network to NFTs, web3",2022-06-09 20:44:05,Seeking Alpha
ma,Is a bank charter in the cards after Apple touts 'Pay Later' program?,2022-06-09 08:42:21,Seeking Alpha
ma,Is a bank charter in the cards after Apple touts 'Pay Later' program?,2022-06-09 08:42:21,Seeking Alpha
ma,Why This Wedbush Analyst Says PayPal Is A Better Payments Play Than Block,2022-06-08 22:25:18,Benzinga
ma,"Consumer spending remains strong as pendulum swings to services, Visa CFO says",2022-06-07 18:46:34,Seeking Alpha
ma,"Affirm (AFRM) Stock Slumps as Apple Enters the Buy Now, Pay Later Space",2022-06-07 13:37:11,InvestorPlace
ma,7 Cheap Growth Stocks That Won’t Stay That Way for Long,2022-06-06 11:00:51,InvestorPlace
ma,Mastercard exec says widespread digital asset adoption will eventually come to fruition,2022-05-25 13:44:25,Seeking Alpha
ma,"Paypal has Fallen, But Can it Get Up?",2022-05-25 10:05:38,InvestorPlace
ma,7 Blue-Chips Stocks to Buy at an All-Time Low,2022-05-24 22:22:26,InvestorPlace
ma,Wells Fargo Lists Its Picks In the Fintech Universe - See Which Stocks Made the Cut,2022-05-24 22:02:23,Benzinga
ma,Mastercard launches Cyber Front attack simulation and assessment platform,2022-05-24 14:52:05,Seeking Alpha
ma,Morgan Stanley names 15 stocks that can weather a bear market,2022-05-23 12:57:14,Seeking Alpha
ma,Citi screens for quality growth stocks in this pullback,2022-05-22 17:57:08,Seeking Alpha
ma,Mastercard and OPay ink strategic partnership for growing cashless ecosystem,2022-05-19 10:12:14,Seeking Alpha
ma,Sector Rotation And 9 Stocks To Watch During A Recession,2022-05-19 00:43:36,Benzinga
ma,"Visa, Mastercard, FIS get new Buy ratings as Goldman picks up on payments",2022-05-18 14:59:02,Seeking Alpha
ma,Affirm Stock Bottomed After March Quarter Numbers,2022-05-18 12:07:40,InvestorPlace
ma,Airbnb Stock Provides No Shelter In the Stock Market Storm,2022-05-17 20:20:13,InvestorPlace
ma,"Lone Pine Capital raises stakes in Square, adds Meta Platforms, exits Adobe, slashes MasterCard",2022-05-17 16:50:08,Seeking Alpha
ma,Citigroup (C) Stock Pops 7% After Warren Buffett Buys In,2022-05-17 15:11:40,InvestorPlace
ma,5 American Stocks To Buy To Bet On An Economic Rebound: From Amazon To Coca-Cola,2022-05-13 18:16:03,Benzinga
ma,The Top 10 Stocks Helping Warren Buffett Beat the Market,2022-05-11 22:26:59,InvestorPlace
ma,"Top News In Fintech And Beyond For May 9, 2022",2022-05-08 18:32:35,Benzinga
ma,4 Cheap Stocks Poised to Pop for Investors,2022-05-06 11:10:39,InvestorPlace
ma,Why Is SoFi (SOFI) Stock Heating Up Today?,2022-05-04 19:42:04,InvestorPlace
ma,Why Is SoundHound AI (SOUN) Stock Up 30% Today?,2022-05-02 14:54:32,InvestorPlace
ma,"Barron's Latest Picks And Pans: Twitter, Visa, Mastercard, Mohawk Industries, Robinhood And More",2022-04-30 23:19:20,Benzinga
ma,Here's How Analysts Responded To Mastercard's Q1,2022-04-29 21:16:15,Benzinga
ma,Nexo tokens reverse course after brief rally on Binance listing,2022-04-29 19:48:58,Seeking Alpha
ma,"Benzinga's Top Ratings Upgrades, Downgrades For April 29, 2022",2022-04-29 16:03:33,Benzinga
ma,NEXO Crypto Soars as Market Dives With Payment Card Launch and Binance Listing,2022-04-29 15:42:06,InvestorPlace
ma,10 Biggest Price Target Changes For Friday,2022-04-29 13:52:58,Benzinga
ma,Visa and Mastercard downgraded by Piper Sandler on Europe recession fears,2022-04-29 13:44:03,Seeking Alpha
ma,"Mastercard stock climbs after Q1 earnings, call shows 'overwhelming positives'",2022-04-28 17:59:08,Seeking Alpha
ma,"Mastercard Incorporated Q1 Profit Increases, beats estimates",2022-04-28 14:15:25,RTTNews
ma,Mastercard Q1 earnings beat as cross-border travel exceeds expectations,2022-04-28 13:06:14,Seeking Alpha
ma,"Mastercard Non-GAAP EPS of $2.76 beats by $0.60, revenue of $5.2B beats by $300M",2022-04-28 12:03:23,Seeking Alpha
ma,Notable earnings before Thursday's open,2022-04-27 15:25:48,Seeking Alpha
ma,Mastercard Q1 preview: Consumer spending tailwinds set to boost results,2022-04-27 15:07:32,Seeking Alpha
ma,MasterCard earnings: here's what Wall Street expects,2022-04-27 15:01:13,Markets Insider Automation
ma,Mobile payment ETF IPAY is in the green thanks to Visa & Mastercard,2022-04-27 14:18:32,Seeking Alpha
ma,"Visa, Mastercard Hike Merchant Processing Fees",2022-04-26 22:15:22,RTTNews
ma,"How Polygon Can Survive Ethereum’s Big Upgrade, “The Merge”",2022-04-25 20:21:03,InvestorPlace
ma,Mastercard launches next-generation identity technology with Microsoft to help more consumers shop online safely,2022-04-25 14:30:00,PR Newswire
ma,3 Blockchain Stocks to Buy Now,2022-04-25 10:00:11,InvestorPlace
ma,"Mastercard, Visa stand to benefit from real-time payment expansion: Deutsche Bank",2022-04-24 14:21:00,Seeking Alpha
ma,3 NFT Stocks That Reddit Investors Still Love,2022-04-24 10:53:01,InvestorPlace
ma,Fintech firm Stripe rolls out feature to let Twitter users get paid in stablecoin USDC,2022-04-22 13:54:02,Seeking Alpha
ma,What 5 Analyst Ratings Have To Say About Mastercard,2022-04-21 15:27:28,Benzinga
ma,NELO ENABLES BUY NOW PAY LATER FOR ALL ECOMMERCE STORES IN MEXICO,2022-04-20 17:00:00,PR Newswire
ma,NRF Urges Visa And Mastercard To Cancel Credit Card Swipe Fee Increases,2022-04-19 20:43:04,RTTNews
ma,Dogecoin Harbors Profit Opportunities for Investors and Traders Alike,2022-04-18 14:18:00,InvestorPlace
ma,"Read Barclays' Take On Visa, Mastercard, PayPal Amid Present Macro Environment",2022-04-14 18:11:30,Benzinga
ma,PayPal price target cut 12% at Truist on market share concerns,2022-04-14 13:12:23,Seeking Alpha
ma,"Nexo Teams Up With Mastercard, DiPocket To Launch World's First Cryptocurrency-backed Payment Card",2022-04-13 22:25:36,RTTNews
ma,SoFi Stock Has Great Potential Despite Lackluster Stamina,2022-04-13 16:32:14,InvestorPlace
ma,Mastercard partners with Nexo to launch cryptocurrency card in Europe,2022-04-13 12:25:42,Seeking Alpha
ma,Mastercard and Interos Launch Partnership to Address Fast-Changing Global Risk Landscape,2022-04-12 15:00:00,PR Newswire
ma,3 Tech Stocks to Buy That Are About to Bounce,2022-04-11 18:04:38,InvestorPlace
ma,This $600 Million Fund Just Bought Palantir (PLTR) Stock. Here’s Why.,2022-04-08 18:37:41,InvestorPlace
ma,Strike teams up with Shopify to facilitate Bitcoin payments,2022-04-08 15:38:42,Seeking Alpha
ma,"Visa, Mastercard may be challenged by banks' Zelle system in retail - WSJ",2022-04-06 19:38:30,Seeking Alpha
ma,Bank Stocks News: Why Zelle Could Be a Threat to Mastercard and Visa,2022-04-06 19:04:58,InvestorPlace
ma,3 Safe Long-Term Stocks to Ride Out the Volatility,2022-04-05 23:25:03,InvestorPlace
ma,Affirm Stock Is a Good Short-Term Buy,2022-04-05 22:15:26,InvestorPlace
ma,Mastercard closes on purchase of Dynamic Yield from McDonald's,2022-04-04 13:14:54,Seeking Alpha
ma,7 Blue-Chip Stocks to Buy for April 2022,2022-04-01 23:20:40,InvestorPlace
ma,7 Fintech Stocks Set to Rise from the Ashes After PayPal Plunge,2022-03-30 11:48:17,InvestorPlace
ma,Bread Financial and Victoria's Secret launch new co-brand Mastercard,2022-03-29 11:51:42,Seeking Alpha
ma,"Temenos, Mastercard team up to accelerate the adoption of request to pay",2022-03-29 07:12:18,Seeking Alpha
ma,Wells Fargo To Become Official Issuer For Bilt Mastercard,2022-03-28 15:28:34,RTTNews
ma,Beware of SoFi Technologies,2022-03-28 13:45:42,InvestorPlace
ma,Online payment gateway market estimated to grow at 14.8% CAGR: Valuates,2022-03-27 13:17:21,Seeking Alpha
ma,3 Russian Stocks That May Never Recover From the Recent Sanctions,2022-03-25 22:20:57,InvestorPlace
ma,"Top News In Fintech And Beyond For March 24, 2022",2022-03-23 22:55:42,Benzinga
ma,Coinbase Global 'unique' stock in crypto economy: MoffettNathanson's Ellis,2022-03-23 18:35:14,Seeking Alpha
ma,PayPal Stock Is Finally Showing Tangible Progress for Investors,2022-03-21 14:35:24,InvestorPlace
ma,PayPal allows customers to send money to Ukrainians,2022-03-17 19:41:57,Seeking Alpha
ma,"Top News In Fintech And Beyond For March 17, 2022",2022-03-16 23:58:00,Benzinga
ma,9 Best 401(k) Stocks To Buy Right Now,2022-03-16 19:58:34,Benzinga
ma,PayPal CEO Dan Shulman says cryptos will 'redefine the financial world' - CTech,2022-03-15 19:08:57,Seeking Alpha
ma,Aplazo Partners with Mastercard to Bring First-of-its-Kind BNPL Virtual Card to Latin America,2022-03-14 14:00:00,PR Newswire
ma,Affirm Stock Will Suffer From Profitability Woes for the Foreseeable Future,2022-03-14 10:30:58,InvestorPlace
ma,Cyclical Stocks: What Are Cyclical Stocks? List of Companies at Risk During a Recession.,2022-03-08 18:06:30,InvestorPlace
ma,"Visa, Mastercard set to boost credit card fee originally planned for last year - WSJ",2022-03-08 13:12:26,Seeking Alpha
ma,7 Best Long-Term Stocks to Buy for 2022,2022-03-08 12:50:17,InvestorPlace
ma,"Affirm, PayPal, Block stocks drop as oil price spike sparks recession fears",2022-03-07 17:50:28,Seeking Alpha
ma,Alliance Data Systems stock cut to Perform at Oppenheimer on NCO outlook,2022-03-07 16:14:00,Seeking Alpha
ma,Mastercard and Zeta partner for powering nex-gen credit processing for banks & fintechs,2022-03-07 15:18:23,Seeking Alpha
ma,"American Express exits Russia & Belarus after Visa, Mastercard",2022-03-07 08:30:38,Seeking Alpha
ma,"As If 'Kimchi Premium' Wasn't Enough, Russia's SWIFT Cancellation Leads To Eye-Popping 'Vodka Premium' For Bitcoin",2022-03-07 06:53:17,Benzinga
ma,Payment stock 'winners' come down to earth and other 2022 insights: Bernstein,2022-03-06 15:28:00,Seeking Alpha
ma,"Visa, Mastercard Suspend Operations In Russia",2022-03-06 07:29:31,RTTNews
ma,"Visa, Mastercard suspend operations in Russia due to invasion of Ukraine",2022-03-06 01:11:43,Seeking Alpha
ma,Latest On Russia-Ukraine War: Paypal Suspends Service In Russia; Ceasefire Violated,2022-03-05 15:33:31,Benzinga
ma,"Mastercard says 6% of revenues exposed to Russia, Ukraine",2022-03-02 17:39:42,Seeking Alpha
ma,"Visa, Mastercard Block Multiple Russian Financial Institutions Amid Russia-Ukraine Crisis",2022-03-01 20:57:24,RTTNews
ma,Which U.S. Companies Are Cutting Ties With Russia? See Latest List.,2022-03-01 15:59:53,InvestorPlace
ma,Corporate move to divest from Russia continues to escalate,2022-03-01 10:03:45,Seeking Alpha
ma,Bank of the West and Mastercard® Team Up to Help Small Businesses Open their Digital Doors™,2022-02-24 17:58:00,PR Newswire
ma,"Future FinTech subsidiary to partner with Mastercard for launch of e-money platform, debit card",2022-02-24 14:13:44,Seeking Alpha
ma,A Solana NFT Vending Machine Gives SOL Crypto Fans Unique Opportunity,2022-02-23 20:57:10,InvestorPlace
ma,Long-Term Altcoin Investors Should Look at Solana,2022-02-23 18:32:59,InvestorPlace
ma,7 New ETFs To Consider if You Want To Play Today’s Top Trends,2022-02-22 19:57:48,InvestorPlace
ma,Where Can I Spend My Bitcoin?,2022-02-21 22:17:33,Benzinga
ma,SoFi Stock Will Recover From the Tech Stock Correction,2022-02-18 17:32:11,InvestorPlace
ma,EXCLUSIVE: Bakkt CEO Gavin Michael Wants to Bring Crypto to the Mainstream,2022-02-17 18:28:43,InvestorPlace
ma,7 Stocks To Buy at the Bottom After the Market Rout,2022-02-17 17:20:35,InvestorPlace
ma,"Amazon, Visa resolve spat over credit card swipe fees",2022-02-17 08:38:14,Seeking Alpha
ma,Charlie Munger Blasts Crypto Despite Berkshire’s Big NU Stock Bet,2022-02-16 21:54:21,InvestorPlace
ma,"Despite Hitting New Lows, Coinbase Has a Promising Future",2022-02-16 13:41:29,InvestorPlace
ma,Western Union expands in South Korea through Travel Wallet app,2022-02-16 13:02:17,Seeking Alpha
ma,Nubank Stock Gets a Boost from $1B Warren Buffett Investment,2022-02-15 21:01:26,InvestorPlace
ma,7 Crypto Stocks That Can Create Value,2022-02-15 16:55:00,InvestorPlace
ma,"Mastercard adds crypto & digital currencies, open banking consulting  practices",2022-02-15 14:22:36,Seeking Alpha
ma,Expect a Big Tech Stock Rebound as Earnings Reignite Wall Street Spirits,2022-02-10 16:02:25,InvestorPlace
ma,Mastercard declares $0.49 dividend,2022-02-08 21:17:10,Seeking Alpha
ma,5 Best Digital Payments Stocks To Buy Right Now,2022-02-08 20:42:43,Benzinga
ma,10 Fintech Stocks To Own Until 2032 and Beyond,2022-02-08 18:41:35,InvestorPlace
ma,Apple unveils Tap to Pay for contactless shopping with iPhones,2022-02-08 15:28:23,Seeking Alpha
ma,"HELLO ALICE LAUNCHES THE YEAR OF SMALL BUSINESS,  A MOVEMENT IN PARTNERSHIP WITH NAACP, U.S. HISPANIC CHAMBER OF COMMERCE, GLOBAL ENTREPRENEURSHIP NETWORK, AND MASTERCARD®",2022-02-08 15:00:00,PR Newswire
ma,7 Stocks to Buy After January’s Wild Market Rout,2022-02-08 11:00:16,InvestorPlace
ma,Why Hyper-Growth in AI Will Lift Upstart,2022-02-07 17:52:43,InvestorPlace
ma,Mastercard Partnership Is the Icing on the Cake for Exela Technologies,2022-02-07 16:34:44,InvestorPlace
ma,What are NFTs? An Investor’s Guide to Investing in Non-Fungible Tokens,2022-02-03 20:50:07,InvestorPlace
ma,"PayPal stock slumps after 2022 guidance disappoints, customer strategy shift",2022-02-02 12:54:44,Seeking Alpha
ma,Will Coinbase and Rolling Stone NFTs Be the Real Winners of the Super Bowl?,2022-02-01 21:17:10,InvestorPlace
ma,Now is Your Chance to Buy Affirm at a Steep Discount,2022-02-01 19:38:31,InvestorPlace
ma,Executives Sell Over $10M Of 5 Stocks,2022-02-01 13:43:28,Benzinga
ma,Visa CEO Al Kelly: We will continue to lean into the crypto space,2022-01-28 20:14:33,Seeking Alpha
ma,Analyst Ratings For Mastercard,2022-01-28 20:02:27,Benzinga
ma,7 Technology Stocks Reporting Earnings the Week of January 31,2022-01-28 18:15:32,InvestorPlace
ma,10 Biggest Price Target Changes For Friday,2022-01-28 13:13:34,Benzinga
ma,"Mastercard Incorporated Q4 Profit Increases, beats estimates",2022-01-27 14:06:47,RTTNews
ma,Mastercard stock edges down as January data moderates from H2 2021,2022-01-27 14:01:42,Seeking Alpha
ma,"Mastercard Non-GAAP EPS of $2.35 beats by $0.14, revenue of $5.2B beats by $30M",2022-01-27 13:03:21,Seeking Alpha
ma,"A Peek Into The Markets: US Stock Futures Edge Higher Ahead Of Earnings, Economic Reports",2022-01-27 11:21:31,Benzinga
ma,Block: Jack Dorsey is Too Hip to Be Square,2022-01-26 21:04:32,InvestorPlace
ma,Payment gateways - Visa and Mastercard to report strong quarters on rising spending levels,2022-01-26 19:26:06,Seeking Alpha
ma,"Affirm launches SuperApp, browser extension to streamline consumer finances",2022-01-26 16:01:58,Seeking Alpha
ma,Notable earnings before Thursday's open,2022-01-26 15:59:27,Seeking Alpha
ma,MasterCard earnings: here's what to expect,2022-01-26 15:01:13,Markets Insider Automation
ma,"American Express climbs as travel spending improves, buoying  credit card stocks",2022-01-25 18:01:49,Seeking Alpha
ma,The 2 Best EV Startups in the Business,2022-01-24 21:46:15,InvestorPlace
ma,"Apollo Global, Athene and BNP Paribas form Eliant for supply chain finance needs",2022-01-24 13:24:43,Seeking Alpha
ma,Affirm Holdings raised to Equalweight at Stephens on GMV guidance optimism,2022-01-24 12:55:09,Seeking Alpha
ma,My Top 6 Surprises This Week,2022-01-21 21:42:47,InvestorPlace
ma,Mastercard launches virtual card solution for instant B2B payments,2022-01-20 15:16:01,Seeking Alpha
