Ticker,Title,Datetime,Source
acn,Mizuho Securities Reaffirms Their Buy Rating on Accenture (ACN),2025-01-15 09:36:34,TipRanks
acn,Analysts Conflicted on These Technology Names: Sanmina-Sci (SANM) and Accenture (ACN),2025-01-13 14:00:18,TipRanks
acn,Euro stocks can offer a lesson in high concentration for the U.S. – Goldman,2025-01-09 18:41:49,Seeking Alpha
acn,"Accenture acquires digital twin technology platform, terms undisclosed",2025-01-08 11:01:24,TipRanks
acn,Accenture upgraded to Outperform from Peer Perform at Wolfe Research,2025-01-08 10:10:34,TipRanks
acn,Accenture Positioned for Growth Amid Conservative Guidance and Market Opportunities: A Buy Recommendation,2025-01-08 09:56:05,TipRanks
acn,Accenture buys Singapore-based digital twin tech platform,2025-01-08 06:53:15,Seeking Alpha
acn,Accenture Unveils AI Refinery For Industry For Faster AI Agent Deployment,2025-01-07 08:03:06,RTTNews
acn,"KION, Accenture, NVIDIA Join To Design Efficient And Safe Warehouse Configuration",2025-01-07 07:12:32,RTTNews
acn,"Catalyst Watch: CES, M&A votes and the Supreme Court tackles the TikTok case",2025-01-03 20:00:09,Seeking Alpha
acn,Accenture: Balancing AI-Driven Growth with Macroeconomic Uncertainties,2024-12-25 12:55:10,TipRanks
acn,RBC Capital Reaffirms Their Buy Rating on Accenture (ACN),2024-12-23 15:55:06,TipRanks
acn,"Key deals for the week: Accenture, Berkshire Hills Bancorp, NXP Semiconductors and more",2024-12-21 19:36:00,Seeking Alpha
acn,14 out of 16 companies deliver EPS wins this week-Earnings Scorecard,2024-12-21 18:46:00,Seeking Alpha
acn,Jefferies Keeps Their Hold Rating on Accenture (ACN),2024-12-20 18:36:27,TipRanks
acn,Accenture (ACN) Receives a Buy from Barclays,2024-12-20 18:20:03,TipRanks
acn,Accenture’s Strong Financial Performance and Growth Prospects Earn a Buy Rating,2024-12-20 18:09:03,TipRanks
acn,Accenture’s Q1 FY2025 Triumph: Robust Revenue Growth and Generative AI Momentum Fuel ‘Buy’ Rating,2024-12-20 18:06:32,TipRanks
acn,Accenture price target raised to $425 from $390 at BMO Capital,2024-12-20 14:15:52,TipRanks
acn,Accenture price target raised to $385 from $355 at Jefferies,2024-12-20 13:20:33,TipRanks
acn,Accenture slips even as Mizuho ups price target after 'strong' Q1,2024-12-20 13:19:58,Seeking Alpha
acn,Accenture removed as bearish Fresh Pick at Baird,2024-12-20 13:16:13,TipRanks
acn,Accenture price target raised to $455 from $450 at UBS,2024-12-20 12:25:32,TipRanks
acn,Accenture Reports Strong Q1 Fiscal 2025 Results,2024-12-20 03:52:30,TipRanks
acn,Accenture price target raised to $430 from $420 at Goldman Sachs,2024-12-19 23:15:17,TipRanks
acn,Accenture price target raised to $390 from $375 at Stifel,2024-12-19 18:45:27,TipRanks
acn,Early notable gainers among liquid option names on December 19th,2024-12-19 14:55:19,TipRanks
acn,"Biggest stock movers Thursday: ACN, MU, MESO, and more",2024-12-19 14:41:28,Seeking Alpha
acn,Unusually active option classes on open December 19th,2024-12-19 14:40:16,TipRanks
acn,Morning Movers: Lamb Weston tanks after second quarter results and CEO change,2024-12-19 14:05:27,TipRanks
acn,"4 stocks to watch on Thursday: NKE, FDX and more",2024-12-19 13:58:00,Seeking Alpha
acn,Accenture Updates FY25 Business Outlook; Raises Revenue Guidance - Update,2024-12-19 13:22:57,RTTNews
acn,Accenture in charts: FQ1 reports Y/Y revenue growth across all Industry groups,2024-12-19 12:48:18,Seeking Alpha
acn,"Accenture rises after Q1 beat as AI bookings continue to grow, raises revenue outlook",2024-12-19 12:29:42,Seeking Alpha
acn,"Earnings Snapshot: Accenture reports mixed FQ1 results; initiates FQ2, raises FY revenue outlook",2024-12-19 12:04:25,Seeking Alpha
acn,"Earnings Snapshot: Accenture tops FQ1 estimates; initiates FQ2, raises FY revenue outlook",2024-12-19 12:04:25,Seeking Alpha
acn,Accenture cuts FY25 GAAP EPS view to $12.43-$12.79 from $12.55-$12.91,2024-12-19 11:45:52,TipRanks
acn,"Accenture sees Q2 revenue $16.2B-$16.8B, consensus $16.62B",2024-12-19 11:45:37,TipRanks
acn,Accenture backs FY25 operating cash flow view of $9.4B-$10.1B,2024-12-19 11:45:14,TipRanks
acn,Accenture declares $1.48 dividend,2024-12-19 11:44:41,Seeking Alpha
acn,"Accenture GAAP EPS of $3.59 beats by $0.20, revenue of $17.7B beats by $570M",2024-12-19 11:42:21,Seeking Alpha
acn,"Accenture reports Q1 GAAP EPS $3.59, consensus $3.42",2024-12-19 11:40:13,TipRanks
acn,Here's the major earnings before the open tomorrow,2024-12-18 23:00:47,Seeking Alpha
acn,Notable companies reporting before tomorrow’s open,2024-12-18 18:30:18,TipRanks
acn,Accenture Q1 earnings preview: Will the firm continue to ride the AI wave,2024-12-18 18:21:38,Seeking Alpha
acn,Accenture To Acquire IQT Group - Quick Facts,2024-12-18 11:49:29,RTTNews
acn,Accenture to acquire IQT,2024-12-18 10:42:51,Seeking Alpha
acn,"Accenture to acquire IQT Group, terms undisclosed",2024-12-18 10:35:25,TipRanks
acn,Accenture’s Hold Rating: Balancing Modest Revenue Growth with Foreign Exchange and Economic Challenges,2024-12-17 10:36:06,TipRanks
acn,Four out of six companies deliver EPS wins this week - Earnings Scorecard,2024-12-14 13:27:00,Seeking Alpha
acn,"Earnings week ahead: FDX, NKE, CCL, BB, ACN, MU, and more",2024-12-13 20:50:00,Seeking Alpha
acn,Accenture (ACN): New Buy Recommendation for This Technology Giant,2024-12-12 13:35:46,TipRanks
acn,Wall Street Analysts Are Bullish on Top Technology Picks,2024-12-12 11:50:07,TipRanks
acn,Accenture price target raised to $422 from $395 at Piper Sandler,2024-12-12 11:45:26,TipRanks
acn,"New Buy Rating for Accenture (ACN), the Technology Giant",2024-12-11 14:45:23,TipRanks
acn,Accenture’s Strategic Growth Outlook: Buy Rating Affirmed Despite FX Challenges,2024-12-09 06:15:20,TipRanks
acn,Accenture upgraded to Buy from Neutral at Goldman Sachs,2024-12-06 09:40:17,TipRanks
acn,Salesforce surges as Agentforce proves to be droids enterprises were looking for,2024-12-04 14:05:57,Seeking Alpha
acn,Accenture To Acquire AOX For Undisclosed Terms,2024-12-03 14:06:09,RTTNews
acn,"Accenture to acquire German software maker AOX, terms undisclosed",2024-12-03 12:36:21,TipRanks
acn,Accenture to acquire Germany-based AOX,2024-12-03 12:31:55,Seeking Alpha
acn,Accenture designated as a bearish Fesh Pick at Baird,2024-12-03 11:40:44,TipRanks
acn,"AWS plans to work more with Accenture, other consulting firms, BI reports",2024-12-03 11:16:14,TipRanks
acn,"Amazon plans to ramp up cloud work with Accenture and other consulting firms, according to internal document",2024-12-03 11:02:01,Business Insider
acn,"Analysts Offer Insights on Technology Companies: Accenture (ACN), Intel (INTC) and Zscaler (ZS)",2024-12-03 10:50:32,TipRanks
acn,"Accenture nominates Masahiko Uotani, Jennifer Nason to board of directors",2024-12-02 11:35:16,TipRanks
acn,‘Bunker’ and ‘Booster’ stocks in the U.S. – Which would perform better in a downturn vs. upturn?,2024-11-27 16:21:49,Seeking Alpha
acn,"Analysts Offer Insights on Technology Companies: Wix (WIX), Accenture (ACN) and Vertex (VERX)",2024-11-25 06:01:23,TipRanks
acn,"Accenture acquires Plano, Texas-based Award Solutions",2024-11-21 20:12:51,Seeking Alpha
acn,"Accenture acquires Award Solutions, terms not disclosed",2024-11-21 19:15:09,TipRanks
acn,"Accenture, ETS collaborate on end-to-end talent management solution",2024-11-18 10:30:16,TipRanks
acn,Accenture put volume heavy and directionally bearish,2024-11-14 16:55:44,TipRanks
acn,Accenture launches center for advanced AI in Kyoto,2024-11-14 10:55:35,TipRanks
acn,Accenture enters collaboration agreement with Kyoto University,2024-11-14 10:55:08,TipRanks
acn,Accenture acquires consulting and technology firm Allitix,2024-11-04 19:25:08,Seeking Alpha
acn,"Accenture acquires Allitix, terms not disclosed",2024-11-04 17:35:06,TipRanks
acn,Exane downgrades Accenture to Neutral on slower growth recovery,2024-10-30 16:51:02,TipRanks
acn,Accenture downgraded to Neutral from Outperform at Exane BNP Paribas,2024-10-30 13:11:59,TipRanks
acn,Accenture awarded $1.6B Air Force task order,2024-10-29 13:11:35,TipRanks
acn,Accenture Announces Strategic Investment In Reality Defender - Quick Facts,2024-10-22 14:44:21,RTTNews
acn,Accenture acquisition of Joshua Tree Group to help with gen AI: Baird,2024-10-16 20:37:34,Seeking Alpha
acn,Cautious Outlook on Accenture: Hold Rating Amid Modest Growth and Valuation Concerns,2024-10-16 12:35:37,TipRanks
acn,Accenture (ACN) Receives a Hold from Jefferies,2024-10-03 12:18:47,TipRanks
acn,"Accenture, Nvidia Form New Nvidia Business Group To Scale Enterprise AI Adoption",2024-10-02 14:46:25,RTTNews
acn,Accenture Hold Rating: Balancing AI Growth Potential with Macroeconomic Challenges,2024-10-01 17:07:37,TipRanks
acn,Accenture: Poised for Growth with Buy Rating Amid Sector Recovery and Strategic Positioning,2024-09-30 05:15:43,TipRanks
acn,5 out of 7 S&P 500 companies that reported earnings this week beat estimates - Earnings Scorecard,2024-09-28 17:46:00,Seeking Alpha
acn,Trending stocks this week as market reactions to Fed rate cut continue,2024-09-28 16:09:05,Seeking Alpha
acn,Accenture (ACN) Receives a Rating Update from a Top Analyst,2024-09-27 14:26:16,TipRanks
acn,"Accenture’s Buy Rating: A Blend of Strong Revenue Growth, Innovation, and Financial Health",2024-09-27 10:45:49,TipRanks
acn,"New Buy Rating for Accenture (ACN), the Technology Giant",2024-09-27 10:35:57,TipRanks
acn,Cautious Optimism on Accenture’s Outlook: Hold Rating Affirmed amidst Organic Growth and Stable Spending Environment,2024-09-27 10:07:45,TipRanks
acn,Accenture Poised for Growth: Stable Fundamentals and Strong Revenue Pipeline,2024-09-26 17:55:24,TipRanks
acn,"Piper Sandler upgrades Accenture after Q4 beat, robust Q1 outlook",2024-09-26 17:36:05,Seeking Alpha
acn,Buy Rating Affirmed for Accenture Amid Strong Q4 Performance and Solid Future Guidance,2024-09-26 15:15:20,TipRanks
acn,Accenture Guides FY25 In Line With Estimates; Boosts Dividend 15%; OKs $4 Bln Share Buyback - Update,2024-09-26 13:11:15,RTTNews
acn,"Accenture rises after Q4 beat amid AI wave, upbeat Q1 outlook",2024-09-26 11:52:20,Seeking Alpha
acn,"Earnings Snapshot: Accenture tops FQ4 estimates; initiates FY25 outlook, raises dividend",2024-09-26 11:07:45,Seeking Alpha
acn,"Accenture in charts: North America, EMEA revenue rise Y/Y, growth markets sees decline",2024-09-26 11:05:26,Seeking Alpha
acn,"Accenture raises dividend by 14.7% to $1.48, announces $4B buyback",2024-09-26 10:44:24,Seeking Alpha
acn,"Accenture Non-GAAP EPS of $2.79 beats by $0.02, revenue of $16.4B beats by $20M",2024-09-26 10:41:32,Seeking Alpha
acn,Here's the major earnings before the open tomorrow,2024-09-25 22:00:40,Seeking Alpha
acn,"Biggest stock movers Wednesday: GM, SAP, SFIX, RITM, and more",2024-09-25 13:54:52,Seeking Alpha
acn,"U.S. probing SAP, Carahsoft for potential price-fixing - Bloomberg",2024-09-25 07:57:47,Seeking Alpha
acn,AWS expands partnership with SLB to accelerate energy development,2024-09-23 15:37:59,Seeking Alpha
acn,"Seven S&P 500 stocks will provide earnings this week including COST, MU, AZO, and others",2024-09-23 14:16:52,Seeking Alpha
acn,Analysts Offer Insights on Technology Companies: Accenture (ACN) and TD SYNNEX Corporation (SNX),2024-09-23 13:30:16,TipRanks
acn,"Earnings week ahead: Micron, Costco, BlackBerry, Accenture and more",2024-09-22 12:02:00,Seeking Alpha
acn,"Catalyst Watch: Spotlight on Micron, Southwest Airlines, and FOMC speakers",2024-09-20 19:00:55,Seeking Alpha
acn,"New Buy Rating for Accenture (ACN), the Technology Giant",2024-09-20 11:26:51,TipRanks
acn,Assessing Accenture’s Growth Prospects: A Hold Rating Amid Strategic and Market Considerations,2024-09-20 10:18:19,TipRanks
acn,Accenture (ACN) Gets a Buy from Citi,2024-09-17 10:58:06,TipRanks
acn,Accenture In Deal With Indonesia's Indosat To Boost Sovereign AI Cloud Platform,2024-09-17 10:12:24,RTTNews
acn,"Chevron tops list of most shorted large-cap stocks in August, Hazeltree says",2024-09-13 10:04:28,Seeking Alpha
acn,Maintaining Hold on Accenture: Balancing Q4 Earnings Prospects with Caution on 2025 Outlook,2024-09-13 06:17:58,TipRanks
acn,Hold Rating on Accenture Amidst Stabilizing Demand and Valuation Concerns,2024-09-12 05:15:55,TipRanks
acn,Analysts Have Conflicting Sentiments on These Technology Companies: Accenture (ACN) and Apple (AAPL),2024-09-11 07:30:20,TipRanks
acn,Accenture: A Strong Buy Amid Solid Performance and Promising FY2025 Outlook,2024-09-10 10:27:58,TipRanks
acn,Accenture invests in EMTECH,2024-09-10 10:14:54,Seeking Alpha
acn,Accenture In Multi-year Partnership With Unilever To Simplify Digital Core And Apply Generative AI,2024-09-05 11:44:07,RTTNews
acn,Accenture’s Hold Rating by David Koning: Optimistic Projections vs. Marginal Gains and Leadership Transition,2024-08-30 06:56:24,TipRanks
acn,Accenture's deal to acquire consus.health will boost health strategy biz: Baird,2024-08-28 18:07:13,Seeking Alpha
acn,Accenture To Acquire German Healthcare Management Consultancy 'consus.health' For Undisclosed Terms,2024-08-27 09:01:55,RTTNews
acn,"Accenture to acquire consus.health, expanding healthcare consulting capabilities in Germany",2024-08-27 08:16:35,Seeking Alpha
acn,"Analysts Offer Insights on Technology Companies: Accenture (ACN), Toast Inc (TOST) and Fidelity National Info (FIS)",2024-08-07 05:43:02,TipRanks
acn,Accenture Acquires Boslan To Help Design Net-zero Infrastructure Projects Using AI,2024-08-02 13:41:23,RTTNews
acn,Accenture buys engineering firm Boslan,2024-08-02 11:06:17,Seeking Alpha
acn,3 Rapidly-Rebounding Tech Stocks to Buy on the Way Back Up,2024-08-01 18:08:57,InvestorPlace
acn,Hot Stocks: Top 3 Analyst Upgrades You Can’t Ignore in July,2024-07-26 17:49:13,InvestorPlace
acn,"Europe data centers to grow 6 times, €115B of capex by 2035 - MS",2024-07-24 15:46:32,Seeking Alpha
acn,Hold Rating on Accenture Amid Strategic Acquisition and Market Challenges,2024-07-24 06:27:03,TipRanks
acn,"JPMorgan, Mastercard, Accenture get order from FTC on surveillance pricing",2024-07-23 14:35:10,Seeking Alpha
acn,3 Growth Stocks to Bet On for Market-Crushing Returns,2024-07-23 10:30:00,InvestorPlace
acn,Accenture To Acquire Camelot Management Consultants - Quick Facts,2024-07-22 14:31:34,RTTNews
acn,Accenture to acquire management and technology consulting firm Camelot Management,2024-07-22 12:29:30,Seeking Alpha
acn,"Analysts Offer Insights on Technology Companies: Blackbaud (BLKB), Par Technology (PAR) and Accenture (ACN)",2024-07-22 00:01:28,TipRanks
acn,"Notable analyst calls this week: Shopify, CrowdStrike and Chegg among top picks",2024-07-20 18:31:00,Seeking Alpha
acn,Deep Dive Into Accenture Stock: Analyst Perspectives (20 Ratings),2024-07-19 18:01:10,Benzinga
acn,Accenture buys retail tech services firm,2024-07-16 12:24:28,Seeking Alpha
acn,"Analysts’ Opinions Are Mixed on These Technology Stocks: Grab (GRAB), Accenture (ACN) and International Business Machines (IBM)",2024-07-15 10:31:28,TipRanks
acn,Accenture Acquires Cientra For Undisclosed Terms,2024-07-10 14:07:21,RTTNews
acn,Accenture to boost silicon design capabilities with Cientra acquisition,2024-07-10 12:02:29,Seeking Alpha
acn,"Excelmax deal could boost Accenture sales, expand edge innovation: Baird",2024-07-09 17:54:54,Seeking Alpha
acn,Accenture acquires O&G service provider; marks second acquisition in two days,2024-07-09 16:49:23,Seeking Alpha
acn,Accenture Buys India-based Excelmax Technologies For Undisclosed Terms,2024-07-08 14:24:35,RTTNews
acn,Accenture buys Indian chip design services provider,2024-07-08 12:22:29,Seeking Alpha
acn,Accenture: Poised for Long-Term Growth Amidst Near-Term Economic Challenges,2024-06-26 14:56:54,TipRanks
acn,NVIDIA To Rally Around 19%? Here Are 10 Top Analyst Forecasts For Wednesday,2024-06-26 14:12:59,Benzinga
acn,You’ve Been Warned! 3 Blockchain Stocks to Buy Now or Regret Forever,2024-06-26 12:00:00,InvestorPlace
acn,Accenture Stock Downgraded to Equal-Weight Amid Slowed Growth and Cloud Revenue Deceleration,2024-06-26 08:55:54,TipRanks
acn,IPG in talks for sale of digital marketing agency R/GA to TCS - report,2024-06-26 08:06:55,Seeking Alpha
acn,Don't Overlook Accenture International Revenue Trends While Assessing the Stock,2024-06-24 21:24:27,Benzinga
acn,Beyond The Numbers: 17 Analysts Discuss Accenture Stock,2024-06-24 17:01:37,Benzinga
acn,3 Quantum Computing Stocks to Buy Now: June 2024,2024-06-24 10:00:00,InvestorPlace
acn,Maintaining a Hold: Balancing Accenture’s Strategic Acquisitions with Market Uncertainties,2024-06-24 06:05:34,TipRanks
acn,Most S&P names post earnings beat during Juneteenth week - Earnings Scorecard,2024-06-22 18:45:00,Seeking Alpha
acn,Analysts Offer Insights on Technology Companies: Accenture (ACN) and Palo Alto Networks (PANW),2024-06-22 04:20:33,TipRanks
acn,These Analysts Slash Their Forecasts On Accenture After Q3 Results,2024-06-21 20:21:51,Benzinga
acn,"Analysts Offer Insights on Technology Companies: Accenture (ACN), Shoals Technologies Group (SHLS) and Gen Digital (GEN)",2024-06-21 08:40:18,TipRanks
acn,Piper Sandler Remains a Hold on Accenture (ACN),2024-06-21 04:25:27,TipRanks
acn,Accenture (ACN) Gets a Hold from TD Cowen,2024-06-21 02:35:07,TipRanks
acn,"S&P 500, Nasdaq 100 Dip From Record Highs As Investors Take Chipmaker Profits; Energy Sector Rebounds, Yields Rise: What's Driving Markets Thursday?",2024-06-20 19:41:14,Benzinga
acn,Accenture’s Strong Quarterly Performance and Positive Outlook Affirm Buy Rating,2024-06-20 19:05:18,TipRanks
acn,"Globant, Cognizant Technology, others perk up on back of strong Accenture results",2024-06-20 18:00:20,Seeking Alpha
acn,"ACN Stock Earnings: Accenture Misses EPS, Misses Revenue for Q3 2024",2024-06-20 14:52:52,InvestorPlace
acn,Accenture Ltd. hosts conference call for investors,2024-06-20 14:45:00,Markets Insider Automation
acn,"Biggest stock movers today: NVDA, DJT, ACN, and more",2024-06-20 14:00:09,Seeking Alpha
acn,Accenture rises after revised revenue forecast for 2024 amid AI boost,2024-06-20 12:03:26,Seeking Alpha
acn,Accenture in charts: Revenue across industry groups and regions rise sequentially in Q3,2024-06-20 11:57:20,Seeking Alpha
acn,Accenture declares $1.29 dividend,2024-06-20 10:44:41,Seeking Alpha
acn,"Accenture Non-GAAP EPS of $3.13 misses by $0.02, revenue of $16.47B misses by $70M",2024-06-20 10:41:34,Seeking Alpha
acn,Notable earnings before Thursday's open,2024-06-19 18:11:11,Seeking Alpha
acn,Accenture Q3 2024 Earnings Preview,2024-06-19 17:57:36,Seeking Alpha
acn,Here's what Wall Street expects from Accenture's earnings,2024-06-19 15:01:13,Markets Insider Automation
acn,Accenture To Buy Italy's Fibermind For Undisclosed Terms,2024-06-19 12:06:48,RTTNews
acn,Accenture Gears Up For Q3 Print; These Most Accurate Analysts Revise Forecasts Ahead Of Earnings Call,2024-06-19 10:42:30,Benzinga
acn,Accenture plans to buy Fibermind - a network services player in Italy,2024-06-19 10:04:32,Seeking Alpha
acn,Nvidia To Rally Around 53%? Here Are 10 Top Analyst Forecasts For Tuesday,2024-06-18 15:44:28,Benzinga
acn,"Analysts Have Conflicting Sentiments on These Technology Companies: Accenture (ACN), Science Applications (SAIC) and Autodesk (ADSK)",2024-06-18 09:10:19,TipRanks
acn,Micron To Rally Around 31%? Here Are 10 Top Analyst Forecasts For Monday,2024-06-17 14:36:43,Benzinga
acn,"Analysts Conflicted on These Technology Names: Sportradar Group AG (SRAD), Accenture (ACN) and Asure (ASUR)",2024-06-17 14:13:14,TipRanks
acn,"Analysts Offer Insights on Technology Companies: Accenture (ACN), UiPath (PATH) and TTM Technologies (TTMI)",2024-06-17 10:54:29,TipRanks
acn,Accenture (ACN): New Buy Recommendation for This Technology Giant,2024-06-17 09:27:06,TipRanks
acn,"Earnings week ahead: Kroger, Accenture, Lennar, CarMax and more",2024-06-16 12:00:00,Seeking Alpha
acn,Tech had all the attention in this quiet earnings week - Earnings Scorecard,2024-06-15 18:45:00,Seeking Alpha
acn,Blue-Chip Jackpots: 3 Top-Notch Stocks at Bottom-Barrel Prices,2024-06-15 10:00:00,InvestorPlace
acn,Liberty Global's Acquisition to Aid Long-Term Growth,2024-06-14 19:45:36,Benzinga
acn,"Catalyst Watch: HP Enterprise event, Walmart+ Week, Pure Storage buzz, and triple-witching volatility",2024-06-14 19:00:00,Seeking Alpha
acn,3 AI Stocks to Buy That Are Actually Churning Out Revenue,2024-06-13 10:38:00,InvestorPlace
acn,Analysts Offer Insights on Technology Companies: NICE (NICE) and Accenture (ACN),2024-06-12 12:00:33,TipRanks
acn,Accenture (ACN): New Buy Recommendation for This Technology Giant,2024-06-12 07:46:26,TipRanks
acn,Accenture closes acquisition of the Brazilian creative agency SOKO,2024-06-11 19:10:55,Seeking Alpha
acn,Accenture (ACN) Receives a Hold from TD Cowen,2024-06-11 05:16:04,TipRanks
acn,Is Accenture a Buy as Wall Street Analysts Look Optimistic?,2024-06-06 21:31:46,Benzinga
acn,20 Analysts Assess Accenture: What You Need To Know,2024-06-05 20:01:08,Benzinga
acn,Keurig Dr Pepper To Rally Around 18%? Here Are 10 Top Analyst Forecasts For Wednesday,2024-06-05 14:40:49,Benzinga
acn,"Analysts Offer Insights on Technology Companies: Accenture (ACN), Intel (INTC) and Cisco Systems (CSCO)",2024-06-05 12:01:12,TipRanks
acn,Buy Rating Reaffirmed for Accenture Amidst Modest Guidance and Strong Market Position,2024-06-05 09:25:49,TipRanks
acn,The 3 Best AI System Integrator Stocks to Buy Now: May 2024,2024-06-03 10:54:00,InvestorPlace
acn,Double Delight- 3 Tech Stocks Delivering Dividends and Growth,2024-05-30 10:57:00,InvestorPlace
acn,Best Buy Likely To Report Lower Q1 Earnings; Here Are The Recent Forecast Changes From Wall Street's Most Accurate Analysts,2024-05-30 08:12:40,Benzinga
acn,Piper Sandler Keeps Their Hold Rating on Accenture (ACN),2024-05-28 11:06:16,TipRanks
acn,3 Fintech Stocks Poised to Profit from the Unbanked Revolution,2024-05-27 10:53:00,InvestorPlace
acn,Accenture (ACN) Gets a Buy from Guggenheim,2024-05-25 08:25:27,TipRanks
acn,Analysts Offer Insights on Technology Companies: Accenture (ACN) and Block (SQ),2024-05-24 12:31:09,TipRanks
acn,Maintaining Hold on Accenture Amid Market Volatility and Acquisition Impacts,2024-05-24 05:49:42,TipRanks
acn,3 Overlooked AI Stocks That Could Make You a Fortune,2024-05-23 10:45:00,InvestorPlace
acn,Accenture to acquire business management consultant Partners in Performance,2024-05-22 05:52:10,Seeking Alpha
acn,Accenture To Acquire Partners In Performance; Terms Undisclosed,2024-05-22 03:05:26,RTTNews
acn,3 Top Small-Cap Growth Opportunities in the AI Era,2024-05-17 11:00:00,InvestorPlace
acn,"Accenture strengthens AI, manufacturing capabilities in Japan with OpenStream buy",2024-05-17 09:00:47,Seeking Alpha
acn,Accenture To Acquire OPENSTREAM; Terms Undisclosed,2024-05-17 04:19:08,RTTNews
acn,Cognizant Technology gains on speculation of activist investor amid 13F filing,2024-05-16 14:21:56,Seeking Alpha
acn,Accenture Invests In Predictive Simulation Company Turbine,2024-05-16 13:02:06,RTTNews
acn,Balancing Growth Prospects and Economic Challenges: Hold Rating on Accenture,2024-05-16 11:26:00,TipRanks
acn,Key Takeaways From Accenture Analyst Ratings,2024-05-15 20:00:38,Benzinga
acn,This Accenture Analyst Is No Longer Bullish; Here Are Top 5 Downgrades For Today,2024-05-15 14:24:23,Benzinga
acn,Deutsche Bank downgrades Accenture to Hold,2024-05-15 13:17:15,Seeking Alpha
acn,AI Battle Ahead: Why Palantir Stock Faces a Tough Road in 2025,2024-05-15 10:55:00,InvestorPlace
acn,3 Dividend Achiever Stocks to Buy for Income and Growth,2024-05-06 19:45:55,InvestorPlace
acn,MSFT Analysis: Why Microsoft Stock Is a Must-Own for Investors in 2024,2024-05-04 10:34:00,InvestorPlace
acn,Accenture To Acquire Brazilian Creative Agency SOKO For Undisclosed Terms,2024-05-02 16:09:00,RTTNews
acn,Accenture To Acquire Parsionate - Quick Facts,2024-05-02 12:09:08,RTTNews
acn,Accenture strengthens AI capabilities in Europe with Parsionate buy,2024-05-02 10:31:59,Seeking Alpha
acn,"With rate cuts pushed out, Goldman looks at quality stocks",2024-04-28 19:24:54,Seeking Alpha
acn,"IBM's Moment Of Truth As Earnings Expected To Impress With Strong AI Influence, Analyst Says",2024-04-23 23:06:55,Benzinga
acn,"IBM Q1 earnings preview: Focus on consulting weakness, enterprise AI adoption",2024-04-23 15:42:31,Seeking Alpha
acn,Accenture acquires Unlimited,2024-04-10 14:32:22,Seeking Alpha
acn,Analysts Offer Insights on Technology Companies: Verisign (VRSN) and Accenture (ACN),2024-04-10 06:11:56,TipRanks
acn,Accenture Acquires Axis Corporate For Undisclosed Terms,2024-04-08 17:26:23,RTTNews
acn,"Accenture to acquire Japanese technology services provider, CLIMB",2024-04-08 09:20:25,Seeking Alpha
acn,Accenture To Acquire CLIMB; Terms Undisclosed,2024-04-08 04:29:25,RTTNews
acn,Accenture to acquire Italy based Intellera Consulting,2024-04-02 11:26:50,Seeking Alpha
acn,"Accenture, AutoZone And 2 Other Stocks Insiders Are Selling",2024-03-27 13:24:44,Benzinga
acn,"Analysts Offer Insights on Technology Companies: Advanced Micro Devices (AMD), Accenture (ACN) and Roper Technologies (ROP)",2024-03-25 07:32:56,TipRanks
acn,These Analysts Revise Their Forecasts On Accenture After Q2 Results,2024-03-22 20:07:12,Benzinga
acn,Accenture To Gain From Strong GenAI Project Acceleration Despite Decline In Demand For Smaller Projects: Analyst,2024-03-22 19:39:09,Benzinga
acn,Seven S&P 500 names beat on EPS this week; Micron gets Street cred for its AI prospects - Earnings Scorecard,2024-03-22 18:12:31,Seeking Alpha
acn,Analysts Offer Insights on Technology Companies: Palo Alto Networks (PANW) and Accenture (ACN),2024-03-22 11:40:08,TipRanks
acn,"Analysts Offer Insights on Technology Companies: Braze (BRZE), Accenture (ACN) and Apple (AAPL)",2024-03-22 10:42:09,TipRanks
acn,Accenture (ACN): New Buy Recommendation for This Technology Giant,2024-03-22 10:37:48,TipRanks
