Ticker,Title,Datetime,Source
tsm,Silicon Selections: 3 “Strong Buy” Semiconductor Stocks to Watch,2023-04-20 01:09:08,TipRanks
tsm,"Taiwan Semiconductor Q1 2023 earnings on deck, what to expect",2023-04-19 19:22:01,Seeking Alpha
tsm,"Meta Prepares For Further Job Cuts, Google To Allow Developers To Use Alternative Payment Options, Intel Ditches Production Of Bitcoin Mining Chip: Today's Top Stories",2023-04-19 15:34:38,Benzinga
tsm,Taiwan Semiconductor Manufacturing is about to announce earnings — here's what Wall Street expects,2023-04-19 15:01:13,Markets Insider Automation
tsm,7 Dividend Stocks to Sell Before They Face Regulatory Risks,2023-04-18 10:45:14,InvestorPlace
tsm,Looking for Growth? Start With These 3 Chip Stocks,2023-04-17 22:48:45,InvestorPlace
tsm,"Benzinga's Top Ratings Upgrades, Downgrades For April 17, 2023",2023-04-17 17:00:44,Benzinga
tsm,Buckle Up. INTC Stock Still Faces a Rocky Road Ahead,2023-04-16 15:30:33,InvestorPlace
tsm,"Earnings Week Ahead: Tesla, AT&T, Charles Schwab, Netflix, and more",2023-04-14 18:30:56,Seeking Alpha
tsm,"Catalyst Watch: Earnings season picks up steam, housing data due",2023-04-14 17:30:11,Seeking Alpha
tsm,Chip Companies Continue to Dominate – This One is My Favorite,2023-04-13 20:32:16,InvestorPlace
tsm,The 3 Most Promising Quantum Computing Stocks to Buy in April,2023-04-13 13:39:34,InvestorPlace
tsm,3 Chip Stocks Primed to Rise From the Ashes,2023-04-13 11:45:44,InvestorPlace
tsm,"New Buy Rating for Taiwan Semi (TSM), the Technology Giant",2023-04-11 10:35:11,TipRanks
tsm,Micron surge leads chip stocks higher even as PC sales data highlights concerns,2023-04-10 16:14:57,Seeking Alpha
tsm,"Why Are Chip Stocks MU, TSM, NVDA On the Move Today?",2023-04-10 12:57:27,InvestorPlace
tsm,TSMC March Revenue Down 15.4% YoY - Quick Facts,2023-04-10 12:35:29,RTTNews
tsm,"Catalyst Watch: Eyes on inflation data, big bank earnings",2023-04-07 18:15:29,Seeking Alpha
tsm,NVDA Stock Alert: Can Google Outpace Nvidia in the AI Chip Race?,2023-04-05 19:55:49,InvestorPlace
tsm,Why It’s Buyer Beware When It Comes to AI Mania and NVDA Stock,2023-04-04 10:30:35,InvestorPlace
tsm,7 Growth Stocks That Are Poised to Boom in 2024,2023-03-30 18:34:28,InvestorPlace
tsm,7 Top Momentum Stocks to Ride the Bullish Trend,2023-03-30 14:17:14,InvestorPlace
tsm,Are US Sanctions On China Working? China Tech ETFs Paint A Picture,2023-03-29 01:55:35,Benzinga
tsm,3 AI Stocks to Buy Sitting in the Sweet Spot,2023-03-23 10:45:19,InvestorPlace
tsm,"Nvidia, AMD stocks lead semiconductors higher as sector sinks after Fed decision",2023-03-22 20:09:04,Seeking Alpha
tsm,7 Best Stocks to Buy After the Market Crashes,2023-03-21 19:43:41,InvestorPlace
tsm,7 Emerging Markets Stocks to Buy for Global Growth,2023-03-21 17:23:56,InvestorPlace
tsm,3 Semiconductor Stocks to Watch as the Chip Shortage Continues,2023-03-21 15:52:15,InvestorPlace
tsm,7 Growth Stocks That Will Deliver Double-Digit Returns in 2023,2023-03-20 18:35:20,InvestorPlace
tsm,"Analysts Are Bullish on These Technology Stocks: Taiwan Semi (TSM), T Mobile US (TMUS)",2023-03-17 09:20:35,TipRanks
tsm,Taiwan Semiconductor goes ex-dividend tomorrow,2023-03-15 18:23:29,Seeking Alpha
tsm,Analysts Offer Insights on Technology Companies: Taiwan Semi (TSM) and Gitlab (GTLB),2023-03-14 10:20:24,TipRanks
tsm,7 Blockchain Stocks Destined to Disrupt Traditional Industries,2023-03-13 21:48:23,InvestorPlace
tsm,"Analysts Offer Insights on Technology Companies: Activision Blizzard (ATVI), Taiwan Semi (TSM) and Coursera (COUR)",2023-03-10 16:30:23,TipRanks
tsm,Why Is BYND Cannasoft (BCAN) Stock Up 10% Today?,2023-03-09 16:40:39,InvestorPlace
tsm,CS Stock Alert: Why Credit Suisse Just Delayed Its Annual Report,2023-03-09 16:07:42,InvestorPlace
tsm,TSM Stock Price Prediction: The Case for Taiwan Semiconductor Hitting $115,2023-03-09 15:45:17,InvestorPlace
tsm,Taiwan Semi (TSM): New Buy Recommendation for This Technology Giant,2023-03-09 10:45:13,TipRanks
tsm,"Intel Business Model 'Structurally Misaligned With Industry Direction,' Analyst Says",2023-03-06 16:52:36,Benzinga
tsm,3 Blue-Chip Stocks to Buy for High Returns,2023-03-02 17:56:24,InvestorPlace
tsm,NVDA Stock Alert: Why Is Nvidia Down Today?,2023-03-01 20:19:18,InvestorPlace
tsm,What Is the Best Semiconductor Stock to Buy Now? Our 3 Top Picks.,2023-03-01 15:48:10,InvestorPlace
tsm,Could the Chips Act be a Game Changer for These 3 Stocks?,2023-03-01 10:08:30,TipRanks
tsm,What Is the Best Tech Stock to Buy Now? Our 7 Top Picks.,2023-02-28 20:49:42,InvestorPlace
tsm,7 Cash-Rich Companies to Invest in During Economic Uncertainty,2023-02-26 19:12:53,InvestorPlace
tsm,3 Reasonably-Valued Tech Stocks That Analysts Love,2023-02-24 00:56:45,TipRanks
tsm,Chip-focused ETFs surge along with Nvidia's earnings-fueled rally,2023-02-23 18:45:27,Seeking Alpha
tsm,Why Are Chip Stocks Up Today?,2023-02-23 16:21:50,InvestorPlace
tsm,Intel and 9 Other Companies With Dividend Cuts in 2023,2023-02-22 20:28:08,InvestorPlace
tsm,Intel dips on dividend cut as chip sector awaits Nvidia earnings,2023-02-22 19:53:24,Seeking Alpha
tsm,The 3 Best Growth Stocks to Invest in for the Long Haul,2023-02-22 18:37:20,InvestorPlace
tsm,7 Dangerous Dividend Stocks to Avoid,2023-02-21 11:30:04,InvestorPlace
tsm,Is Warren Buffett Giving Up on Taiwan Semiconductor (TSM) Stock?,2023-02-15 20:24:22,InvestorPlace
tsm,Why Sabre Are Trading Lower By 19%? Here Are Other Stocks Moving In Wednesday's Mid-Day Session,2023-02-15 20:04:30,Benzinga
tsm,"Taiwan Semiconductor Manufacturing, Devon Energy, Barclays among premarket losers' pack",2023-02-15 13:44:38,Seeking Alpha
tsm,Buffett’s Berkshire Adds AAPL; Cuts Holdings in USB and TSM,2023-02-15 12:03:20,TipRanks
tsm,"Barclays, Devon Energy And Other Big Stocks Moving Lower In Wednesday's Pre-Market Session",2023-02-15 11:59:29,Benzinga
tsm,3 Stocks Everyone Loves,2023-02-15 07:00:55,TipRanks
tsm,"Tesla, Upstart, Airbnb,  Nu Holdings, Taiwan Semiconductor: Why These 5 Stocks Are Drawing Investors' Attention Today",2023-02-15 02:07:27,Benzinga
tsm,"3G Capital adds Nvidia in Q4; exits Microsoft, JD.com",2023-02-14 22:35:38,Seeking Alpha
tsm,"Berkshire Hathaway adds to Apple stake, pares US Bancorp, BNY Mellon stakes",2023-02-14 22:09:51,Seeking Alpha
tsm,"Tiger Global adds ZoomInfo, TakeTwo, Grab Holdings, exits Li Auto, DoorDash",2023-02-14 19:13:31,Seeking Alpha
tsm,The 7 Best Beaten-Down Warren Buffett Stocks to Buy,2023-02-08 23:35:53,InvestorPlace
tsm,Why did Nvidia shares climb 5% Tuesday? Chips rally with Microsoft's AI plans,2023-02-07 21:45:10,Seeking Alpha
tsm,The 3 Most Undervalued Growth Stocks for Your February Buy List,2023-02-06 11:15:04,InvestorPlace
tsm,The 3 Most Undervalued Semiconductor Stocks to Buy in February 2023,2023-02-05 21:25:20,InvestorPlace
tsm,The 3 Most Promising Quantum Computing Stocks to Buy in February,2023-02-03 13:54:05,InvestorPlace
tsm,The 5 Most Undervalued Tech Stocks for Your February Buy List,2023-02-02 20:17:28,InvestorPlace
tsm,7 Sorry Semiconductor Stocks to Sell in February Before It’s Too Late,2023-02-02 00:07:16,InvestorPlace
tsm,"Up 26% YTD, Taiwan Semiconductor Stock (NYSE:TSM) Could Head Even Higher",2023-02-01 02:00:53,TipRanks
tsm,"Samsung says 2023 chip spending will be 'similar' to 2022, pressures sector",2023-01-31 12:38:01,Seeking Alpha
tsm,Should You Buy Taiwan Semiconductor Stock (NYSE:TSM) after Its 52% Rally?,2023-01-30 00:38:52,TipRanks
tsm,3 Tech Stocks That Will Be Big Winners in 2023,2023-01-29 20:19:49,InvestorPlace
tsm,Semiconductors largely buck Intel weakness as earnings kicks into high gear,2023-01-27 18:59:31,Seeking Alpha
tsm,Japan and the Netherlands set to join U.S. in chip war against China,2023-01-27 09:13:10,Seeking Alpha
tsm,25 Tech Stocks to Sell Before They Die,2023-01-26 19:47:17,InvestorPlace
tsm,7 Cream-of-the-Crop Stocks to Buy Today,2023-01-25 22:00:18,InvestorPlace
tsm,Dogs of the Dow 2023: 5 Dividend Stocks for Income Investors,2023-01-24 20:53:48,InvestorPlace
tsm,ADRs are outperforming; here are MKM's favorites,2023-01-23 19:38:55,Seeking Alpha
tsm,Cramer Says This Company Is In A 'Business That Is In A Serious Recession Right Now',2023-01-16 15:41:35,Benzinga
tsm,iPhone's Long-Term Prospects Intact But Here's Why Analyst Still Expects Apple To Give Soft Outlook On Feb. 2,2023-01-13 07:00:14,Benzinga
tsm,"Dow, S&P 500, Nasdaq score modest gains as CPI report fuels Fed hopes",2023-01-12 21:10:40,Seeking Alpha
tsm,Why did Taiwan Semiconductor stock go up today? Spending cut soothes nerves,2023-01-12 21:04:21,Seeking Alpha
tsm,"Dow, S&P, Nasdaq head for higher finish after CPI data; eyes now on bank earnings",2023-01-12 20:29:23,Seeking Alpha
tsm,Why KNOT Offshore Partners Shares Are Trading Lower By Around 38%? Here Are Other Stocks Moving In Thursday's Mid-Day Session,2023-01-12 19:19:25,Benzinga
tsm,"TSMC, CommScope Holding And Other Big Stocks Moving Higher On Thursday",2023-01-12 17:59:08,Benzinga
tsm,"Taiwan Semiconductor jumps after mixed Q4, but confirms it will cut 2023 spending",2023-01-12 15:21:33,Seeking Alpha
tsm,Taiwan Semi (TSM): New Buy Recommendation for This Technology Giant,2023-01-12 11:25:09,TipRanks
tsm,"For Cues On Apple's Upcoming Q1 Results, Watch This Key Supplier's Earnings Print Tonight, Says Munster",2023-01-12 07:14:31,Benzinga
tsm,"Taiwan Semiconductor GAAP EPS of $1.82 beats by $0.05, revenue of $19.93B misses by $990M",2023-01-12 05:32:22,Seeking Alpha
tsm,Taiwan Semiconductor (NYSE:TSM): This Warren Buffett Stock Makes Perfect Sense,2023-01-12 01:57:42,TipRanks
tsm,All eyes on 2023 guidance as Taiwan Semiconductor gets set for Q4 results,2023-01-11 17:42:44,Seeking Alpha
tsm,The 7 Best Mutual Funds for Your 401k,2023-01-10 20:05:31,InvestorPlace
tsm,"Apple, Microsoft And Other Information Technology Stocks From Benzinga's Most Accurate Analysts",2023-01-10 17:05:55,Benzinga
tsm,"2 Berkshire Hathaway Tech Stocks Worth Buying, According to Analysts",2023-01-09 18:53:04,TipRanks
tsm,"Taiwan Semiconductor Is Top Pick For 2023, Revenue Likely To Grow 30% In FY24, Analyst Says",2023-01-09 18:46:31,Benzinga
tsm,"Nvidia, AMD surge as chip stocks continue run to start 2023",2023-01-09 18:12:31,Seeking Alpha
tsm,"US Stocks Look Set To Carry Last Week's Momentum Forward On Monday — Focus Now On Inflation Data, Q4 Reporting Season",2023-01-09 12:14:41,Benzinga
tsm,"Analysts Are Bullish on These Technology Stocks: Taiwan Semi (TSM), Gitlab (GTLB)",2023-01-09 11:10:40,TipRanks
tsm,Big Banks To Kick Off Q4 Earnings Season Amid Expectations For First S&P 500 Profit Decline In More Than 2 Years,2023-01-08 23:00:11,Benzinga
tsm,"Earnings week ahead: JP Morgan, Delta Air Lines, KB Home and more",2023-01-06 17:43:06,Seeking Alpha
tsm,7 Cheap Tech Stocks to Buy Before the Next Breakout,2023-01-05 23:25:43,InvestorPlace
tsm,Qualcomm leads chip rebound as semi stocks see broad based gains,2023-01-04 17:01:53,Seeking Alpha
tsm,Leading Contract Chipmaker TSMC Fails To Impress Analysts,2023-01-04 14:13:39,Benzinga
tsm,China will respond to COVID travel restrictions; pausing key subsidies,2023-01-04 08:48:51,Seeking Alpha
tsm,TipRanks ‘Perfect 10’ List: These Semiconductor Stocks Tick All the Boxes,2023-01-01 14:32:50,TipRanks
tsm,"Just how much market cap did Apple, Meta and the biggest tech companies lose in 2022?",2022-12-31 20:00:00,Seeking Alpha
tsm,TSMC Announces 3nm Volume Capacity Expansion,2022-12-29 13:30:26,RTTNews
tsm,US Stocks Poised For Higher Open But Analyst Says 'Exhausted' Market Looking To End 2022 Without 'Further Meaningful Losses',2022-12-29 12:13:29,Benzinga
tsm,3 Seriously Undervalued Semiconductor Stocks to Buy Now,2022-12-29 12:00:18,InvestorPlace
tsm,Apple Supplier TSMC To Start Production Of 3nm Chips Soon: Reports,2022-12-27 19:23:24,RTTNews
tsm,7 of the Best Meme Stocks to Double Down on in 2023,2022-12-25 14:30:09,InvestorPlace
tsm,7 Undervalued Reddit Stocks to Buy Now,2022-12-20 20:53:17,InvestorPlace
tsm,The 7 Best Tech Stocks to Buy Now,2022-12-20 02:30:36,InvestorPlace
tsm,Taiwan Semiconductor goes ex-dividend tomorrow,2022-12-14 15:17:35,Seeking Alpha
tsm,The 7 Hottest Tech Stocks to Own for 2023 and Beyond,2022-12-13 17:34:12,InvestorPlace
tsm,Taiwan Semiconductor (NYSE:TSM): One of the Best Bets in Tech,2022-12-12 15:17:11,TipRanks
tsm,Why This Apple Analyst Sees Upside To iPhone Shipments In The Coming Months,2022-12-11 21:50:04,Benzinga
tsm,Tech Roundup: Chips and Chinese techs are in the sun,2022-12-10 17:00:00,Seeking Alpha
tsm,Taiwan chipmaker Taiwan Semiconductor says November sales up 50% Y/Y,2022-12-09 09:34:16,Seeking Alpha
tsm,7 Stocks Ready for the 2023 Fireworks,2022-12-07 21:44:16,InvestorPlace
tsm,10 Things to Know About the Hertz Rental Car Lawsuit,2022-12-07 17:40:58,InvestorPlace
tsm,Fusion Fuel (HTOO) Stock Is Up 11% on HUGE Deal News,2022-12-07 17:12:09,InvestorPlace
tsm,TSM Stock Alert: What to Know as Taiwan Semiconductor Triples Investment in Arizona Factory,2022-12-07 16:52:36,InvestorPlace
tsm,"Semiconductors mixed even as Mobileye jumps on strong Q3, guidance",2022-12-07 16:01:18,Seeking Alpha
tsm,Apple To Use US-made Microchips From TSMC's New Arizona Factory,2022-12-07 10:13:38,RTTNews
tsm,Our 7 Top Tech Stock Picks for 2023,2022-12-06 23:40:26,InvestorPlace
tsm,Intel Beware: A Chipmaker's New Product Launch Could Steak Market Share Across The Industry,2022-12-06 21:10:27,Benzinga
tsm,"Dear GE Stock Fans, Mark Your Calendars for Dec. 8",2022-12-06 17:24:36,InvestorPlace
tsm,President Biden Is Bringing Taiwan Semi (TSM) Stock a HUGE Catalyst,2022-12-06 16:54:53,InvestorPlace
tsm,"Apple, Nvidia CEOs to join President Biden at Taiwan Semi chip plant in Arizona",2022-12-06 15:43:46,Seeking Alpha
tsm,7 Tech Stocks to Take Seriously in 2023,2022-12-02 11:59:30,InvestorPlace
tsm,Looking for Bargains? These 3 Pummeled Stocks are “Strong Buys”,2022-12-01 19:42:05,TipRanks
tsm,3 Semiconductor Stocks to Buy for the Holiday Tech Rush,2022-11-30 16:30:05,InvestorPlace
tsm,3 Well-Positioned Stocks that the Big Money Is Buying,2022-11-29 23:06:44,InvestorPlace
tsm,Are TSMC’s (NYSE:TSM) Investors Worried Only About China’s Unrest?,2022-11-29 12:12:15,TipRanks
tsm,Warren Buffett Buys Taiwan Semiconductor Stock (NYSE:TSM). Should You?,2022-11-24 04:00:45,TipRanks
tsm,7 Index Funds to Buy to Retire a Millionaire,2022-11-23 23:01:23,InvestorPlace
tsm,"Bob Iger Returns To Disney, Tesla To Face Safety Trial In Seoul, FTX Owes 50 Biggest Creditors $3B: Top Stories Monday, Nov. 21",2022-11-21 14:45:47,Benzinga
tsm,The 25 Best Stocks to Buy for Retirement,2022-11-19 20:54:10,InvestorPlace
tsm,Are These 2 New Warren Buffett Stocks Really Worth Buying? Here’s What Analysts Are Saying,2022-11-17 00:50:00,TipRanks
tsm,7 Meme Stocks That Are Actually Worth Betting On,2022-11-16 23:45:00,InvestorPlace
tsm,Why Fast Radius Shares Plunged Around 48%; Here Are 103 Biggest Movers From Yesterday,2022-11-16 11:01:25,Benzinga
tsm,"Sea, UiPath, J&J Snack Foods And Other Big Gainers From Tuesday",2022-11-16 08:33:09,Benzinga
tsm,Why Opiant Pharmaceuticals Shares Are Trading Higher By 115%? Here Are 67 Stocks Moving In Tuesday's Mid-Day Session,2022-11-15 19:15:29,Benzinga
tsm,Warren Buffett's big Taiwan Semiconductor buy spurs rally in chip names,2022-11-15 18:00:59,Seeking Alpha
tsm,Corsair Gaming (CRSR) Stock Sinks After Public Offering Announcement,2022-11-15 16:06:25,InvestorPlace
tsm,Warren Buffett Just Bet $4 Billion on Taiwan Semi (TSM) Stock. Why?,2022-11-15 15:31:45,InvestorPlace
tsm,"Pre-market Movers: AZTA, PEGY, POWW, PRI, SHLS…",2022-11-15 13:34:20,RTTNews
tsm,"HUYA, Tencent Music Entertainment, Taiwan Semiconductor Manufacturing, And Some Other Big Stocks Moving Higher In Today's Pre-Market Session",2022-11-15 12:29:04,Benzinga
tsm,What Stocks did Buffett’s Berkshire Add in its $9B Q3 Shopping Bag?,2022-11-15 08:27:37,TipRanks
tsm,"Buffett's Berkshire Hathaway takes new stakes in TSM, LPX and Jefferies",2022-11-14 21:50:26,Seeking Alpha
tsm,"While TSMC's Moat Remains Unparallel, It Would Be Premature To Count Out Samsung, Analyst Says",2022-11-14 21:24:11,Benzinga
tsm,"Tiger Global takes stakes in HubSpot, PayPal in Q3, exits XPeng, Samsara",2022-11-14 20:38:44,Seeking Alpha
tsm,7 Game-Changing Tech Stocks to Buy to Retire a Millionaire,2022-11-12 17:26:57,InvestorPlace
tsm,This Nvidia Analyst Is Reducing Estimates Ahead Of Q3 Earnings: What You Need To Know,2022-11-11 21:34:22,Benzinga
tsm,"Why Are Chip Stocks AMD, NVDA, INTC, MRVL in the Spotlight Today?",2022-11-11 14:27:11,InvestorPlace
tsm,Taiwan Semiconductor surges as foundry giant says October sales rise 56%; chip stocks rise,2022-11-10 15:21:00,Seeking Alpha
tsm,"Semiconductor stocks fall with Nvidia, AMD leading decline as Intel unveils new Xeon chips",2022-11-09 20:08:46,Seeking Alpha
tsm,"GlobalFoundries surges on strong Q3, outlook; other chip names follow",2022-11-08 14:35:17,Seeking Alpha
tsm,"Politician’s Picks: Senior Delaware Senator Favors CVS, ABT, TSM Stocks",2022-11-06 11:53:00,TipRanks
tsm,3 Quantum Computing Stocks That Can Make You a Millionaire by 2025,2022-11-05 16:34:58,InvestorPlace
tsm,Dump These 10 Stocks Immediately,2022-11-05 13:00:23,InvestorPlace
tsm,7 Tech Stocks to Buy Before the Market Blasts Higher in 2023,2022-11-04 16:26:53,InvestorPlace
tsm,7 Tech Stocks Set to Soar From 52-Week Lows,2022-11-03 17:51:21,InvestorPlace
tsm,Cramer's Take On This Stock That's Down 53% Year-To-Date: 'I Think Long-Term. I Don't Want To Own It',2022-11-03 13:06:27,Benzinga
tsm,Why Taiwan Semiconductor Stock (NYSE:TSM) is Worth Considering,2022-10-26 00:30:55,TipRanks
tsm,Intel's Mobileye self-driving unit expected to go public this week: what to know,2022-10-25 11:00:00,Seeking Alpha
tsm,Why Is Li Auto (LI) Stock Down 19% Today?,2022-10-24 17:36:35,InvestorPlace
tsm,Why Is Xpeng (XPEV) Stock Down 13% Today?,2022-10-24 17:24:03,InvestorPlace
tsm,A Major Squeeze Is Brewing in PaxMedica (PXMD) Stock,2022-10-24 16:47:35,InvestorPlace
tsm,BYND Stock Alert: What to Know as Beyond Meat Launches Plant-Based Steak Product,2022-10-24 16:03:35,InvestorPlace
tsm,What Is Going on With Taiwan Semiconductor (TSM) Stock Today?,2022-10-24 15:49:54,InvestorPlace
tsm,"With Intel Q3 earnings on tap, semiconductors end week sharply higher",2022-10-21 20:04:50,Seeking Alpha
tsm,Semiconductor Stocks Lag On Export Uncertainty As Investors Await China's Response,2022-10-21 19:44:37,Benzinga
tsm,TSM Stock News: Taiwan Semiconductor Considers Japan Expansion,2022-10-21 17:30:48,InvestorPlace
tsm,"Earnings week ahead: Apple, Alphabet, Amazon, Meta, Boeing and more",2022-10-21 17:16:55,Seeking Alpha
tsm,7 Semiconductor Stock Predictions for 2023,2022-10-19 20:42:16,InvestorPlace
tsm,Chips mostly lower as yields rise; ASML guidance buoys semiconductor equipment stocks,2022-10-19 17:39:47,Seeking Alpha
tsm,7 Semiconductor Stocks to Buy When the Chips Are Down,2022-10-19 17:27:44,InvestorPlace
tsm,"China-Related Headwinds Force Chip Analyst To Slash Expectations on Lam Research, Applied Materials",2022-10-18 20:38:57,Benzinga
tsm,The 7 Best Mutual Funds for Your 401(k),2022-10-18 18:57:18,InvestorPlace
tsm,"Taiwan Semiconductor Correction Is Incoming In Q1, Analyst Says",2022-10-17 19:05:12,Benzinga
tsm,Taiwan Semi (TSM) Receives a Buy from Needham,2022-10-17 11:25:13,TipRanks
tsm,"Buy These 2 Chip Stocks on the Dip, Say Analysts",2022-10-15 23:27:30,TipRanks
tsm,Chip-stock swoon leads slate of broad tech losses,2022-10-14 17:48:00,Seeking Alpha
tsm,"Applied Materials, Lam Research, KLA Corp. turn around even as export regulations start",2022-10-13 20:03:03,Seeking Alpha
tsm,Apple Supplier TSMC Is 'Attractive' Analyst Says. What Results May Mean For iPhone Maker,2022-10-13 19:15:21,Benzinga
tsm,Why Are Chip Stocks Down Today?,2022-10-13 15:37:58,InvestorPlace
tsm,"Oil Output Cut May Tip Global Economy Into Recession, Elon Musk's Starship's First Space Tourist, Alphabet Approves Distribution Of Trump's Truth Social App: Top Stories Thursday, Oct. 13",2022-10-13 14:08:11,Benzinga
tsm,Why Is Relmada (RLMD) Stock Down 78% Today?,2022-10-13 14:06:22,InvestorPlace
tsm,Taiwan Semiconductor (TSM) Stock Drops Despite Q3 Beats,2022-10-13 13:45:39,InvestorPlace
tsm,"US Stocks Show Cautious Optimism As S&P 500, Dow Futures Surge Ahead Of Key CPI Data — Trump's SPAC Partner, Applied Materials And Chip Stocks In Focus Today",2022-10-13 13:03:49,Benzinga
tsm,"Analysts Offer Insights on Technology Companies: Boeing (BA), Taiwan Semi (TSM) and Duck Creek Technologies (DCT)",2022-10-13 12:31:32,TipRanks
tsm,US Stock Futures Gain; All Eyes On Consumer Price Index,2022-10-13 11:43:33,Benzinga
tsm,"Samsung, Taiwan Semiconductor, get reprieves for U.S. chip restrictions to China: reports",2022-10-13 11:27:04,Seeking Alpha
tsm,"Taiwan Semiconductor GAAP EPADR of $1.79 beats by $0.11, revenue of $20.23B beats by $1.14B",2022-10-13 06:10:28,Seeking Alpha
tsm,Taiwan Semiconductor Q3 preview: What to expect from the industry bellwether?,2022-10-12 17:59:36,Seeking Alpha
tsm,Notable earnings before Thursday's open,2022-10-12 13:34:15,Seeking Alpha
tsm,7 Risky Stocks to Watch as Q3 Earnings Kicks Off,2022-10-11 15:34:28,InvestorPlace
tsm,Why Is Laser Photonics (LASE) Stock Up 55% Today?,2022-10-11 15:20:01,InvestorPlace
tsm,COIN Stock Alert: What to Know as Google Taps Coinbase to Bring Crypto to the Cloud,2022-10-11 14:31:19,InvestorPlace
tsm,Why Is Taiwan Semiconductor (TSM) Stock in the Spotlight Today?,2022-10-11 13:59:26,InvestorPlace
tsm,"Qualcomm, chip equipment makers lead semis lower as sector deals with new export rules",2022-10-10 14:44:20,Seeking Alpha
tsm,US-China Tensions Aggravate: Chinese Chipmakers Bleed As US Sharpens Its Knives,2022-10-10 13:46:21,Benzinga
tsm,"AMD plunges 14%, hits 52-week low as preliminary results disappoint; Intel, Nvidia among other chips in the red",2022-10-07 18:04:03,Seeking Alpha
tsm,"Earnings week ahead: Pepsi, Citigroup, Taiwan Semiconductor, Delta Air Lines and more",2022-10-07 17:20:16,Seeking Alpha
tsm,ChipMOS Registers 27% Revenue Decline In Q3,2022-10-07 15:00:07,Benzinga
tsm,Taiwan Semiconductor revenue declines sequentially in September,2022-10-07 13:29:55,Seeking Alpha
tsm,US Stock Futures Mixed; All Eyes On Jobs Report,2022-10-07 12:16:16,Benzinga
tsm,Advanced Micro Devices edges up even as worries over data centers emerge,2022-10-05 20:52:14,Seeking Alpha
tsm,"TSMC Is Morgan Stanley's Top Pick In Tech Space, Calls It ""An Enabler Of Future Technology""",2022-10-05 12:10:38,Benzinga
tsm,This Is the Best Time to Buy These 7 Long-Term Stocks,2022-10-03 23:31:57,InvestorPlace
tsm,The Next Big Thing in Tech? 7 Quantum Computing Stocks to Bet On.,2022-09-30 17:25:17,InvestorPlace
tsm,7 Cheap Income Stocks Everyone Should Own,2022-09-30 10:30:58,InvestorPlace
tsm,"Semiconductors plunge as PC weakness continues, BofA downgrades Apple",2022-09-29 17:27:15,Seeking Alpha
tsm,LVWR Stock Alert: 7 Things to Know as LiveWire Starts Trading,2022-09-28 17:24:00,InvestorPlace
tsm,Why Is Prothena (PRTA) Stock Up 75% Today?,2022-09-28 16:52:05,InvestorPlace
tsm,What Is Going on With Silo Pharma (SILO) Stock Today?,2022-09-28 16:16:35,InvestorPlace
tsm,Why Is Taiwan Semiconductor (TSM) Stock Down Today?,2022-09-28 15:55:16,InvestorPlace
tsm,7 Semiconductor Stocks to Buy Before the Bull Market Returns,2022-09-28 14:42:39,InvestorPlace
tsm,The 3 Most Undervalued Quantum Computing Stocks to Buy Now,2022-09-26 13:49:38,InvestorPlace
tsm,7 Stocks to Buy to Play the Tech Cold War,2022-09-16 10:30:43,InvestorPlace
tsm,"It Wasn't Pelosi, Part 2: Congress Member Spends Half Their Salary On Chip Stock Ahead Of The CHIPS Act",2022-09-15 23:32:12,Benzinga
tsm,"Taiwan Semiconductor (NYSE:TSM) Stock: Set to Grow Revenues, Says Analyst",2022-09-15 06:05:51,TipRanks
tsm,"Taiwan Semi's Monopoly Help It Defy Industry Downcycle, Bullish Analyst Predicts 38% Potential Upside",2022-09-14 20:02:01,Benzinga
tsm,Taiwan Semiconductor goes ex-dividend tomorrow,2022-09-14 14:59:37,Seeking Alpha
tsm,"Top Financial Stories Wednesday, September 14: Multiple Antitrust Setbacks For Google, Bitcoin Crashes, Visa Finds New Gun Control System Ineffective And More…",2022-09-14 14:24:49,Benzinga
tsm,The US Chip Fever: Google and NIST Collaborate To Develop Chips for Researchers and Tech Startups,2022-09-13 20:49:27,Benzinga
tsm,7 Bear Market Stocks to Buy and Hold Forever,2022-09-08 15:45:29,InvestorPlace
tsm,CHIPS Act Update Gives Bears the Upper Hand With Chip Stocks,2022-09-06 14:33:56,InvestorPlace
tsm,The 7 Best Vanguard ETFs to Buy Now,2022-09-06 07:12:48,InvestorPlace
tsm,"US Restriction On Nvidia, AMD Selling Chips To China Poses Structural Risk For Semiconductor Industry, Analyst Says",2022-09-02 12:48:25,Benzinga
tsm,Semiconductors smoked as Nvidia plunges most since 2020 on Chinese chip ban,2022-09-01 16:31:29,Seeking Alpha
tsm,"Benzinga Before The Bell: Tesla Sues Louisiana Automobile Dealers Association, Will iPhone 14 Feature Satellite Connectivity?, Netflix Denies $7 To $9 Ad-Supported Plan And Other Top Financial...",2022-08-30 14:32:26,Benzinga
tsm,7 Undervalued Stocks That Are Screaming Buys Right Now,2022-08-25 12:45:13,InvestorPlace
tsm,Is Fisker Ready To Re-Emerge As The Tesla Killer?,2022-08-24 18:47:06,Benzinga
tsm,New MacBook Pro May Not Feature Chips Utilizing Most-Advanced Process Node Tech,2022-08-23 11:19:16,Benzinga
tsm,7 Stocks to Watch in Case China-Taiwan Tensions Rise,2022-08-18 20:37:41,InvestorPlace
tsm,"Semiconductors rise as Wolfspeed surges 30% after strong results, guidance",2022-08-18 17:57:20,Seeking Alpha
tsm,"Lone Pine takes new stakes in Alphabet, LPL; exits Snap, DoorDash while boosting Thermo Fisher",2022-08-16 16:20:13,Seeking Alpha
tsm,7 Bargain Stocks to Buy Before the Bull Market Returns,2022-08-15 11:00:43,InvestorPlace
tsm,"George Soros' Investment Firm Takes Position In Tesla, Bulks Up On These Tech Stocks In Q2",2022-08-13 23:04:38,Benzinga
