Headline,Date
WSJ ProPro Bankruptcy DistressAMC’s Hycroft Deal Triggers Meme-Stock Gold RushThe gold-mining company has raised roughly $140 million from stock sales since AMC said it was buying a stake.,"March 25, 2022 06:46 pm ET"
"Pro Bankruptcy DistressBed Bath & Beyond Creditors Organize Ahead of Bond TalksBed Bath & Beyond’s bondholders are organizing, looking to protect their investments in the struggling retailer as it looks for ways to ease its debt during a slump in sales, according to people with knowledge of the matter.","October 3, 2022 07:34 pm ET"
WSJ ProPro PE Fund NewsOak Hill Advisors Seeks $3 Billion to Lend to Larger CompaniesThe $63 billion credit arm of T. Rowe Price sees bigger businesses as more recession-proof.,"January 26, 2024 03:52 pm ET"
Review & OutlookOpinion: Upside Down Mortgage PolicyA new federal housing rule will make reliable borrowers subsidize risky loans.,"April 22, 2023 11:34 am ET"
"WSJ ProPro PE DealsTPG Launches Talent Company; Buys Boat Rocker’s Untitled StakePrivate-equity firm TPG is launching a new talent management and representation company, with an initial investment in Hollywood talent manager Untitled Entertainment.","June 28, 2024 10:21 am ET"
"MarketsChinese Property Titan Teeters as Investor Confidence FadesChina Evergrande Group’s debt-fueled growth powered its ascent, before problems started to mount.","July 27, 2021 07:34 am ET"
Paid ProgramPhotonics Era: Accelerate the Journey to Business SuccessHarnessing the power of light to illuminate and accelerate the path to a more sustainable future.,Tarih bulunamadı.
FinanceTurkey Faces Financial Reckoning After ElectionInvestors have increased bets that problems will mount once the election is over and President Recep Tayyip Erdogan’s patchwork of financial fixes lose their effectiveness.,"May 16, 2023 07:55 am ET"
"Pro BankruptcyTalen Energy to Hand Power-Plant Business to BondholdersTalen Energy placed a collection of nuclear, gas and coal facilities in chapter 11 after last year’s rally in natural-gas prices strained its cash, positioning unsecured bondholders to take over that business.","May 10, 2022 04:37 pm ET"
"ChinaChina’s Communist Party Overhaul Deepens Control Over Finance, TechnologyThe restructuring plans reinforce the party’s dominance over policy making, as part of leader Xi Jinping’s efforts to entrench his brand of top-down rule.","March 16, 2023 10:24 am ET"
Property ReportDevelopers Sit on Empty Lots After Historic Apartment BoomHigher interest rates and flattening rents are scuttling rental projects.,"June 4, 2024 05:30 am ET"
CommentaryOpinion: Putin May Fear Default More Than Defeat in UkraineRussia’s 1998 financial collapse looms large in his thinking and may explain why the country is still paying interest on its debt.,"March 24, 2022 06:53 pm ET"
Pro Bankruptcy DistressBed Bath & Beyond’s $1 Billion Stock Deal: What to KnowThe retailer faces doubts about its long-term survival even after getting an unusual financial lifeline.,"February 15, 2023 03:31 pm ET"
"Risk & Compliance JournalCrypto Sector Seeks Lawyers, Compliance Officers After Reputational HitsAttracting compliance workers is harder than ever for crypto firms—just when the industry needs them the most.","October 10, 2023 05:30 am ET"
Future ViewOpinion: How Dating Apps Shape Romance and LoveStudents discuss young Americans’ use of online matchmaking services.,"December 28, 2021 06:46 pm ET"
"CommentaryOpinion: The End of Affirmative Action and the Long Road to Racial Equality Under the LawAfter going through slavery, Jim Crow and affirmative action, has the Supreme Court finally brought us there?","June 29, 2023 02:27 pm ET"
"CommentaryOpinion: ‘Altruism’ Was Central to Sam Bankman-Fried’s CrimesHis moral arrogance makes the case for punishing him harshly, not for leniency as his lawyers argue in court.","March 14, 2024 05:40 pm ET"
IndiaIndia Successfully Test Launches Its First Privately Developed RocketThe event marks a step in the country’s push to develop a commercial space industry.,"November 18, 2022 08:30 am ET"
"CFO JournalBanks to Companies: No More Deposits, PleaseAwash in deposits over the course of the pandemic, some banks are now encouraging their corporate clients to spend the cash on their businesses or move it elsewhere.","June 9, 2021 07:30 am ET"
"WSJ ProPro PE Industry NewsTechnology Deals Shine Across Slower African Deal LandscapeIn the technology sector, particularly financial technology and digital infrastructure, private-equity and venture-capital firms continued to find attractive investment opportunities in the region.","March 7, 2021 07:12 am ET"
House CallWikipedia’s Jimmy Wales Was Educated in a One-Room Schoolhouse,"November 30, 2021 11:10 am ET"
Personal FinanceFace Money Fears for a Happier Financial LifeResearch suggests that seeking more insight on complex money issues could positively affect a person’s overall happiness.,"December 29, 2021 05:30 am ET"
"MarketsWhy Russia Doesn’t Want to Default—Even in a Time of WarThe last time Russia defaulted on its debt, in 1998, it took several years of painful economic reforms to get back in the good graces of international investors.","April 7, 2022 10:32 am ET"
FinanceMarket Chill Opens a Path for Sixth Street’s AdvanceThe lender’s decision to sit out the go-go market is providing an advantage during a downturn in deals involving companies including Emerson Electric.,"December 23, 2022 07:49 am ET"
"Credit MarketsPrivate Equity Taps Insurers’ Cash to Speed Up GrowthBlackstone, Carlyle and other fund managers are reaching deals to tap the insurance industry’s cash.","January 31, 2023 05:30 am ET"
"EconomyA Buoyant Global Economy Is Starting to SagManufacturing activity is weakening, Europe has slipped into a mild recession, China’s rebound from Covid-19 is sputtering and heavy debt and high interest rates burden many emerging markets.","July 16, 2023 07:58 am ET"
"WorldEU, Canada Willing to Back Climate Damage Fund—but Only If China Helps PayThe European Union and Canada are willing to back the creation of a fund that would pay for damage linked to climate change in the most vulnerable countries—but only if wealthier developing nations such as China contribute.","November 18, 2022 07:48 am ET"
"Paid ProgramIn Conversation: Tech Mahindra’s Lakshmanan Chidambaram and experts from Ford on the future of AR and car dealershipsSince the 1908 launch of the Model T, the Ford Motor Company has been at the forefront of innovation. Ford’s Elizabeth Tarquinto and Bryan Jenkins, along with Lakshmanan Chidambaram, president of Tech Mahindra Americas, talk about how the use of augmented reality and other technologies is creating the dealership of the future.",Tarih bulunamadı.
"Personal FinanceWhy Interest Rates Are Rising Everywhere—Except Your Savings AccountMany banks continue to offer meager yields on savings accounts, but it can pay off to shop around.","October 3, 2022 05:30 am ET"
U.S. EconomyStudent-Loan Bills Set to Add Pressure on Younger AmericansThe expected resumption of student-debt payments comes as borrowers in their 20s and 30s are falling behind on other obligations.,"March 11, 2023 05:30 am ET"
"BusinessBoeing Names GE Veteran Brian West as CFOHe will succeed Greg Smith, who is set to retire in July. The plane maker also named a former airline pilot to its board.","June 30, 2021 06:56 pm ET"
"MarketsCryptocurrency Giant Binance.US Hires Former Top Bank RegulatorBrian Brooks will become the new CEO of Binance.US, the U.S. affiliate of overseas crypto-exchange giant Binance.","April 20, 2021 02:33 pm ET"
EuropeItaly Frees Iranian Wanted by U.S.Iranian businessman Mohammad Abedini was released after an Italian journalist was freed by Tehran.,"January 12, 2025 12:25 pm ET"
"CorrectionsCorrections & AmplificationsCorrections & Amplifications for the edition of Dec. 7, 2021.","December 7, 2021 12:01 am ET"
"WSJ ProPro Bankruptcy DistressTravelport Ditches Proposal Asking Lenders to Defer Cash InterestTravelport Worldwide scrapped a proposal asking certain senior lenders to defer cash interest payments, people familiar with the matter said.","January 23, 2023 02:18 pm ET"
LIVE COVERAGE POSTWhat Investors Need to Know About Today's Treasury Announcement,"January 31, 2024 10:45 am ET"
Li-Cycle Stock Rises After Company Scores $375 Million Government Loan,"February 27, 2023 09:22 am ET"
Yen Stays Weak Against the Dollar Even as Tokyo Steps Up Verbal Defense of its Currency,"September 8, 2022 07:31 am ET"
Three Things I Learned From Trying the Riskiest Trade in Markets,"March 18, 2024 09:55 am ET"
"LIVE COVERAGE POSTLong-Term Capital Management's Collapse, 25 Years Later","September 25, 2023 07:30 am ET"
LIVE COVERAGE POST‘Soft Landing’ Optimism Has Lifted Some Beaten-Down Stocks Lately,"November 20, 2023 06:00 am ET"
Review & OutlookOpinion: Judges Say You Can’t Build ThatTwo case studies—on LNG and oil drilling—in why the U.S. desperately needs permitting reform.,"September 2, 2024 04:21 pm ET"
"WSJ ProPro PE Legal RegulatoryCredit Firm Brightwood Capital Faces Lawsuit Over Continuation FundBanner Ridge Partners has sued Brightwood over a roughly $253 million deal, alleging it deprived Banner Ridge of $58 million.","April 12, 2024 04:58 pm ET"
"WSJ ProPro VC NewsletterVC Daily: Startups Are Spending Cash FasterVenture-backed late-stage companies are spending capital faster, according to an analysis by Silicon Valley Bank.","August 2, 2021 09:36 am ET"
Amazon Is Joining the Dow Industrials,"February 20, 2024 05:27 pm ET"
Do Reddit Users Want to Be Shareholders?,"March 18, 2024 09:45 am ET"
Business WorldOpinion: ‘Meme’ Stocks Can Learn From AMCA CEO rightly focuses on meeting the public’s irrational desire for his shares.,"June 8, 2021 06:15 pm ET"
CommentaryOpinion: The Clinton-Trump ParallelsDemocrats were right to fight selective prosecution in 1998 and are wrong to engage in it now.,"April 23, 2023 04:13 pm ET"
"Paid ProgramExamining the Potential ROI of Amazon BusinessMore B2B buyers are using Amazon Business, but how do you know if it’s the right fit for your organization?",Tarih bulunamadı.
CommentaryOpinion: Biden Gets Corporate Taxes BackwardA reduced rate wasn’t a ‘giveaway’ to large firms. It set off an economic boom and increased wages.,"May 30, 2024 03:54 pm ET"
Economic DataU.S. Consumer Confidence Declines Unexpectedly as Election NearsThe University of Michigan’s index of consumer sentiment fell in mid-October while economists had expected an increase.,"October 11, 2024 10:47 am ET"
New York Community Bancorp Deposits Fall 5%,"March 7, 2024 11:45 am ET"
Why Are Bond Yields So High? And Should You Be Worried?,"September 25, 2023 09:45 am ET"
FinanceVacation-Home Buyers Face New TestPeople are buying vacation homes and investment properties in record numbers during the coronavirus pandemic. Changes at Fannie Mae and Freddie Mac could make those mortgages more expensive.,"April 1, 2021 05:30 am ET"
U.S.Trump’s Wallet—and Reputation—to Be Tested in Civil-Fraud TrialThe former president faces a lengthy courtroom battle that could shed light on his finances and business practices.,"October 1, 2023 03:06 pm ET"
"TechElon Musk’s Inner Circle Rocked by Fight Over His $230 Billion FortuneBefore the Tesla CEO’s billion-dollar battle over Twitter, another fight broke out over how his charitable giving should be managed. Ex-professional gambler Igor Kurganov became a top Musk adviser on giving his fortune away. Jared Birchall, his wealth manager and key player in financing the bid for Twitter, wanted him out.","July 16, 2022 08:52 am ET"
"ScienceScientists Make World’s Skinniest SpaghettiThe nanopasta, measuring about 1/200th the width of a human hair, could one day be used to improve bandages.","January 8, 2025 12:50 pm ET"
Middle EastIsrael Urged by Yellen to Help Palestinian Economy FunctionTreasury Secretary Janet Yellen warned that the West Bank’s economy could collapse if Israel doesn’t preserve its banking relationship with Palestinian financial institutions in the territory it occupies.,"October 28, 2024 12:08 pm ET"
Best of the WebOpinion: Norway’s Government Uses Oil Wealth to Pressure U.S. FirmsShouldn’t Norwegians pay for their own virtue signals?,"May 19, 2023 03:37 pm ET"
"PoliticsTreasury Watchdog Warns of Cellphone-Data Use Without WarrantsLaw-enforcement agencies may not be on firm legal footing when they purchase and use highly revealing cellphone GPS data drawn from mobile apps without obtaining a warrant first, a new Treasury Department watchdog report warns.","February 22, 2021 09:24 am ET"
PoliticsLaw Enforcement’s Use of Commercial Phone Data Stirs Surveillance FightAgencies’ growing use of purchased data without warrants raises new legal questions.,"September 15, 2021 08:00 am ET"
"Central BanksNY Fed Official Sees Declining Use of Fed Reserve Repo ToolThe very high level of use of the U.S. central bank’s reverse repo facility should fall over time, a top staff official at the Federal Reserve Bank of New York said Thursday.","September 8, 2022 11:59 am ET"
PoliticsU.S. Warns Russia of ‘Catastrophic Consequences’ of Using Nuclear Weapons in UkraineNational security adviser Jake Sullivan said the U.S. will continue to provide weapons to Ukraine despite nuclear threats by Russian President Vladimir Putin.,"September 25, 2022 11:14 am ET"
"Journal Reports: EnergyNew Technology Lets Farmers Use Land for Both Solar Panels and CropsBy using elevated panels, researchers hope they can generate electricity without reducing yields on the crops growing underneath.","November 10, 2022 11:00 am ET"
WorldAustralia to Deploy U.S. Himars Rocket System Being Used in UkraineThe rockets will help boost Australia’s long-range strike capability.,"January 4, 2023 11:13 pm ET"
"Journal Reports: LeadershipShould Companies Use Unconventional Spelling for Its Products? It Isn’t Always KlearIf consumers think it’s a marketing gimmick, it could backfire, a study finds.","April 15, 2023 12:00 pm ET"
"Paid ProgramA failure in the consumer space, Google Glass’s emerging impact in the enterprise sphere is forging a new path for smart glasses in the workplace.",Tarih bulunamadı.
WSJ ProPro VC New MoneyPatient Advocate Solace Health Gets $14 MillionThe firm connects patients with healthcare professionals who help them negotiate an increasingly complex medical system.,"August 22, 2024 06:00 am ET"
"Europe EconomyFrance Has a Debt Problem, But Europe Does NotExcept for France, many European economies owe relatively little when compared with other rich parts of the world.","December 10, 2024 10:26 am ET"
LIVE COVERAGE POSTUnraveling the Money Trail at B. Riley Financial,"February 12, 2024 11:07 am ET"
LettersOpinion: The Medicare Cost ComplexThe expansion of medical reimbursement codes hurts patients as well as taxpayers.,"June 8, 2023 04:13 pm ET"
LIVE COVERAGE POSTHong Kong Stocks Sink to New Low for 2023,"October 3, 2023 06:56 am ET"
Heard on the Street Recap: Scoot Over,"December 21, 2023 03:29 am ET"
"Review & OutlookOpinion: Ted Cruz, the Supreme Court and $10,000The Justices strike down a cap on campaigns that repay personal loans.","May 16, 2022 06:25 pm ET"
"Review & OutlookOpinion: The Rich Rush to Muni BondsAs Biden’s tax hikes loom, cities and states see a tax-exempt boom.","September 2, 2021 06:48 pm ET"
"WSJ ProPro Bankruptcy NewsletterPro Bankruptcy Briefing: Governor’s Greensill Guarantees; Argentine Plant Owner Fights On Venue; Eagle Backers’ Bid BlockedWest Virginia’s popular Republican governor is personally liable for money his coal companies borrowed from defunct financial startup Greensill Capital. Stoneway Capital is in financing talks with the same bondholders challenging its bankruptcy venue, while the Eagle Hospitality hotel trust overcame objections to $480 million in sales.","June 1, 2021 09:10 am ET"
"CIO JournalWalgreens Names Hsiao Wang as Next CIOWalgreens Boots Alliance Inc. said Thursday it would appoint Hsiao Wang as its new chief information officer, as tech leader Francesco Tinto departs.","September 9, 2022 02:10 pm ET"
"PoliticsRepublican George Santos Faces Probe Over ‘Fabrications and Inconsistencies’ During CampaignThe district attorney in Nassau County, N.Y., is “looking into the matter,” a spokesman says.","December 28, 2022 06:50 pm ET"
WSJ ProPro BankruptcyCrypto ATM Operator Coin Cloud Follows Its Lender Into BankruptcyCoin Cloud said it owes bankrupt crypto lender Genesis Global Holdco $116 million and will either get new financing or sell its troubled ATM business in chapter 11.,"February 8, 2023 04:52 pm ET"
"Pro BankruptcyChilean Telecommunications Provider WOM Files for Chapter 11 BankruptcyChilean telecommunications provider WOM filed for bankruptcy, blaming a delayed 5G network rollout, aggressive vendor actions and credit downgrades that spooked a lender.","April 1, 2024 03:29 pm ET"
BusinessTGI Fridays Nears Bankruptcy FilingThe casual-dining stalwart has dealt with slowing sales. A deal to purchase the company fell through earlier this year.,"October 31, 2024 04:49 pm ET"
"Rumble Seat2024 Chrysler Pacifica PHEV: A Pioneering Hybrid That Still Has GameWith 32 miles of all-electric range, the Pacifica can nearly zero out gas consumption for the average American driver—as long as you remember to plug it in, writes Dan Neil.","January 17, 2025 12:15 pm ET"
CorrectionsCorrections & AmplificationsCorrections & Amplifications,"November 1, 2021 12:01 am ET"
Trump Campaign Makes Fundraising Pitch With Fake Mugshot,"April 4, 2023 02:28 pm ET"
"WSJ ProPro BankruptcyEagle Hospitality Shareholders Can’t Derail $480 Million Asset Sales, Judge RulesBankrupt hotel owner Eagle Hospitality Real Estate Investment Trust won court approval to sell off assets for roughly $480 million after a bankruptcy judge rejected a last-minute competing bid from a group led by two shareholders.","May 28, 2021 07:23 pm ET"
"EarningsMarriott Posts Quarterly Gains, Sees Business Travel Picking Up This FallThe hotel chain expects demand for business and group stays to rise in the fall as it anticipates more workers returning to offices on a hybrid basis.","August 3, 2021 05:24 pm ET"
EuropeGermany Warns Falling Euro Could Push Inflation Even HigherThe comments add pressure on the European Central Bank to reverse its negative rate policy despite concerns about a recession.,"May 20, 2022 12:12 pm ET"
Paid ProgramThe Next Step in Digital HealthHow one health care institution is leveraging advanced analytics and cutting-edge technology to address top medical challenges.,Tarih bulunamadı.
U.S.Hunter Biden’s Legal Issues Shadow Launch of President’s Re-Election CampaignLegal developments in Washington and Arkansas have underscored the potential liabilities the president’s son could present for the campaign.,"May 3, 2023 05:59 pm ET"
PoliticsNew York Tax Officials Crack Down on Remote WorkersNonresidents who were commuting to the state before the pandemic are making refund claims that tax authorities are questioning.,"May 6, 2021 11:23 am ET"
"StocksNordstrom, Twitter, Peloton: Stocks That Defined the WeekHere are seven major companies whose stocks moved on the week’s news.","August 26, 2022 06:17 pm ET"
"WorldCOP26 Talks Continue With a Deal Still ElusiveNegotiators seeking to reach a global deal to slow climate change said they would continue talks through the night and into Saturday, as they wrestled with differences over the wording of what they hope will be a meaningful agreement.","November 12, 2021 05:20 pm ET"
"FinanceConsortium Including Elliott in Advanced Talks to Buy NielsenA consortium of private-equity firms including Elliott Management is in advanced talks to buy TV-ratings company Nielsen Holdings for about $15 billion including debt, according to people familiar with the matter.","March 14, 2022 04:19 pm ET"
Jumbo JungleWant to Lower Your Homeowners Insurance Premium? There Are Discounts for the TakingLuxury homes tend to be more expensive to insure—but there are ways to save.,"August 11, 2021 11:30 am ET"
CFO JournalPPG Industries Puts Focus on M&A Instead of Share BuybacksThe paint maker has struck three deals in recent months and is trying to do a fourth one.,"February 3, 2021 03:06 pm ET"
Best of the WebOpinion: Bidens and ChinaWho else can invest alongside financial heavyweights by putting up so little equity?,"September 27, 2023 05:36 pm ET"
The AmericasOpinion: Showdown in Mexico’s Zama Oil FieldPemex tries to muscle in on a consortium’s field in what could be a test of the USMCA.,"June 27, 2021 03:57 pm ET"
MarketsDeutsche Bank Posts Jump in Profit on Rising RatesThe German lender’s net profit rose sharply in the third quarter as it charged higher interest on loans and traded more currencies and bonds for clients in a volatile market.,"October 26, 2022 04:19 pm ET"
Politics & IdeasOpinion: How Will Inflation End?Larry Summers forecasts a major recession and high unemployment.,"April 5, 2022 01:07 pm ET"
AfricaGhana to Restructure External Debt as Part of IMF DealThe West African country is latest developing nation to seek debt relief amid rising interest rates and the Ukraine war.,"December 13, 2022 12:37 pm ET"
"WorldPope Francis Mourns Cardinal Pell, Who Called His Reign a ‘Catastrophe’The pope said the final prayers at Cardinal George Pell’s funeral but didn’t lay to rest the grievances of many conservatives for whom the late cardinal was a leading spokesman","January 15, 2023 05:09 am ET"
"U.S.George Santos Pleads Guilty to Fraud, Identity TheftThe expelled Republican congressman faces at least two years in prison.","August 19, 2024 10:33 pm ET"
"CFO JournalCompanies Find It’s a Good Time to Push Pension Obligations Off Balance SheetsLockheed Martin, Arconic and others have bought annuities this year to reduce risk from their defined-benefit pensions.","August 22, 2021 10:00 am ET"
"A-hedThe Two Words That Terrify Junior EmployeesCurt notes sent by higher-ups wreck weekends and family time; “Until you’ve gotten that 10 p.m. ‘pls fix,’ you just don’t get it.”","October 10, 2022 10:32 am ET"
"WorldTax Deal Is Advance for Cooperation, but Tough Tasks RemainWhile the world’s largest economies look past tensions to seal an ambitious tax deal, other common problems such as climate change demand more difficult compromises.","July 10, 2021 08:18 am ET"
"BusinessThe Elon Musk-Twitter Deal Saga: What’s Happened So FarThe Tesla CEO is seeking to abandon his bid to buy the social-media company, capping a tumultuous stretch since he struck an agreement to buy it in April.","July 12, 2022 06:53 pm ET"
BusinessHow Macy’s Has Avoided the Inventory Pileup Plaguing Other Apparel ChainsExecutives say they cut orders and shifted inventory after seeing some troubling signs in credit-card spending.,"October 5, 2022 05:30 am ET"
FinanceJunk-Loan Market Shrugs Off Economic JittersInvestors and company executives say low-rated companies will overcome rising interest rates and weakening demand.,"February 13, 2023 04:25 pm ET"
Paid ProgramSuccess With AI in the EnterpriseHow can enterprises align high-return use cases with the right generative AI tools? Oracle’s Mahesh Thiagarajan explains.,Tarih bulunamadı.
"Future ViewOpinion: What Can Be Done About the Opioid Crisis?Students discuss drug-policy reform, addiction and fentanyl overdoses.","May 31, 2022 06:52 pm ET"
"MarketsPhilip Falcone’s Second Act in Long-Term-Care Insurance Turns UglyLong-term care has been a troubled insurance product for well over a decade, causing financial pain to many insurers and their customers. Now, one executive’s plan to make money where others have failed has backfired.","March 2, 2021 07:00 am ET"
"MarketsHNA Group’s Financial Maneuvers Powered Its Rise—and Caused Its DownfallFrom 2015 to 2017, Chinese conglomerate HNA went on a $40 billion deal-making frenzy, Now, following its downfall, light is falling on the unorthodox ways that money was moved around the company.","February 8, 2021 05:30 am ET"
CFO JournalNot Enough Accountants? The CFO’s Tenure Might Get a Little ShakierA CFO is somewhat more likely to be replaced after financial-reporting deficiencies are uncovered—even if the accountant shortfall may be to blame.,"August 2, 2024 09:30 am ET"
CFO JournalWhat’s Next for Ralph Lauren’s Jane Nielsen? Mentor Indra Nooyi Has an Idea.The brand’s COO and former CFO is “an iron fist with a velvet glove.”,"September 21, 2024 12:01 am ET"
Political EconomicsOpinion: You Don’t Need a Banking Crisis for a Financial MeltdownPost-2008 regulations may save us from a bank panic. The danger is every other financial institution.,"April 6, 2023 01:10 pm ET"
"CommentaryOpinion: Elect the GOP to Keep IRS Auditors From Knocking on Your DoorUnder Biden, the agency is bent on squeezing more revenue without oversight or accountability.","October 31, 2022 06:30 pm ET"
WSJ ProPro VC Industry NewsTech Provider for Cannabis Firms Dutchie Raises $200 MillionDutchie Inc. raised $200 million in a fresh round of funding and acquired two software companies as the technology provider for cannabis dispensaries looks to build out its offerings amid rising consumer demand for marijuana products.,"March 16, 2021 05:45 am ET"
Heard on the StreetThe Pandemic’s E-Commerce Stars Are CopingOnline retailers that experienced dizzying growth in 2020 and 2021 are settling into their postpandemic reality.,"December 27, 2023 10:23 am ET"
"CFO JournalWaste Management Boosts Profit Margins By Rerouting and Replacing Trash TrucksThe waste and recycling company expects further improvement in its profit margin this year as a result of recent investments, its CFO says.","May 2, 2024 10:56 am ET"
