Headline,Date
"CFO JournalStanley Black & Decker CFO Looking for Partnerships With Battery, Chip MakersThe company, which is best known for its power tools, is seeking electric battery and computer chip makers that would agree to supply components in return for an investment.","June 18, 2021 08:00 am ET"
Middle EastShadow Network of Militias Backs IranThe strike ordered by President Biden against Iranian-backed militia positions in Syria highlights Tehran’s ability to move weapons and personnel across borders and threaten U.S. interests.,"February 26, 2021 02:25 pm ET"
"CFO JournalSome Companies Pull Back on Securitizations as Investors Seek Higher YieldsIssuance of debt backed by consumer and commercial loans dropped 45% in the first quarter, data show.","April 17, 2022 10:00 am ET"
"AfricaU.S. Seeks Security Council Allies Against RussiaMozambique, which became an nonpermanent member this year, is being courted by the U.S.","January 28, 2023 11:27 am ET"
Bookshelf‘Savings and Trust’ Review: The Freedman’s Bank CollapseThe Freedman’s Bank aimed to give those emancipated from slavery a place in the post-Civil War economy. It was badly mismanaged and eventually failed.,"October 18, 2024 11:35 am ET"
WSJ ProSustainable BusinessShareholder Activism Around ESG Is Rising—Just Ask the Church of EnglandInvestors are increasingly voting against companies’ boards to push for climate policies,"May 31, 2024 11:01 am ET"
MarketsUkraine Fails to Raise New Debt as Russian Invasion Threat LoomsThe nation’s access to debt markets hit a bump this week in a sign that investors are getting jittery about the possibility of a Russian invasion.,"February 3, 2022 08:55 am ET"
"Heard on the StreetCrypto Can Run, but It Can’t HideCryptocurrency firms besieged by the SEC might be lured to friendlier jurisdictions overseas, until they cause scandals that again lead to tighter regulation.","June 15, 2023 07:43 am ET"
"Pro PE Industry NewsRising Costs Present New Hurdles for Clean EnergyElectricity-price volatility, rising interest rates and equipment prices are driving the cost of green energy higher.","November 10, 2023 08:00 am ET"
FinanceCredit-Card Debt Keeps Falling. That’s a Problem for Banks.Americans are paying off their credit cards at the fastest rates in years. Banks are responding with generous card solicitations and looser underwriting standards.,"May 11, 2021 05:33 am ET"
Pro Cyber NewsSurveillance Risks Shape How Central Banks Test Digital CurrenciesDozens of governments are exploring whether digital currencies backed by central banks can bring benefits without the instability of cryptocurrency markets or new risk for financial systems.,"March 22, 2022 05:30 am ET"
"A-hedThese Moms’ Lives Are a Hot Mess, and They’re Ready to Show It“Nonaestheticmom” influencers ditch the facade of social media and share tips for average families.","November 1, 2023 10:00 am ET"
Historically SpeakingYou Might Not Want to Win a Roman LotteryHumans have long liked to draw lots as a way to win fortunes and settle fates.,"November 25, 2022 01:53 pm ET"
CIO JournalCIO 2023 Priorities: Speed and AgilityA tumultuous geopolitical landscape and continued economic tightening are expected to influence the CIO agenda,"December 30, 2022 08:00 am ET"
Paid Program3 Ways Businesses Can Support Water StewardshipWhy innovative cloud solutions and partnerships are key to helping AWS on its water stewardship journey.,Tarih bulunamadı.
"Credit MarketsRisky Borrowers Hope to Boost Green CredentialsInvestors’ thirst for yield in debt markets is driving demand for the risky loans that fund private equity deals, allowing companies to begin testing new features designed to boost their green and governance credentials.","February 2, 2021 05:08 am ET"
"WorldU.S. Bars Ukrainian Banking Tycoon Over Corruption AllegationsThe Biden administration imposed sanctions on Ukrainian former public official Ihor Kolomoisky and his family for alleged corruption, marking a renewed effort by the U.S. to help Kyiv address a problem that officials say is at the heart of its economic and political woes.","March 5, 2021 02:53 pm ET"
MarketsGreensill Whistleblower Tips Warned German Regulator of Fraud Last YearAn internal German government report shows that authorities were scrutinizing Greensill for more than a year before it unraveled.,"March 31, 2021 04:34 pm ET"
"Heard on the StreetIt’s a Buyer’s Market for Boats, RVs and Other Pandemic ToysSales of recreational items went from pandemic boom to inflationary bust. Some sellers were braced for the downturn.","June 7, 2024 05:30 am ET"
U.S.California Population Declines for First Time in More Than a CenturyPandemic-related deaths and immigration declines added to long-running trends that have caused the once-booming state’s population growth to stall.,"May 7, 2021 03:48 pm ET"
LIVE COVERAGE POSTHeard on the Street Recap: Toes Jammed,"October 11, 2023 06:44 pm ET"
Political EconomicsOpinion: The Financial Markets Will Disappoint Your Yen for StabilityThe Japanese currency’s rapid appreciation could serve to trigger a global financial emergency.,"August 8, 2024 05:16 pm ET"
CFO JournalHealth Insurer Humana Makes Its Interim CFO PermanentSusan Diamond is taking over as Humana’s CFO as the health insurer pushes into the home healthcare business.,"June 28, 2021 02:35 pm ET"
CFO JournalInternet Conglomerate IAC Hires NFL Executive as CFOChristopher Halpin will join the company later this month.,"January 5, 2022 09:00 am ET"
"WSJ ProPro Bankruptcy DistressTuesday Morning Lands $35 Million Lifeline From Pier 1 OwnerThe discount home-goods retailer has raised debt from the company that owns RadioShack, Dressbarn and other formerly bankrupt retail brands.","September 12, 2022 12:14 pm ET"
"Pro BankruptcyKKR-Backed GenesisCare Preps for Bankruptcy Filing Within DaysGenesisCare, a provider of cancer-care services backed by KKR, is preparing to file for bankruptcy within days, according to people familiar with the matter.","May 25, 2023 04:00 pm ET"
Pro BankruptcyWood-Pellet Maker Enviva Files for BankruptcyThe nation’s largest exporter of wood pellets filed for chapter 11 following a failed gamble on future commodities prices.,"March 13, 2024 03:11 pm ET"
Best of the WebOpinion: Menendez Brings Displeasure to DemocratsHolding the Senate majority was already a heavy lift in 2024.,"June 4, 2024 01:18 pm ET"
Mark Carney Says U.S. Climate Legislation Puts Pressure on Others to Respond,"January 19, 2023 02:32 pm ET"
"FinanceWelcome to Y’all Street, Texas’ Burgeoning Financial HubGoldman Sachs, JPMorgan and others are lured to the state by lower taxes and housing costs and a friendlier vibe.","August 10, 2024 05:30 am ET"
"FashionThe Right Way to Wear Suede—and the Pitfalls to Avoid. A Style Guide for Women.Ready to go head-to-toe or just dabbling? Consider our advice on pulling off the tricky texture whether you’re a timid first-timer, more confident, or a true suede daredevil.","January 16, 2025 04:15 pm ET"
"WSJ ProPro BankruptcyBrooklyn’s Williamsburg Hotel Owners Approved to Press Forward With Restructuring PlanThe owners of the hotel defeated attempts by a federal bankruptcy watchdog to oust management, allowing its operators to move ahead with a plan to restructure its finances and emerge from chapter 11.","October 6, 2021 05:14 pm ET"
"WSJ ProPro BankruptcyCypress Environmental, a Pipeline Inspector, Files Prepackaged BankruptcyThe company’s financing efforts were hampered by employee lawsuits, court papers say.","May 9, 2022 01:38 pm ET"
WSJ ProPro Bankruptcy PeoplePaul Hastings Law Firm Poaches About 40 Restructuring Attorneys From StroockThe mass lateral move comes as defaults and bankruptcies hover around their lowest rate in decades.,"March 31, 2022 01:26 pm ET"
"Paid ProgramThe Sky's the LimitFighting terrorism, delivering consumer products and aid, exploring extreme terrains – drones are set to revolutionize lives becoming a USD12 billion business by 2021.",Tarih bulunamadı.
Stocks and Bonds Beat Cash in the Long Run,"October 31, 2023 09:45 am ET"
Pro VC New MoneyStartup Gets Backing to Create Clearing Firm for EquitiesEmbedded Financial Technologies is a custodian-and-clearing firm for equities and options.,"April 21, 2021 05:00 am ET"
"Heard on the StreetThe Green Investing Standard That Could Set the Global BarEurope’s new rules for institutional investors are woolly, but will be followed by sharper ones that may set the baseline for other countries, including the U.S.","March 12, 2021 06:49 am ET"
WSJ ProPro PE Limited PartnersNew Jersey Weighs $1.5 Billion in Credit Bets Managed by Goldman SachsThe New Jersey Division of Investment is weighing whether to commit $1.5 billion in public pension assets to two separately managed accounts run by Goldman Sachs Group’s asset management arm in a bid to rapidly expand its private-credit portfolio.,"November 17, 2021 05:18 pm ET"
"U.S.Giuliani Associate Faces SEC LawsuitThe commission filed the lawsuit against Lev Parnas, a Florida businessman who helped Rudy Giuliani push for investigations in Ukraine to benefit former President Donald Trump.","February 4, 2021 04:59 pm ET"
FinanceCredit Suisse Faces Compliance Probe Over Russia SanctionsLawmakers are seeking information following reports that Credit Suisse instructed investors in a recent debt deal to destroy and erase information related to its dealings with rich clients.,"March 28, 2022 09:47 am ET"
"MarketsDeutsche Bank Profit Rises on Booming Lending BusinessThe German bank’s net profit rose on the back of higher interest rates, driving the lender to its strongest year since 2007.","February 2, 2023 03:29 am ET"
"CorrectionsCorrections & AmplificationsCorrections & Amplifications for the edition of Nov. 9, 2024.","November 8, 2024 05:33 pm ET"
"CorrectionsCorrections & AmplificationsCorrections & Amplifications for the edition of Aug. 5, 2023","August 4, 2023 05:45 pm ET"
Logistics ReportOverseas Shipholding to Be Acquired by Saltchuk in $950 Million DealThe deal has been unanimously approved by the boards of both companies and is expected to close in the next few months.,"May 20, 2024 08:03 am ET"
CME Group to Launch Treasury Bill Futures,"September 5, 2023 09:14 am ET"
"TechChina Warns Large Tech Firms as Industry Faces Rising OversightTencent, ByteDance and JD.com were among the firms ordered to change business practices that regulators see as risky, the latest sign of heightened scrutiny of the sector.","April 29, 2021 05:11 pm ET"
Journal Reports: Investing MonthlyWhy Am I Overspending? Blame It on PoliticsElection fatigue has me and my friends so anxious that we find solace in buying more stuff than we should.,"September 8, 2024 09:00 am ET"
"Heard on the StreetPeak Season Is Still Ahead for Timeshare StocksAs the pandemic wanes, timeshare stocks are the vacation from speculation investors need.","May 25, 2021 02:10 pm ET"
"CommentaryOpinion: Biden Wants to Spend, Not InvestHis plan draws down private capital to fund current consumption, not actual infrastructure.","April 21, 2021 06:41 pm ET"
"FinanceJPMorgan Invests in Mortgage ClearinghouseJPMorgan has contributed additional venture capital funding to Maxex, a growing digital exchange for residential mortgages.","June 22, 2021 05:35 am ET"
"U.S.Former Puerto Rico Governor Arrested on Bribery ChargesWanda Vázquez Garced was allegedly involved in a bribery scheme that involved money paid to her 2020 campaign, according to the Justice Department.","August 5, 2022 09:32 pm ET"
"WSJ ProPro VC FundsVenture Firm Portal Innovations Raises $100 Million, Targets Emerging Biomedical HubsBiotechnology venture firm Portal Innovations has raised $100 million to invest in startups in Atlanta, Houston, Chicago and other cities that have top academic medical centers, but relatively few venture investors. Portal builds lab space in these cities and has raised the capital from real-estate investors seeking exposure to the biotechnology industry.","May 4, 2023 06:00 am ET"
CommentaryOpinion: Climate Alarmists’ Bad ScienceAdvocates conduct shoddy research in an effort to show that warming will reduce economic growth.,"April 3, 2024 05:33 pm ET"
Paid Program3 Ways Businesses Can Support Water StewardshipWhy innovative cloud solutions and partnerships are key to helping AWS on its water stewardship journey.,Tarih bulunamadı.
"Journal Reports: Funds/ETFsHow to Prepare Financially for the Death of a SpouseYou and your spouse did everything right, financially. Except you didn’t consider the consequences when one of you dies first.","June 3, 2021 12:07 pm ET"
"MarketsESG Rules From Europe Challenge U.S. Fund ManagersU.S. funds are being forced to comply with new European rules on climate and other sustainable-finance issues, requiring disclosure of potential harm their investments could do to the environment and society.","March 22, 2021 05:30 am ET"
"WSJ ProPro Central Banks NewsletterNo Fed Policy Shift Despite Inflation Surge; Senate Confirms Former Fed Economist for Key Treasury PostFed Chairman Jerome Powell told the Senate Banking Committee it would be an error to overreact to the recent surge in inflation. He indicated that the Fed was in no hurry to adjust its policies, and would have a better grasp of how the reopening was proceeding by year’s end. Meanwhile, the Senate confirmed former Fed economist Nellie Liang in a role that puts her at the forefront of efforts to manage the soaring federal debt.","July 16, 2021 08:38 am ET"
"U.S.Biden Administration Removes Fannie, Freddie OverseerSupreme Court decision clearing path for new overseer is a blow to investors betting that the mortgage giants would be returned to private hands after more than 12 years of government control.","June 23, 2021 10:15 pm ET"
Middle EastNew Finance Minister Aims to Entrench Israeli Rule in West BankThe leader of the far-right Religious Zionism party said he plans to spend billions of dollars building infrastructure and investing in Jewish settlements in the territory.,"January 4, 2023 07:40 am ET"
"PoliticsSinema’s Opposition Stymies Democrats’ Tax-Increase PlansSenate Democrats are considering abandoning central tax elements of their social policy and climate package, as a key senator continues to oppose any increase in marginal rates for businesses, high-income individuals or capital gains.","October 20, 2021 07:54 pm ET"
"AfricaChildren Fed on Grass, No Medication for Rape Victims: Aid to African Crises Cut Back as Needs SoarAid groups in Africa face the biggest funding shortfalls in decades amid new humanitarian emergencies, price increases and the Ukraine war.","September 23, 2023 10:00 am ET"
"Election 2024Trump Proposes 15% Tax Rate for Some Companies, Role for Elon Musk in GovernmentThe Republican presidential nominee urged the creation of a sovereign wealth fund and reiterated a call for regulation cuts.","September 5, 2024 06:31 pm ET"
"FinanceCrypto Industry Should Face Tougher Regulations, Fed Vice Chairwoman SaysBetter guardrails are needed for cryptocurrencies to protect individual investors and to dampen any risks that might emerge as the industry grows, Federal Reserve Vice Chairwoman Lael Brainard said.","July 8, 2022 11:06 am ET"
"MarketsChinese Developer Yango Group Proposes Bond Swap to Avoid ‘Imminent’ DefaultThe company asked international investors to swap $747 million of dollar debt for new bonds, blaming a shutdown of its usual financing channels for the cash crunch.","November 1, 2021 05:58 am ET"
FinanceAnt’s Consumer-Lending Unit to Raise $1.5 Billion in New CapitalThe Chinese financial-technology is scaling back its fundraising ambitions after a large state-backed investor backed out of a previous plan.,"November 14, 2022 08:55 pm ET"
"WSJ ProPro BankruptcyLimetree Bay Refinery’s Bankruptcy Lender Shrinks LifelineArena Investors said it would offer the bankrupt and idled Limetree Bay oil refinery in St. Croix only a portion of the loan package it had previously agreed to, drawing a rebuke from the judge overseeing the chapter 11 case.","August 9, 2021 09:43 pm ET"
CommentaryOpinion: What the U.S. Can Do for UkraineStopping Putin’s slaughter will require help from federal and state officials as well as businesses.,"March 6, 2022 04:35 pm ET"
"BusinessEnergy & Utilities Roundup: Market TalkFind insight on rigs drilling for oil in the U.S. and Canada, Constellation Energy’s acquisition of Calpine and more in the latest Market Talks covering Energy and Utilities.","January 10, 2025 04:52 pm ET"
"Heard on the StreetMacy’s Buyout Could Take a Miracle on 34th StreetA suitor has shown up at Macy’s, but given the tough environment, a deal that crosses the finish line would be a surprise gift for shareholders.","December 11, 2023 09:58 am ET"
"ChinaChina’s Economy Faces Risk of Yearslong Real-Estate HangoverChina’s aggressive campaign to root out speculative real-estate activity could slow the country’s growth rate for years to come, economists say, even if a major housing correction is averted.","November 8, 2021 07:00 am ET"
Credit MarketsArizona Sports Park’s Early Cash Crunch Squeezes BondholdersSome projects that launched when muni junk debt surged during the pandemic’s borrowing boom have struggled in a time of rising rates and slowing growth.,"September 15, 2022 10:00 am ET"
WorldJanet Yellen Visits Ukraine to Discuss Economic SupportA rare war zone trip by a U.S. Treasury secretary underlines the Biden administration’s message of commitment to Kyiv’s defense.,"February 27, 2023 05:14 pm ET"
WorldA Bank China Built to Challenge the Dollar Now Needs the DollarHow Russia’s war in Ukraine paralyzed the Brics’s New Development Bank.,"June 16, 2023 07:00 am ET"
"Paid ProgramPutting Patients First in Eye SurgeryAs the name Asami eye surgery clinic indicates, among the many ophthalmologic services the clinic offers, its speciality is eye surgery. It performed around 1,300 surgeries in 2022 after opening in 2021. Tetsu Asami, the clinic’s director, says, “We aim to contribute to community health care by providing medical services that make people think, ‘I am happy I came here.’”",Tarih bulunamadı.
Financial RegulationWashington Quietly Scrapped a Plan to Save Homeowners Thousands of DollarsA title insurance pilot program was scuttled after blowback from insurers and lawmakers.,"November 22, 2023 09:00 am ET"
BusinessVenmo to Charge Users for Selling Goods and ServicesThe payments app said it would allow the use of personal accounts for business transactions for the same fee applied to users of business profiles.,"June 26, 2021 07:00 am ET"
"WSJ ProPro VC NewsletterVC Daily: Logistics Startups Cite Suez DebacleAlthough the container ship stuck in the Suez Canal has been freed, the global supply-chain wrinkle it caused is enduring. Cue the burgeoning class of logistics startups.","March 31, 2021 09:55 am ET"
CommentaryOpinion: Climate Alarmists’ Bad ScienceAdvocates conduct shoddy research in an effort to show that warming will reduce economic growth.,"April 3, 2024 05:33 pm ET"
"Property ReportApp Deal Highlights a Push to Lure Workers Back Into OfficesReal-estate data firm VTS has agreed to buy Toronto-based Lane Technologies, an office-app developer.","October 19, 2021 05:30 am ET"
"Heard on the StreetBeijing Bets the House on InfrastructureAs Chinese factories and the housing market stumble again, the silence from Beijing is deafening.","August 1, 2022 09:40 am ET"
WSJ ProSustainable BusinessA Drop in Interest Rates Could Boost RenewablesLong-shelved capital-intensive green-energy projects could be dusted off for construction to begin—if everything goes right.,"August 22, 2024 10:20 am ET"
TechElon Musk’s xAI Startup Is Valued at $50 Billion in New Funding RoundThe artificial-intelligence company has told investors it raised $5 billion in its latest funding round.,"November 20, 2024 03:13 pm ET"
Review & OutlookOpinion: Biden Builds a Domestic Green ArmyHe’s shrinking the real Army but arming a political Climate Corps.,"April 2, 2024 05:38 pm ET"
CommentaryOpinion: Silicon Valley’s Coming Energy CrisisArtificial intelligence will put pressure on the electric grid.,"June 2, 2024 04:34 pm ET"
Risk & Compliance JournalU.K. to Put Magnifying Glass on Crypto TransfersThe country’s financial regulator laid out guidance for applying rules for traditional money transfers to those involving digital assets.,"August 17, 2023 05:33 pm ET"
Bankman-Fried Is Charged With Fraud,"December 13, 2022 05:46 am ET"
LIVE COVERAGE POSTHeard on the Street Recap: When Genius Failed,"September 22, 2023 06:05 pm ET"
"Managing Your CareerThe Colleges Where You’re Most Likely to Have a Positive Return on Your InvestmentHitting a certain income threshold after graduation makes in-state tuition worth it, even when students take on loans.","May 26, 2024 05:30 am ET"
"CFO JournalPuma Promotes Insider to CFO as Company Projects GrowthThe German sportswear maker said Wednesday Hubert Hinterseher would take over from current CFO Michael Lämmermann on June 1. Mr. Lämmermann plans to retire after 28 years with the company, including the past eight years as finance chief, but will stay on as an adviser until the end of the year, Puma said.","May 5, 2021 05:49 pm ET"
"BusinessBlue Apron Lays Off 10% of Corporate WorkforceThe meal-kit company said it plans to cut spending on marketing, consulting and labor in 2023.","December 8, 2022 10:19 pm ET"
LettersOpinion: Do U.S. Universities Have a ‘Legacy’ Problem?Racial preferences have fallen. Now what?,"July 10, 2023 02:32 pm ET"
WSJ ProPro BankruptcyResidential Solar Panel Seller Lumio Files for BankruptcyPrimary senior secured lender White Oak has offered to buy the business using roughly $100 million of the debt it is owed.,"September 3, 2024 03:24 pm ET"
Logistics ReportTrucker Kal Freight Files for Bankruptcy ProtectionThe truckload operator says it will maintain operations and restructure its business.,"December 6, 2024 04:19 pm ET"
Paid Program,Tarih bulunamadı.
"A-hedThe Absurd Tactics Soccer Fans Use  to Score a Beer at the World CupFans trek for miles and befriend strangers to try to find booze in Qatar, a country that sharply limits consumption.","December 8, 2022 10:09 am ET"
BusinessMusk Says Florida Site Could Handle Starship TestsSpaceX signaled it might conduct testing from the Kennedy Space Center complex if the FAA pursues an additional environmental review of a company facility in Texas.,"February 12, 2022 08:00 am ET"
"Artificial IntelligenceMayo Clinic, Others Use ‘AI Factories’ to Speed AI DevelopmentThe healthcare provider and other organizations are using an assembly-line approach to artificial-intelligence development, where small teams use common software tools and procedures to speed the production of AI applications while cutting costs.","May 18, 2021 05:30 am ET"
CFO JournalLevi Strauss Uses More Frequent Financial Forecasts to Confront UncertaintyThe demin company is adjusting its financial targets every six months instead of annually as it faces an uncertain economic outlook.,"July 13, 2022 05:30 am ET"
"EarningsProcter & Gamble Uses Size to Lessen Impact of Supply-Chain MessP&G, Ikea and Albertsons are among the large companies tapping alternative sources of inventory to keep shelves stocked.","October 19, 2021 04:11 pm ET"
"A-hedAuto Makers Tout the ‘Frunk:’ A Trunk in Front. But Does the Word Sound Like Swearing?It’s a cooler! Hamster holder! “Hell, you tell me how many beers you’d be able to fit in that frunk.”","May 6, 2022 09:47 am ET"
U.S.How Foil Blankets Are Used to Save  the World’s Largest TreesFirefighters are taking special precautions such as using reflective shielding to protect giant sequoias from the KNP Complex Fire in the Sierra Nevada.,"September 18, 2021 10:00 am ET"
CFO JournalCarvana Cuts Costs as Demand for Used Autos Remains Under PressureThe online used car dealer said reducing expenses is its top priority after focusing for years on aggressive sales growth.,"August 4, 2022 07:45 pm ET"
"Journal Reports: TechnologyWhen to Use a VPN—and When It Won’t Protect Your DataInternet service providers, hackers and others can collect a treasure trove of user data. VPNs can offer more privacy…sometimes.","September 6, 2022 10:00 am ET"
PoliticsJudge Strikes Down Policy Used to Expel MigrantsA federal judge said the pandemic-era policy known as Title 42 was promulgated in violation of a federal law that dictates how agencies can issue regulations.,"November 15, 2022 08:46 pm ET"
PoliticsTrump Sues Woodward Over Use of Audio RecordingsJournalist Bob Woodward used recordings of interviews with Donald Trump taken for a book in a recently released audiobook.,"January 30, 2023 07:50 pm ET"
U.S.Parts of California Not Used to Snow Have Been Buried Under It for WeeksSome officials at higher elevations are working to clear more snow than they’ve seen in their lifetimes.,"March 8, 2023 07:26 pm ET"
"Journal ReportsGolf Courses Look to Stay Green—but Using Less WaterWith many parts of the country trying to cut back on water use, courses are under pressure to reduce their thirsts.","April 6, 2023 10:00 am ET"
"BusinessT-Mobile US to Lay Off 5,000 EmployeesWireless services company plans to cut about 7% of its workforce as it fends off competition from cable companies.","August 24, 2023 10:15 am ET"
"RussiaPrigozhin’s Life on the Run: Wagner Chief Used Jets to Evade Tracking for YearsMercenary leader moved around Russia, blocked surveillance and eluded sanctions until assassination in plane crash.","August 30, 2023 08:54 am ET"
Journal Reports: TechnologyA Beginner’s Guide to Using AI: Your First 10 HoursYou’ve never used AI before. Here’s how to get started.,"May 10, 2024 01:00 pm ET"
