Headline,Date
"ObituariesDoreen M. Frasca Thrived in Muni Bonds and Funded AirportsThe advisory-firm founder, who died at age 68, made an early mark by defeating Sonia Sotomayor in a high-school election.","September 30, 2022 10:02 am ET"
The Saturday EssayLessons Learned From a Fiery Decade in L.A.I’ve seen up close what comes next for families who lose everything. There is more that we all can do to reduce the danger.,"January 10, 2025 09:00 pm ET"
"Pro VC New MoneySelf-Driving Trucking Startup Taps U.S., Chinese InvestorsSelf-driving trucking startup PlusAI raised $200 million in fresh capital from investors including several top-tier Silicon Valley venture-capital firms as well as a Chinese investment firm and automotive companies.","February 10, 2021 01:26 pm ET"
Review & OutlookOpinion: Alvin Bragg’s Political Charge Against Donald TrumpAn indictment of a former President must be for serious offenses with indisputable evidence.,"March 19, 2023 05:14 pm ET"
Risk & Compliance JournalKirstjen Nielsen Joins Web3 Compliance Platform Astra Protocol as AdviserThe crypto compliance provider’s appointment of two high-profile former Trump officials comes as the cryptocurrency industry stakes out a spot at Washington’s revolving door.,"April 27, 2022 07:00 am ET"
Pro BankruptcyBuenos Aires Bondholders Sue Over $7 Billion Debt LogjamGoldenTree Asset Management and others sought a judgment in the U.S. District Court in New York over the Argentine province’s failure to make debt payments stretching back to April of last year.,"March 23, 2021 04:25 pm ET"
"WSJ ProPro BankruptcyChristian Health Nonprofit Seeks Bankruptcy After State ProbesSharity Ministries has filed for bankruptcy, saying its reputation, finances and membership levels have suffered after New York and other states cracked down on its business model.","July 9, 2021 05:23 pm ET"
"Review & OutlookOpinion: Yes, It’s a Global Tax on American TechYellen and friends try to hide the G-7’s aims from Congress.","June 11, 2021 06:08 pm ET"
"Risk & Compliance JournalKuCoin and Its Founders Face Criminal Charges Over Money-Laundering ViolationsU.S. prosecutors have filed criminal charges against KuCoin and two of its founders, accusing the global cryptocurrency exchange of violating U.S. anti-money-laundering laws.","March 26, 2024 08:40 pm ET"
Logistics ReportDaimler Truck Unit Says Bankrupt Kal Freight Owes It Millions After Alleged FraudCreditors including Daimler Truck Financial Services say they are owed tens of millions of dollars following alleged fraud by bankrupt trucking company Kal Freight.,"December 12, 2024 05:40 pm ET"
"CFO JournalHow CFOs Are Preparing for a Potential Economic DownturnFinance chiefs are confronting the uncertain economic outlook with plans to trim variable costs and delay projects, while continuing to raise prices to offset higher expenses.","July 29, 2022 07:30 am ET"
"ObituariesGerman Immigrant Managed Marlboro Cash FlowHans Storr, who has died at age 89, rose to chief financial officer at cigarette maker Philip Morris and lined up financing for major acquisitions.","September 10, 2021 10:00 am ET"
"MarketsGovernment Climate Funding Pushes Private Sector to Make Good on PromisesBillions of dollars in federal funding for battery metals, hydrogen and carbon capture is designed to unlock more private-sector investment.","November 1, 2022 05:30 am ET"
"CFO JournalHerbalife CFO Looks to Change Investor Views After Years of Activist Pressure“We talked about Carl Icahn, Bill Ackman and all these other things, rather than the business itself,” Herbalife CFO Alex Amezquita said.","February 25, 2021 09:30 am ET"
"FinanceGoldman to Buy Specialty Lender GreenSky for $2.2 BillionGoldman will pay roughly $12 a share in stock for GreenSky, which arranges loans for big one-time purchases like construction projects or cosmetic surgery.","September 15, 2021 07:50 am ET"
"FinanceRussia Makes Bond Payment In Dollars To Avoid DefaultIn a reversal, Russia says it sent nearly $650 million to creditors just days before the country risked toppling into default.","April 29, 2022 02:02 pm ET"
"CFO JournalCFO Journal Summer Reads: 10 Book RecommendationsThe reading list includes tomes on data privacy, the downside of managing through fear, an ‘inspirational story of hard work’ and more.","May 26, 2023 05:30 am ET"
My RideHe Fixed 180 iPhones So He Could Rescue One BMWA young tinkerer got an education while financing and rebuilding his 1989 635CSi.,"December 15, 2023 05:00 pm ET"
"EconomyBond Trading by China’s PBOC Wouldn’t Be Quantitative Easing, Gov. SaysTrading in bonds by China’s central bank wouldn’t be a form of massive monetary easing, according to its governor, as he responded to speculation that Beijing is eyeing the unconventional policy tool to prop up the economy.","June 19, 2024 12:49 am ET"
CFO JournalTyson Foods Promotes Chairman’s Son to CFO RoleTyson promoted the chairman’s son to be its new finance chief as the meat producer navigates higher costs for worker wages and animal feed.,"September 27, 2022 05:49 pm ET"
"Paid ProgramHelping Seniors Fend Off HomelessnessAs America’s aging population faces increasing housing insecurity, this holistic program offers a scalable solution.",Tarih bulunamadı.
WSJ ProPro Bankruptcy NewsletterPro Bankruptcy Briefing: Sizing Up Evergrande; Ozy Media Shuts Down; Junk Loans Feed Private-Equity DividendsChina’s Evergrande debt crisis: sizing up a big mess. Analysts have generally said an Evergrande default wouldn’t spur a crisis of confidence like the one that followed the Lehman Brothers collapse.,"October 4, 2021 09:53 am ET"
WSJ ProPro VC Industry NewsBlood-Testing Startups Thrive Despite Theranos ImplosionBut the scandal has made investors more circumspect in evaluating the science behind new products.,"January 5, 2022 05:30 am ET"
Review & OutlookOpinion: The 2025 ‘Tax Armageddon’Democrats in Congress say they’ll hold middle-class tax cuts hostage to a huge overall tax increase.,"June 23, 2024 03:16 pm ET"
CommentaryOpinion: Federal Revenue Did Well Under the Trump Tax CutDemocrats are touting a GAO report as evidence that corporations don’t pay up. They’re wrong.,"February 9, 2023 01:49 pm ET"
"Pro VC Industry NewsSilicon Valley Bank Gets Back to Lending, Albeit at Slower PaceAs overall venture debt contracts, the paths to funding for startups are squeezed.","July 5, 2023 07:00 am ET"
"DealsXerox to Buy Printer Maker Lexmark From Chinese OwnersThe deal values closely held Lexmark at $1.5 billion, including debt.","December 23, 2024 09:08 am ET"
"BusinessBed Bath & Beyond Says CFO Gustavo Arnal Found DeadThe 52-year-old executive died by suicide two days after he had briefed investors on the home-goods retailer’s plans to secure new financing, slash jobs and close about a fifth of its stores.","September 4, 2022 08:58 pm ET"
"WorldU.S. Plan to Ramp Up Carbon Credits Faces Doubts at COP27Climate envoy John Kerry outlined a carbon-credit plan that aims to pump billions of dollars into developing countries’ energy transition, while some businesses expressed caution over investing in the program.","November 9, 2022 11:25 am ET"
"BusinessFinance Firms Back Push to Diversify Wall StreetThe CUNY Futures in Finance initiative will provide internship opportunities, career-development staff and help with postcollege hiring.","August 12, 2021 06:30 am ET"
"WSJ ProPro VC NewsletterVC Daily: Question of the Week: What Are Lessons From High-Profile Exits?Last week, we asked how firms are managing soaring valuations in investing strategies.","April 30, 2021 10:08 am ET"
"ChinaHong Kong’s Struggle to Lure Bankers Dims Its Role as a Global Finance HubAs the region’s top networking center, Hong Kong’s reputation continues to suffer as Covid controls keep international bankers and investors away.","June 26, 2022 07:00 am ET"
"Sustainable Business ResearchScope 3 Emissions: What Businesses Need to KnowMeasuring and reducing Scope 3 emissions is a significant challenge for most organizations. This paper provides an introduction to what Scope 3 emissions consist of, why businesses track them and insights from sustainability practitioners on starting a Scope 3 measurement program.","June 16, 2023 02:26 pm ET"
"Pro VC Industry NewsEuropean Startups Enter the Megadeal EraA dozen European startups have raised financing rounds of $500 million or greater this year, the most on record.","June 23, 2021 06:30 am ET"
"BusinessWhite-Collar Employee Salaries Start to SwellProfessionals toward the end of 2021 saw compensation jump at the fastest rate in nearly 20 years, with sectors including law and finance reaping significant gains.","December 26, 2021 05:30 am ET"
"Pro BankruptcyPuerto Rico Board’s Director to Resign After Landmark Debt DealNatalie Jaresko, who restructured Ukraine’s debt before Puerto Rico’s, is resigning effective April 1.","February 3, 2022 11:06 am ET"
"EconomyGlobal Tax Deal Was a Win for Yellen, Who Now Must Persuade CongressTreasury Secretary Janet Yellen, credited with reviving talks to clamp down on tax avoidance by multinational firms, must now navigate more complex negotiations.","July 8, 2021 04:18 pm ET"
FinanceA Poor Province in China Splurged on Bridges and Roads. Now It’s Facing a Debt Reckoning.Guizhou province has jaw-dropping landscapes and some of the world’s highest bridges—and outstanding debt of about 1.3 times its gross domestic product.,"May 21, 2023 11:40 pm ET"
"CorrectionsCorrections & AmplificationsCorrections & Amplifications for the edition of April 27, 2022.","April 27, 2022 12:01 am ET"
LIVE COVERAGE POSTThe Fed Is Lending Again,"December 6, 2023 03:26 pm ET"
Paid ProgramCash Conscious: The New Rules of Savvy SpendingDiscover how strategic budgeting and clever cash-back tactics can help you navigate the rising tide of costs.,Tarih bulunamadı.
"WSJ ProPro VC NewsletterVC Daily: Question of the Week: What Are Lessons From High-Profile Exits?Last week, we asked how firms are managing soaring valuations in investing strategies.","April 30, 2021 10:08 am ET"
"Pro VC Industry NewsEuropean Startups Enter the Megadeal EraA dozen European startups have raised financing rounds of $500 million or greater this year, the most on record.","June 23, 2021 06:30 am ET"
"BusinessWhite-Collar Employee Salaries Start to SwellProfessionals toward the end of 2021 saw compensation jump at the fastest rate in nearly 20 years, with sectors including law and finance reaping significant gains.","December 26, 2021 05:30 am ET"
"Heard on the StreetCertain Biotech Investors Get an Early Look at Results. Is That Fair?Private investments in public equities, or PIPEs, are all the rage in biotech, but some investors resent the sharing of nonpublic information.","April 15, 2024 05:30 am ET"
"CorrectionsCorrections & AmplificationsCorrections & Amplifications for the edition of April 27, 2022.","April 27, 2022 12:01 am ET"
"Bitcoin Price Tops $70,000","March 8, 2024 01:00 pm ET"
LIVE COVERAGE POSTThe Fed Is Lending Again,"December 6, 2023 03:26 pm ET"
"Pro BankruptcyPuerto Rico Board’s Director to Resign After Landmark Debt DealNatalie Jaresko, who restructured Ukraine’s debt before Puerto Rico’s, is resigning effective April 1.","February 3, 2022 11:06 am ET"
"EconomyGlobal Tax Deal Was a Win for Yellen, Who Now Must Persuade CongressTreasury Secretary Janet Yellen, credited with reviving talks to clamp down on tax avoidance by multinational firms, must now navigate more complex negotiations.","July 8, 2021 04:18 pm ET"
FinanceA Poor Province in China Splurged on Bridges and Roads. Now It’s Facing a Debt Reckoning.Guizhou province has jaw-dropping landscapes and some of the world’s highest bridges—and outstanding debt of about 1.3 times its gross domestic product.,"May 21, 2023 11:40 pm ET"
CFO JournalPatrick Industries Names Andy Roeder as CFOExecutive most recently served as finance chief of Polaris’s boats unit.,"March 5, 2024 09:52 am ET"
LIVE COVERAGE POSTNYCB Stock Rises After Bank Cuts Dividend,"March 7, 2024 11:17 am ET"
"Pro VC FundsFemHealth Ventures Seeks $50 Million for Women’s Health InvestmentsLaunched in 2020, FemHealth Ventures plans to invest in drug, medical-technology and digital-health startups in women’s health.","May 27, 2021 06:00 am ET"
"FinanceWest Virginia Gov. Jim Justice Strikes Deal Over Greensill DebtThe agreement with Credit Suisse will remove a debt overhang for the governor, who personally guaranteed $850 million in loans.","June 24, 2022 01:32 pm ET"
FinanceA Big Risk Hanging Over European Banks: Leveraged LoansEurope’s banking regulator is growing antsy about a booming market for banks: loans that fuel riskier borrowers and the global deal-making machine.,"April 28, 2022 05:08 am ET"
"WSJ ProSustainable BusinessFree Climate Data Platform to Offer Sneak Peek at COP28Businesses working on how to report their sustainability data are focused on the handful of mandatory reporting standards coming from regulators around the globe, but there is another project that might be worth watching—the net zero data public utility, or NZDPU.","November 30, 2023 03:00 am ET"
WSJ ProPro Cyber NewsUnitedHealth Braces for Capitol Hill GrillingChief Executive Andrew Witty is expected to testify before House and Senate committees Wednesday about the Change Healthcare hack.,"April 30, 2024 02:56 pm ET"
"WSJ ProPro VC New MoneyConcertAI, a Startup Focused on Cancer Research, Raises $150 MillionThe firm uses AI to match patients to specific clinical trials, and to make jumbled medical data AI-ready to sift for more insights. Sixth Street provided funding that values the firm at $1.9 billion","March 29, 2022 06:30 am ET"
WorldState Department Recognizes Türkiye as Turkey’s Formal NameAnkara had requested nations use the Turkish language name rather than anglicized spelling and pronunciation.,"January 6, 2023 10:17 am ET"
Paid Program,Tarih bulunamadı.
WSJ ProPro Cyber NewsUnitedHealth Braces for Capitol Hill GrillingChief Executive Andrew Witty is expected to testify before House and Senate committees Wednesday about the Change Healthcare hack.,"April 30, 2024 02:56 pm ET"
"WSJ ProPro VC New MoneyConcertAI, a Startup Focused on Cancer Research, Raises $150 MillionThe firm uses AI to match patients to specific clinical trials, and to make jumbled medical data AI-ready to sift for more insights. Sixth Street provided funding that values the firm at $1.9 billion","March 29, 2022 06:30 am ET"
WorldState Department Recognizes Türkiye as Turkey’s Formal NameAnkara had requested nations use the Turkish language name rather than anglicized spelling and pronunciation.,"January 6, 2023 10:17 am ET"
FinanceFranklin Resources to Acquire Putnam Investments From Great-West LifecoAsset manager Franklin will pay as much as $1.3 billion in stock and cash.,"May 31, 2023 02:50 pm ET"
WSJ ProPro BankruptcyMeme Traders Face Hefty Losses After Bed Bath & Beyond’s Bankruptcy FilingBed Bath & Beyond raised more than $400 million in its final months from selling stock before filing for chapter 11 bankruptcy. The individual investors behind much of that last-ditch financing are likely to be left holding the bag.,"April 25, 2023 07:19 pm ET"
BusinessDollar Tree CFO Departs; Raises Full-Year Sales ViewDollar Tree is parting ways with its top finance executive a month after its CEO stepped down. The discount retailer has also raised its full-year sales guidance in light of strong third-quarter results.,"December 4, 2024 08:32 am ET"
WSJ ProPro PE Commentary AnalysisLack of Leverage Leads Buyout Shops to Purchase Minority StakesThe absence of cheap debt is resulting in a comeback for a deal type largely unseen since the financial crisis,"January 3, 2023 06:00 am ET"
"Pro PE Industry NewsPrivate-Equity-Owned Businesses Confront Hiring Hurdles for Key RolesNearly half of private-equity fund managers and portfolio-company finance chiefs say private-equity-owned businesses are understaffed, including key finance positions, according to a recent survey.","June 27, 2023 06:30 am ET"
"Latin AmericaU.S. Bars Former Honduran President Hernández From EntryThe State Department said it included Juan Orlando Hernández on its Corrupt and Undemocratic Actors list in July, citing alleged acts of corruption and illicit campaign financing.","February 7, 2022 09:34 pm ET"
Pro PE Fund NewsSixth Street Collects $4.4 Billion to Capitalize on Market DisruptionThe firm has raised a $3.6 billion late-stage software growth fund and an $800 million companion fund focused on smaller midstage deals.,"November 3, 2022 07:00 am ET"
"Pro VC Industry NewsLPs Doubt Venture Funds’ Startup ValuationsInvestors in venture funds are scrutinizing unrealized returns for overly optimistic projections, slowing down fundraising processes.","January 2, 2024 06:00 am ET"
ChinaChina Raises $48 Billion for Semiconductor FundBeijing is aiming to increase its chip-making capabilities in the face of an escalating technology competition with the U.S.,"May 27, 2024 09:18 am ET"
"CommentaryOpinion: The FEC Has No Business Regulating AICongress had given us no authority to pass such rules, and we lack the expertise.","August 13, 2024 05:10 pm ET"
"WSJ ProPro VC NewsletterVC Daily: Tiger Global Backs Logistics Startup in Latest Vote of Confidence in SectorVenture investors’ recent interest in logistics startups looks to be continuing into the holiday season, a time when shipping backlogs put the supply-chain crunch on full display.","December 13, 2021 10:01 am ET"
Real EstateHome Buyers Get Creative With Cash Deals to Fend Off High Mortgage RatesCash-only deals are on the rise as buyers look for ways to circumvent 20-year-high interest rates.,"November 10, 2022 07:00 am ET"
Saudi Sovereign-Wealth Fund Reveals Finances for First Time Ahead of Bond Sale,"September 28, 2022 12:15 pm ET"
"CFO JournalUtz Promotes Accounting Executive to CFO Role Amid Broader ReshufflingAjay Kataria is set to succeed Cary Devore, who has been named chief operating officer.","July 26, 2021 04:14 pm ET"
"WorldOECD Selects Australia’s Cormann as Next Secretary-GeneralThe former finance minister listed a range of goals for the OECD, including pushing for a multilateral approach to digital taxation and effective action to reach net-zero greenhouse gas emissions by 2050.","March 12, 2021 06:53 pm ET"
"WSJ ProPro BankruptcyBankrupt Construction Startup Katerra Approved to Tap SoftBank LoanAt a virtual hearing late Monday, lawyers for Katerra and SoftBank reached a compromise with lawyers for unsecured creditors who had been urging the company to seek alternative sources of financing.","July 20, 2021 05:20 pm ET"
CFO JournalFood-Delivery Startup Wonder Names Blackstone Alum as CFOKelley Morrell was named finance chief as Marc Lore’s food-delivery business prepares to raise capital and someday join the public markets.,"June 21, 2023 11:33 am ET"
Paid ProgramChina’s Emerging Market for Home-Based Senior CareHow a major insurance company delivers seamless in-home support for China's aging population.,Tarih bulunamadı.
Cheerios Maker's Debt Prices Sink After Child Labor Allegations,"March 7, 2023 12:30 pm ET"
Eli Lilly Is Worried That the Novo-Catalent Deal Could Dent Its Ability to Make Drugs,"February 6, 2024 12:14 pm ET"
LIVE COVERAGE POSTAmerican Airlines Picks Citi as Sole Credit-Card Issuer,"December 5, 2024 09:32 am ET"
"CFO JournalHow CFOs Are Preparing for a Potential Economic DownturnFinance chiefs are confronting the uncertain economic outlook with plans to trim variable costs and delay projects, while continuing to raise prices to offset higher expenses.","July 29, 2022 07:30 am ET"
"WSJ ProPro PE NewsletterPE Daily: Raine’s Beachbody Snagged by SPAC | SEC Seeks Monitor to Protect GPB Capital InvestorsIn what could be seen as a refreshing instance of putting money where the mouth is, more than two-thirds of the privately held companies polled by Navex Global Inc. said they have environmental, social and governance programs in place, our colleague Dieter Holger reports. Almost 80% of the businesses backed by private-equity and venture capital say the same. And when publicly traded companies are included, more than three-fifths say they expect to spend more on ESG initiatives this year.","February 10, 2021 09:06 am ET"
"CFO JournalHerbalife CFO Looks to Change Investor Views After Years of Activist Pressure“We talked about Carl Icahn, Bill Ackman and all these other things, rather than the business itself,” Herbalife CFO Alex Amezquita said.","February 25, 2021 09:30 am ET"
"FinanceGoldman to Buy Specialty Lender GreenSky for $2.2 BillionGoldman will pay roughly $12 a share in stock for GreenSky, which arranges loans for big one-time purchases like construction projects or cosmetic surgery.","September 15, 2021 07:50 am ET"
"FinanceRussia Makes Bond Payment In Dollars To Avoid DefaultIn a reversal, Russia says it sent nearly $650 million to creditors just days before the country risked toppling into default.","April 29, 2022 02:02 pm ET"
"CFO JournalCFO Journal Summer Reads: 10 Book RecommendationsThe reading list includes tomes on data privacy, the downside of managing through fear, an ‘inspirational story of hard work’ and more.","May 26, 2023 05:30 am ET"
My RideHe Fixed 180 iPhones So He Could Rescue One BMWA young tinkerer got an education while financing and rebuilding his 1989 635CSi.,"December 15, 2023 05:00 pm ET"
"EconomyBond Trading by China’s PBOC Wouldn’t Be Quantitative Easing, Gov. SaysTrading in bonds by China’s central bank wouldn’t be a form of massive monetary easing, according to its governor, as he responded to speculation that Beijing is eyeing the unconventional policy tool to prop up the economy.","June 19, 2024 12:49 am ET"
"CorrectionsCorrections & AmplificationsCorrections & Amplifications for the edition of Oct. 1, 2024","September 30, 2024 06:59 pm ET"
AsiaPakistan Clinches $3 Billion in IMF Rescue LendingThe International Monetary Fund program should see the cash-strapped country through its election period and installation of a new government.,"June 30, 2023 12:32 pm ET"
The AmericasOpinion: A Crack Appears in Cuba’s DictatorshipA regime leak to the Miami Herald reveals that the Havana elite is hoarding billions.,"January 5, 2025 04:09 pm ET"
Risk & Compliance JournalSkycity’s Adelaide Casino Faces Money-Laundering InvestigationCasino operator Skycity Entertainment said an Australian regulator is investigating potential serious breaches of anti-money laundering and terrorism-financing laws at its Adelaide casino.,"June 7, 2021 07:21 pm ET"
U.S. EconomyJanice Eberly Seen as Leading Candidate for Fed Vice ChairThe finance professor at Northwestern University is the leading candidate for the No. 2 job at the Federal Reserve.,"March 8, 2023 10:11 pm ET"
LIVE COVERAGE POSTGrayscale Moves Forward With Spot Bitcoin ETF Plan,"October 19, 2023 04:15 pm ET"
"Anthony Scaramucci Predicts Bitcoin Could Reach $100,000 This Year","March 11, 2024 04:49 pm ET"
Going 'Ex-China' Was a Big Winner For Emerging Markets Investors,"December 29, 2023 05:00 am ET"
"CFO JournalThe Disney CFO Who Raised Concerns About Bob Chapek Has Respect on the StreetChristine McCarthy, Walt Disney’s longtime finance chief, took an unusual step when she expressed a lack of confidence in the chief executive to directors of the entertainment giant.","November 25, 2022 04:26 pm ET"
Paid ProgramCash Conscious: The New Rules of Savvy SpendingDiscover how strategic budgeting and clever cash-back tactics can help you navigate the rising tide of costs.,Tarih bulunamadı.
"BusinessAtos Considers Four Restructuring OffersAtos said the proposals were from a group of bondholders and banks, Bain Capital, EP Equity Investment and Onepoint, adding that it had signed a $108 million interim financing deal with bondholders.","May 6, 2024 01:41 am ET"
"Central BanksBrazil’s Central Bank Intensifies Battle Against Sky-High Borrowing CostsA 20% annual rate on a credit card might seem usurious to an American consumer, but Brazilian cardholders face an average annual percentage rate of 346% on their plastic.","April 27, 2022 05:33 am ET"
BusinessRival Group Makes Roughly $680 Million Bid for TribuneA Maryland hotel magnate and a Swiss billionaire have made a bid for Tribune Publishing that the newspaper chain is expected to favor over a takeover deal it struck with hedge fund Alden Global Capital.,"April 4, 2021 05:43 pm ET"
"CFO JournalAfter Wirecard, Germany’s Proposed Audit Overhaul Worries Finance ExecutivesAuditors and finance chiefs of some of Germany’s biggest businesses are worried that a new regulatory proposal intended to improve audit quality in the wake of the Wirecard scandal will lead to higher costs and less competition.","April 8, 2021 04:00 am ET"
"CFO JournalCFO Pay Rises as Their Companies Navigate Coronavirus PandemicMedian pay for finance chiefs at the largest U.S. companies rose 7% in total during the 2020 fiscal year, largely driven by stock-based compensation.","April 15, 2021 08:00 am ET"
"FashionThe Anti-Status Watch: Why Men in Finance Love Cheap, Cheesy WatchesThe ultimate trading-floor flex? A Snoopy Swatch. Or a Casio calculator. Why lots of money men (still) favor novelty watches.","October 10, 2024 04:15 pm ET"
"PoliticsDemocrats Float Taxes 
		
			
		
	on Partnerships, BuybacksSenators are giving details on two proposals that could generate money for the $3.5 trillion spending bill as support for a major increase in the capital-gains tax wanes.","September 10, 2021 01:37 pm ET"
"TechTech, Media & Telecom Roundup: Market TalkFind insight on Corus Entertainment, Rogers Communications, NetEase and more in the latest Market Talks covering Technology, Media and Telecom.","October 25, 2024 04:56 pm ET"
