Headline,Date
"FinanceMidsize Companies Are Big Business for Wall Street’s MegabanksWith fewer large deals, banks including JPMorgan are earning more fees from smaller outfits.","June 17, 2024 09:00 am ET"
"Election 2024What Happens Next Now That Biden Has Dropped Out?The president said he is ending his re-election campaign, kicking off a frantic process to replace the incumbent at the top of the Democratic Party’s ticket for November.","July 22, 2024 01:40 pm ET"
"TechAmazon, Others Race to Buy Up Renewable EnergyThe race to secure electricity deals for power-hungry data centers has tech companies reshaping the renewable-energy market and grappling with a new challenge: how to ensure their investments actually reduce emissions.","June 23, 2021 06:58 am ET"
"WSJ ProPro VC NewsletterVC Daily: Imperative Care Corrals $260 Million for Stroke TreatmentImperative Care Inc., a startup led by entrepreneur Fred Khosravi, has raised $260 million in new capital with a goal of providing a series of medical technologies to stroke patients.","July 15, 2021 09:05 am ET"
"CorrectionsCorrections & AmplificationsCorrections & Amplifications for the edition of Oct. 18, 2023","October 17, 2023 06:47 pm ET"
"CorrectionsCorrections & AmplificationsCorrections & Amplifications for the edition of Oct. 25, 2024.","October 24, 2024 06:05 pm ET"
Paid ProgramDefending the Enterprise Means Seeing the FieldLeverage the power of prevention with over-the-horizon visibility and high fidelity convictions of known and unknown threats.,Tarih bulunamadı.
Pro PE Commentary AnalysisKreutzer’s Take: Covid Adds to Job Worries of Portfolio-Company CFOsChief financial officers at private equity-backed companies faced more pressure from owners who emphasized growth as the economy rebounded from Covid last year.,"January 12, 2022 11:38 am ET"
"AfricaZambia’s Opposition Wins Surprise Landslide as Defaulting Economy ReelsHakainde Hichilema was elected president of Africa’s second-largest copper producer, defeating incumbent Edgar Lungu, a close Beijing ally, and marking the first election loss for a sitting African president for two years.","August 16, 2021 07:41 am ET"
Heard on the StreetTuro Wants All Your RidesThe Airbnb for car sharing has filed to go public at a time when it is difficult and expensive to get around.,"October 5, 2021 02:27 pm ET"
"WSJ ProPro Bankruptcy NewsletterPro Bankruptcy Briefing: Air Force One Contractor GDC Technics Ducks Liquidation ThreatAir Force One supplier GDC Technics, which faces an angry customer in Boeing, struck a deal with unsecured creditors, providing them cash in return for their support for a restructuring.","June 25, 2021 09:13 am ET"
CommentaryOpinion: Illinois Democrats Play Politics With the State’s ElectricityTheir climate bill would raise prices and kill jobs in heavily Republican southern counties.,"July 16, 2021 12:45 pm ET"
"The AmericasOpinion: The EU Funds Havana—and Helps MoscowEuropean aid may seem small, but the Cuban regime is desperate for hard currency.","September 1, 2024 12:30 pm ET"
Bookshelf‘The Rise of the Rest’ Review: Startups Across AmericaAn AOL co-founder travels by bus on a series of tours around the country in search of local entrepreneurship.,"September 11, 2022 04:30 pm ET"
"Pro Bankruptcy InternationalEvergrande Creditors Demand Further Explanation for Billions in Seized CashOffshore creditors want additional information about the seizure of nearly $2 billion by local banks that could explain how Evergrande pledged the funds without investors’ knowledge, according to people familiar with the matter.","July 27, 2022 06:52 pm ET"
Europe Markets‘Doom Loop’ Fears Put Italian Banks to the TestThe European Central Bank is expected to unveil a program to shield indebted economies. Italian bank shares will be a test of the plan’s success.,"July 5, 2022 05:30 am ET"
"Heard on the StreetU.K. Meltdown Shows Why Investors Should Watch Currencies, Not BondsThe Bank of England’s gilt-market intervention underlines how governments can always borrow more. It is their powerlessness over exchange rates that ultimately binds them.","September 29, 2022 07:25 am ET"
WorldNew Zealand’s Inflation Challenge Worsened by Cyclone GabrielleThe country’s central bank raised interest rates by half a percentage point as it assesses the impact of recent storms on the economy.,"February 22, 2023 12:54 am ET"
FinanceYour Next Greece Getaway Could Be at a Hotel Owned by Goldman SachsGoldman bought three hotels overlooking the Aegean Sea. Next up: a renovation and a new brand.,"April 1, 2023 05:30 am ET"
"Pro VC Industry NewsVenture Fundraising in Healthcare Rises as Investment in Startups SlowsLooking past recent negative returns, VCs bet that biomedical innovation coupled with declining startup valuations will one day yield fat profits.","May 25, 2023 06:00 am ET"
"FinanceBrought to You by BlackRock: Airports, Pipelines and Data CentersThe world’s largest asset manager has ambitions beyond index funds.","January 31, 2024 05:30 am ET"
"CorrectionsCorrections & AmplificationsCorrections & Amplifications for the edition of May 27, 2022.","May 26, 2022 08:34 pm ET"
"CorrectionsCorrections & AmplificationsCorrections & Amplifications for the edition of Sept. 8, 2023","September 7, 2023 07:03 pm ET"
"CorrectionsCorrections & AmplificationsCorrections & Amplifications for the edition of March 17, 2023.","March 16, 2023 09:09 pm ET"
"CorrectionsCorrections & AmplificationsCorrections & Amplifications for the edition of Oct. 19, 2024","October 18, 2024 07:57 pm ET"
Paid ProgramSilicon Valley’s Green Computing RevolutionData centers are a major source of energy consumption. Efficient server architecture can preserve resources and benefit the bottom line. Click to learn more. #supermicro,Tarih bulunamadı.
LIVE COVERAGE POSTWhat Does the Government Have to Prove to the Jury in the Bankman-Fried Trial?,"October 26, 2023 01:45 pm ET"
Russian Crude Price Cap Versus Recent Price History,"December 2, 2022 03:03 pm ET"
New York Community Bancorp Stock Keeps Falling,"March 4, 2024 12:57 pm ET"
LIVE COVERAGE POSTWhat Is JD Vance’s Net Worth?,"October 1, 2024 05:00 pm ET"
CommentaryOpinion: There’s a Climate Solution in Dairy Cows’ StomachsA new partnership will work to reduce methane emissions from production of milk around the world.,"January 16, 2023 09:00 pm ET"
WSJ ProPro PE DealsThoma Bravo Backs User-Experience Company UserZoomThe software investor is acquiring a majority stake in the developer of programs used to refine digital experiences.,"March 2, 2022 07:00 am ET"
DealsStonepeak and Charging Firm Nuvve Want to Electrify School BusesThe private-equity firm is forming a joint venture with a newly public supplier of charging technology.,"May 17, 2021 01:52 pm ET"
"CommentaryOpinion: The Federal Reserve Is Too Cautious on Quantitative TighteningWhen payments to banks are delayed, they’ll know it’s time to stop reducing its balance sheet.","June 3, 2024 05:23 pm ET"
CommentaryOpinion: Why I Changed My Mind About Online ID VerificationIt wouldn’t affect privacy much and can prevent election interference.,"September 19, 2023 05:30 pm ET"
"WSJ ProSustainable BusinessG-7 Calls for Making Climate-Change Reporting CompulsoryThe Group of Seven leading nations have taken a step closer to the goal of establishing global standards for disclosing corporate environmental data, which investors increasingly want.","June 7, 2021 11:43 am ET"
"Heard on the StreetShopify’s Fate Is Tied to That of Small BusinessesShopify is selling a post-pandemic growth narrative, but not everyone is buying it.","February 17, 2021 10:07 am ET"
"MarketsEl Salvador to Issue ‘Bitcoin Bond’ Next YearThe Central American country, the first to adopt bitcoin as a national currency, aims to raise $1 billion to buy bitcoin and invest in bitcoin-related infrastructure.","November 22, 2021 06:59 pm ET"
WSJ ProPro PE Fund NewsProvidence Strategic Growth Pitches $1 Billion Continuation FundThe Boston-based firm is pitching its Encore fund to the largest investors in its flagship funds.,"April 5, 2021 04:17 pm ET"
"BusinessPatagonia Founder Is Giving Away Company to Fight Climate ChangeRather than sell the company or take it public, Yvon Chouinard said the outdoor clothing brand he founded nearly 50 years ago will be owned by a trust and a nonprofit organization.","September 14, 2022 07:25 pm ET"
"Pro VC MA IPOsSurf Air Mobility Lists Shares, Giving Hope That a Key Venture Exit Door Is ReopeningThe air charter company’s direct NYSE listing, despite closing 84% lower than the reference price, is the latest sign of a thaw in the market for stock debuts.","July 27, 2023 04:50 pm ET"
"Pro VC Industry NewsMedical-Robotics Startup Mendaera Raises $73 Million for Market LaunchStartup Mendaera has secured $73 million in new venture capital to use robotics in biopsies and other common medical procedures, another sign of investor interest in applying the technology more widely in healthcare.","September 26, 2024 06:00 am ET"
"Risk & Compliance JournalU.S. Sanctions Gazprombank, Dozens of Other Russian InstitutionsThe energy-focused bank, which had until now been spared from sanctions, is helping pay for Russia’s war in Ukraine, U.S. officials said.","November 21, 2024 01:58 pm ET"
"Paid ProgramTransforming Retail With AI—From Edge to CloudWhy a customized, edge-to-cloud approach to infrastructure makes sense.",Tarih bulunamadı.
"CryptocurrencyFTX’s Sam Bankman-Fried Charged With Criminal Fraud, ConspiracyU.S. prosecutors, in an indictment unsealed Tuesday, accused the crypto exchange’s founder of a scheme to defraud customers and his hedge fund’s lenders.","December 13, 2022 10:42 pm ET"
"StreetwiseA Recession Signal Is Flashing Red. Or Is It?When the yield curve turns positive, the country is usually about to plunge into recession. Hope this time relies on a few historical exceptions.","September 11, 2024 05:30 am ET"
"FinanceSEC Probes Trading Affiliates of Crypto Giant Binance’s U.S. ArmThe regulator is interested in trading firms with links to Binance’s founder, people familiar with the probe say.","February 15, 2022 01:02 pm ET"
Sustainable BusinessLab-Grown Meat Producer Upside Foods Raises $400 MillionAbu Dhabi Growth Fund and Baillie Gifford are among Series C investors as cultivated-meat producers seek U.S. regulatory approval.,"April 21, 2022 08:30 am ET"
"Heard on the StreetCrypto Winter May Be Harsh for CoinbaseThe company plans to invest even if crypto activity continues to fall, but investors may not have the same patience.","May 11, 2022 11:34 am ET"
"Media & MarketingPopular Science Owner Recurrent Raises $300 Million in Blackstone-Led RoundThe media firm, which also counts Domino and Outdoor Life among its publishing brands, plans to use proceeds to fund acquisitions.","May 18, 2022 09:00 am ET"
"Cross CountryOpinion: The A’s Need a Home. May I Suggest Oakland?In Las Vegas, they’d be one nightlife attraction among many. Here they have a big market and loyal fan base.","June 9, 2023 05:53 pm ET"
"Experience ReportLawsuits Over Digital Accessibility for People With Disabilities Are RisingThe number of U.S. lawsuits alleging that websites, apps and digital videos were inaccessible to people with disabilities rose 64% in the first half of 2021 from a year earlier, a new report says.","July 15, 2021 01:10 pm ET"
"WSJ ProPro Cyber NewsData Recovery Startup HYCU Bags $87.5 Million in FundingData-protection startup HYCU Inc. has raised $87.5 million in Series A funding, making it the latest cloud-focused firm to secure a large capital investment in a hot market for enterprise technology.","March 30, 2021 05:30 am ET"
Heard on the StreetSandemonium Can Lift This Company’s StockU.S. Silica Holdings is back from a near-death experience and has a long runway ahead as oil and gas drilling booms.,"August 10, 2022 07:03 am ET"
"Heard on the StreetReaching Consumers the Goldman WayA realigning of reporting units emphasizes that the firm aims to keep adding deposits and loans, even if it won’t be doing it the same way.","October 18, 2022 04:31 pm ET"
WSJ ProPro VC Industry NewsFirst Republic’s Seizure Adds to Venture Investors’ Banking ConcernsFailed bank has been a cornerstone of the entrepreneurial ecosystem.,"May 1, 2023 09:12 am ET"
"RussiaThe Crypto Exchange Moving Money for Criminal Gangs, Rich Russians and a Hamas-Linked Terror GroupGarantex’s international pipeline helps defy Treasury sanctions by channeling rubles to crypto to dollars. Customers line up with bags of cash.","October 13, 2023 09:34 am ET"
"CIO JournalDatabricks to Move Signature Data-Storage Technology Upgrades to Open SourceData-analytics company Databricks plans to switch to open source all of the capabilities and upgrades it has made to Delta Lake, its flagship cloud-based data-storage technology, essentially giving them away online free.","June 28, 2022 12:00 pm ET"
CIO JournalThe AI Boom Is Here. The Cloud May Not Be Ready.Traditional cloud infrastructure wasn’t designed to support large-scale artificial intelligence. Hyperscalers are quickly working to rebuild it.,"July 10, 2023 12:00 pm ET"
HealthMake America Ageless: Trump’s Health Picks Take Longevity Movement MainstreamAntiaging scientists and entrepreneurs hope the new administration will make it easier to develop treatments.,"January 15, 2025 12:01 am ET"
"WSJ ProPro PE NewsletterPE Daily: BlackRock Banks $1.67 Billion | Investors Get Choosy | Pennsylvania Pension Holds Off on Investments | LightBay Takes Aim at $800 MillionAs we draw near the end of this year’s first half, the pace of dealmaking shows little sign of slowing. Whether the summer months will bring a lull remains to be seen.","June 14, 2021 08:58 am ET"
"WSJ ProPro VC NewsletterVC Daily: Question of the Week: Will Space Go Mainstream?Last week, WSJ Pro Venture Capital asked if you were less likely to sell startup shares on a secondary exchange now that IPOs and SPACs are booming.","February 19, 2021 09:17 am ET"
FinanceNineDot Lands Carlyle Investment for New York Battery ProjectsThe private-equity firm spent over $100 million in December on separate investments in NineDot and Fermata Energy as it expands into the market for large-scale electricity storage.,"January 14, 2022 07:00 am ET"
Review & OutlookOpinion: Biden Signs Up for Climate ReparationsThe latest shakedown is a new fund to pay poor countries for supposed damage caused by Western use of fossil fuels.,"November 20, 2022 04:21 pm ET"
"Paid ProgramThe New Wave of Healthcare: Empowering Patients With TechnologyWith digital health solutions, patients can make better and faster decisions about their health.",Tarih bulunamadı.
"Risk & Compliance JournalU.S. Sanctions Gazprombank, Dozens of Other Russian InstitutionsThe energy-focused bank, which had until now been spared from sanctions, is helping pay for Russia’s war in Ukraine, U.S. officials said.","November 21, 2024 01:58 pm ET"
Review & OutlookOpinion: Biden’s Strange Help for CubaWhy aid the struggling anti-American regime in Havana now?,"May 19, 2022 06:29 pm ET"
"WSJ ProPro Bankruptcy Data TablesFirm Retention Summary: Flexible Funding LLCThis is a summary of a request from Flexible Funding LLC to hire Forshey & Prostok LLP as attorneys, filed Oct. 6 with the U.S. Bankruptcy Court in Fort Worth, Texas.","October 13, 2021 07:06 pm ET"
"EarningsHarley-Davidson Earnings Boosted by Higher ShipmentsThe motorcycle company said global shipments rose 18% from a year before, sending total revenue up 12%.","February 2, 2023 07:55 am ET"
LIVE COVERAGE POSTHeard on the Street Tuesday Recap: Peaks and Troughs,"March 6, 2024 09:12 am ET"
U.K. Government Wants to Disqualify Lex Greensill as a Director,"March 7, 2024 12:15 pm ET"
"CorrectionsCorrections & AmplificationsCorrections & Amplifications for the edition of May 27, 2022.","May 26, 2022 08:34 pm ET"
"CorrectionsCorrections & AmplificationsCorrections & Amplifications for the edition of Sept. 8, 2023","September 7, 2023 07:03 pm ET"
"CorrectionsCorrections & AmplificationsCorrections & Amplifications for the edition of March 17, 2023.","March 16, 2023 09:09 pm ET"
"CorrectionsCorrections & AmplificationsCorrections & Amplifications for the edition of Oct. 19, 2024","October 18, 2024 07:57 pm ET"
LIVE COVERAGE POSTWhat Does the Government Have to Prove to the Jury in the Bankman-Fried Trial?,"October 26, 2023 01:45 pm ET"
Credit Suisse Stock Breaks Its Losing Streak,"March 16, 2023 02:33 pm ET"
Russian Crude Price Cap Versus Recent Price History,"December 2, 2022 03:03 pm ET"
LIVE COVERAGE POSTThe Santa Claus Rally Stumbles,"January 3, 2024 04:30 pm ET"
New York Community Bancorp Stock Keeps Falling,"March 4, 2024 12:57 pm ET"
Disney's Stock Edges Up After Journal's Report on Nelson Peltz's Push for Board Seats,"October 9, 2023 02:54 pm ET"
LIVE COVERAGE POSTWhat Is JD Vance’s Net Worth?,"October 1, 2024 05:00 pm ET"
"CryptocurrencyFTX’s Sam Bankman-Fried Charged With Criminal Fraud, ConspiracyU.S. prosecutors, in an indictment unsealed Tuesday, accused the crypto exchange’s founder of a scheme to defraud customers and his hedge fund’s lenders.","December 13, 2022 10:42 pm ET"
Sustainable BusinessLab-Grown Meat Producer Upside Foods Raises $400 MillionAbu Dhabi Growth Fund and Baillie Gifford are among Series C investors as cultivated-meat producers seek U.S. regulatory approval.,"April 21, 2022 08:30 am ET"
"Heard on the StreetCrypto Winter May Be Harsh for CoinbaseThe company plans to invest even if crypto activity continues to fall, but investors may not have the same patience.","May 11, 2022 11:34 am ET"
Paid ProgramMaking More Oreos with a Smaller Carbon FootprintA high-tech factory in Bahrain aims to become 100% solar-powered with minimal upfront investment.,Tarih bulunamadı.
"CIO JournalApple Pitches Its $3,500 Vision Pro Headset to Businesses. Will It Catch On?Retailer Lowe’s and software developer SAP are among the companies the tech giant is touting as proof of the device’s usefulness to businesses.","April 18, 2024 02:47 pm ET"
PoliticsU.S. Bans Seafood Imports From Chinese CompanyCustoms and Border Protection agents will detain shipments containing seafood harvested by China’s Dalian Ocean Fishing due to alleged human-rights abuses.,"May 28, 2021 02:18 pm ET"
"HealthSome European Countries Limit Use of Moderna Vaccine in Younger AgesFinland joined Sweden, Denmark and Norway in recommending against use of Moderna’s Covid-19 vaccine in younger age groups, citing risks of rare cardiovascular side effects they said warranted the precautionary steps.","October 7, 2021 09:52 am ET"
HealthJ&J Sues Drug-Benefit Middleman Over Drug-Cost Assistance ProgramThe drugmaker’s lawsuit against SaveOnSP alleges it exploited a financial assistance program designed to help patients cover out-of-pocket costs of prescriptions.,"May 4, 2022 05:00 pm ET"
"U.S.Smugglers Use Snapchat, Tiktok to Recruit Americans to Drive Migrants From the Border Into the U.S.Posts promise quick cash for easy work but don’t say it’s to transport people who illegally entered the U.S.","October 19, 2022 09:00 am ET"
"Latin AmericaFreed From Jail in Venezuela, Houston Oil Executive Describes OrdealJose Pereira, a former executive with the Citgo Petroleum unit of Venezuela’s state-run oil company, was summoned to Caracas, arrested, convicted on corruption charges and detained for five years.","October 23, 2022 10:00 am ET"
"Sustainable BusinessZara Lets U.K. Customers Resell Used Clothes to Help Soothe Environmental ConcernsThe retailer has joined its fast-fashion rivals that have started reselling their clothes, a trend that tackles a piece of the industry’s daunting waste problem.","November 3, 2022 03:26 pm ET"
"U.S.How ‘Forever Chemicals’ Are All Around Us, From Winter Coats to Fast-Food WrappersThe chemicals, known as PFAS, have been used in industry and consumer products worldwide for more than 70 years because of their ability to resist water, grease and stains and put out fires.","March 15, 2023 08:00 am ET"
"Risk & Compliance JournalMorgan Stanley Fined by U.K. Energy Market Regulator Over WhatsApp UsesThe fine was the first ever issued in the U.K. for record-keeping requirements related to trading wholesale energy products, the regulator Ofgem said.","August 24, 2023 05:03 pm ET"
Carry OnWe’ve Used Showers for Centuries. Why Can’t Hotels Make Them Easier?Guests just want to get clean without wet floors and confusing temperature controls.,"October 31, 2023 09:00 pm ET"
"Journal Reports: Investing MonthlyThe S&P 500 Isn’t as Diverse as It Used to Be. Here’s Why That Matters.As tech and financial stocks have come to dominate the index, volatility and interest-rate sensitivity have picked up.","July 3, 2024 10:00 am ET"
"CMO TodayAll-AI Ad From Toys ‘R’ Us Inspires Debate Over the Future of MarketingThe toy brand’s new ad, created almost entirely with OpenAI’s Sora tool, prompted heated reactions and predictions of more to come.","June 28, 2024 06:00 am ET"
"WSJ ProSustainable BusinessGlobal Charities Say Using Companies’ Carbon Offsets to Lower Emissions Undermines Climate TargetsGreenpeace, Amnesty International and Oxfam are among over 80 charities arguing that using carbon offsets delays climate action.","July 2, 2024 12:00 am ET"
Pentagon Releases Video of U.S. Strike on Munitions Facility Used by Iran-Backed Group,"November 9, 2023 06:24 pm ET"
WSJ ProPro VC FundsCrypto Venture Firm Dragonfly Is Targeting a $500 Million FundThe pool of capital would be the largest raised so far by the young firm and comes as venture investors are raising ever-larger funds in a rush to back crypto startups.,"January 26, 2022 05:28 pm ET"
Credit MarketsChina Offers $4.6 Billion in Euro BondsBeijing’s sale of euro-denominated government bonds comes weeks after it raised $4 billion in dollar debt at cheap rates.,"November 9, 2021 10:45 pm ET"
"CFO JournalRockwell Automation Names Former 3M Executive as CFORockwell Automation on Tuesday said it named Nicholas Gangestad senior vice president and chief financial officer, effective March 1.","February 16, 2021 02:09 pm ET"
"WSJ ProPro PE Fund NewsCorry Capital Closes Life-Settlements Fund at $534 MillionCorry Capital Advisors has closed its latest fund to invest in life settlements, a strategy that aims for consistent returns unaffected by broader economic conditions.","June 28, 2021 07:00 am ET"
"Review & OutlookOpinion: A Democratic Dole for the PressWhy do journalists deserve subsidies more than, say, nurses?","September 23, 2021 06:30 pm ET"
"FinanceStuart Kirk, Climate Investing Critic, Resigns From HSBCThe former head of responsible investment and research at HSBC Asset Management sparked a debate on the value of ESG investing.","July 7, 2022 11:39 am ET"
"Paid ProgramPast, Present and Future: Why Innovation in the Telecom Industry is the Glue that Connects Communities to ProsperityFor almost two centuries the telecommunications industry has been at the forefront of human development, says Tech Mahindra's Manish Vyas. As 5G rolls out, there is so much more to come.",Tarih bulunamadı.
CommentaryOpinion: How Trump Can Help Ukraine WinHe could sway Putin by mobilizing the $300 billion in Russian money frozen in Western banks.,"November 17, 2024 04:34 pm ET"
Heard on the StreetStock Market’s New EV Joyride Ignores Supply RisksInvestors who are jumping back into electric vehicles should heed the lessons of this year’s semiconductor shortages.,"October 29, 2021 09:55 am ET"
"PoliticsSenate Confirms Chris Magnus to Head U.S. Customs and Border ProtectionThe Tucson, Ariz., police chief will take over the border agency as it continues to face unusually high levels of illegal immigration at the southern border.","December 7, 2021 06:29 pm ET"
"BusinessIBM Nears $5 Billion Deal for Software ProviderPurchase of  Apptio, owned by private-equity firm Vista Equity Partners, could be finalized over the weekend.","June 23, 2023 07:49 pm ET"
FinanceChina’s New Funding Model: Keep It CentralBeijing is taking a bigger role in funding growth after local governments took on too much debt.,"March 6, 2024 06:56 am ET"
"WSJ ProPro VC Commentary AnalysisPro Take: Pre-IPO Startups Face a New Hurdle—Getting Their AI Story RightWhile adopting artificial intelligence can accelerate a business’s revenue growth, it is also a period of adjustment that can keep companies in the private markets longer.","November 27, 2024 05:30 am ET"
"WSJ ProPro PE NewsletterPE Daily: BlackRock’s $3 Billion Secondary Haul | Brighton Park Invests $1.1 Billion FundBlackRock is not necessarily a name that immediately comes to mind when one thinks of the secondary market, but that may be about to change. The global asset management giant has rounded up some $3 billion to back secondary deals, including a $2.4 billion debut secondary fund, as our own Chris Cumming reports. Secondary funds continue to enjoy popularity among investors this quarter following a record year last year.","March 31, 2021 09:43 am ET"
WSJ ProPro VC FundsVida Ventures Closes $825 Million Life Sciences FundBoston- and Los Angeles-based Vida Ventures has grown quickly since its formation in 2017.,"June 24, 2021 06:00 am ET"
LettersOpinion: Low-Tax America Meets ‘Build Back Better’Passing the BBB bill would raise revenues by less than 1% of GDP by the end of the decade.,"November 21, 2021 11:34 am ET"
"WSJ ProPro VC PeopleChelsea Clinton Calls for More Support for Maternal HealthThrough her venture firm Metrodora, Ms. Clinton has invested in midwife-care startup Oula. Services shown to improve women’s health often haven’t received the investment they merit, she said.","March 6, 2023 05:23 pm ET"
